"ID","Pokemon","Family","Shadow","Little_Rank","Great_Rank","Ultra_Rank","Master_Rank","Little_IVs","Great_IVs","Ultra_IVs","Master_IVs","Little_Level","Great_Level","Ultra_Level","Master_Level","Little_CP","Great_CP","Ultra_CP","Master_CP","Little_MoveSet","Great_MoveSet","Ultra_MoveSet","Master_MoveSet","Evo_Fam","Evo_Next"
"136","Flareon","Eevee","FALSE",,"614","422","302",,"0/15/13","1/15/15","15/15/15",,"18.5","31","50",,"1488","2495","3424",,"Fire Spin, Superpower, Flamethrower","Fire Spin, Superpower, Flamethrower","Fire Spin, Superpower, Flamethrower","133;136","136"
"137","Porygon","Porygon","FALSE",,"616",,,,"0/13/15",,,,"37.5",,,,"1500",,,,"Quick Attack, Discharge, Hyper Beam",,,"137;233;474","137;233;474"
"137","Porygon (Shadow)","Porygon","TRUE",,"887",,,,"0/13/15",,,,"37.5",,,,"1500",,,,"Tackle, Discharge, Signal Beam",,,"137;233;474","137;233;474"
"138","Omanyte","Omanyte","FALSE",,"853",,,,"0/13/15",,,,"45.5",,,,"1500",,,,"Water Gun, Rock Blast, Ancient Power",,,"138;139","138;139"
"138","Omanyte (Shadow)","Omanyte","TRUE",,"801",,,,"0/13/15",,,,"45.5",,,,"1500",,,,"Mud Shot, Rock Blast, Ancient Power",,,"138;139","138;139"
"139","Omastar","Omanyte","FALSE",,"847","591","502",,"0/9/15","0/14/15","15/15/15",,"20.5","37.5","50",,"1493","2497","3150",,"Mud Shot, Rock Slide, Hydro Pump","Mud Shot, Rock Slide, Rock Blast","Mud Shot, Rock Slide, Rock Blast","138;139","139"
"139","Omastar (Shadow)","Omanyte","TRUE",,"862","531","465",,"0/9/15","0/14/15","15/15/15",,"20.5","37.5","50",,"1493","2497","3150",,"Mud Shot, Rock Slide, Hydro Pump","Mud Shot, Rock Slide, Rock Blast","Mud Shot, Rock Slide, Rock Blast","138;139","139"
"140","Kabuto","Kabuto","FALSE",,"933",,,,"10/15/15",,,,"49.5",,,,"1498",,,,"Mud Shot, Ancient Power, Aqua Jet",,,"140;141","140;141"
"141","Kabutops","Kabuto","FALSE",,"791","564","493",,"0/14/10","0/14/15","15/15/15",,"21","39","50",,"1493","2500","3067",,"Fury Cutter, Stone Edge, Ancient Power","Fury Cutter, Stone Edge, Ancient Power","Fury Cutter, Stone Edge, Ancient Power","140;141","141"
"142","Aerodactyl","Aerodactyl","FALSE",,"726","606","491",,"1/15/15","0/13/15","15/15/15",,"20","37.5","50",,"1500","2496","3147",,"Rock Throw, Rock Slide, Earth Power","Rock Throw, Rock Slide, Earth Power","Rock Throw, Rock Slide, Earth Power","142","142"
"142","Aerodactyl (Shadow)","Aerodactyl","TRUE",,"624","595","492",,"1/15/15","0/13/15","15/15/15",,"20","37.5","50",,"1500","2496","3147",,"Rock Throw, Rock Slide, Earth Power","Rock Throw, Rock Slide, Earth Power","Rock Throw, Rock Slide, Earth Power","142","142"
"143","Snorlax","Snorlax","FALSE",,"303","253","112",,"1/15/14","0/12/15","15/15/15",,"17.5","29.5","50",,"1498","2491","3647",,"Lick, Body Slam, Superpower","Lick, Body Slam, Earthquake","Lick, Body Slam, Superpower","143;446","143;446"
"143","Snorlax (Shadow)","Snorlax","TRUE",,"300","283","78",,"1/15/14","0/12/15","15/15/15",,"17.5","29.5","50",,"1498","2491","3647",,"Lick, Body Slam, Superpower","Lick, Body Slam, Earthquake","Lick, Body Slam, Superpower","143;446","143;446"
"144","Articuno","Articuno","FALSE",,"436","127","150",,"0/15/15","0/13/15","15/15/15",,"18.5","32","50",,"1500","2496","3450",,"Ice Shard, Triple Axel, Ancient Power","Ice Shard, Icy Wind, Ancient Power","Ice Shard, Triple Axel, Ancient Power","144","144"
"144","Articuno (Galarian)","Articuno","FALSE",,"654","528","230",,"0/15/14","0/15/12","15/15/15",,"15.5","26","50",,"1498","2494","4059",,"Psycho Cut, Ancient Power, Brave Bird","Psycho Cut, Ancient Power, Brave Bird","Psycho Cut, Ancient Power, Brave Bird","144","144"
"144","Articuno (Shadow)","Articuno","TRUE",,"458","380","117",,"0/15/15","0/13/15","15/15/15",,"18.5","32","50",,"1500","2496","3450",,"Ice Shard, Triple Axel, Ancient Power","Ice Shard, Triple Axel, Ancient Power","Ice Shard, Triple Axel, Ancient Power","144","144"
"145","Zapdos","Zapdos","FALSE",,"102","88","57",,"0/12/12","0/13/13","15/15/15",,"16","26.5","50",,"1495","2498","3987",,"Thunder Shock, Drill Peck, Thunder","Thunder Shock, Drill Peck, Thunderbolt","Thunder Shock, Drill Peck, Thunderbolt","145","145"
"145","Zapdos (Galarian)","Zapdos","FALSE",,"597","453","138",,"3/15/14","1/15/15","15/15/15",,"15.5","26","50",,"1495","2492","4012",,"Counter, Ancient Power, Brave Bird","Counter, Ancient Power, Brave Bird","Counter, Ancient Power, Brave Bird","145","145"
"145","Zapdos (Shadow)","Zapdos","TRUE",,"67","68","61",,"0/12/12","0/13/13","15/15/15",,"16","26.5","50",,"1495","2498","3987",,"Thunder Shock, Drill Peck, Thunderbolt","Thunder Shock, Drill Peck, Thunderbolt","Thunder Shock, Drill Peck, Thunderbolt","145","145"
"146","Moltres","Moltres","FALSE",,"578","599","246",,"1/15/14","0/14/12","15/15/15",,"16","27","50",,"1493","2500","3917",,"Fire Spin, Sky Attack, Ancient Power","Fire Spin, Sky Attack, Overheat","Wing Attack, Sky Attack, Overheat","146","146"
"146","Moltres (Galarian)","Moltres","FALSE","93","54","23","27","6/14/15","0/13/12","1/15/15","15/15/15","6","18","29.5","50","500","1493","2492","3580","Sucker Punch, Brave Bird, Ancient Power","Sucker Punch, Ancient Power, Brave Bird","Sucker Punch, Ancient Power, Brave Bird","Sucker Punch, Ancient Power, Payback","146","146"
"146","Moltres (Shadow)","Moltres","TRUE",,"576","443","145",,"1/15/14","0/14/12","15/15/15",,"16","27","50",,"1493","2500","3917",,"Fire Spin, Sky Attack, Ancient Power","Fire Spin, Sky Attack, Ancient Power","Fire Spin, Sky Attack, Ancient Power","146","146"
"148","Dragonair","Dratini","FALSE",,"114",,,,"1/15/15",,,,"34",,,,"1497",,,,"Dragon Breath, Aqua Tail, Body Slam",,,"147;148;149","148;149"
"148","Dragonair (Shadow)","Dratini","TRUE",,"109",,,,"1/15/15",,,,"34",,,,"1497",,,,"Dragon Breath, Body Slam, Aqua Tail",,,"147;148;149","148;149"
"149","Dragonite","Dratini","FALSE",,"134","154","17",,"3/15/14","0/13/15","15/15/15",,"14.5","24.5","50",,"1495","2499","4287",,"Dragon Breath, Dragon Claw, Superpower","Dragon Breath, Dragon Claw, Superpower","Dragon Breath, Dragon Claw, Superpower","147;148;149","149"
"149","Dragonite (Shadow)","Dratini","TRUE",,"110","82","20",,"3/15/14","0/13/15","15/15/15",,"14.5","24.5","50",,"1495","2499","4287",,"Dragon Breath, Dragon Claw, Superpower","Dragon Breath, Dragon Claw, Superpower","Dragon Breath, Dragon Claw, Superpower","147;148;149","149"
"150","Mewtwo","Mewtwo","FALSE",,,"470","31",,,"1/15/13","15/15/15",,,"22","50",,,"2494","4724",,,"Psycho Cut, Psystrike, Shadow Ball","Psycho Cut, Psystrike, Shadow Ball","150","150"
"150","Mewtwo (Armored)","Mewtwo","FALSE",,,"100","155",,,"0/12/13","15/15/15",,,"30","50",,,"2499","3603",,,"Confusion, Psystrike, Dynamic Punch","Confusion, Psystrike, Dynamic Punch","150","150"
"150","Mewtwo (Shadow)","Mewtwo","TRUE",,"489","379","22",,"4/15/15","1/15/13","15/15/15",,"13","22","50",,"1500","2494","4724",,"Psycho Cut, Psystrike, Thunderbolt","Psycho Cut, Psystrike, Shadow Ball","Psycho Cut, Psystrike, Shadow Ball","150","150"
"151","Mew","Mew","FALSE",,"327","287","85",,"0/10/13","0/15/10","15/15/15",,"17.5","29","50",,"1498","2493","3691",,"Shadow Claw, Wild Charge, Surf","Shadow Claw, Dragon Claw, Wild Charge","Shadow Claw, Surf, Wild Charge","151","151"
"153","Bayleef","Chikorita","FALSE",,"381",,,,"3/15/14",,,,"50",,,,"1494",,,,"Magical Leaf, Ancient Power, Energy Ball",,,"152;153;154","153;154"
"153","Bayleef (Shadow)","Chikorita","TRUE",,"485",,,,"3/15/14",,,,"50",,,,"1494",,,,"Magical Leaf, Ancient Power, Energy Ball",,,"152;153;154","153;154"
"154","Meganium","Chikorita","FALSE",,"105","89","277",,"0/10/15","0/14/15","15/15/15",,"24","50","50",,"1499","2500","2725",,"Vine Whip, Frenzy Plant, Earthquake","Vine Whip, Frenzy Plant, Earthquake","Vine Whip, Frenzy Plant, Earthquake","152;153;154","154"
"154","Meganium (Shadow)","Chikorita","TRUE",,"201","90","324",,"0/10/15","0/14/15","15/15/15",,"24","50","50",,"1499","2500","2725",,"Vine Whip, Frenzy Plant, Earthquake","Vine Whip, Frenzy Plant, Earthquake","Vine Whip, Frenzy Plant, Earthquake","152;153;154","154"
"156","Quilava","Cyndaquil","FALSE",,"787",,,,"0/13/15",,,,"40",,,,"1496",,,,"Ember, Flame Charge, Dig",,,"155;156;157","156;157"
"156","Quilava (Shadow)","Cyndaquil","TRUE",,"788",,,,"0/13/15",,,,"40",,,,"1496",,,,"Ember, Flame Charge, Dig",,,"155;156;157","156;157"
"157","Typhlosion","Cyndaquil","FALSE",,"190","70","165",,"0/15/13","0/13/15","15/15/15",,"19.5","35","50",,"1488","2497","3266",,"Incinerate, Blast Burn, Thunder Punch","Incinerate, Blast Burn, Thunder Punch","Incinerate, Blast Burn, Thunder Punch","155;156;157","157"
"157","Typhlosion (Hisuian)","Cyndaquil","FALSE","281","572","371","226","0/14/11","0/11/12","1/15/14","15/15/15","6.5","19","32","50","499","1500","2499","3385","Hex, Wild Charge, Night Shade","Hex, Fire Punch, Shadow Ball","Hex, Fire Punch, Shadow Ball","Hex, Shadow Ball, Fire Punch","155;156;157","157"
"157","Typhlosion (Shadow)","Cyndaquil","TRUE",,"107","94","164",,"0/15/13","0/13/15","15/15/15",,"19.5","35","50",,"1488","2497","3266",,"Incinerate, Blast Burn, Thunder Punch","Incinerate, Blast Burn, Thunder Punch","Incinerate, Blast Burn, Thunder Punch","155;156;157","157"
"158","Totodile","Totodile","FALSE",,"952",,,,"15/15/15",,,,"50",,,,"1279",,,,"Water Gun, Crunch, Water Pulse",,,"158;159;160","158;159;160"
"158","Totodile (Shadow)","Totodile","TRUE",,"961",,,,"15/15/15",,,,"50",,,,"1279",,,,"Water Gun, Crunch, Water Pulse",,,"158;159;160","158;159;160"
"159","Croconaw","Totodile","FALSE",,"529",,,,"0/13/15",,,,"37.5",,,,"1499",,,,"Water Gun, Ice Punch, Crunch",,,"158;159;160","159;160"
"159","Croconaw (Shadow)","Totodile","TRUE",,"460",,,,"0/13/15",,,,"37.5",,,,"1499",,,,"Water Gun, Ice Punch, Crunch",,,"158;159;160","159;160"
"160","Feraligatr","Totodile","FALSE",,"8","7","38",,"0/11/13","1/15/14","15/15/15",,"20","35.5","50",,"1493","2496","3230",,"Shadow Claw, Hydro Cannon, Ice Beam","Shadow Claw, Hydro Cannon, Ice Beam","Shadow Claw, Hydro Cannon, Ice Beam","158;159;160","160"
"160","Feraligatr (Shadow)","Totodile","TRUE",,"7","1","51",,"0/11/13","1/15/14","15/15/15",,"20","35.5","50",,"1493","2496","3230",,"Shadow Claw, Hydro Cannon, Ice Beam","Shadow Claw, Hydro Cannon, Ice Beam","Shadow Claw, Hydro Cannon, Ice Beam","158;159;160","160"
"162","Furret","Sentret","FALSE",,"245","681",,,"1/15/14","15/15/14",,,"35.5","50",,,"1500","1987",,,"Sucker Punch, Brick Break, Dig","Sucker Punch, Brick Break, Dig",,"161;162","162"
"164","Noctowl","Hoothoot","FALSE",,"206","353","557",,"1/14/15","15/15/15","15/15/15",,"28.5","50","50",,"1494","2288","2288",,"Wing Attack, Sky Attack, Night Shade","Wing Attack, Night Shade, Sky Attack","Wing Attack, Night Shade, Sky Attack","163;164","164"
"165","Ledyba","Ledyba","FALSE","85",,,,"0/15/15",,,,"29",,,,"499",,,,"Bug Bite, Aerial Ace, Swift",,,,"165;166","165;166"
"165","Ledyba (Shadow)","Ledyba","TRUE","82",,,,"0/15/15",,,,"29",,,,"497",,,,"Bug Bite, Aerial Ace, Swift",,,,"165;166","165;166"
"166","Ledian","Ledyba","FALSE","191","324",,,"0/11/15","13/15/15",,,"15","50",,,"499","1500",,,"Bug Bite, Aerial Ace, Silver Wind","Counter, Aerial Ace, Dynamic Punch",,,"165;166","166"
"166","Ledian (Shadow)","Ledyba","TRUE","197","332",,,"0/11/15","13/15/15",,,"15","50",,,"499","1500",,,"Bug Bite, Aerial Ace, Silver Wind","Counter, Aerial Ace, Dynamic Punch",,,"165;166","166"
"167","Spinarak","Spinarak","FALSE","83",,,,"0/15/15",,,,"24.5",,,,"496",,,,"Poison Sting, Cross Poison, Night Slash",,,,"167;168","167;168"
"168","Ariados","Spinarak","FALSE","104","91",,,"0/13/11","0/14/15",,,"11","35",,,"500","1497",,,"Poison Sting, Cross Poison, Lunge","Poison Sting, Lunge, Trailblaze",,,"167;168","168"
"169","Crobat","Zubat","FALSE","158","565","405","455","0/6/12","0/15/12","0/15/14","15/15/15","7.5","21.5","41.5","50","500","1496","2500","2992","Air Slash, Cross Poison, Shadow Ball","Air Slash, Poison Fang, Shadow Ball","Air Slash, Poison Fang, Shadow Ball","Air Slash, Cross Poison, Shadow Ball","41;42;169","169"
"169","Crobat (Shadow)","Zubat","TRUE",,"573","368","428",,"0/15/12","0/15/14","15/15/15",,"21.5","41.5","50",,"1496","2500","2992",,"Air Slash, Poison Fang, Shadow Ball","Air Slash, Poison Fang, Shadow Ball","Air Slash, Cross Poison, Shadow Ball","41;42;169","169"
"170","Chinchou","Chinchou","FALSE",,"827",,,,"15/15/15",,,,"50",,,,"1265",,,,"Bubble, Thunderbolt, Water Pulse",,,"170;171","170;171"
"171","Lanturn","Chinchou","FALSE",,"86","225","488",,"0/13/14","15/15/15","15/15/15",,"28","50","50",,"1496","2357","2357",,"Water Gun, Surf, Thunderbolt","Spark, Surf, Thunderbolt","Water Gun, Surf, Thunderbolt","170;171","171"
"173","Cleffa","Clefairy","FALSE","368",,,,"0/15/15",,,,"32.5",,,,"500",,,,"Zen Headbutt, Psyshock, Swift",,,,"35;36;173","173"
"174","Igglybuff","Jigglypuff","FALSE","109",,,,"1/15/15",,,,"49",,,,"500",,,,"Feint Attack, Wild Charge, Swift",,,,"39;40;174","174"
"175","Togepi","Togepi","FALSE","260",,,,"1/15/15",,,,"34",,,,"499",,,,"Hidden Power (Rock), Ancient Power, Psyshock",,,,"175;176;468","175;176;468"
"176","Togetic","Togepi","FALSE","54","55","600",,"0/15/11","0/14/14","15/15/15",,"11.5","38.5","50",,"499","1496","1931",,"Fairy Wind, Aerial Ace, Ancient Power","Fairy Wind, Aerial Ace, Dazzling Gleam","Fairy Wind, Aerial Ace, Ancient Power",,"175;176;468","176;468"
"178","Xatu","Natu","FALSE",,"897","679","619",,"0/13/15","15/15/15","15/15/15",,"26","50","50",,"1499","2474","2474",,"Air Slash, Aerial Ace, Future Sight","Air Slash, Aerial Ace, Future Sight","Air Slash, Aerial Ace, Future Sight","177;178","178"
"178","Xatu (Shadow)","Natu","TRUE",,"880","677","616",,"0/13/15","15/15/15","15/15/15",,"26","50","50",,"1499","2474","2474",,"Air Slash, Aerial Ace, Future Sight","Air Slash, Aerial Ace, Future Sight","Air Slash, Aerial Ace, Future Sight","177;178","178"
"180","Flaaffy","Mareep","FALSE",,"790",,,,"0/15/14",,,,"47",,,,"1497",,,,"Tackle, Trailblaze, Power Gem",,,"179;180;181","180;181"
"180","Flaaffy (Shadow)","Mareep","TRUE",,"929",,,,"0/15/14",,,,"47",,,,"1497",,,,"Charge Beam, Trailblaze, Power Gem",,,"179;180;181","180;181"
"181","Ampharos","Mareep","FALSE",,"311","236","275",,"0/13/11","0/13/15","15/15/15",,"20","36","50",,"1499","2499","3225",,"Volt Switch, Brutal Swing, Trailblaze","Volt Switch, Brutal Swing, Trailblaze","Volt Switch, Brutal Swing, Thunder Punch","179;180;181","181"
"181","Ampharos (Shadow)","Mareep","TRUE",,"316","259","281",,"0/13/11","0/13/15","15/15/15",,"20","36","50",,"1499","2499","3225",,"Volt Switch, Brutal Swing, Trailblaze","Volt Switch, Brutal Swing, Trailblaze","Volt Switch, Brutal Swing, Thunder Punch","179;180;181","181"
"182","Bellossom","Bellossom","FALSE",,"317","298","472",,"1/14/14","9/15/15","15/15/15",,"25","50","50",,"1499","2498","2578",,"Bullet Seed, Leaf Blade, Return","Bullet Seed, Leaf Blade, Return","Bullet Seed, Leaf Blade, Return","43;44;182","182"
"182","Bellossom (Shadow)","Bellossom","TRUE",,"312","284","489",,"1/14/14","9/15/15","15/15/15",,"25","50","50",,"1499","2498","2578",,"Bullet Seed, Leaf Blade, Dazzling Gleam","Bullet Seed, Leaf Blade, Dazzling Gleam","Bullet Seed, Leaf Blade, Dazzling Gleam","43;44;182","182"
"183","Marill","Marill","FALSE","2",,,,"13/15/14",,,,"50",,,,"499",,,,"Bubble, Aqua Tail, Body Slam",,,,"183;184;298","183;184;298"
"184","Azumarill","Marill","FALSE","147","17","651",,"0/15/15","0/15/15","15/15/15",,"12.5","45.5","50",,"497","1498","1795",,"Bubble, Ice Beam, Play Rough","Bubble, Ice Beam, Play Rough","Bubble, Ice Beam, Play Rough",,"183;184;298","184;298"
"185","Sudowoodo","Sudowoodo","FALSE",,"698","491","570",,"0/14/11","15/15/15","15/15/15",,"27","50","50",,"1496","2428","2428",,"Counter, Meteor Beam, Trailblaze","Counter, Meteor Beam, Trailblaze","Counter, Meteor Beam, Trailblaze","185;438","185;438"
"185","Sudowoodo (Shadow)","Sudowoodo","TRUE",,"803","594","578",,"0/14/11","15/15/15","15/15/15",,"27","50","50",,"1496","2428","2428",,"Counter, Meteor Beam, Trailblaze","Counter, Meteor Beam, Trailblaze","Counter, Meteor Beam, Trailblaze","185;438","185;438"
"186","Politoed","Politoed","FALSE",,"247","139","336",,"0/15/11","0/15/14","15/15/15",,"23.5","48.5","50",,"1498","2498","2769",,"Mud Shot, Weather Ball (Water), Earthquake","Mud Shot, Surf, Blizzard","Bubble, Weather Ball (Water), Ice Beam","60;61;186","186"
"186","Politoed (Shadow)","Politoed","TRUE",,"220","121","319",,"0/15/11","0/15/14","15/15/15",,"23.5","48.5","50",,"1498","2498","2769",,"Mud Shot, Weather Ball (Water), Earthquake","Mud Shot, Weather Ball (Water), Blizzard","Bubble, Weather Ball (Water), Ice Beam","60;61;186","186"
"189","Jumpluff","Hoppip","FALSE",,"20","543",,,"0/14/14","15/15/15",,,"43","50",,,"1500","1850",,,"Fairy Wind, Aerial Ace, Energy Ball","Fairy Wind, Aerial Ace, Acrobatics",,"187;188;189","189"
"189","Jumpluff (Shadow)","Hoppip","TRUE",,"13","535",,,"0/14/14","15/15/15",,,"43","50",,,"1500","1850",,,"Fairy Wind, Aerial Ace, Energy Ball","Fairy Wind, Aerial Ace, Acrobatics",,"187;188;189","189"
"190","Aipom","Aipom","FALSE",,"415",,,,"14/15/14",,,,"49.5",,,,"1500",,,,"Astonish, Swift, Aerial Ace",,,"190;424","190;424"
"190","Aipom (Shadow)","Aipom","TRUE",,"380",,,,"14/15/14",,,,"49.5",,,,"1500",,,,"Astonish, Swift, Aerial Ace",,,"190;424","190;424"
"192","Sunflora","Sunkern","FALSE",,"775","638",,,"0/15/14","15/15/15",,,"26.5","50",,,"1492","2421",,,"Bullet Seed, Sludge Bomb, Leaf Storm","Bullet Seed, Sludge Bomb, Leaf Storm",,"191;192","192"
"193","Yanma","Yanma","FALSE","249","711",,,"1/15/14","0/14/15",,,"13","49.5",,,"497","1498",,,"Wing Attack, Aerial Ace, Ancient Power","Quick Attack, Aerial Ace, Silver Wind",,,"193;469","193;469"
"194","Wooper (Paldean)","Wooper","FALSE","17",,,,"0/15/15",,,,"35.5",,,,"500",,,,"Poison Jab, Dig, Body Slam",,,,"194;195","194;195"
"195","Quagsire","Wooper","FALSE",,"29","248","498",,"0/15/14","15/15/15","15/15/15",,"29","50","50",,"1494","2252","2252",,"Mud Shot, Aqua Tail, Stone Edge","Mud Shot, Aqua Tail, Stone Edge","Mud Shot, Aqua Tail, Mud Bomb","194;195","195"
"195","Quagsire (Shadow)","Wooper","TRUE",,"16","195","495",,"0/15/14","15/15/15","15/15/15",,"29","50","50",,"1494","2252","2252",,"Mud Shot, Aqua Tail, Stone Edge","Mud Shot, Aqua Tail, Stone Edge","Mud Shot, Aqua Tail, Mud Bomb","194;195","195"
"196","Espeon","Eevee","FALSE",,"718","574","328",,"0/15/15","1/15/15","15/15/15",,"17.5","29","50",,"1491","2500","3583",,"Confusion, Psychic Fangs, Shadow Ball","Confusion, Psychic Fangs, Shadow Ball","Confusion, Psychic Fangs, Shadow Ball","133;196","196"
"197","Umbreon","Eevee","FALSE","44","88","102","383","0/12/3","0/15/14","15/15/15","15/15/15","9.5","27.5","50","50","498","1497","2416","2416","Snarl, Foul Play, Last Resort","Snarl, Foul Play, Last Resort","Snarl, Foul Play, Last Resort","Snarl, Foul Play, Last Resort","133;197","197"
"198","Murkrow","Murkrow","FALSE","296","810",,,"3/15/14","0/15/14",,,"12","43.5",,,"500","1498",,,"Feint Attack, Drill Peck, Foul Play","Feint Attack, Drill Peck, Foul Play",,,"198;430","198;430"
"198","Murkrow (Shadow)","Murkrow","TRUE","291","823",,,"3/15/14","0/15/14",,,"12","43.5",,,"500","1498",,,"Feint Attack, Drill Peck, Foul Play","Feint Attack, Drill Peck, Foul Play",,,"198;430","198;430"
"199","Slowking","Slowpoke","FALSE",,"554","397","481",,"0/13/15","0/14/14","15/15/15",,"22.5","45.5","50",,"1493","2499","2877",,"Water Gun, Surf, Psychic","Water Gun, Surf, Psychic","Confusion, Surf, Scald","79;199","199"
"199","Slowking (Galarian)","Slowpoke","FALSE","246","845","544","475","4/14/14","0/14/13","0/15/14","15/15/15","7","21","39.5","50","499","1498","2493","3072","Confusion, Surf, Shadow Ball","Hex, Surf, Shadow Ball","Hex, Surf, Shadow Ball","Confusion, Surf, Shadow Ball","79;199","199"
"199","Slowking (Shadow)","Slowpoke","TRUE",,"601","460","509",,"0/13/15","0/14/14","15/15/15",,"22.5","45.5","50",,"1493","2499","2877",,"Water Gun, Surf, Psychic","Water Gun, Surf, Psychic","Confusion, Surf, Scald","79;199","199"
"200","Misdreavus","Misdreavus","FALSE","190","457","645",,"0/13/14","1/15/15","15/15/14",,"10","29.5","50",,"498","1498","2178",,"Psywave, Dark Pulse, Shadow Sneak","Psywave, Dark Pulse, Shadow Sneak","Astonish, Dark Pulse, Shadow Sneak",,"200;429","200;429"
"200","Misdreavus (Shadow)","Misdreavus","TRUE","172","490","637",,"0/13/14","1/15/15","15/15/14",,"10","29.5","50",,"498","1498","2178",,"Astonish, Dark Pulse, Shadow Sneak","Astonish, Dark Pulse, Shadow Sneak","Astonish, Dark Pulse, Shadow Sneak",,"200;429","200;429"
"201","Unown","Unown","FALSE",,"1001",,,,"15/15/15",,,,"50",,,,"1339",,,,"Hidden Power (Psychic), Struggle, NA",,,"201","201"
"202","Wobbuffet","Wobbuffet","FALSE",,"443",,,,"15/15/15",,,,"50",,,,"1160",,,,"Counter, Return, Mirror Coat",,,"202;360","202;360"
"202","Wobbuffet (Shadow)","Wobbuffet","TRUE",,"681",,,,"15/15/15",,,,"50",,,,"1160",,,,"Counter, Mirror Coat, Frustration",,,"202;360","202;360"
"203","Girafarig","Girafarig","FALSE",,"347","502",,,"0/15/12","15/15/15",,,"28","50",,,"1486","2314",,,"Confusion, Psychic Fangs, Trailblaze","Double Kick, Psychic Fangs, Trailblaze",,"203;981","203;981"
"203","Girafarig (Shadow)","Girafarig","TRUE",,"348","466",,,"0/15/12","15/15/15",,,"28","50",,,"1486","2314",,,"Confusion, Psychic Fangs, Trailblaze","Double Kick, Psychic Fangs, Trailblaze",,"203;981","203;981"
"204","Pineco","Pineco","FALSE","313","979",,,"0/15/15","15/15/15",,,"18","50",,,"500","1253",,,"Bug Bite, Rock Tomb, Gyro Ball","Bug Bite, Rock Tomb, Return",,,"204;205","204;205"
"204","Pineco (Shadow)","Pineco","TRUE","308","948",,,"0/15/15","15/15/15",,,"18","50",,,"497","1253",,,"Bug Bite, Rock Tomb, Gyro Ball","Bug Bite, Rock Tomb, Sand Tomb",,,"204;205","204;205"
"205","Forretress","Pineco","FALSE","88","288","118","533","0/15/13","0/9/15","9/15/15","15/15/15","8.5","25.5","50","50","500","1496","2499","2580","Volt Switch, Mirror Shot, Heavy Slam","Volt Switch, Earthquake, Mirror Shot","Volt Switch, Earthquake, Mirror Shot","Volt Switch, Mirror Shot, Heavy Slam","204;205","205"
"205","Forretress (Shadow)","Pineco","TRUE","101","364","204","530","0/15/13","0/9/15","9/15/15","15/15/15","8.5","25.5","50","50","500","1496","2499","2580","Volt Switch, Mirror Shot, Heavy Slam","Volt Switch, Earthquake, Mirror Shot","Volt Switch, Earthquake, Mirror Shot","Volt Switch, Mirror Shot, Heavy Slam","204;205","205"
"206","Dunsparce","Dunsparce","FALSE",,"10","573",,,"0/14/12","15/15/15",,,"40","50",,,"1496","1909",,,"Rollout, Drill Run, Rock Slide","Rollout, Drill Run, Rock Slide",,"206;982","206;982"
"207","Gligar","Gligar","FALSE",,"115","601",,,"0/15/12","15/15/15",,,"33","50",,,"1493","2099",,,"Fury Cutter, Aerial Ace, Dig","Fury Cutter, Night Slash, Aerial Ace",,"207;472","207;472"
"207","Gligar (Shadow)","Gligar","TRUE",,"95","608",,,"0/15/12","15/15/15",,,"33","50",,,"1493","2099",,,"Fury Cutter, Aerial Ace, Dig","Wing Attack, Aerial Ace, Night Slash",,"207;472","207;472"
"208","Steelix","Onix","FALSE",,"24","8","278",,"0/14/15","2/15/15","15/15/15",,"24","49.5","50",,"1493","2497","2729",,"Thunder Fang, Psychic Fangs, Breaking Swipe","Thunder Fang, Psychic Fangs, Breaking Swipe","Dragon Tail, Breaking Swipe, Psychic Fangs","95;208","208"
"208","Steelix (Shadow)","Onix","TRUE",,"38","24","307",,"0/14/15","2/15/15","15/15/15",,"24","49.5","50",,"1493","2497","2729",,"Thunder Fang, Psychic Fangs, Breaking Swipe","Thunder Fang, Psychic Fangs, Breaking Swipe","Dragon Tail, Breaking Swipe, Psychic Fangs","95;208","208"
"209","Snubbull","Snubbull","FALSE","344","954",,,"0/12/14","15/15/14",,,"16","50",,,"498","1399",,,"Tackle, Crunch, Dazzling Gleam","Tackle, Crunch, Brick Break",,,"209;210","209;210"
"209","Snubbull (Shadow)","Snubbull","TRUE","353","956",,,"0/12/14","15/15/14",,,"16","50",,,"498","1399",,,"Tackle, Crunch, Dazzling Gleam","Tackle, Crunch, Brick Break",,,"209;210","209;210"
"210","Granbull","Snubbull","FALSE","318","394","304","436","0/15/14","0/15/15","0/15/14","15/15/15","7.5","22","44","50","498","1494","2490","2885","Snarl, Crunch, Close Combat","Charm, Close Combat, Crunch","Charm, Close Combat, Crunch","Snarl, Close Combat, Crunch","209;210","210"
"210","Granbull (Shadow)","Snubbull","TRUE",,"250","280","380",,"0/15/15","0/15/14","15/15/15",,"22","44","50",,"1494","2490","2885",,"Charm, Close Combat, Crunch","Charm, Close Combat, Crunch","Snarl, Close Combat, Crunch","209;210","210"
"211","Qwilfish","Qwilfish","FALSE","14","65","229",,"6/15/15","0/12/14","15/15/15",,"9","28","50",,"499","1490","2318",,"Poison Sting, Aqua Tail, Ice Beam","Poison Sting, Aqua Tail, Ice Beam","Poison Sting, Aqua Tail, Ice Beam",,"211;904","211;904"
"211","Qwilfish (Hisuian)","Qwilfish","FALSE","28","118","219",,"0/12/15","0/15/15","15/15/15",,"9","26.5","50",,"498","1497","2415",,"Poison Sting, Aqua Tail, Sludge Bomb","Poison Sting, Aqua Tail, Shadow Ball","Poison Jab, Aqua Tail, Dark Pulse",,"211;904","211;904"
"212","Scizor","Scyther","FALSE","58","226","274","221","0/11/13","1/15/15","0/15/15","15/15/15","6.5","18.5","32","50","499","1497","2498","3393","Bullet Punch, Night Slash, X-Scissor","Fury Cutter, Night Slash, Trailblaze","Fury Cutter, Night Slash, Trailblaze","Fury Cutter, Night Slash, X-Scissor","123;212","212"
"212","Scizor (Shadow)","Scyther","TRUE",,"268","246","188",,"1/15/15","0/15/15","15/15/15",,"18.5","32","50",,"1497","2498","3393",,"Fury Cutter, Night Slash, Trailblaze","Fury Cutter, Night Slash, Trailblaze","Bullet Punch, Night Slash, Iron Head","123;212","212"
"213","Shuckle","Shuckle","FALSE","1",,,,"15/15/15",,,,"50",,,,"458",,,,"Rock Throw, Stone Edge, Rock Blast",,,,"213","213"
"213","Shuckle (Shadow)","Shuckle","TRUE","3",,,,"15/15/15",,,,"50",,,,"458",,,,"Rock Throw, Stone Edge, Rock Blast",,,,"213","213"
