"ID","Pokemon","Family","Shadow","Little_Rank","Great_Rank","Ultra_Rank","Master_Rank","Little_IVs","Great_IVs","Ultra_IVs","Master_IVs","Little_Level","Great_Level","Ultra_Level","Master_Level","Little_CP","Great_CP","Ultra_CP","Master_CP","Little_MoveSet","Great_MoveSet","Ultra_MoveSet","Master_MoveSet","Evo_Fam","Evo_Next"
"323","Camerupt (Shadow)","Numel","TRUE",,"718",,,,"0/14/13",,,,"26",,,,"1499",,,,"Incinerate, Earth Power, Overheat",,,"322;323","323"
"324","Torkoal","Torkoal","FALSE",,"522",,,,"0/15/15",,,,"27.5",,,,"1491",,,,"Fire Spin, Overheat, Earthquake",,,"324","324"
"325","Spoink","Spoink","FALSE",,"844",,,,"15/15/15",,,,"49.5",,,,"1495",,,,"Zen Headbutt, Shadow Ball, Return",,,"325;326","325;326"
"325","Spoink (Shadow)","Spoink","TRUE",,"843",,,,"15/15/15",,,,"49.5",,,,"1495",,,,"Zen Headbutt, Shadow Ball, Mirror Coat",,,"325;326","325;326"
"326","Grumpig","Spoink","FALSE",,"2",,,,"1/14/15",,,,"24",,,,"1498",,,,"Psywave, Dynamic Punch, Shadow Ball",,,"325;326","326"
"326","Grumpig (Shadow)","Spoink","TRUE",,"7",,,,"1/14/15",,,,"24",,,,"1498",,,,"Psywave, Dynamic Punch, Shadow Ball",,,"325;326","326"
"327","Spinda","Spinda","FALSE",,"49",,,,"15/15/14",,,,"50",,,,"1380",,,,"Sucker Punch, Rock Tomb, Icy Wind",,,"327","327"
"328","Trapinch","Trapinch","FALSE",,"749",,,,"15/15/15",,,,"50",,,,"1441",,,,"Sand Attack, Scorching Sands, Crunch",,,"328;329;330","328;329;330"
"328","Trapinch (Shadow)","Trapinch","TRUE",,"747",,,,"15/15/15",,,,"50",,,,"1441",,,,"Sand Attack, Scorching Sands, Crunch",,,"328;329;330","328;329;330"
"329","Vibrava","Trapinch","FALSE",,"486",,,,"15/15/15",,,,"50",,,,"1384",,,,"Dragon Breath, Sand Tomb, Bug Buzz",,,"328;329;330","329;330"
"329","Vibrava (Shadow)","Trapinch","TRUE",,"424",,,,"15/15/15",,,,"50",,,,"1384",,,,"Dragon Breath, Sand Tomb, Bug Buzz",,,"328;329;330","329;330"
"330","Flygon","Trapinch","FALSE",,"113",,,,"0/15/9",,,,"21.5",,,,"1499",,,,"Dragon Tail, Scorching Sands, Dragon Claw",,,"328;329;330","330"
"330","Flygon (Shadow)","Trapinch","TRUE",,"102",,,,"0/15/9",,,,"21.5",,,,"1499",,,,"Dragon Tail, Dragon Claw, Scorching Sands",,,"328;329;330","330"
"334","Altaria","Swablu","FALSE",,"45",,,,"0/14/15",,,,"29",,,,"1498",,,,"Dragon Breath, Sky Attack, Moonblast",,,"333;334","334"
"335","Zangoose","Zangoose","FALSE",,"111",,,,"0/15/10",,,,"23.5",,,,"1494",,,,"Shadow Claw, Close Combat, Night Slash",,,"335","335"
"336","Seviper","Seviper","FALSE",,"371",,,,"0/15/12",,,,"27",,,,"1500",,,,"Poison Jab, Crunch, Poison Fang",,,"336","336"
"337","Lunatone","Lunatone","FALSE",,"167",,,,"0/15/14",,,,"24.5",,,,"1494",,,,"Psywave, Rock Slide, Moonblast",,,"337","337"
"338","Solrock","Solrock","FALSE",,"171",,,,"0/15/14",,,,"24.5",,,,"1494",,,,"Psywave, Rock Slide, Psychic",,,"338","338"
"340","Whiscash","Barboach","FALSE",,"222",,,,"0/14/13",,,,"28",,,,"1490",,,,"Mud Shot, Mud Bomb, Scald",,,"339;340","340"
"340","Whiscash (Shadow)","Barboach","TRUE",,"172",,,,"0/14/13",,,,"28",,,,"1490",,,,"Mud Shot, Mud Bomb, Scald",,,"339;340","340"
"341","Corphish","Corphish","FALSE",,"740",,,,"15/15/15",,,,"50",,,,"1391",,,,"Bubble, Aqua Jet, Razor Shell",,,"341;342","341;342"
"341","Corphish (Shadow)","Corphish","TRUE",,"691",,,,"15/15/15",,,,"50",,,,"1391",,,,"Bubble, Aqua Jet, Razor Shell",,,"341;342","341;342"
"344","Claydol","Baltoy","FALSE",,"124",,,,"0/14/15",,,,"29.5",,,,"1488",,,,"Mud Slap, Rock Tomb, Ice Beam",,,"343;344","344"
"345","Lileep","Lileep","FALSE",,"235",,,,"15/15/15",,,,"50",,,,"1460",,,,"Bullet Seed, Ancient Power, Grass Knot",,,"345;346","345;346"
"345","Lileep (Shadow)","Lileep","TRUE",,"231",,,,"15/15/15",,,,"50",,,,"1460",,,,"Bullet Seed, Ancient Power, Grass Knot",,,"345;346","345;346"
"346","Cradily","Lileep","FALSE",,"20",,,,"0/15/15",,,,"26",,,,"1498",,,,"Bullet Seed, Rock Tomb, Grass Knot",,,"345;346","346"
"346","Cradily (Shadow)","Lileep","TRUE",,"41",,,,"0/15/15",,,,"26",,,,"1498",,,,"Bullet Seed, Rock Tomb, Grass Knot",,,"345;346","346"
"347","Anorith","Anorith","FALSE",,"841",,,,"0/15/15",,,,"45",,,,"1500",,,,"Struggle Bug, Aqua Jet, Ancient Power",,,"347;348","347;348"
"347","Anorith (Shadow)","Anorith","TRUE",,"837",,,,"0/15/15",,,,"45",,,,"1500",,,,"Struggle Bug, Aqua Jet, Cross Poison",,,"347;348","347;348"
"348","Armaldo","Anorith","FALSE",,"543",,,,"0/9/15",,,,"20",,,,"1497",,,,"Fury Cutter, Rock Blast, Liquidation",,,"347;348","348"
"348","Armaldo (Shadow)","Anorith","TRUE",,"420",,,,"0/9/15",,,,"20",,,,"1497",,,,"Fury Cutter, Rock Blast, Liquidation",,,"347;348","348"
"350","Milotic","Feebas","FALSE",,"347",,,,"0/15/11",,,,"19",,,,"1495",,,,"Dragon Tail, Surf, Blizzard",,,"349;350","350"
"352","Kecleon","Kecleon","FALSE",,"128",,,,"0/15/15",,,,"28",,,,"1495",,,,"Sucker Punch, Aerial Ace, Ice Beam",,,"352","352"
"354","Banette","Shuppet","FALSE",,"588",,,,"0/14/15",,,,"24.5",,,,"1500",,,,"Shadow Claw, Shadow Ball, Dazzling Gleam",,,"353;354","354"
"354","Banette (Shadow)","Shuppet","TRUE",,"705",,,,"0/14/15",,,,"24.5",,,,"1500",,,,"Shadow Claw, Shadow Ball, Dazzling Gleam",,,"353;354","354"
"356","Dusclops","Duskull","FALSE",,"4",,,,"0/11/15",,,,"45",,,,"1498",,,,"Hex, Ice Punch, Shadow Punch",,,"355;356;477","356;477"
"356","Dusclops (Shadow)","Duskull","TRUE",,"11",,,,"0/11/15",,,,"45",,,,"1498",,,,"Hex, Ice Punch, Shadow Punch",,,"355;356;477","356;477"
"357","Tropius","Tropius","FALSE",,"84",,,,"0/15/15",,,,"30",,,,"1494",,,,"Air Slash, Leaf Blade, Aerial Ace",,,"357","357"
"358","Chimecho","Chimecho","FALSE",,"180",,,,"0/14/12",,,,"25.5",,,,"1500",,,,"Astonish, Psyshock, Shadow Ball",,,"358;433","358;433"
"362","Glalie","Snorunt","FALSE",,"63",,,,"0/13/13",,,,"27.5",,,,"1498",,,,"Rollout, Avalanche, Shadow Ball",,,"361;362","362"
"362","Glalie (Shadow)","Snorunt","TRUE",,"73",,,,"0/13/13",,,,"27.5",,,,"1498",,,,"Rollout, Avalanche, Shadow Ball",,,"361;362","362"
"364","Sealeo","Spheal","FALSE",,"219",,,,"0/15/14",,,,"38",,,,"1497",,,,"Powder Snow, Water Pulse, Body Slam",,,"363;364;365","364;365"
"364","Sealeo (Shadow)","Spheal","TRUE",,"138",,,,"0/15/14",,,,"38",,,,"1497",,,,"Powder Snow, Water Pulse, Body Slam",,,"363;364;365","364;365"
"365","Walrein","Spheal","FALSE",,"67",,,,"0/12/15",,,,"21",,,,"1495",,,,"Powder Snow, Icicle Spear, Earthquake",,,"363;364;365","365"
"365","Walrein (Shadow)","Spheal","TRUE",,"48",,,,"0/12/15",,,,"21",,,,"1495",,,,"Powder Snow, Icicle Spear, Earthquake",,,"363;364;365","365"
"366","Clamperl","Clamperl","FALSE",,"676",,,,"15/15/14",,,,"50",,,,"1436",,,,"Water Gun, Body Slam, Water Pulse",,,"366;367","366;367"
"367","Huntail","Clamperl","FALSE",,"448",,,,"1/15/15",,,,"24",,,,"1498",,,,"Water Gun, Aqua Tail, Crunch",,,"366;367","367"
"368","Gorebyss","Gorebyss","FALSE",,"827",,,,"0/15/15",,,,"22.5",,,,"1500",,,,"Water Gun, Water Pulse, Psychic",,,"366;368","368"
"369","Relicanth","Relicanth","FALSE",,"270",,,,"1/15/15",,,,"22.5",,,,"1498",,,,"Water Gun, Aqua Tail, Ancient Power",,,"369","369"
"372","Shelgon","Bagon","FALSE",,"338",,,,"1/15/14",,,,"28",,,,"1493",,,,"Dragon Breath, Flamethrower, Twister",,,"371;372;373","372;373"
"372","Shelgon (Shadow)","Bagon","TRUE",,"339",,,,"1/15/14",,,,"28",,,,"1493",,,,"Dragon Breath, Flamethrower, Dragon Pulse",,,"371;372;373","372;373"
"373","Salamence","Bagon","FALSE",,"343",,,,"0/10/14",,,,"15",,,,"1490",,,,"Dragon Tail, Fly, Outrage",,,"371;372;373","373"
"373","Salamence (Shadow)","Bagon","TRUE",,"303",,,,"0/10/14",,,,"15",,,,"1490",,,,"Dragon Tail, Fly, Outrage",,,"371;372;373","373"
"377","Regirock","Regirock","FALSE",,"83",,,,"0/10/12",,,,"18.5",,,,"1497",,,,"Lock On, Stone Edge, Focus Blast",,,"377","377"
"377","Regirock (Shadow)","Regirock","TRUE",,"147",,,,"0/10/12",,,,"18.5",,,,"1500",,,,"Lock On, Stone Edge, Focus Blast",,,"377","377"
"378","Regice","Regice","FALSE",,"176",,,,"0/10/12",,,,"18.5",,,,"1497",,,,"Lock On, Blizzard, Thunder",,,"378","378"
"378","Regice (Shadow)","Regice","TRUE",,"333",,,,"0/10/12",,,,"18.5",,,,"1500",,,,"Lock On, Blizzard, Thunder",,,"378","378"
"380","Latias","Latias","FALSE",,"438",,,,"0/14/14",,,,"16",,,,"1499",,,,"Dragon Breath, Mist Ball, Thunder",,,"380","380"
"380","Latias (Shadow)","Latias","TRUE",,"346",,,,"0/14/14",,,,"16",,,,"1496",,,,"Dragon Breath, Mist Ball, Thunder",,,"380","380"
"381","Latios","Latios","FALSE",,"240",,,,"0/15/15",,,,"14.5",,,,"1497",,,,"Dragon Breath, Dragon Claw, Luster Purge",,,"381","381"
"381","Latios (Shadow)","Latios","TRUE",,"170",,,,"0/15/15",,,,"14.5",,,,"1495",,,,"Dragon Breath, Dragon Claw, Luster Purge",,,"381","381"
"382","Kyogre (Shadow)","Kyogre","TRUE",,"689",,,,"0/15/13",,,,"13.5",,,,"1499",,,,"Waterfall, Surf, Origin Pulse",,,"382","382"
"383","Groudon (Shadow)","Groudon","TRUE",,"662",,,,"0/15/13",,,,"13.5",,,,"1499",,,,"Mud Shot, Precipice Blades, Fire Punch",,,"383","383"
"384","Rayquaza","Rayquaza","FALSE",,"260",,,,"0/15/12",,,,"14.5",,,,"1496",,,,"Dragon Tail, Breaking Swipe, Dragon Ascent",,,"384","384"
"386","Deoxys (Defense)","Deoxys","FALSE",,"291",,,,"0/15/15",,,,"25.5",,,,"1491",,,,"Counter, Psycho Boost, Thunderbolt",,,"386","386"
"386","Deoxys (Speed)","Deoxys","FALSE",,"832",,,,"0/14/14",,,,"19.5",,,,"1499",,,,"Charge Beam, Psycho Boost, Swift",,,"386","386"
"387","Turtwig","Turtwig","FALSE",,"821",,,,"15/15/15",,,,"50",,,,"1342",,,,"Tackle, Body Slam, Seed Bomb",,,"387;388;389","387;388;389"
"387","Turtwig (Shadow)","Turtwig","TRUE",,"811",,,,"15/15/15",,,,"50",,,,"1342",,,,"Tackle, Body Slam, Seed Bomb",,,"387;388;389","387;388;389"
"388","Grotle","Turtwig","FALSE",,"506",,,,"0/15/11",,,,"31.5",,,,"1497",,,,"Razor Leaf, Body Slam, Energy Ball",,,"387;388;389","388;389"
"388","Grotle (Shadow)","Turtwig","TRUE",,"406",,,,"0/15/11",,,,"31.5",,,,"1497",,,,"Razor Leaf, Body Slam, Energy Ball",,,"387;388;389","388;389"
"389","Torterra","Turtwig","FALSE",,"568",,,,"0/11/13",,,,"19.5",,,,"1496",,,,"Razor Leaf, Frenzy Plant, Stone Edge",,,"387;388;389","389"
"389","Torterra (Shadow)","Turtwig","TRUE",,"442",,,,"0/11/13",,,,"19.5",,,,"1496",,,,"Razor Leaf, Frenzy Plant, Stone Edge",,,"387;388;389","389"
"391","Monferno","Chimchar","FALSE",,"798",,,,"0/15/14",,,,"43.5",,,,"1498",,,,"Ember, Flamethrower, Low Sweep",,,"390;391;392","391;392"
"391","Monferno (Shadow)","Chimchar","TRUE",,"781",,,,"0/15/14",,,,"43.5",,,,"1498",,,,"Ember, Flamethrower, Low Sweep",,,"390;391;392","391;392"
"392","Infernape","Chimchar","FALSE",,"663",,,,"0/13/15",,,,"21",,,,"1491",,,,"Fire Spin, Close Combat, Blast Burn",,,"390;391;392","392"
"392","Infernape (Shadow)","Chimchar","TRUE",,"711",,,,"0/13/15",,,,"21",,,,"1491",,,,"Fire Spin, Close Combat, Blast Burn",,,"390;391;392","392"
"393","Piplup","Piplup","FALSE",,"791",,,,"15/15/14",,,,"50",,,,"1215",,,,"Bubble, Drill Peck, Icy Wind",,,"393;394;395","393;394;395"
"393","Piplup (Shadow)","Piplup","TRUE",,"796",,,,"15/15/14",,,,"50",,,,"1215",,,,"Bubble, Drill Peck, Icy Wind",,,"393;394;395","393;394;395"
"394","Prinplup","Piplup","FALSE",,"492",,,,"0/15/14",,,,"38",,,,"1500",,,,"Bubble, Icy Wind, Hydro Pump",,,"393;394;395","394;395"
"394","Prinplup (Shadow)","Piplup","TRUE",,"601",,,,"0/15/14",,,,"38",,,,"1500",,,,"Bubble, Icy Wind, Hydro Pump",,,"393;394;395","394;395"
"397","Staravia","Starly","FALSE",,"162",,,,"15/15/15",,,,"50",,,,"1468",,,,"Quick Attack, Brave Bird, Fly",,,"396;397;398","397;398"
"397","Staravia (Shadow)","Starly","TRUE",,"205",,,,"15/15/15",,,,"50",,,,"1468",,,,"Quick Attack, Brave Bird, Fly",,,"396;397;398","397;398"
"398","Staraptor","Starly","FALSE",,"200",,,,"0/13/13",,,,"20",,,,"1492",,,,"Quick Attack, Fly, Close Combat",,,"396;397;398","398"
"398","Staraptor (Shadow)","Starly","TRUE",,"201",,,,"0/13/13",,,,"20",,,,"1492",,,,"Quick Attack, Fly, Close Combat",,,"396;397;398","398"
"400","Bibarel","Bidoof","FALSE",,"274",,,,"0/14/13",,,,"33.5",,,,"1499",,,,"Rollout, Surf, Hyper Fang",,,"399;400","400"
"400","Bibarel (Shadow)","Bidoof","TRUE",,"190",,,,"0/14/13",,,,"33.5",,,,"1499",,,,"Rollout, Surf, Hyper Fang",,,"399;400","400"
"402","Kricketune","Kricketot","FALSE",,"407",,,,"0/15/15",,,,"39.5",,,,"1492",,,,"Fury Cutter, X-Scissor, Aerial Ace",,,"401;402","402"
"404","Luxio","Shinx","FALSE",,"609",,,,"0/15/15",,,,"48",,,,"1500",,,,"Spark, Wild Charge, Crunch",,,"403;404;405","404;405"
"404","Luxio (Shadow)","Shinx","TRUE",,"681",,,,"0/15/15",,,,"48",,,,"1493",,,,"Spark, Wild Charge, Crunch",,,"403;404;405","404;405"
"405","Luxray","Shinx","FALSE",,"450",,,,"0/15/12",,,,"19.5",,,,"1496",,,,"Spark, Wild Charge, Psychic Fangs",,,"403;404;405","405"
"405","Luxray (Shadow)","Shinx","TRUE",,"490",,,,"0/15/12",,,,"19.5",,,,"1496",,,,"Snarl, Wild Charge, Psychic Fangs",,,"403;404;405","405"
"407","Roserade","Roselia","FALSE",,"188",,,,"0/11/14",,,,"19",,,,"1497",,,,"Poison Sting, Weather Ball (Fire), Leaf Storm",,,"315;406;407","406;407"
"409","Rampardos","Cranidos","FALSE",,"778",,,,"1/14/8",,,,"17",,,,"1498",,,,"Smack Down, Rock Slide, Flamethrower",,,"408;409","409"
"409","Rampardos (Shadow)","Cranidos","TRUE",,"634",,,,"1/14/8",,,,"17",,,,"1498",,,,"Smack Down, Rock Slide, Flamethrower",,,"408;409","409"
"413","Wormadam (Plant)","Burmy","FALSE",,"707",,,,"0/15/14",,,,"35.5",,,,"1497",,,,"Bug Bite, Energy Ball, Bug Buzz",,,"412;413","413"
"413","Wormadam (Sandy)","Burmy","FALSE",,"650",,,,"0/15/14",,,,"35.5",,,,"1497",,,,"Bug Bite, Bug Buzz, Bulldoze",,,"412;413","413"
"414","Mothim","Mothim","FALSE",,"770",,,,"0/15/15",,,,"32.5",,,,"1496",,,,"Air Slash, Aerial Ace, Bug Buzz",,,"412;414","414"
"416","Vespiquen","Combee","FALSE",,"234",,,,"0/14/13",,,,"29",,,,"1500",,,,"Poison Sting, X-Scissor, Power Gem",,,"415;416","416"
"417","Pachirisu","Pachirisu","FALSE",,"108",,,,"15/15/14",,,,"50",,,,"1372",,,,"Volt Switch, Thunder Punch, Thunderbolt",,,"417","417"
"419","Floatzel","Buizel","FALSE",,"518",,,,"0/15/13",,,,"23",,,,"1494",,,,"Water Gun, Aqua Jet, Swift",,,"418;419","419"
"421","Cherrim (Overcast)","Cherubi","FALSE",,"820",,,,"0/13/15",,,,"28",,,,"1498",,,,"Bullet Seed, Dazzling Gleam, Solar Beam",,,"420;421","421"
"421","Cherrim (Sunshine)","Cherubi","FALSE",,"594",,,,"0/13/15",,,,"28",,,,"1498",,,,"Bullet Seed, Weather Ball (Fire), Solar Beam",,,"420;421","421"
"422","Shellos","Shellos","FALSE",,"637",,,,"15/15/15",,,,"50",,,,"1284",,,,"Mud Slap, Mud Bomb, Body Slam",,,"422;423","422;423"
"423","Gastrodon","Shellos","FALSE",,"120",,,,"1/15/14",,,,"24.5",,,,"1497",,,,"Mud Slap, Body Slam, Earth Power",,,"422;423","423"
"424","Ambipom","Aipom","FALSE",,"509",,,,"0/13/14",,,,"23.5",,,,"1496",,,,"Astonish, Aerial Ace, Return",,,"190;424","424"
"424","Ambipom (Shadow)","Aipom","TRUE",,"395",,,,"0/13/14",,,,"23.5",,,,"1496",,,,"Astonish, Aerial Ace, Low Sweep",,,"190;424","424"
"425","Drifloon","Drifloon","FALSE",,"141",,,,"15/15/15",,,,"50",,,,"1353",,,,"Hex, Icy Wind, Shadow Ball",,,"425;426","425;426"
"425","Drifloon (Shadow)","Drifloon","TRUE",,"112",,,,"15/15/15",,,,"50",,,,"1353",,,,"Hex, Icy Wind, Shadow Ball",,,"425;426","425;426"
"426","Drifblim","Drifloon","FALSE",,"15",,,,"0/15/12",,,,"24",,,,"1498",,,,"Hex, Icy Wind, Shadow Ball",,,"425;426","426"
"426","Drifblim (Shadow)","Drifloon","TRUE",,"27",,,,"0/15/12",,,,"24",,,,"1498",,,,"Hex, Icy Wind, Shadow Ball",,,"425;426","426"
"427","Buneary","Buneary","FALSE",,"479",,,,"15/15/15",,,,"50",,,,"1423",,,,"Quick Attack, Swift, Fire Punch",,,"427;428","427;428"
"428","Lopunny","Buneary","FALSE",,"401",,,,"0/15/14",,,,"28",,,,"1493",,,,"Double Kick, Triple Axel, Focus Blast",,,"427;428","428"
"429","Mismagius","Misdreavus","FALSE",,"418",,,,"0/15/15",,,,"21.5",,,,"1499",,,,"Hex, Shadow Ball, Dark Pulse",,,"200;429","429"
"429","Mismagius (Shadow)","Misdreavus","TRUE",,"458",,,,"0/15/15",,,,"21.5",,,,"1499",,,,"Hex, Shadow Ball, Dark Pulse",,,"200;429","429"
"432","Purugly","Glameow","FALSE",,"293",,,,"0/12/15",,,,"29.5",,,,"1489",,,,"Shadow Claw, Aerial Ace, Thunder",,,"431;432","432"
"432","Purugly (Shadow)","Glameow","TRUE",,"247",,,,"0/12/15",,,,"29.5",,,,"1489",,,,"Shadow Claw, Aerial Ace, Thunder",,,"431;432","432"
"438","Bonsly","Sudowoodo","FALSE",,"433",,,,"15/15/15",,,,"50",,,,"1472",,,,"Rock Throw, Rock Tomb, Rock Slide",,,"185;438","438"
"441","Chatot","Chatot","FALSE",,"813",,,,"0/15/14",,,,"33.5",,,,"1500",,,,"Steel Wing, Sky Attack, Night Shade",,,"441","441"
"444","Gabite","Gible","FALSE",,"732",,,,"0/15/14",,,,"31",,,,"1497",,,,"Mud Shot, Dig, Flamethrower",,,"443;444;445","444;445"
"444","Gabite (Shadow)","Gible","TRUE",,"776",,,,"0/15/14",,,,"31",,,,"1497",,,,"Mud Shot, Dig, Flamethrower",,,"443;444;445","444;445"
"445","Garchomp","Gible","FALSE",,"469",,,,"0/15/14",,,,"14",,,,"1495",,,,"Dragon Tail, Sand Tomb, Outrage",,,"443;444;445","445"
"445","Garchomp (Shadow)","Gible","TRUE",,"415",,,,"0/15/14",,,,"14",,,,"1495",,,,"Dragon Tail, Sand Tomb, Outrage",,,"443;444;445","445"
"446","Munchlax","Snorlax","FALSE",,"268",,,,"0/14/13",,,,"32",,,,"1499",,,,"Tackle, Body Slam, Bulldoze",,,"143;446","446"
"449","Hippopotas","Hippopotas","FALSE",,"203",,,,"13/15/14",,,,"49.5",,,,"1498",,,,"Sand Attack, Rock Tomb, Dig",,,"449;450","449;450"
"449","Hippopotas (Shadow)","Hippopotas","TRUE",,"278",,,,"13/15/14",,,,"49.5",,,,"1498",,,,"Sand Attack, Rock Tomb, Dig",,,"449;450","449;450"
"450","Hippowdon","Hippopotas","FALSE",,"204",,,,"0/14/10",,,,"18.5",,,,"1494",,,,"Sand Attack, Weather Ball (Rock), Scorching Sands",,,"449;450","450"
"450","Hippowdon (Shadow)","Hippopotas","TRUE",,"149",,,,"0/14/10",,,,"18.5",,,,"1494",,,,"Sand Attack, Weather Ball (Rock), Scorching Sands",,,"449;450","450"
"451","Skorupi","Skorupi","FALSE",,"729",,,,"15/15/15",,,,"50",,,,"1141",,,,"Poison Sting, Aqua Tail, Cross Poison",,,"451;452","451;452"
"451","Skorupi (Shadow)","Skorupi","TRUE",,"678",,,,"15/15/15",,,,"50",,,,"1141",,,,"Poison Sting, Aqua Tail, Cross Poison",,,"451;452","451;452"
"454","Toxicroak","Croagunk","FALSE",,"635",,,,"1/15/15",,,,"22.5",,,,"1498",,,,"Counter, Mud Bomb, Shadow Ball",,,"453;454","454"
"454","Toxicroak (Shadow)","Croagunk","TRUE",,"628",,,,"1/15/15",,,,"22.5",,,,"1498",,,,"Counter, Mud Bomb, Shadow Ball",,,"453;454","454"
"455","Carnivine","Carnivine","FALSE",,"444",,,,"0/14/13",,,,"26.5",,,,"1498",,,,"Vine Whip, Crunch, Power Whip",,,"455","455"
"457","Lumineon","Finneon","FALSE",,"512",,,,"0/15/12",,,,"34.5",,,,"1497",,,,"Water Gun, Water Pulse, Silver Wind",,,"456;457","457"
"458","Mantyke","Mantine","FALSE",,"286",,,,"15/15/15",,,,"50",,,,"1411",,,,"Bubble, Aerial Ace, Water Pulse",,,"226;458","458"
"459","Snover","Snover","FALSE",,"632",,,,"15/15/14",,,,"50",,,,"1311",,,,"Powder Snow, Ice Beam, Energy Ball",,,"459;460","459;460"
"459","Snover (Shadow)","Snover","TRUE",,"752",,,,"15/15/14",,,,"50",,,,"1311",,,,"Powder Snow, Ice Beam, Energy Ball",,,"459;460","459;460"
"460","Abomasnow","Snover","FALSE",,"85",,,,"0/15/15",,,,"24",,,,"1491",,,,"Powder Snow, Icy Wind, Energy Ball",,,"459;460","460"
"460","Abomasnow (Shadow)","Snover","TRUE",,"32",,,,"0/15/15",,,,"24",,,,"1491",,,,"Powder Snow, Weather Ball (Ice), Energy Ball",,,"459;460","460"
"463","Lickilicky","Lickitung","FALSE",,"28",,,,"0/15/10",,,,"23.5",,,,"1498",,,,"Rollout, Body Slam, Shadow Ball",,,"108;463","463"
"464","Rhyperior","Rhyhorn","FALSE",,"302",,,,"0/14/14",,,,"15",,,,"1498",,,,"Mud Slap, Breaking Swipe, Rock Wrecker",,,"111;112;464","464"
"464","Rhyperior (Shadow)","Rhyhorn","TRUE",,"257",,,,"0/14/14",,,,"15",,,,"1498",,,,"Mud Slap, Breaking Swipe, Rock Wrecker",,,"111;112;464","464"
"465","Tangrowth","Tangela","FALSE",,"330",,,,"1/15/14",,,,"18.5",,,,"1498",,,,"Vine Whip, Power Whip, Rock Slide",,,"114;465","465"
"465","Tangrowth (Shadow)","Tangela","TRUE",,"358",,,,"1/15/14",,,,"18.5",,,,"1498",,,,"Vine Whip, Power Whip, Rock Slide",,,"114;465","465"
"466","Electivire","Electabuzz","FALSE",,"86",,,,"1/15/15",,,,"18",,,,"1498",,,,"Thunder Shock, Ice Punch, Wild Charge",,,"125;239;466","239;466"
"466","Electivire (Shadow)","Electabuzz","TRUE",,"60",,,,"1/15/15",,,,"18",,,,"1498",,,,"Thunder Shock, Ice Punch, Wild Charge",,,"125;239;466","239;466"
"467","Magmortar","Magmar","FALSE",,"364",,,,"0/10/15",,,,"18",,,,"1500",,,,"Karate Chop, Fire Punch, Thunderbolt",,,"126;240;467","240;467"
"467","Magmortar (Shadow)","Magmar","TRUE",,"305",,,,"0/10/15",,,,"18",,,,"1500",,,,"Karate Chop, Fire Punch, Thunderbolt",,,"126;240;467","240;467"
"469","Yanmega","Yanma","FALSE",,"638",,,,"0/14/15",,,,"19",,,,"1498",,,,"Wing Attack, Aerial Ace, Ancient Power",,,"193;469","469"
"470","Leafeon","Leafeon","FALSE",,"279",,,,"1/15/14",,,,"19",,,,"1496",,,,"Quick Attack, Leaf Blade, Last Resort",,,"133;470","470"
"471","Glaceon","Glaceon","FALSE",,"564",,,,"0/15/12",,,,"18",,,,"1499",,,,"Ice Shard, Avalanche, Icy Wind",,,"133;471","471"
"472","Gliscor","Gligar","FALSE",,"182",,,,"1/15/14",,,,"21",,,,"1496",,,,"Sand Attack, Earthquake, Aerial Ace",,,"207;472","472"
"472","Gliscor (Shadow)","Gligar","TRUE",,"183",,,,"1/15/14",,,,"21",,,,"1496",,,,"Sand Attack, Earthquake, Aerial Ace",,,"207;472","472"
"473","Mamoswine","Swinub","FALSE",,"267",,,,"0/15/7",,,,"17",,,,"1491",,,,"Powder Snow, Icicle Spear, High Horsepower",,,"220;221;473","473"
"473","Mamoswine (Shadow)","Swinub","TRUE",,"232",,,,"0/15/7",,,,"17",,,,"1491",,,,"Powder Snow, Icicle Spear, High Horsepower",,,"220;221;473","473"
"474","Porygon-Z","Porygon","FALSE",,"823",,,,"1/15/13",,,,"17",,,,"1499",,,,"Lock On, Tri Attack, Zap Cannon",,,"137;233;474","474"
"474","Porygon-Z (Shadow)","Porygon","TRUE",,"819",,,,"1/15/13",,,,"17",,,,"1499",,,,"Lock On, Tri Attack, Zap Cannon",,,"137;233;474","474"
"475","Gallade","Gallade","FALSE",,"119",,,,"0/15/15",,,,"18",,,,"1498",,,,"Psycho Cut, Close Combat, Leaf Blade",,,"280;281;475","475"
"475","Gallade (Shadow)","Gallade","TRUE",,"78",,,,"0/15/15",,,,"18",,,,"1498",,,,"Psycho Cut, Close Combat, Leaf Blade",,,"280;281;475","475"
"477","Dusknoir","Duskull","FALSE",,"9",,,,"0/14/13",,,,"24",,,,"1499",,,,"Astonish, Dynamic Punch, Shadow Punch",,,"355;356;477","477"
"477","Dusknoir (Shadow)","Duskull","TRUE",,"6",,,,"0/14/13",,,,"24",,,,"1499",,,,"Astonish, Dynamic Punch, Shadow Punch",,,"355;356;477","477"
"478","Froslass","Froslass","FALSE",,"31",,,,"0/15/15",,,,"28",,,,"1496",,,,"Hex, Avalanche, Shadow Ball",,,"361;478","478"
"478","Froslass (Shadow)","Froslass","TRUE",,"61",,,,"0/15/15",,,,"28",,,,"1496",,,,"Hex, Avalanche, Shadow Ball",,,"361;478","478"
"479","Rotom","Rotom","FALSE",,"453",,,,,,,,,,,,"1500",,,,"Astonish, Thunderbolt, Ominous Wind",,,"479","479"
"479","Rotom (Frost)","Rotom","FALSE",,"698",,,,"0/12/15",,,,"22",,,,"1491",,,,"Thunder Shock, Thunderbolt, Blizzard",,,"479","479"
"479","Rotom (Heat)","Rotom","FALSE",,"556",,,,"0/12/15",,,,"22",,,,"1491",,,,"Thunder Shock, Overheat, Thunderbolt",,,"479","479"
"479","Rotom (Mow)","Rotom","FALSE",,"675",,,,"0/12/15",,,,"22",,,,"1491",,,,"Thunder Shock, Thunderbolt, Ominous Wind",,,"479","479"
"479","Rotom (Wash)","Rotom","FALSE",,"644",,,,"0/12/15",,,,"22",,,,"1491",,,,"Thunder Shock, Thunderbolt, Hydro Pump",,,"479","479"
"480","Uxie","Uxie","FALSE",,"189",,,,"0/13/13",,,,"23",,,,"1500",,,,"Confusion, Swift, Future Sight",,,"480","480"
"481","Mesprit","Mesprit","FALSE",,"555",,,,"0/15/12",,,,"18.5",,,,"1500",,,,"Confusion, Swift, Future Sight",,,"481","481"
"482","Azelf","Azelf","FALSE",,"713",,,,"0/14/11",,,,"17.5",,,,"1500",,,,"Confusion, Swift, Future Sight",,,"482","482"
"484","Palkia (Shadow)","Palkia","TRUE",,"103",,,,"0/14/12",,,,"14",,,,"1498",,,,"Dragon Breath, Aqua Tail, Draco Meteor",,,"484","484"
"486","Regigigas (Shadow)","Regigigas","TRUE",,"848",,,,"0/8/12",,,,"13",,,,"1499",,,,"Hidden Power (Ground), Thunder, Focus Blast",,,"486","486"
"487","Giratina (Origin)","Giratina","FALSE",,"99",,,,"0/10/11",,,,"15.5",,,,"1499",,,,"Shadow Claw, Ominous Wind, Shadow Ball",,,"487","487"
"488","Cresselia","Cresselia","FALSE",,"62",,,,"2/15/13",,,,"20",,,,"1497",,,,"Psycho Cut, Grass Knot, Moonblast",,,"488","488"
"488","Cresselia (Shadow)","Cresselia","TRUE",,"134",,,,"2/15/13",,,,"20",,,,"1492",,,,"Psycho Cut, Grass Knot, Moonblast",,,"488","488"
"492","Shaymin (Land)","Shaymin","FALSE",,"606",,,,"0/10/13",,,,"17.5",,,,"1492",,,,"Magical Leaf, Grass Knot, Seed Flare",,,"492","492"
"492","Shaymin (Sky)","Shaymin","FALSE",,"779",,,,"0/14/15",,,,"15.5",,,,"1489",,,,"Magical Leaf, Grass Knot, Energy Ball",,,"492","492"
"494","Victini","Victini","FALSE",,"351",,,,"0/10/13",,,,"17.5",,,,"1498",,,,"Quick Attack, V-Create, Psychic",,,"494","494"
"496","Servine","Snivy","FALSE",,"306",,,,"4/15/14",,,,"50",,,,"1500",,,,"Vine Whip, Grass Knot, Wrap",,,"495;496;497","496;497"
"496","Servine (Shadow)","Snivy","TRUE",,"328",,,,"4/15/14",,,,"50",,,,"1500",,,,"Vine Whip, Grass Knot, Leaf Tornado",,,"495;496;497","496;497"
"497","Serperior","Snivy","FALSE",,"53",,,,"0/10/15",,,,"25.5",,,,"1499",,,,"Vine Whip, Frenzy Plant, Aerial Ace",,,"495;496;497","497"
"497","Serperior (Shadow)","Snivy","TRUE",,"89",,,,"0/10/15",,,,"25.5",,,,"1499",,,,"Vine Whip, Frenzy Plant, Aerial Ace",,,"495;496;497","497"
"499","Pignite","Tepig","FALSE",,"756",,,,"0/15/15",,,,"29.5",,,,"1495",,,,"Ember, Rock Tomb, Flame Charge",,,"498;499;500","499;500"
"499","Pignite (Shadow)","Tepig","TRUE",,"763",,,,"0/15/15",,,,"29.5",,,,"1495",,,,"Ember, Rock Tomb, Flame Charge",,,"498;499;500","499;500"
"500","Emboar","Tepig","FALSE",,"808",,,,"0/14/9",,,,"19",,,,"1494",,,,"Ember, Blast Burn, Rock Slide",,,"498;499;500","500"
"500","Emboar (Shadow)","Tepig","TRUE",,"803",,,,"0/14/9",,,,"19",,,,"1494",,,,"Ember, Blast Burn, Rock Slide",,,"498;499;500","500"
"502","Dewott","Oshawott","FALSE",,"275",,,,"0/15/15",,,,"36",,,,"1499",,,,"Fury Cutter, Aqua Tail, X-Scissor",,,"501;502;503","502;503"
"502","Dewott (Shadow)","Oshawott","TRUE",,"261",,,,"0/15/15",,,,"36",,,,"1498",,,,"Fury Cutter, Aqua Tail, X-Scissor",,,"501;502;503","502;503"
