"ID","Pokemon","Family","Shadow","Little_Rank","Great_Rank","Ultra_Rank","Master_Rank","Little_IVs","Great_IVs","Ultra_IVs","Master_IVs","Little_Level","Great_Level","Ultra_Level","Master_Level","Little_CP","Great_CP","Ultra_CP","Master_CP","Little_MoveSet","Great_MoveSet","Ultra_MoveSet","Master_MoveSet","Evo_Fam","Evo_Next"
"118","Goldeen","Goldeen","FALSE",,"914",,,,"15/15/15",,,,"50",,,,"1302",,,,"Mud Shot, Aqua Tail, Horn Attack",,,"118;119","118;119"
"119","Seaking","Goldeen","FALSE",,"363",,,,"0/14/14",,,,"26.5",,,,"1500",,,,"Poison Jab, Drill Run, Icy Wind",,,"118;119","119"
"121","Starmie","Staryu","FALSE",,"240",,,,"0/15/11",,,,"22",,,,"1488",,,,"Psywave, Surf, Power Gem",,,"120;121","121"
"122","Mr. Mime","Mr-mime","FALSE",,"544",,,,"0/13/15",,,,"25.5",,,,"1500",,,,"Psywave, Shadow Ball, Psychic",,,"122;439;866","122;439;866"
"122","Mr. Mime (Galarian)","Mr-mime","FALSE",,"897",,,,"1/15/13",,,,"27.5",,,,"1497",,,,"Confusion, Ice Punch, Triple Axel",,,"122;439;866","122;439;866"
"123","Scyther","Scyther","FALSE",,"519",,,,"0/14/11",,,,"21",,,,"1496",,,,"Fury Cutter, Aerial Ace, Night Slash",,,"123;212","123;212"
"123","Scyther (Shadow)","Scyther","TRUE",,"450",,,,"0/14/11",,,,"21",,,,"1496",,,,"Fury Cutter, Aerial Ace, Night Slash",,,"123;212","123;212"
"124","Jynx","Jynx","FALSE",,"951",,,,"0/14/15",,,,"22",,,,"1496",,,,"Confusion, Avalanche, Psyshock",,,"124;238","124;238"
"125","Electabuzz","Electabuzz","FALSE",,"536",,,,"0/14/11",,,,"24.5",,,,"1490",,,,"Thunder Shock, Thunder Punch, Return",,,"125;239;466","125;239;466"
"125","Electabuzz (Shadow)","Electabuzz","TRUE",,"405",,,,"0/14/11",,,,"24.5",,,,"1500",,,,"Thunder Shock, Thunder Punch, Thunderbolt",,,"125;239;466","125;239;466"
"126","Magmar","Magmar","FALSE",,"260",,,,"0/15/15",,,,"23.5",,,,"1499",,,,"Karate Chop, Fire Punch, Scorching Sands",,,"126;240;467","126;240;467"
"126","Magmar (Shadow)","Magmar","TRUE",,"137",,,,"0/15/15",,,,"23.5",,,,"1499",,,,"Karate Chop, Fire Punch, Scorching Sands",,,"126;240;467","126;240;467"
"127","Pinsir","Pinsir","FALSE",,"534",,,,"0/13/14",,,,"19",,,,"1500",,,,"Fury Cutter, Close Combat, X-Scissor",,,"127","127"
"127","Pinsir (Shadow)","Pinsir","TRUE",,"453",,,,"0/13/14",,,,"19",,,,"1500",,,,"Fury Cutter, Close Combat, X-Scissor",,,"127","127"
"128","Tauros","Tauros","FALSE",,"725",,,,"0/15/15",,,,"21.5",,,,"1495",,,,"Tackle, Trailblaze, Horn Attack",,,"128","128"
"128","Tauros (Aqua)","Tauros","FALSE",,"268",,,,"0/11/15",,,,"20",,,,"1494",,,,"Double Kick, Aqua Jet, Trailblaze",,,"128","128"
"128","Tauros (Blaze)","Tauros","FALSE",,"451",,,,"0/11/15",,,,"20",,,,"1494",,,,"Double Kick, Flame Charge, Trailblaze",,,"128","128"
"128","Tauros (Combat)","Tauros","FALSE",,"360",,,,"0/11/15",,,,"20",,,,"1494",,,,"Double Kick, Close Combat, Trailblaze",,,"128","128"
"130","Gyarados","Magikarp","FALSE",,"203",,,,"0/14/15",,,,"16.5",,,,"1498",,,,"Dragon Breath, Aqua Tail, Crunch",,,"129;130","130"
"130","Gyarados (Shadow)","Magikarp","TRUE",,"393",,,,"0/14/15",,,,"16.5",,,,"1498",,,,"Waterfall, Aqua Tail, Crunch",,,"129;130","130"
"133","Eevee","Eevee","FALSE",,"885",,,,"15/15/15",,,,"50",,,,"1210",,,,"Quick Attack, Swift, Dig",,,"133;134;135;136;196;197;470;471;700","133;134;135;136;196;197;470;471;700"
"134","Vaporeon","Eevee","FALSE",,"299",,,,"1/15/15",,,,"18",,,,"1499",,,,"Water Gun, Aqua Tail, Last Resort",,,"133;134","134"
"135","Jolteon","Eevee","FALSE",,"681",,,,"0/12/15",,,,"19.5",,,,"1495",,,,"Thunder Shock, Discharge, Last Resort",,,"133;135","135"
"136","Flareon","Eevee","FALSE",,"508",,,,"0/15/13",,,,"18.5",,,,"1488",,,,"Fire Spin, Superpower, Flamethrower",,,"133;136","136"
"137","Porygon","Porygon","FALSE",,"693",,,,"0/13/15",,,,"37.5",,,,"1500",,,,"Quick Attack, Discharge, Hyper Beam",,,"137;233;474","137;233;474"
"137","Porygon (Shadow)","Porygon","TRUE",,"853",,,,"0/13/15",,,,"37.5",,,,"1500",,,,"Tackle, Discharge, Signal Beam",,,"137;233;474","137;233;474"
"138","Omanyte","Omanyte","FALSE",,"668",,,,"0/13/15",,,,"45.5",,,,"1500",,,,"Mud Shot, Rock Tomb, Rock Blast",,,"138;139","138;139"
"138","Omanyte (Shadow)","Omanyte","TRUE",,"667",,,,"0/13/15",,,,"45.5",,,,"1500",,,,"Mud Shot, Rock Tomb, Rock Blast",,,"138;139","138;139"
"139","Omastar","Omanyte","FALSE",,"866",,,,"0/9/15",,,,"20.5",,,,"1493",,,,"Mud Shot, Rock Slide, Hydro Pump",,,"138;139","139"
"139","Omastar (Shadow)","Omanyte","TRUE",,"884",,,,"0/9/15",,,,"20.5",,,,"1493",,,,"Mud Shot, Rock Slide, Hydro Pump",,,"138;139","139"
"140","Kabuto","Kabuto","FALSE",,"487",,,,"10/15/15",,,,"49.5",,,,"1498",,,,"Mud Shot, Aqua Jet, Rock Tomb",,,"140;141","140;141"
"141","Kabutops","Kabuto","FALSE",,"874",,,,"0/14/10",,,,"21",,,,"1493",,,,"Fury Cutter, Stone Edge, Ancient Power",,,"140;141","141"
"142","Aerodactyl","Aerodactyl","FALSE",,"835",,,,"1/15/15",,,,"20",,,,"1500",,,,"Rock Throw, Rock Slide, Earth Power",,,"142","142"
"142","Aerodactyl (Shadow)","Aerodactyl","TRUE",,"731",,,,"1/15/15",,,,"20",,,,"1500",,,,"Rock Throw, Rock Slide, Earth Power",,,"142","142"
"143","Snorlax","Snorlax","FALSE",,"284",,,,"1/15/14",,,,"17.5",,,,"1498",,,,"Lick, Body Slam, Superpower",,,"143;446","143;446"
"143","Snorlax (Shadow)","Snorlax","TRUE",,"234",,,,"1/15/14",,,,"17.5",,,,"1498",,,,"Lick, Body Slam, Superpower",,,"143;446","143;446"
"144","Articuno","Articuno","FALSE",,"514",,,,"0/15/15",,,,"18.5",,,,"1500",,,,"Ice Shard, Triple Axel, Ancient Power",,,"144","144"
"144","Articuno (Galarian)","Articuno","FALSE",,"695",,,,"0/15/14",,,,"15.5",,,,"1498",,,,"Psycho Cut, Ancient Power, Brave Bird",,,"144","144"
"144","Articuno (Shadow)","Articuno","TRUE",,"565",,,,"0/15/15",,,,"18.5",,,,"1500",,,,"Ice Shard, Triple Axel, Ancient Power",,,"144","144"
"145","Zapdos","Zapdos","FALSE",,"154",,,,"0/12/12",,,,"16",,,,"1495",,,,"Thunder Shock, Drill Peck, Thunderbolt",,,"145","145"
"145","Zapdos (Galarian)","Zapdos","FALSE",,"727",,,,"3/15/14",,,,"15.5",,,,"1495",,,,"Counter, Ancient Power, Brave Bird",,,"145","145"
"145","Zapdos (Shadow)","Zapdos","TRUE",,"102",,,,"0/12/12",,,,"16",,,,"1498",,,,"Thunder Shock, Drill Peck, Thunderbolt",,,"145","145"
"146","Moltres","Moltres","FALSE",,"578",,,,"1/15/14",,,,"16",,,,"1493",,,,"Fire Spin, Sky Attack, Ancient Power",,,"146","146"
"146","Moltres (Galarian)","Moltres","FALSE",,"31",,,,"0/13/12",,,,"18",,,,"1493",,,,"Sucker Punch, Ancient Power, Brave Bird",,,"146","146"
"146","Moltres (Shadow)","Moltres","TRUE",,"553",,,,"1/15/14",,,,"16",,,,"1499",,,,"Fire Spin, Sky Attack, Ancient Power",,,"146","146"
"148","Dragonair","Dratini","FALSE",,"165",,,,"1/15/15",,,,"34",,,,"1497",,,,"Dragon Breath, Aqua Tail, Body Slam",,,"147;148;149","148;149"
"148","Dragonair (Shadow)","Dratini","TRUE",,"145",,,,"1/15/15",,,,"34",,,,"1497",,,,"Dragon Breath, Body Slam, Aqua Tail",,,"147;148;149","148;149"
"149","Dragonite","Dratini","FALSE",,"138",,,,"3/15/14",,,,"14.5",,,,"1495",,,,"Dragon Breath, Dragon Claw, Superpower",,,"147;148;149","149"
"149","Dragonite (Shadow)","Dratini","TRUE",,"103",,,,"3/15/14",,,,"14.5",,,,"1495",,,,"Dragon Breath, Dragon Claw, Superpower",,,"147;148;149","149"
"150","Mewtwo (Shadow)","Mewtwo","TRUE",,"526",,,,"4/15/15",,,,"13",,,,"1499",,,,"Psycho Cut, Psystrike, Thunderbolt",,,"150","150"
"151","Mew","Mew","FALSE",,"69",,,,"0/10/13",,,,"17.5",,,,"1498",,,,"Shadow Claw, Wild Charge, Psyshock",,,"151","151"
"153","Bayleef","Chikorita","FALSE",,"389",,,,"3/15/14",,,,"50",,,,"1494",,,,"Magical Leaf, Ancient Power, Energy Ball",,,"152;153;154","153;154"
"153","Bayleef (Shadow)","Chikorita","TRUE",,"481",,,,"3/15/14",,,,"50",,,,"1494",,,,"Magical Leaf, Ancient Power, Energy Ball",,,"152;153;154","153;154"
"154","Meganium","Chikorita","FALSE",,"86",,,,"0/10/15",,,,"24",,,,"1499",,,,"Vine Whip, Frenzy Plant, Earthquake",,,"152;153;154","154"
"154","Meganium (Shadow)","Chikorita","TRUE",,"144",,,,"0/10/15",,,,"24",,,,"1499",,,,"Vine Whip, Frenzy Plant, Earthquake",,,"152;153;154","154"
"156","Quilava","Cyndaquil","FALSE",,"756",,,,"0/13/15",,,,"40",,,,"1496",,,,"Ember, Flame Charge, Dig",,,"155;156;157","156;157"
"156","Quilava (Shadow)","Cyndaquil","TRUE",,"761",,,,"0/13/15",,,,"40",,,,"1496",,,,"Ember, Flame Charge, Dig",,,"155;156;157","156;157"
"157","Typhlosion","Cyndaquil","FALSE",,"193",,,,"0/15/13",,,,"19.5",,,,"1488",,,,"Incinerate, Blast Burn, Thunder Punch",,,"155;156;157","157"
"157","Typhlosion (Hisuian)","Cyndaquil","FALSE",,"390",,,,"0/11/12",,,,"19",,,,"1500",,,,"Hex, Fire Punch, Shadow Ball",,,"155;156;157","157"
"157","Typhlosion (Shadow)","Cyndaquil","TRUE",,"167",,,,"0/15/13",,,,"19.5",,,,"1488",,,,"Incinerate, Blast Burn, Thunder Punch",,,"155;156;157","157"
"158","Totodile","Totodile","FALSE",,"864",,,,"15/15/15",,,,"50",,,,"1279",,,,"Water Gun, Aqua Jet, Crunch",,,"158;159;160","158;159;160"
"158","Totodile (Shadow)","Totodile","TRUE",,"868",,,,"15/15/15",,,,"50",,,,"1279",,,,"Water Gun, Aqua Jet, Crunch",,,"158;159;160","158;159;160"
"159","Croconaw","Totodile","FALSE",,"485",,,,"0/13/15",,,,"37.5",,,,"1499",,,,"Water Gun, Ice Punch, Crunch",,,"158;159;160","159;160"
"159","Croconaw (Shadow)","Totodile","TRUE",,"500",,,,"0/13/15",,,,"37.5",,,,"1499",,,,"Water Gun, Ice Punch, Crunch",,,"158;159;160","159;160"
"162","Furret","Sentret","FALSE",,"12",,,,"1/15/14",,,,"35.5",,,,"1500",,,,"Sucker Punch, Swift, Trailblaze",,,"161;162","162"
"164","Noctowl","Hoothoot","FALSE",,"247",,,,"1/14/15",,,,"28.5",,,,"1494",,,,"Wing Attack, Sky Attack, Night Shade",,,"163;164","164"
"166","Ledian","Ledyba","FALSE",,"341",,,,"13/15/15",,,,"50",,,,"1500",,,,"Counter, Dynamic Punch, Aerial Ace",,,"165;166","166"
"166","Ledian (Shadow)","Ledyba","TRUE",,"329",,,,"13/15/15",,,,"50",,,,"1500",,,,"Counter, Aerial Ace, Dynamic Punch",,,"165;166","166"
"168","Ariados","Spinarak","FALSE",,"219",,,,"0/14/15",,,,"35",,,,"1497",,,,"Poison Sting, Lunge, Trailblaze",,,"167;168","168"
"169","Crobat","Zubat","FALSE",,"639",,,,"0/15/12",,,,"21.5",,,,"1496",,,,"Air Slash, Poison Fang, Shadow Ball",,,"41;42;169","169"
"169","Crobat (Shadow)","Zubat","TRUE",,"658",,,,"0/15/12",,,,"21.5",,,,"1496",,,,"Air Slash, Poison Fang, Shadow Ball",,,"41;42;169","169"
"170","Chinchou","Chinchou","FALSE",,"877",,,,"15/15/15",,,,"50",,,,"1265",,,,"Bubble, Thunderbolt, Water Pulse",,,"170;171","170;171"
"171","Lanturn","Chinchou","FALSE",,"97",,,,"0/13/14",,,,"28",,,,"1496",,,,"Water Gun, Surf, Thunderbolt",,,"170;171","171"
"176","Togetic","Togepi","FALSE",,"45",,,,"0/14/14",,,,"38.5",,,,"1496",,,,"Fairy Wind, Psyshock, Dazzling Gleam",,,"175;176;468","176;468"
"178","Xatu","Natu","FALSE",,"923",,,,"0/13/15",,,,"26",,,,"1499",,,,"Air Slash, Aerial Ace, Future Sight",,,"177;178","178"
"178","Xatu (Shadow)","Natu","TRUE",,"921",,,,"0/13/15",,,,"26",,,,"1499",,,,"Air Slash, Aerial Ace, Future Sight",,,"177;178","178"
"180","Flaaffy","Mareep","FALSE",,"912",,,,"0/15/14",,,,"47",,,,"1497",,,,"Charge Beam, Discharge, Trailblaze",,,"179;180;181","180;181"
"180","Flaaffy (Shadow)","Mareep","TRUE",,"929",,,,"0/15/14",,,,"47",,,,"1497",,,,"Charge Beam, Trailblaze, Discharge",,,"179;180;181","180;181"
"181","Ampharos","Mareep","FALSE",,"431",,,,"0/13/11",,,,"20",,,,"1499",,,,"Volt Switch, Brutal Swing, Trailblaze",,,"179;180;181","181"
"181","Ampharos (Shadow)","Mareep","TRUE",,"358",,,,"0/13/11",,,,"20",,,,"1499",,,,"Volt Switch, Brutal Swing, Trailblaze",,,"179;180;181","181"
"182","Bellossom","Bellossom","FALSE",,"220",,,,"1/14/14",,,,"25",,,,"1499",,,,"Bullet Seed, Leaf Blade, Dazzling Gleam",,,"43;44;182","182"
"182","Bellossom (Shadow)","Bellossom","TRUE",,"252",,,,"1/14/14",,,,"25",,,,"1499",,,,"Bullet Seed, Leaf Blade, Dazzling Gleam",,,"43;44;182","182"
"185","Sudowoodo","Sudowoodo","FALSE",,"762",,,,"0/14/11",,,,"27",,,,"1496",,,,"Counter, Meteor Beam, Trailblaze",,,"185;438","185;438"
"185","Sudowoodo (Shadow)","Sudowoodo","TRUE",,"849",,,,"0/14/11",,,,"27",,,,"1496",,,,"Counter, Meteor Beam, Trailblaze",,,"185;438","185;438"
"186","Politoed","Politoed","FALSE",,"312",,,,"0/15/11",,,,"23.5",,,,"1498",,,,"Mud Shot, Weather Ball (Water), Earthquake",,,"60;61;186","186"
"186","Politoed (Shadow)","Politoed","TRUE",,"279",,,,"0/15/11",,,,"23.5",,,,"1498",,,,"Mud Shot, Weather Ball (Water), Earthquake",,,"60;61;186","186"
"190","Aipom","Aipom","FALSE",,"385",,,,"14/15/14",,,,"49.5",,,,"1500",,,,"Astonish, Swift, Aerial Ace",,,"190;424","190;424"
"190","Aipom (Shadow)","Aipom","TRUE",,"300",,,,"14/15/14",,,,"49.5",,,,"1500",,,,"Astonish, Swift, Aerial Ace",,,"190;424","190;424"
"192","Sunflora","Sunkern","FALSE",,"823",,,,"0/15/14",,,,"26.5",,,,"1492",,,,"Bullet Seed, Sludge Bomb, Leaf Storm",,,"191;192","192"
"193","Yanma","Yanma","FALSE",,"742",,,,"0/14/15",,,,"49.5",,,,"1498",,,,"Quick Attack, Aerial Ace, Silver Wind",,,"193;469","193;469"
"195","Quagsire","Wooper","FALSE",,"44",,,,"0/15/14",,,,"29",,,,"1494",,,,"Mud Shot, Aqua Tail, Stone Edge",,,"194;195","195"
"195","Quagsire (Shadow)","Wooper","TRUE",,"32",,,,"0/15/14",,,,"29",,,,"1494",,,,"Mud Shot, Aqua Tail, Stone Edge",,,"194;195","195"
"196","Espeon","Eevee","FALSE",,"803",,,,"0/15/15",,,,"17.5",,,,"1491",,,,"Confusion, Psychic Fangs, Shadow Ball",,,"133;196","196"
"197","Umbreon","Eevee","FALSE",,"39",,,,"0/15/14",,,,"27.5",,,,"1497",,,,"Snarl, Dark Pulse, Last Resort",,,"133;197","197"
"198","Murkrow","Murkrow","FALSE",,"689",,,,"0/15/14",,,,"43.5",,,,"1498",,,,"Feint Attack, Drill Peck, Foul Play",,,"198;430","198;430"
"198","Murkrow (Shadow)","Murkrow","TRUE",,"743",,,,"0/15/14",,,,"43.5",,,,"1498",,,,"Feint Attack, Drill Peck, Foul Play",,,"198;430","198;430"
"199","Slowking","Slowpoke","FALSE",,"568",,,,"0/13/15",,,,"22.5",,,,"1493",,,,"Water Gun, Surf, Psychic",,,"79;199","199"
"199","Slowking (Galarian)","Slowpoke","FALSE",,"483",,,,"0/14/13",,,,"21",,,,"1498",,,,"Hex, Surf, Shadow Ball",,,"79;199","199"
"199","Slowking (Shadow)","Slowpoke","TRUE",,"624",,,,"0/13/15",,,,"22.5",,,,"1493",,,,"Water Gun, Surf, Psychic",,,"79;199","199"
"200","Misdreavus","Misdreavus","FALSE",,"456",,,,"1/15/15",,,,"29.5",,,,"1498",,,,"Psywave, Dark Pulse, Shadow Sneak",,,"200;429","200;429"
"200","Misdreavus (Shadow)","Misdreavus","TRUE",,"440",,,,"1/15/15",,,,"29.5",,,,"1498",,,,"Astonish, Dark Pulse, Shadow Sneak",,,"200;429","200;429"
"201","Unown","Unown","FALSE",,"997",,,,"15/15/15",,,,"50",,,,"1339",,,,"Hidden Power (Psychic), Struggle, NA",,,"201","201"
"202","Wobbuffet","Wobbuffet","FALSE",,"376",,,,"15/15/15",,,,"50",,,,"1160",,,,"Counter, Return, Mirror Coat",,,"202;360","202;360"
"202","Wobbuffet (Shadow)","Wobbuffet","TRUE",,"657",,,,"15/15/15",,,,"50",,,,"1160",,,,"Counter, Mirror Coat, Frustration",,,"202;360","202;360"
"203","Girafarig","Girafarig","FALSE",,"416",,,,"0/15/12",,,,"28",,,,"1486",,,,"Confusion, Psychic Fangs, Trailblaze",,,"203;981","203;981"
"203","Girafarig (Shadow)","Girafarig","TRUE",,"421",,,,"0/15/12",,,,"28",,,,"1486",,,,"Confusion, Psychic Fangs, Trailblaze",,,"203;981","203;981"
"204","Pineco","Pineco","FALSE",,"944",,,,"15/15/15",,,,"50",,,,"1253",,,,"Bug Bite, Rock Tomb, Return",,,"204;205","204;205"
"204","Pineco (Shadow)","Pineco","TRUE",,"936",,,,"15/15/15",,,,"50",,,,"1253",,,,"Bug Bite, Rock Tomb, Sand Tomb",,,"204;205","204;205"
"205","Forretress","Pineco","FALSE",,"130",,,,"0/9/15",,,,"25.5",,,,"1496",,,,"Volt Switch, Rock Tomb, Earthquake",,,"204;205","205"
"205","Forretress (Shadow)","Pineco","TRUE",,"292",,,,"0/9/15",,,,"25.5",,,,"1496",,,,"Volt Switch, Rock Tomb, Earthquake",,,"204;205","205"
"206","Dunsparce","Dunsparce","FALSE",,"72",,,,"0/14/12",,,,"40",,,,"1496",,,,"Rollout, Drill Run, Rock Slide",,,"206;982","206;982"
"207","Gligar","Gligar","FALSE",,"122",,,,"0/15/12",,,,"33",,,,"1493",,,,"Fury Cutter, Aerial Ace, Dig",,,"207;472","207;472"
"207","Gligar (Shadow)","Gligar","TRUE",,"134",,,,"0/15/12",,,,"33",,,,"1493",,,,"Fury Cutter, Aerial Ace, Dig",,,"207;472","207;472"
"208","Steelix","Onix","FALSE",,"18",,,,"0/14/15",,,,"24",,,,"1493",,,,"Thunder Fang, Psychic Fangs, Breaking Swipe",,,"95;208","208"
"208","Steelix (Shadow)","Onix","TRUE",,"30",,,,"0/14/15",,,,"24",,,,"1493",,,,"Thunder Fang, Psychic Fangs, Breaking Swipe",,,"95;208","208"
"209","Snubbull","Snubbull","FALSE",,"978",,,,"15/15/14",,,,"50",,,,"1399",,,,"Tackle, Crunch, Dazzling Gleam",,,"209;210","209;210"
"209","Snubbull (Shadow)","Snubbull","TRUE",,"987",,,,"15/15/14",,,,"50",,,,"1399",,,,"Tackle, Crunch, Dazzling Gleam",,,"209;210","209;210"
"210","Granbull","Snubbull","FALSE",,"369",,,,"0/15/15",,,,"22",,,,"1494",,,,"Charm, Close Combat, Crunch",,,"209;210","210"
"210","Granbull (Shadow)","Snubbull","TRUE",,"237",,,,"0/15/15",,,,"22",,,,"1494",,,,"Charm, Close Combat, Crunch",,,"209;210","210"
"211","Qwilfish","Qwilfish","FALSE",,"80",,,,"0/12/14",,,,"28",,,,"1490",,,,"Poison Sting, Aqua Tail, Ice Beam",,,"211;904","211;904"
"211","Qwilfish (Hisuian)","Qwilfish","FALSE",,"112",,,,"0/15/15",,,,"26.5",,,,"1497",,,,"Poison Sting, Aqua Tail, Shadow Ball",,,"211;904","211;904"
"212","Scizor","Scyther","FALSE",,"356",,,,"1/15/15",,,,"18.5",,,,"1497",,,,"Fury Cutter, Night Slash, Trailblaze",,,"123;212","212"
"212","Scizor (Shadow)","Scyther","TRUE",,"322",,,,"1/15/15",,,,"18.5",,,,"1497",,,,"Fury Cutter, Night Slash, Trailblaze",,,"123;212","212"
"214","Heracross","Heracross","FALSE",,"552",,,,"0/15/15",,,,"18",,,,"1497",,,,"Counter, Upper Hand, Megahorn",,,"214","214"
"215","Sneasel","Sneasel","FALSE",,"584",,,,"1/15/14",,,,"27.5",,,,"1499",,,,"Ice Shard, Avalanche, Foul Play",,,"215;461","215;461"
"215","Sneasel (Hisuian)","Sneasel","FALSE",,"469",,,,"1/15/14",,,,"27.5",,,,"1499",,,,"Poison Jab, Close Combat, Aerial Ace",,,"215;461","215;461"
"215","Sneasel (Hisuian) (Shadow)","Sneasel","TRUE",,"480",,,,"1/15/14",,,,"27.5",,,,"1499",,,,"Poison Jab, Close Combat, Aerial Ace",,,"215;461","215;461"
"215","Sneasel (Shadow)","Sneasel","TRUE",,"535",,,,"1/15/14",,,,"27.5",,,,"1499",,,,"Ice Shard, Avalanche, Foul Play",,,"215;461","215;461"
"216","Teddiursa","Teddiursa","FALSE",,"683",,,,"15/15/14",,,,"50",,,,"1482",,,,"Lick, Swift, Cross Chop",,,"216;217;901","216;217;901"
"216","Teddiursa (Shadow)","Teddiursa","TRUE",,"594",,,,"15/15/14",,,,"50",,,,"1482",,,,"Lick, Swift, Cross Chop",,,"216;217;901","216;217;901"
"217","Ursaring","Teddiursa","FALSE",,"93",,,,"0/14/15",,,,"19",,,,"1499",,,,"Shadow Claw, Swift, Close Combat",,,"216;217;901","217;901"
"217","Ursaring (Shadow)","Teddiursa","TRUE",,"81",,,,"0/14/15",,,,"19",,,,"1499",,,,"Shadow Claw, Swift, Close Combat",,,"216;217;901","217;901"
"219","Magcargo","Slugma","FALSE",,"77",,,,"0/15/14",,,,"38.5",,,,"1492",,,,"Incinerate, Rock Tomb, Overheat",,,"218;219","219"
"221","Piloswine","Swinub","FALSE",,"152",,,,"0/15/10",,,,"24.5",,,,"1497",,,,"Powder Snow, Icicle Spear, High Horsepower",,,"220;221;473","221;473"
"221","Piloswine (Shadow)","Swinub","TRUE",,"160",,,,"0/15/10",,,,"24.5",,,,"1497",,,,"Powder Snow, Icicle Spear, High Horsepower",,,"220;221;473","221;473"
"222","Corsola","Corsola","FALSE",,"571",,,,"10/15/15",,,,"50",,,,"1500",,,,"Bubble, Power Gem, Rock Blast",,,"222","222"
"222","Corsola (Galarian)","Corsola","FALSE",,"1",,,,"1/14/15",,,,"49.5",,,,"1494",,,,"Astonish, Night Shade, Power Gem",,,"222","222"
"224","Octillery","Remoraid","FALSE",,"938",,,,"0/15/13",,,,"24.5",,,,"1500",,,,"Lock On, Octazooka, Gunk Shot",,,"223;224","224"
"226","Mantine","Mantine","FALSE",,"190",,,,"0/15/13",,,,"27.5",,,,"1499",,,,"Wing Attack, Aerial Ace, Ice Beam",,,"226;458","226;458"
"227","Skarmory","Skarmory","FALSE",,"181",,,,"0/15/13",,,,"27.5",,,,"1499",,,,"Steel Wing, Brave Bird, Sky Attack",,,"227","227"
"227","Skarmory (Shadow)","Skarmory","TRUE",,"305",,,,"0/15/13",,,,"27.5",,,,"1499",,,,"Steel Wing, Brave Bird, Sky Attack",,,"227","227"
"228","Houndour","Houndour","FALSE",,"931",,,,"15/15/15",,,,"50",,,,"1395",,,,"Ember, Crunch, Flamethrower",,,"228;229","228;229"
"228","Houndour (Shadow)","Houndour","TRUE",,"889",,,,"15/15/15",,,,"50",,,,"1395",,,,"Ember, Crunch, Flamethrower",,,"228;229","228;229"
"229","Houndoom","Houndour","FALSE",,"590",,,,"0/13/13",,,,"21.5",,,,"1498",,,,"Fire Fang, Foul Play, Flamethrower",,,"228;229","229"
"229","Houndoom (Shadow)","Houndour","TRUE",,"521",,,,"0/13/13",,,,"21.5",,,,"1498",,,,"Fire Fang, Foul Play, Flamethrower",,,"228;229","229"
"230","Kingdra","Horsea","FALSE",,"524",,,,"0/15/13",,,,"21.5",,,,"1498",,,,"Dragon Breath, Outrage, Octazooka",,,"116;117;230","230"
"230","Kingdra (Shadow)","Horsea","TRUE",,"562",,,,"0/15/13",,,,"21.5",,,,"1498",,,,"Dragon Breath, Outrage, Octazooka",,,"116;117;230","230"
"231","Phanpy","Phanpy","FALSE",,"859",,,,"15/15/15",,,,"50",,,,"1364",,,,"Tackle, Trailblaze, Body Slam",,,"231;232","231;232"
"231","Phanpy (Shadow)","Phanpy","TRUE",,"852",,,,"15/15/15",,,,"50",,,,"1364",,,,"Tackle, Trailblaze, Body Slam",,,"231;232","231;232"
"232","Donphan","Phanpy","FALSE",,"129",,,,"0/14/8",,,,"19",,,,"1500",,,,"Mud Slap, Trailblaze, Body Slam",,,"231;232","232"
"232","Donphan (Shadow)","Phanpy","TRUE",,"88",,,,"0/14/8",,,,"19",,,,"1500",,,,"Mud Slap, Trailblaze, Body Slam",,,"231;232","232"
"233","Porygon2","Porygon","FALSE",,"734",,,,"0/12/15",,,,"21",,,,"1500",,,,"Lock On, Tri Attack, Zap Cannon",,,"137;233;474","233;474"
"233","Porygon2 (Shadow)","Porygon","TRUE",,"780",,,,"0/12/15",,,,"21",,,,"1500",,,,"Lock On, Tri Attack, Zap Cannon",,,"137;233;474","233;474"
"234","Stantler","Stantler","FALSE",,"881",,,,"0/11/15",,,,"26.5",,,,"1496",,,,"Tackle, Wild Charge, Stomp",,,"234;899","234;899"
"234","Stantler (Shadow)","Stantler","TRUE",,"878",,,,"0/11/15",,,,"26.5",,,,"1494",,,,"Tackle, Wild Charge, Stomp",,,"234;899","234;899"
"237","Hitmontop","Hitmonlee","FALSE",,"411",,,,"0/14/15",,,,"26.5",,,,"1500",,,,"Counter, Close Combat, Triple Axel",,,"106;236","237"
"237","Hitmontop (Shadow)","Hitmonlee","TRUE",,"438",,,,"0/14/15",,,,"26.5",,,,"1500",,,,"Counter, Close Combat, Triple Axel",,,"106;236","237"
"238","Smoochum","Jynx","FALSE",,"503",,,,"15/15/15",,,,"50",,,,"1460",,,,"Powder Snow, Psyshock, Ice Punch",,,"124;238","238"
"239","Elekid","Electabuzz","FALSE",,"700",,,,"15/15/15",,,,"50",,,,"1364",,,,"Thunder Shock, Thunder Punch, Brick Break",,,"125;239;466","239"
"240","Magby","Magmar","FALSE",,"388",,,,"15/15/15",,,,"50",,,,"1496",,,,"Karate Chop, Fire Punch, Brick Break",,,"126;240;467","240"
"241","Miltank","Miltank","FALSE",,"200",,,,"0/14/14",,,,"24.5",,,,"1494",,,,"Rollout, Body Slam, Thunderbolt",,,"241","241"
"242","Blissey","Chansey","FALSE",,"684",,,,"0/15/3",,,,"21.5",,,,"1498",,,,"Zen Headbutt, Wild Charge, Dazzling Gleam",,,"113;242;440","242;440"
"243","Raikou","Raikou","FALSE",,"287",,,,"3/15/14",,,,"16",,,,"1492",,,,"Thunder Shock, Wild Charge, Shadow Ball",,,"243","243"
"243","Raikou (Shadow)","Raikou","TRUE",,"243",,,,"3/15/14",,,,"16",,,,"1500",,,,"Thunder Shock, Wild Charge, Shadow Ball",,,"243","243"
"244","Entei","Entei","FALSE",,"586",,,,"1/15/15",,,,"16",,,,"1500",,,,"Fire Fang, Flame Charge, Scorching Sands",,,"244","244"
"244","Entei (Shadow)","Entei","TRUE",,"528",,,,"1/15/15",,,,"16",,,,"1499",,,,"Fire Fang, Flame Charge, Scorching Sands",,,"244","244"
"245","Suicune","Suicune","FALSE",,"177",,,,"1/15/14",,,,"19",,,,"1499",,,,"Ice Fang, Bubble Beam, Scald",,,"245","245"
"245","Suicune (Shadow)","Suicune","TRUE",,"251",,,,"1/15/14",,,,"19",,,,"1491",,,,"Ice Fang, Bubble Beam, Scald",,,"245","245"
"247","Pupitar","Larvitar","FALSE",,"920",,,,"0/14/14",,,,"35.5",,,,"1500",,,,"Bite, Ancient Power, Dig",,,"246;247;248","247;248"
"247","Pupitar (Shadow)","Larvitar","TRUE",,"905",,,,"0/14/14",,,,"35.5",,,,"1500",,,,"Bite, Ancient Power, Dig",,,"246;247;248","247;248"
"248","Tyranitar","Larvitar","FALSE",,"770",,,,"0/15/15",,,,"14.5",,,,"1498",,,,"Smack Down, Brutal Swing, Stone Edge",,,"246;247;248","248"
"248","Tyranitar (Shadow)","Larvitar","TRUE",,"687",,,,"0/15/15",,,,"14.5",,,,"1498",,,,"Smack Down, Brutal Swing, Stone Edge",,,"246;247;248","248"
"249","Lugia","Lugia","FALSE",,"738",,,,"0/11/11",,,,"15.5",,,,"1496",,,,"Dragon Tail, Sky Attack, Aeroblast",,,"249","249"
"249","Lugia (Shadow)","Lugia","TRUE",,"851",,,,"0/11/11",,,,"15.5",,,,"1497",,,,"Dragon Tail, Aeroblast, Sky Attack",,,"249","249"
"250","Ho-Oh","Ho-oh","FALSE",,"366",,,,"0/13/15",,,,"14.5",,,,"1500",,,,"Incinerate, Brave Bird, Earthquake",,,"250","250"
"250","Ho-Oh (Shadow)","Ho-oh","TRUE",,"486",,,,"0/13/15",,,,"14.5",,,,"1499",,,,"Incinerate, Brave Bird, Earthquake",,,"250","250"
"251","Celebi","Celebi","FALSE",,"760",,,,"0/10/13",,,,"17.5",,,,"1498",,,,"Magical Leaf, Seed Bomb, Leaf Storm",,,"251","251"
"253","Grovyle","Treecko","FALSE",,"382",,,,"0/15/14",,,,"38.5",,,,"1499",,,,"Quick Attack, Leaf Blade, Aerial Ace",,,"252;253;254","253;254"
"253","Grovyle (Shadow)","Treecko","TRUE",,"462",,,,"0/15/14",,,,"38.5",,,,"1499",,,,"Bullet Seed, Leaf Blade, Aerial Ace",,,"252;253;254","253;254"
"254","Sceptile","Treecko","FALSE",,"457",,,,"0/12/15",,,,"20.5",,,,"1497",,,,"Bullet Seed, Leaf Blade, Earthquake",,,"252;253;254","254"
"254","Sceptile (Shadow)","Treecko","TRUE",,"423",,,,"0/12/15",,,,"20.5",,,,"1497",,,,"Bullet Seed, Leaf Blade, Earthquake",,,"252;253;254","254"
"256","Combusken","Torchic","FALSE",,"818",,,,"0/15/14",,,,"39.5",,,,"1497",,,,"Ember, Flame Charge, Rock Slide",,,"255;256;257","256;257"
"256","Combusken (Shadow)","Torchic","TRUE",,"804",,,,"0/15/14",,,,"39.5",,,,"1497",,,,"Ember, Flame Charge, Rock Slide",,,"255;256;257","256;257"
"257","Blaziken","Torchic","FALSE",,"419",,,,"1/15/14",,,,"19.5",,,,"1496",,,,"Fire Spin, Blaze Kick, Blast Burn",,,"255;256;257","257"
"257","Blaziken (Shadow)","Torchic","TRUE",,"371",,,,"1/15/14",,,,"19.5",,,,"1496",,,,"Fire Spin, Blaze Kick, Blast Burn",,,"255;256;257","257"
"259","Marshtomp","Mudkip","FALSE",,"179",,,,"0/14/15",,,,"35",,,,"1498",,,,"Mud Shot, Mud Bomb, Surf",,,"258;259;260","259;260"
