"ID","Pokemon","Family","Shadow","Little_Rank","Great_Rank","Ultra_Rank","Master_Rank","Little_IVs","Great_IVs","Ultra_IVs","Master_IVs","Little_Level","Great_Level","Ultra_Level","Master_Level","Little_CP","Great_CP","Ultra_CP","Master_CP","Little_MoveSet","Great_MoveSet","Ultra_MoveSet","Master_MoveSet","Evo_Fam","Evo_Next"
"259","Marshtomp (Shadow)","Mudkip","TRUE",,"199",,,,"0/14/15",,,,"35",,,,"1499",,,,"Mud Shot, Mud Bomb, Surf",,,"258;259;260","259;260"
"260","Swampert","Mudkip","FALSE",,"71",,,,"0/14/14",,,,"19",,,,"1498",,,,"Mud Shot, Hydro Cannon, Earthquake",,,"258;259;260","260"
"260","Swampert (Shadow)","Mudkip","TRUE",,"113",,,,"0/14/14",,,,"19",,,,"1498",,,,"Mud Shot, Hydro Cannon, Earthquake",,,"258;259;260","260"
"262","Mightyena","Poochyena","FALSE",,"109",,,,"0/12/14",,,,"30",,,,"1491",,,,"Sucker Punch, Crunch, Poison Fang",,,"261;262","262"
"262","Mightyena (Shadow)","Poochyena","TRUE",,"70",,,,"0/12/14",,,,"30",,,,"1491",,,,"Sucker Punch, Crunch, Poison Fang",,,"261;262","262"
"264","Linoone","Zigzagoon","FALSE",,"65",,,,"0/15/14",,,,"40",,,,"1497",,,,"Shadow Claw, Swift, Grass Knot",,,"263;264;862","264;862"
"264","Linoone (Galarian)","Zigzagoon","FALSE",,"554",,,,"0/15/14",,,,"40",,,,"1497",,,,"Snarl, Body Slam, Dig",,,"263;264;862","264;862"
"264","Linoone (Galarian) (Shadow)","Zigzagoon","TRUE",,"475",,,,"0/15/14",,,,"40",,,,"1497",,,,"Snarl, Body Slam, Dig",,,"263;264;862","264;862"
"267","Beautifly","Wurmple","FALSE",,"831",,,,"0/15/15",,,,"34",,,,"1500",,,,"Infestation, Air Cutter, Silver Wind",,,"265;266;267","267"
"269","Dustox","Cascoon","FALSE",,"733",,,,"15/15/14",,,,"50",,,,"1384",,,,"Confusion, Sludge Bomb, Silver Wind",,,"265;268;269","269"
"271","Lombre","Lotad","FALSE",,"786",,,,"15/15/14",,,,"50",,,,"1353",,,,"Bubble, Scald, Grass Knot",,,"270;271;272","271;272"
"272","Ludicolo","Lotad","FALSE",,"444",,,,"0/15/15",,,,"24.5",,,,"1497",,,,"Bubble, Scald, Leaf Storm",,,"270;271;272","272"
"274","Nuzleaf","Seedot","FALSE",,"545",,,,"15/15/15",,,,"50",,,,"1387",,,,"Feint Attack, Leaf Blade, Foul Play",,,"273;274;275","274;275"
"274","Nuzleaf (Shadow)","Seedot","TRUE",,"516",,,,"15/15/15",,,,"50",,,,"1387",,,,"Feint Attack, Leaf Blade, Foul Play",,,"273;274;275","274;275"
"275","Shiftry","Seedot","FALSE",,"298",,,,"0/14/11",,,,"24.5",,,,"1497",,,,"Snarl, Leaf Blade, Foul Play",,,"273;274;275","275"
"275","Shiftry (Shadow)","Seedot","TRUE",,"168",,,,"0/14/11",,,,"24.5",,,,"1497",,,,"Snarl, Leaf Blade, Foul Play",,,"273;274;275","275"
"277","Swellow","Taillow","FALSE",,"633",,,,"0/15/15",,,,"29.5",,,,"1496",,,,"Wing Attack, Brave Bird, Aerial Ace",,,"276;277","277"
"277","Swellow (Shadow)","Taillow","TRUE",,"656",,,,"0/15/15",,,,"29.5",,,,"1496",,,,"Wing Attack, Brave Bird, Aerial Ace",,,"276;277","277"
"279","Pelipper","Wingull","FALSE",,"255",,,,"0/12/15",,,,"27",,,,"1496",,,,"Wing Attack, Weather Ball (Water), Hurricane",,,"278;279","279"
"282","Gardevoir","Ralts","FALSE",,"472",,,,"0/15/15",,,,"18",,,,"1498",,,,"Charm, Triple Axel, Shadow Ball",,,"280;281;282","282"
"282","Gardevoir (Shadow)","Ralts","TRUE",,"302",,,,"0/15/15",,,,"18",,,,"1498",,,,"Charm, Triple Axel, Shadow Ball",,,"280;281;282","282"
"284","Masquerain","Surskit","FALSE",,"752",,,,"0/15/14",,,,"25",,,,"1499",,,,"Air Slash, Air Cutter, Lunge",,,"283;284","284"
"286","Breloom","Shroomish","FALSE",,"635",,,,"2/15/15",,,,"21",,,,"1493",,,,"Force Palm, Dynamic Punch, Grass Knot",,,"285;286","286"
"288","Vigoroth","Slakoth","FALSE",,"505",,,,"1/15/15",,,,"29",,,,"1499",,,,"Counter, Body Slam, Rock Slide",,,"287;288;289","288;289"
"289","Slaking","Slakoth","FALSE",,"999",,,,"0/14/15",,,,"12.5",,,,"1498",,,,"Yawn, Body Slam, Earthquake",,,"287;288;289","289"
"291","Ninjask","Nincada","FALSE",,"671",,,,"0/12/15",,,,"29",,,,"1496",,,,"Fury Cutter, Aerial Ace, Bug Buzz",,,"290;291","291"
"294","Loudred","Whismur","FALSE",,"829",,,,"15/15/15",,,,"50",,,,"1500",,,,"Bite, Stomp, Disarming Voice",,,"293;294;295","294;295"
"294","Loudred (Shadow)","Whismur","TRUE",,"800",,,,"15/15/15",,,,"50",,,,"1500",,,,"Bite, Stomp, Disarming Voice",,,"293;294;295","294;295"
"295","Exploud","Whismur","FALSE",,"556",,,,"0/15/10",,,,"24.5",,,,"1494",,,,"Astonish, Crunch, Disarming Voice",,,"293;294;295","295"
"295","Exploud (Shadow)","Whismur","TRUE",,"581",,,,"0/15/10",,,,"24.5",,,,"1494",,,,"Astonish, Crunch, Disarming Voice",,,"293;294;295","295"
"297","Hariyama","Makuhita","FALSE",,"238",,,,"0/14/13",,,,"20",,,,"1492",,,,"Force Palm, Upper Hand, Heavy Slam",,,"296;297","297"
"297","Hariyama (Shadow)","Makuhita","TRUE",,"209",,,,"0/14/13",,,,"20",,,,"1492",,,,"Force Palm, Upper Hand, Heavy Slam",,,"296;297","297"
"299","Nosepass","Nosepass","FALSE",,"948",,,,"15/15/15",,,,"50",,,,"1123",,,,"Rock Throw, Rock Slide, Rock Blast",,,"299;476","299;476"
"299","Nosepass (Shadow)","Nosepass","TRUE",,"953",,,,"15/15/15",,,,"50",,,,"1123",,,,"Rock Throw, Rock Slide, Rock Blast",,,"299;476","299;476"
"301","Delcatty","Skitty","FALSE",,"588",,,,"0/15/15",,,,"49",,,,"1496",,,,"Charm, Wild Charge, Disarming Voice",,,"300;301","301"
"303","Mawile","Mawile","FALSE",,"304",,,,"1/15/15",,,,"40",,,,"1500",,,,"Fairy Wind, Iron Head, Play Rough",,,"303","303"
"303","Mawile (Shadow)","Mawile","TRUE",,"320",,,,"1/15/15",,,,"40",,,,"1500",,,,"Fairy Wind, Iron Head, Play Rough",,,"303","303"
"304","Aron","Aron","FALSE",,"517",,,,"15/15/15",,,,"50",,,,"1478",,,,"Metal Claw, Rock Tomb, Body Slam",,,"304;305;306","304;305;306"
"304","Aron (Shadow)","Aron","TRUE",,"541",,,,"15/15/15",,,,"50",,,,"1478",,,,"Metal Claw, Rock Tomb, Body Slam",,,"304;305;306","304;305;306"
"305","Lairon","Aron","FALSE",,"474",,,,"0/14/15",,,,"28",,,,"1500",,,,"Metal Claw, Rock Tomb, Body Slam",,,"304;305;306","305;306"
"305","Lairon (Shadow)","Aron","TRUE",,"496",,,,"0/14/15",,,,"28",,,,"1500",,,,"Metal Claw, Rock Tomb, Body Slam",,,"304;305;306","305;306"
"306","Aggron","Aron","FALSE",,"651",,,,"0/14/12",,,,"19",,,,"1492",,,,"Smack Down, Rock Tomb, Thunder",,,"304;305;306","306"
"306","Aggron (Shadow)","Aron","TRUE",,"710",,,,"0/14/12",,,,"19",,,,"1492",,,,"Smack Down, Rock Tomb, Thunder",,,"304;305;306","306"
"308","Medicham","Meditite","FALSE",,"26",,,,"5/15/14",,,,"50",,,,"1500",,,,"Psycho Cut, Ice Punch, Dynamic Punch",,,"307;308","308"
"310","Manectric","Electrike","FALSE",,"506",,,,"0/15/15",,,,"24",,,,"1494",,,,"Thunder Fang, Psychic Fangs, Wild Charge",,,"309;310","310"
"310","Manectric (Shadow)","Electrike","TRUE",,"685",,,,"0/15/15",,,,"24",,,,"1494",,,,"Snarl, Wild Charge, Psychic Fangs",,,"309;310","310"
"311","Plusle","Plusle","FALSE",,"856",,,,"0/15/14",,,,"34.5",,,,"1499",,,,"Quick Attack, Thunderbolt, Grass Knot",,,"311","311"
"312","Minun","Minun","FALSE",,"626",,,,"0/15/14",,,,"38.5",,,,"1493",,,,"Quick Attack, Thunderbolt, Grass Knot",,,"312","312"
"313","Volbeat","Volbeat","FALSE",,"919",,,,"0/15/15",,,,"35.5",,,,"1494",,,,"Tackle, Bug Buzz, Thunderbolt",,,"313","313"
"314","Illumise","Illumise","FALSE",,"836",,,,"0/15/15",,,,"35.5",,,,"1494",,,,"Tackle, Silver Wind, Dazzling Gleam",,,"314","314"
"315","Roselia","Roselia","FALSE",,"926",,,,"0/13/15",,,,"31",,,,"1497",,,,"Poison Jab, Sludge Bomb, Petal Blizzard",,,"315;406;407","315;406;407"
"317","Swalot","Gulpin","FALSE",,"53",,,,"0/15/13",,,,"29.5",,,,"1500",,,,"Mud Shot, Sludge, Ice Beam",,,"316;317","317"
"319","Sharpedo","Carvanha","FALSE",,"758",,,,"0/15/15",,,,"25.5",,,,"1493",,,,"Waterfall, Crunch, Poison Fang",,,"318;319","319"
"320","Wailmer","Wailmer","FALSE",,"189",,,,"0/15/15",,,,"50",,,,"1500",,,,"Rollout, Scald, Body Slam",,,"320;321","320;321"
"320","Wailmer (Shadow)","Wailmer","TRUE",,"208",,,,"0/15/15",,,,"50",,,,"1500",,,,"Rollout, Scald, Body Slam",,,"320;321","320;321"
"321","Wailord","Wailmer","FALSE",,"241",,,,"0/15/14",,,,"25",,,,"1500",,,,"Rollout, Surf, Return",,,"320;321","321"
"321","Wailord (Shadow)","Wailmer","TRUE",,"352",,,,"0/15/14",,,,"25",,,,"1500",,,,"Rollout, Surf, Hyper Beam",,,"320;321","321"
"323","Camerupt","Numel","FALSE",,"616",,,,"0/14/13",,,,"26",,,,"1499",,,,"Incinerate, Earth Power, Overheat",,,"322;323","323"
"323","Camerupt (Shadow)","Numel","TRUE",,"643",,,,"0/14/13",,,,"26",,,,"1499",,,,"Incinerate, Earth Power, Overheat",,,"322;323","323"
"324","Torkoal","Torkoal","FALSE",,"418",,,,"0/15/15",,,,"27.5",,,,"1491",,,,"Fire Spin, Overheat, Earthquake",,,"324","324"
"325","Spoink","Spoink","FALSE",,"995",,,,"15/15/15",,,,"49.5",,,,"1495",,,,"Zen Headbutt, Shadow Ball, Return",,,"325;326","325;326"
"325","Spoink (Shadow)","Spoink","TRUE",,"993",,,,"15/15/15",,,,"49.5",,,,"1495",,,,"Zen Headbutt, Shadow Ball, Mirror Coat",,,"325;326","325;326"
"326","Grumpig","Spoink","FALSE",,"4",,,,"1/14/15",,,,"24",,,,"1498",,,,"Psywave, Dynamic Punch, Shadow Ball",,,"325;326","326"
"326","Grumpig (Shadow)","Spoink","TRUE",,"9",,,,"1/14/15",,,,"24",,,,"1498",,,,"Psywave, Dynamic Punch, Shadow Ball",,,"325;326","326"
"327","Spinda","Spinda","FALSE",,"150",,,,"15/15/14",,,,"50",,,,"1380",,,,"Sucker Punch, Rock Tomb, Icy Wind",,,"327","327"
"328","Trapinch","Trapinch","FALSE",,"826",,,,"15/15/15",,,,"50",,,,"1441",,,,"Sand Attack, Scorching Sands, Crunch",,,"328;329;330","328;329;330"
"328","Trapinch (Shadow)","Trapinch","TRUE",,"817",,,,"15/15/15",,,,"50",,,,"1441",,,,"Sand Attack, Scorching Sands, Crunch",,,"328;329;330","328;329;330"
"329","Vibrava","Trapinch","FALSE",,"661",,,,"15/15/15",,,,"50",,,,"1384",,,,"Dragon Breath, Sand Tomb, Bug Buzz",,,"328;329;330","329;330"
"329","Vibrava (Shadow)","Trapinch","TRUE",,"595",,,,"15/15/15",,,,"50",,,,"1384",,,,"Dragon Breath, Sand Tomb, Bug Buzz",,,"328;329;330","329;330"
"330","Flygon","Trapinch","FALSE",,"266",,,,"0/15/9",,,,"21.5",,,,"1499",,,,"Dragon Tail, Scorching Sands, Dragon Claw",,,"328;329;330","330"
"330","Flygon (Shadow)","Trapinch","TRUE",,"214",,,,"0/15/9",,,,"21.5",,,,"1499",,,,"Dragon Tail, Dragon Claw, Scorching Sands",,,"328;329;330","330"
"332","Cacturne","Cacnea","FALSE",,"286",,,,"0/14/15",,,,"24.5",,,,"1498",,,,"Sucker Punch, Trailblaze, Dynamic Punch",,,"331;332","332"
"332","Cacturne (Shadow)","Cacnea","TRUE",,"253",,,,"0/14/15",,,,"24.5",,,,"1498",,,,"Sucker Punch, Trailblaze, Dynamic Punch",,,"331;332","332"
"334","Altaria","Swablu","FALSE",,"118",,,,"0/14/15",,,,"29",,,,"1498",,,,"Dragon Breath, Sky Attack, Moonblast",,,"333;334","334"
"335","Zangoose","Zangoose","FALSE",,"156",,,,"0/15/10",,,,"23.5",,,,"1494",,,,"Shadow Claw, Close Combat, Night Slash",,,"335","335"
"336","Seviper","Seviper","FALSE",,"564",,,,"0/15/12",,,,"27",,,,"1500",,,,"Poison Jab, Crunch, Poison Fang",,,"336","336"
"337","Lunatone","Lunatone","FALSE",,"373",,,,"0/15/14",,,,"24.5",,,,"1494",,,,"Psywave, Rock Slide, Moonblast",,,"337","337"
"338","Solrock","Solrock","FALSE",,"429",,,,"0/15/14",,,,"24.5",,,,"1494",,,,"Psywave, Rock Slide, Psychic",,,"338","338"
"340","Whiscash","Barboach","FALSE",,"54",,,,"0/14/13",,,,"28",,,,"1490",,,,"Mud Shot, Mud Bomb, Scald",,,"339;340","340"
"340","Whiscash (Shadow)","Barboach","TRUE",,"50",,,,"0/14/13",,,,"28",,,,"1490",,,,"Mud Shot, Mud Bomb, Scald",,,"339;340","340"
"341","Corphish","Corphish","FALSE",,"828",,,,"15/15/15",,,,"50",,,,"1391",,,,"Bubble, Aqua Jet, Razor Shell",,,"341;342","341;342"
"341","Corphish (Shadow)","Corphish","TRUE",,"790",,,,"15/15/15",,,,"50",,,,"1391",,,,"Bubble, Aqua Jet, Razor Shell",,,"341;342","341;342"
"342","Crawdaunt","Corphish","FALSE",,"447",,,,"2/15/14",,,,"22.5",,,,"1497",,,,"Snarl, Night Slash, Scald",,,"341;342","342"
"342","Crawdaunt (Shadow)","Corphish","TRUE",,"365",,,,"2/15/14",,,,"22.5",,,,"1497",,,,"Snarl, Night Slash, Scald",,,"341;342","342"
"344","Claydol","Baltoy","FALSE",,"17",,,,"0/14/15",,,,"29.5",,,,"1488",,,,"Mud Slap, Rock Tomb, Ice Beam",,,"343;344","344"
"345","Lileep","Lileep","FALSE",,"325",,,,"15/15/15",,,,"50",,,,"1460",,,,"Bullet Seed, Ancient Power, Grass Knot",,,"345;346","345;346"
"345","Lileep (Shadow)","Lileep","TRUE",,"400",,,,"15/15/15",,,,"50",,,,"1460",,,,"Bullet Seed, Ancient Power, Grass Knot",,,"345;346","345;346"
"347","Anorith","Anorith","FALSE",,"988",,,,"0/15/15",,,,"45",,,,"1500",,,,"Struggle Bug, Aqua Jet, Ancient Power",,,"347;348","347;348"
"347","Anorith (Shadow)","Anorith","TRUE",,"980",,,,"0/15/15",,,,"45",,,,"1500",,,,"Struggle Bug, Aqua Jet, Cross Poison",,,"347;348","347;348"
"348","Armaldo","Anorith","FALSE",,"755",,,,"0/9/15",,,,"20",,,,"1497",,,,"Fury Cutter, Rock Blast, Liquidation",,,"347;348","348"
"348","Armaldo (Shadow)","Anorith","TRUE",,"610",,,,"0/9/15",,,,"20",,,,"1497",,,,"Fury Cutter, Rock Blast, Liquidation",,,"347;348","348"
"350","Milotic","Feebas","FALSE",,"511",,,,"0/15/11",,,,"19",,,,"1495",,,,"Dragon Tail, Surf, Blizzard",,,"349;350","350"
"352","Kecleon","Kecleon","FALSE",,"281",,,,"0/15/15",,,,"28",,,,"1495",,,,"Sucker Punch, Aerial Ace, Ice Beam",,,"352","352"
"354","Banette","Shuppet","FALSE",,"647",,,,"0/14/15",,,,"24.5",,,,"1500",,,,"Shadow Claw, Shadow Ball, Dazzling Gleam",,,"353;354","354"
"354","Banette (Shadow)","Shuppet","TRUE",,"798",,,,"0/14/15",,,,"24.5",,,,"1500",,,,"Shadow Claw, Shadow Ball, Dazzling Gleam",,,"353;354","354"
"356","Dusclops","Duskull","FALSE",,"10",,,,"0/11/15",,,,"45",,,,"1498",,,,"Hex, Ice Punch, Shadow Punch",,,"355;356;477","356;477"
"356","Dusclops (Shadow)","Duskull","TRUE",,"25",,,,"0/11/15",,,,"45",,,,"1498",,,,"Hex, Ice Punch, Shadow Punch",,,"355;356;477","356;477"
"357","Tropius","Tropius","FALSE",,"63",,,,"0/15/15",,,,"30",,,,"1494",,,,"Air Slash, Leaf Blade, Aerial Ace",,,"357","357"
"358","Chimecho","Chimecho","FALSE",,"328",,,,"0/14/12",,,,"25.5",,,,"1500",,,,"Astonish, Psyshock, Shadow Ball",,,"358;433","358;433"
"359","Absol","Absol","FALSE",,"676",,,,"0/15/15",,,,"22",,,,"1499",,,,"Snarl, Brutal Swing, Megahorn",,,"359","359"
"359","Absol (Shadow)","Absol","TRUE",,"573",,,,"0/15/15",,,,"22",,,,"1499",,,,"Snarl, Brutal Swing, Megahorn",,,"359","359"
"362","Glalie","Snorunt","FALSE",,"183",,,,"0/13/13",,,,"27.5",,,,"1498",,,,"Rollout, Avalanche, Shadow Ball",,,"361;362","362"
"362","Glalie (Shadow)","Snorunt","TRUE",,"198",,,,"0/13/13",,,,"27.5",,,,"1498",,,,"Rollout, Avalanche, Shadow Ball",,,"361;362","362"
"364","Sealeo","Spheal","FALSE",,"330",,,,"0/15/14",,,,"38",,,,"1497",,,,"Powder Snow, Water Pulse, Body Slam",,,"363;364;365","364;365"
"364","Sealeo (Shadow)","Spheal","TRUE",,"245",,,,"0/15/14",,,,"38",,,,"1497",,,,"Powder Snow, Water Pulse, Body Slam",,,"363;364;365","364;365"
"365","Walrein","Spheal","FALSE",,"117",,,,"0/12/15",,,,"21",,,,"1495",,,,"Powder Snow, Icicle Spear, Earthquake",,,"363;364;365","365"
"365","Walrein (Shadow)","Spheal","TRUE",,"83",,,,"0/12/15",,,,"21",,,,"1495",,,,"Powder Snow, Icicle Spear, Earthquake",,,"363;364;365","365"
"366","Clamperl","Clamperl","FALSE",,"784",,,,"15/15/14",,,,"50",,,,"1436",,,,"Water Gun, Body Slam, Water Pulse",,,"366;367","366;367"
"367","Huntail","Clamperl","FALSE",,"540",,,,"1/15/15",,,,"24",,,,"1498",,,,"Water Gun, Aqua Tail, Crunch",,,"366;367","367"
"368","Gorebyss","Gorebyss","FALSE",,"950",,,,"0/15/15",,,,"22.5",,,,"1500",,,,"Water Gun, Water Pulse, Psychic",,,"366;368","368"
"369","Relicanth","Relicanth","FALSE",,"248",,,,"1/15/15",,,,"22.5",,,,"1498",,,,"Water Gun, Aqua Tail, Ancient Power",,,"369","369"
"372","Shelgon","Bagon","FALSE",,"512",,,,"1/15/14",,,,"28",,,,"1493",,,,"Dragon Breath, Flamethrower, Twister",,,"371;372;373","372;373"
"372","Shelgon (Shadow)","Bagon","TRUE",,"604",,,,"1/15/14",,,,"28",,,,"1493",,,,"Dragon Breath, Flamethrower, Dragon Pulse",,,"371;372;373","372;373"
"373","Salamence","Bagon","FALSE",,"531",,,,"0/10/14",,,,"15",,,,"1490",,,,"Dragon Tail, Fly, Outrage",,,"371;372;373","373"
"373","Salamence (Shadow)","Bagon","TRUE",,"494",,,,"0/10/14",,,,"15",,,,"1490",,,,"Dragon Tail, Fly, Outrage",,,"371;372;373","373"
"375","Metang","Beldum","FALSE",,"254",,,,"0/13/15",,,,"38",,,,"1494",,,,"Metal Claw, Psyshock, Return",,,"374;375;376","375;376"
"375","Metang (Shadow)","Beldum","TRUE",,"348",,,,"0/13/15",,,,"38",,,,"1494",,,,"Metal Claw, Psyshock, Gyro Ball",,,"374;375;376","375;376"
"376","Metagross","Beldum","FALSE",,"875",,,,"2/15/15",,,,"14.5",,,,"1496",,,,"Bullet Punch, Meteor Mash, Psychic",,,"374;375;376","376"
"376","Metagross (Shadow)","Beldum","TRUE",,"922",,,,"2/15/15",,,,"14.5",,,,"1496",,,,"Bullet Punch, Meteor Mash, Psychic",,,"374;375;376","376"
"377","Regirock","Regirock","FALSE",,"92",,,,"0/10/12",,,,"18.5",,,,"1497",,,,"Lock On, Stone Edge, Focus Blast",,,"377","377"
"377","Regirock (Shadow)","Regirock","TRUE",,"155",,,,"0/10/12",,,,"18.5",,,,"1500",,,,"Lock On, Stone Edge, Focus Blast",,,"377","377"
"378","Regice","Regice","FALSE",,"315",,,,"0/10/12",,,,"18.5",,,,"1497",,,,"Lock On, Blizzard, Thunder",,,"378","378"
"378","Regice (Shadow)","Regice","TRUE",,"497",,,,"0/10/12",,,,"18.5",,,,"1500",,,,"Lock On, Blizzard, Thunder",,,"378","378"
"379","Registeel","Registeel","FALSE",,"29",,,,"0/8/15",,,,"24",,,,"1499",,,,"Lock On, Focus Blast, Zap Cannon",,,"379","379"
"379","Registeel (Shadow)","Registeel","TRUE",,"229",,,,"0/8/15",,,,"24",,,,"1498",,,,"Lock On, Focus Blast, Zap Cannon",,,"379","379"
"380","Latias","Latias","FALSE",,"715",,,,"0/14/14",,,,"16",,,,"1499",,,,"Dragon Breath, Mist Ball, Thunder",,,"380","380"
"380","Latias (Shadow)","Latias","TRUE",,"613",,,,"0/14/14",,,,"16",,,,"1496",,,,"Dragon Breath, Mist Ball, Thunder",,,"380","380"
"381","Latios","Latios","FALSE",,"478",,,,"0/15/15",,,,"14.5",,,,"1497",,,,"Dragon Breath, Dragon Claw, Luster Purge",,,"381","381"
"381","Latios (Shadow)","Latios","TRUE",,"397",,,,"0/15/15",,,,"14.5",,,,"1495",,,,"Dragon Breath, Dragon Claw, Luster Purge",,,"381","381"
"382","Kyogre (Shadow)","Kyogre","TRUE",,"753",,,,"0/15/13",,,,"13.5",,,,"1499",,,,"Waterfall, Surf, Origin Pulse",,,"382","382"
"383","Groudon (Shadow)","Groudon","TRUE",,"711",,,,"0/15/13",,,,"13.5",,,,"1499",,,,"Mud Shot, Precipice Blades, Fire Punch",,,"383","383"
"384","Rayquaza","Rayquaza","FALSE",,"482",,,,"0/15/12",,,,"14.5",,,,"1496",,,,"Dragon Tail, Breaking Swipe, Dragon Ascent",,,"384","384"
"385","Jirachi","Jirachi","FALSE",,"412",,,,"0/10/13",,,,"17.5",,,,"1498",,,,"Confusion, Doom Desire, Dazzling Gleam",,,"385","385"
"386","Deoxys (Defense)","Deoxys","FALSE",,"270",,,,"0/15/15",,,,"25.5",,,,"1491",,,,"Counter, Psycho Boost, Thunderbolt",,,"386","386"
"386","Deoxys (Speed)","Deoxys","FALSE",,"981",,,,"0/14/14",,,,"19.5",,,,"1499",,,,"Charge Beam, Psycho Boost, Swift",,,"386","386"
"387","Turtwig","Turtwig","FALSE",,"955",,,,"15/15/15",,,,"50",,,,"1342",,,,"Tackle, Body Slam, Seed Bomb",,,"387;388;389","387;388;389"
"387","Turtwig (Shadow)","Turtwig","TRUE",,"956",,,,"15/15/15",,,,"50",,,,"1342",,,,"Tackle, Body Slam, Seed Bomb",,,"387;388;389","387;388;389"
"388","Grotle","Turtwig","FALSE",,"576",,,,"0/15/11",,,,"31.5",,,,"1497",,,,"Razor Leaf, Body Slam, Energy Ball",,,"387;388;389","388;389"
"388","Grotle (Shadow)","Turtwig","TRUE",,"491",,,,"0/15/11",,,,"31.5",,,,"1497",,,,"Razor Leaf, Body Slam, Energy Ball",,,"387;388;389","388;389"
"389","Torterra","Turtwig","FALSE",,"637",,,,"0/11/13",,,,"19.5",,,,"1496",,,,"Razor Leaf, Frenzy Plant, Stone Edge",,,"387;388;389","389"
"389","Torterra (Shadow)","Turtwig","TRUE",,"548",,,,"0/11/13",,,,"19.5",,,,"1496",,,,"Razor Leaf, Frenzy Plant, Stone Edge",,,"387;388;389","389"
"391","Monferno","Chimchar","FALSE",,"837",,,,"0/15/14",,,,"43.5",,,,"1498",,,,"Ember, Flamethrower, Low Sweep",,,"390;391;392","391;392"
"391","Monferno (Shadow)","Chimchar","TRUE",,"832",,,,"0/15/14",,,,"43.5",,,,"1498",,,,"Ember, Flamethrower, Low Sweep",,,"390;391;392","391;392"
"392","Infernape","Chimchar","FALSE",,"678",,,,"0/13/15",,,,"21",,,,"1491",,,,"Fire Spin, Close Combat, Blast Burn",,,"390;391;392","392"
"392","Infernape (Shadow)","Chimchar","TRUE",,"757",,,,"0/13/15",,,,"21",,,,"1491",,,,"Fire Spin, Close Combat, Blast Burn",,,"390;391;392","392"
"393","Piplup","Piplup","FALSE",,"932",,,,"15/15/14",,,,"50",,,,"1215",,,,"Bubble, Drill Peck, Icy Wind",,,"393;394;395","393;394;395"
"393","Piplup (Shadow)","Piplup","TRUE",,"939",,,,"15/15/14",,,,"50",,,,"1215",,,,"Bubble, Drill Peck, Icy Wind",,,"393;394;395","393;394;395"
"394","Prinplup","Piplup","FALSE",,"546",,,,"0/15/14",,,,"38",,,,"1500",,,,"Bubble, Icy Wind, Hydro Pump",,,"393;394;395","394;395"
"394","Prinplup (Shadow)","Piplup","TRUE",,"722",,,,"0/15/14",,,,"38",,,,"1500",,,,"Bubble, Icy Wind, Hydro Pump",,,"393;394;395","394;395"
"395","Empoleon","Piplup","FALSE",,"205",,,,"0/13/15",,,,"19.5",,,,"1500",,,,"Metal Claw, Hydro Cannon, Drill Peck",,,"393;394;395","395"
"395","Empoleon (Shadow)","Piplup","TRUE",,"233",,,,"0/13/15",,,,"19.5",,,,"1500",,,,"Metal Claw, Hydro Cannon, Drill Peck",,,"393;394;395","395"
"397","Staravia","Starly","FALSE",,"351",,,,"15/15/15",,,,"50",,,,"1468",,,,"Quick Attack, Brave Bird, Fly",,,"396;397;398","397;398"
"397","Staravia (Shadow)","Starly","TRUE",,"375",,,,"15/15/15",,,,"50",,,,"1468",,,,"Quick Attack, Brave Bird, Fly",,,"396;397;398","397;398"
"398","Staraptor","Starly","FALSE",,"354",,,,"0/13/13",,,,"20",,,,"1492",,,,"Quick Attack, Fly, Close Combat",,,"396;397;398","398"
"398","Staraptor (Shadow)","Starly","TRUE",,"333",,,,"0/13/13",,,,"20",,,,"1492",,,,"Quick Attack, Fly, Close Combat",,,"396;397;398","398"
"400","Bibarel","Bidoof","FALSE",,"359",,,,"0/14/13",,,,"33.5",,,,"1499",,,,"Rollout, Surf, Hyper Fang",,,"399;400","400"
"400","Bibarel (Shadow)","Bidoof","TRUE",,"316",,,,"0/14/13",,,,"33.5",,,,"1499",,,,"Rollout, Surf, Hyper Fang",,,"399;400","400"
"402","Kricketune","Kricketot","FALSE",,"525",,,,"0/15/15",,,,"39.5",,,,"1492",,,,"Fury Cutter, X-Scissor, Aerial Ace",,,"401;402","402"
"404","Luxio","Shinx","FALSE",,"751",,,,"0/15/15",,,,"48",,,,"1500",,,,"Spark, Wild Charge, Crunch",,,"403;404;405","404;405"
"404","Luxio (Shadow)","Shinx","TRUE",,"822",,,,"0/15/15",,,,"48",,,,"1493",,,,"Spark, Wild Charge, Crunch",,,"403;404;405","404;405"
"405","Luxray","Shinx","FALSE",,"600",,,,"0/15/12",,,,"19.5",,,,"1496",,,,"Spark, Wild Charge, Psychic Fangs",,,"403;404;405","405"
"405","Luxray (Shadow)","Shinx","TRUE",,"666",,,,"0/15/12",,,,"19.5",,,,"1496",,,,"Snarl, Wild Charge, Psychic Fangs",,,"403;404;405","405"
"407","Roserade","Roselia","FALSE",,"153",,,,"0/11/14",,,,"19",,,,"1497",,,,"Poison Sting, Weather Ball (Fire), Leaf Storm",,,"315;406;407","406;407"
"409","Rampardos","Cranidos","FALSE",,"954",,,,"1/14/8",,,,"17",,,,"1498",,,,"Smack Down, Rock Slide, Flamethrower",,,"408;409","409"
"409","Rampardos (Shadow)","Cranidos","TRUE",,"906",,,,"1/14/8",,,,"17",,,,"1498",,,,"Smack Down, Rock Slide, Flamethrower",,,"408;409","409"
"411","Bastiodon","Shieldon","FALSE",,"33",,,,"0/15/14",,,,"50",,,,"1498",,,,"Smack Down, Stone Edge, Flamethrower",,,"410;411","411"
"411","Bastiodon (Shadow)","Shieldon","TRUE",,"74",,,,"0/15/14",,,,"50",,,,"1498",,,,"Smack Down, Stone Edge, Flamethrower",,,"410;411","411"
"413","Wormadam (Plant)","Burmy","FALSE",,"841",,,,"0/15/14",,,,"35.5",,,,"1497",,,,"Confusion, Energy Ball, Bug Buzz",,,"412;413","413"
"413","Wormadam (Sandy)","Burmy","FALSE",,"741",,,,"0/15/14",,,,"35.5",,,,"1497",,,,"Confusion, Bug Buzz, Bulldoze",,,"412;413","413"
"413","Wormadam (Trash)","Burmy","FALSE",,"361",,,,"0/10/0",,,,"39.5",,,,"1500",,,,"Confusion, Bug Buzz, Iron Head",,,"412;413","413"
"414","Mothim","Mothim","FALSE",,"924",,,,"0/15/15",,,,"32.5",,,,"1496",,,,"Air Slash, Aerial Ace, Bug Buzz",,,"412;414","414"
"416","Vespiquen","Combee","FALSE",,"306",,,,"0/14/13",,,,"29",,,,"1500",,,,"Poison Sting, X-Scissor, Power Gem",,,"415;416","416"
"417","Pachirisu","Pachirisu","FALSE",,"116",,,,"15/15/14",,,,"50",,,,"1372",,,,"Volt Switch, Thunder Punch, Thunderbolt",,,"417","417"
"419","Floatzel","Buizel","FALSE",,"583",,,,"0/15/13",,,,"23",,,,"1494",,,,"Water Gun, Aqua Jet, Swift",,,"418;419","419"
"421","Cherrim (Overcast)","Cherubi","FALSE",,"933",,,,"0/13/15",,,,"28",,,,"1498",,,,"Bullet Seed, Dazzling Gleam, Solar Beam",,,"420;421","421"
"421","Cherrim (Sunshine)","Cherubi","FALSE",,"623",,,,"0/13/15",,,,"28",,,,"1498",,,,"Bullet Seed, Weather Ball (Fire), Solar Beam",,,"420;421","421"
"422","Shellos","Shellos","FALSE",,"614",,,,"15/15/15",,,,"50",,,,"1284",,,,"Mud Slap, Mud Bomb, Body Slam",,,"422;423","422;423"
"424","Ambipom","Aipom","FALSE",,"744",,,,"0/13/14",,,,"23.5",,,,"1496",,,,"Astonish, Aerial Ace, Return",,,"190;424","424"
"424","Ambipom (Shadow)","Aipom","TRUE",,"555",,,,"0/13/14",,,,"23.5",,,,"1496",,,,"Astonish, Aerial Ace, Low Sweep",,,"190;424","424"
"425","Drifloon","Drifloon","FALSE",,"213",,,,"15/15/15",,,,"50",,,,"1353",,,,"Hex, Icy Wind, Shadow Ball",,,"425;426","425;426"
"425","Drifloon (Shadow)","Drifloon","TRUE",,"195",,,,"15/15/15",,,,"50",,,,"1353",,,,"Hex, Icy Wind, Shadow Ball",,,"425;426","425;426"
"426","Drifblim","Drifloon","FALSE",,"37",,,,"0/15/12",,,,"24",,,,"1498",,,,"Hex, Icy Wind, Shadow Ball",,,"425;426","426"
"426","Drifblim (Shadow)","Drifloon","TRUE",,"47",,,,"0/15/12",,,,"24",,,,"1498",,,,"Hex, Icy Wind, Shadow Ball",,,"425;426","426"
"427","Buneary","Buneary","FALSE",,"601",,,,"15/15/15",,,,"50",,,,"1423",,,,"Quick Attack, Swift, Fire Punch",,,"427;428","427;428"
"428","Lopunny","Buneary","FALSE",,"501",,,,"0/15/14",,,,"28",,,,"1493",,,,"Double Kick, Triple Axel, Focus Blast",,,"427;428","428"
"429","Mismagius","Misdreavus","FALSE",,"533",,,,"0/15/15",,,,"21.5",,,,"1499",,,,"Hex, Shadow Ball, Dark Pulse",,,"200;429","429"
"429","Mismagius (Shadow)","Misdreavus","TRUE",,"577",,,,"0/15/15",,,,"21.5",,,,"1499",,,,"Hex, Shadow Ball, Dark Pulse",,,"200;429","429"
"430","Honchkrow","Murkrow","FALSE",,"599",,,,"0/15/15",,,,"20.5",,,,"1500",,,,"Snarl, Brave Bird, Dark Pulse",,,"198;430","430"
"430","Honchkrow (Shadow)","Murkrow","TRUE",,"612",,,,"0/15/15",,,,"20.5",,,,"1500",,,,"Snarl, Brave Bird, Dark Pulse",,,"198;430","430"
