"ID","Pokemon","Family","Shadow","Little_Rank","Great_Rank","Ultra_Rank","Master_Rank","Little_IVs","Great_IVs","Ultra_IVs","Master_IVs","Little_Level","Great_Level","Ultra_Level","Master_Level","Little_CP","Great_CP","Ultra_CP","Master_CP","Little_MoveSet","Great_MoveSet","Ultra_MoveSet","Master_MoveSet","Evo_Fam","Evo_Next"
"1","Bulbasaur","Bulbasaur","FALSE","252","860",,,"0/11/15","15/15/15",,,"18","50",,,"500","1260",,,"Vine Whip, Sludge Bomb, Power Whip","Vine Whip, Power Whip, Sludge Bomb",,,"1;2;3","1;2;3"
"1","Bulbasaur (Shadow)","Bulbasaur","TRUE","270","888",,,"0/11/15","15/15/15",,,"18","50",,,"498","1260",,,"Vine Whip, Sludge Bomb, Power Whip","Vine Whip, Power Whip, Sludge Bomb",,,"1;2;3","1;2;3"
"2","Ivysaur","Bulbasaur","FALSE","259","350",,,"0/10/15","0/13/14",,,"11.5","38.5",,,"498","1493",,,"Vine Whip, Power Whip, Sludge Bomb","Vine Whip, Power Whip, Sludge Bomb",,,"1;2;3","2;3"
"2","Ivysaur (Shadow)","Bulbasaur","TRUE","286","404",,,"0/10/15","0/13/14",,,"11.5","38.5",,,"497","1497",,,"Vine Whip, Power Whip, Sludge Bomb","Vine Whip, Power Whip, Sludge Bomb",,,"1;2;3","2;3"
"3","Venusaur","Bulbasaur","FALSE","173","119","80","239","3/15/14","0/14/11","1/15/14","15/15/15","7","21","39","50","497","1496","2499","3075","Vine Whip, Frenzy Plant, Sludge Bomb","Vine Whip, Frenzy Plant, Sludge Bomb","Vine Whip, Frenzy Plant, Sludge Bomb","Vine Whip, Frenzy Plant, Sludge Bomb","1;2;3","3"
"3","Venusaur (Shadow)","Bulbasaur","TRUE",,"151","75","251",,"0/14/11","1/15/14","15/15/15",,"21","39","50",,"1496","2499","3075",,"Vine Whip, Frenzy Plant, Sludge Bomb","Vine Whip, Frenzy Plant, Sludge Bomb","Vine Whip, Frenzy Plant, Sludge Bomb","1;2;3","3"
"5","Charmeleon","Charmander","FALSE",,"648",,,,"0/13/15",,,,"40",,,,"1496",,,,"Fire Fang, Fire Punch, Return",,,"4;5;6","5;6"
"5","Charmeleon (Shadow)","Charmander","TRUE",,"540",,,,"0/13/15",,,,"40",,,,"1496",,,,"Fire Fang, Fire Punch, Flamethrower",,,"4;5;6","5;6"
"6","Charizard","Charmander","FALSE",,"341","271","194",,"0/15/13","0/13/15","15/15/15",,"19.5","35","50",,"1488","2497","3266",,"Fire Spin, Blast Burn, Dragon Claw","Dragon Breath, Blast Burn, Dragon Claw","Dragon Breath, Blast Burn, Dragon Claw","4;5;6","6"
"6","Charizard (Shadow)","Charmander","TRUE",,"216","319","200",,"0/15/13","0/13/15","15/15/15",,"19.5","35","50",,"1488","2497","3266",,"Fire Spin, Blast Burn, Dragon Claw","Dragon Breath, Blast Burn, Dragon Claw","Dragon Breath, Blast Burn, Dragon Claw","4;5;6","6"
"8","Wartortle","Squirtle","FALSE",,"548",,,,"0/14/15",,,,"50",,,,"1496",,,,"Water Gun, Ice Beam, Hydro Pump",,,"7;8;9","8;9"
"8","Wartortle (Shadow)","Squirtle","TRUE",,"705",,,,"0/14/15",,,,"50",,,,"1496",,,,"Water Gun, Ice Beam, Hydro Pump",,,"7;8;9","8;9"
"9","Blastoise","Squirtle","FALSE",,"168","63","267",,"1/15/15","0/12/15","15/15/15",,"23","48.5","50",,"1492","2495","2788",,"Water Gun, Hydro Cannon, Ice Beam","Water Gun, Hydro Cannon, Ice Beam","Water Gun, Hydro Cannon, Ice Beam","7;8;9","9"
"9","Blastoise (Shadow)","Squirtle","TRUE",,"244","117","273",,"1/15/15","0/12/15","15/15/15",,"23","48.5","50",,"1492","2495","2788",,"Water Gun, Hydro Cannon, Ice Beam","Water Gun, Hydro Cannon, Ice Beam","Water Gun, Hydro Cannon, Ice Beam","7;8;9","9"
"10","Caterpie","Caterpie","FALSE","356",,,,"15/15/15",,,,"50",,,,"494",,,,"Bug Bite, Struggle, NA",,,,"10;11;12","10;11;12"
"11","Metapod","Caterpie","FALSE","329",,,,"14/15/15",,,,"50",,,,"500",,,,"Bug Bite, Struggle, NA",,,,"10;11;12","11;12"
"12","Butterfree","Caterpie","FALSE","346","975",,,"0/14/14","0/13/15",,,"10.5","33",,,"498","1494",,,"Confusion, Psychic, Bug Buzz","Confusion, Bug Buzz, Signal Beam",,,"10;11;12","12"
"12","Butterfree (Shadow)","Caterpie","TRUE",,"968",,,,"0/13/15",,,,"33",,,,"1494",,,,"Confusion, Bug Buzz, Signal Beam",,,"10;11;12","12"
"13","Weedle","Weedle","FALSE","357",,,,"13/15/15",,,,"49.5",,,,"498",,,,"Poison Sting, Return, Struggle",,,,"13;14;15","13;14;15"
"13","Weedle (Shadow)","Weedle","TRUE","332",,,,"13/15/15",,,,"49.5",,,,"498",,,,"Bug Bite, Struggle, Frustration",,,,"13;14;15","13;14;15"
"14","Kakuna","Weedle","FALSE","240",,,,"15/15/15",,,,"50",,,,"488",,,,"Poison Sting, Return, Struggle",,,,"13;14;15","14;15"
"14","Kakuna (Shadow)","Weedle","TRUE","310",,,,"15/15/15",,,,"50",,,,"488",,,,"Bug Bite, Struggle, Frustration",,,,"13;14;15","14;15"
"15","Beedrill","Weedle","FALSE","157","207","559",,"0/12/13","0/13/14","15/15/15",,"10.5","32.5","50",,"497","1494","2087",,"Poison Jab, Drill Run, X-Scissor","Poison Jab, X-Scissor, Drill Run","Poison Jab, Drill Run, X-Scissor",,"13;14;15","15"
"15","Beedrill (Shadow)","Weedle","TRUE","183","286","545",,"0/12/13","0/13/14","15/15/15",,"10.5","32.5","50",,"497","1494","2087",,"Poison Jab, Drill Run, X-Scissor","Poison Jab, X-Scissor, Drill Run","Poison Jab, Drill Run, X-Scissor",,"13;14;15","15"
"17","Pidgeotto","Pidgey","FALSE",,"697",,,,"15/15/15",,,,"50",,,,"1350",,,,"Wing Attack, Aerial Ace, Return",,,"16;17;18","17;18"
"17","Pidgeotto (Shadow)","Pidgey","TRUE",,"840",,,,"15/15/15",,,,"50",,,,"1350",,,,"Wing Attack, Aerial Ace, Twister",,,"16;17;18","17;18"
"18","Pidgeot","Pidgey","FALSE",,"255","235","546",,"0/14/14","15/15/15","15/15/15",,"27","50","50",,"1494","2407","2407",,"Gust, Feather Dance, Brave Bird","Gust, Feather Dance, Brave Bird","Gust, Brave Bird, Aerial Ace","16;17;18","18"
"18","Pidgeot (Shadow)","Pidgey","TRUE",,"368","302","551",,"0/14/14","15/15/15","15/15/15",,"27","50","50",,"1494","2407","2407",,"Gust, Brave Bird, Aerial Ace","Gust, Brave Bird, Aerial Ace","Gust, Brave Bird, Aerial Ace","16;17;18","18"
"19","Rattata (Alolan)","Rattata","FALSE","142",,,,"1/15/15",,,,"27",,,,"498",,,,"Quick Attack, Crunch, Hyper Fang",,,,"19;20","19;20"
"19","Rattata (Alolan) (Shadow)","Rattata","TRUE","204",,,,"1/15/15",,,,"27",,,,"498",,,,"Quick Attack, Crunch, Hyper Fang",,,,"19;20","19;20"
"20","Raticate","Rattata","FALSE",,"686",,,,"0/14/15",,,,"36.5",,,,"1494",,,,"Quick Attack, Hyper Fang, Dig",,,"19;20","20"
"20","Raticate (Alolan)","Rattata","FALSE","55","160","702",,"0/15/12","0/13/14","15/15/15",,"11.5","39","50",,"499","1496","1927",,"Quick Attack, Crunch, Hyper Fang","Quick Attack, Crunch, Return","Quick Attack, Crunch, Hyper Fang",,"19;20","20"
"20","Raticate (Alolan) (Shadow)","Rattata","TRUE","75","249","705",,"0/15/12","0/13/14","15/15/15",,"11.5","39","50",,"499","1496","1927",,"Quick Attack, Crunch, Hyper Fang","Quick Attack, Crunch, Hyper Beam","Quick Attack, Crunch, Hyper Fang",,"19;20","20"
"20","Raticate (Shadow)","Rattata","TRUE",,"723",,,,"0/14/15",,,,"36.5",,,,"1494",,,,"Quick Attack, Hyper Fang, Dig",,,"19;20","20"
"22","Fearow","Spearow","FALSE",,"855","675",,,"0/15/14","15/15/15",,,"28.5","50",,,"1497","2257",,,"Steel Wing, Fly, Drill Run","Steel Wing, Fly, Drill Run",,"21;22","22"
"23","Ekans","Ekans","FALSE","125",,,,"0/14/15",,,,"21.5",,,,"500",,,,"Poison Sting, Poison Fang, Sludge Bomb",,,,"23;24","23;24"
"23","Ekans (Shadow)","Ekans","TRUE","100",,,,"0/14/15",,,,"21.5",,,,"500",,,,"Poison Sting, Poison Fang, Sludge Bomb",,,,"23;24","23;24"
"24","Arbok","Ekans","FALSE","314","877","703",,"0/14/14","0/11/14","15/15/14",,"10","30.5","50",,"499","1495","2171",,"Dragon Tail, Dark Pulse, Sludge Wave","Dragon Tail, Dark Pulse, Sludge Wave","Dragon Tail, Dark Pulse, Sludge Wave",,"23;24","24"
"24","Arbok (Shadow)","Ekans","TRUE","292","904","716",,"0/14/14","0/11/14","15/15/14",,"10","30.5","50",,"499","1495","2171",,"Dragon Tail, Dark Pulse, Sludge Wave","Dragon Tail, Dark Pulse, Sludge Wave","Dragon Tail, Dark Pulse, Sludge Wave",,"23;24","24"
"26","Raichu","Pikachu","FALSE",,"241","239",,,"0/15/14","15/15/14",,,"26","50",,,"1495","2467",,,"Thunder Shock, Wild Charge, Brick Break","Thunder Shock, Brick Break, Wild Charge",,"25;26;172","26;172"
"26","Raichu (Alolan)","Pikachu","FALSE",,"163","171","553",,"1/15/15","8/15/14","15/15/15",,"24.5","50","50",,"1499","2500","2585",,"Thunder Shock, Wild Charge, Trailblaze","Thunder Shock, Trailblaze, Wild Charge","Thunder Shock, Wild Charge, Thunder Punch","25;26;172","26;172"
"27","Sandshrew","Sandshrew","FALSE",,"631",,,,"15/15/15",,,,"50",,,,"1426",,,,"Sand Attack, Dig, Rock Slide",,,"27;28","27;28"
"27","Sandshrew (Alolan)","Sandshrew","FALSE",,"343",,,,"15/15/15",,,,"50",,,,"1462",,,,"Powder Snow, Night Slash, Blizzard",,,"27;28","27;28"
"27","Sandshrew (Alolan) (Shadow)","Sandshrew","TRUE",,"480",,,,"15/15/15",,,,"50",,,,"1462",,,,"Powder Snow, Night Slash, Blizzard",,,"27;28","27;28"
"27","Sandshrew (Shadow)","Sandshrew","TRUE",,"608",,,,"15/15/15",,,,"50",,,,"1426",,,,"Sand Attack, Dig, Rock Slide",,,"27;28","27;28"
"28","Sandslash","Sandshrew","FALSE",,"335","155","348",,"0/14/15","2/14/15","15/15/15",,"24","50","50",,"1493","2492","2684",,"Sand Attack, Night Slash, Scorching Sands","Sand Attack, Night Slash, Scorching Sands","Sand Attack, Night Slash, Scorching Sands","27;28","28"
"28","Sandslash (Alolan)","Sandshrew","FALSE",,"23","36","238",,"0/14/14","0/14/15","15/15/15",,"23.5","49","50",,"1500","2499","2750",,"Powder Snow, Ice Punch, Drill Run","Shadow Claw, Ice Punch, Drill Run","Powder Snow, Ice Punch, Drill Run","27;28","28"
"28","Sandslash (Alolan) (Shadow)","Sandshrew","TRUE",,"44","41","201",,"0/14/14","0/14/15","15/15/15",,"23.5","49","50",,"1500","2499","2750",,"Powder Snow, Ice Punch, Drill Run","Shadow Claw, Ice Punch, Drill Run","Powder Snow, Ice Punch, Drill Run","27;28","28"
"28","Sandslash (Shadow)","Sandshrew","TRUE",,"198","132","337",,"0/14/15","2/14/15","15/15/15",,"24","50","50",,"1493","2492","2684",,"Sand Attack, Night Slash, Scorching Sands","Sand Attack, Night Slash, Scorching Sands","Sand Attack, Night Slash, Scorching Sands","27;28","28"
"29","Nidoran Female","Nidoran-f","FALSE","39",,,,"0/14/13",,,,"25.5",,,,"496",,,,"Poison Sting, Poison Fang, Body Slam",,,,"29;30;31","29;30;31"
"29","Nidoran Female (Shadow)","Nidoran-f","TRUE","36",,,,"0/14/13",,,,"25.5",,,,"496",,,,"Poison Sting, Poison Fang, Body Slam",,,,"29;30;31","29;30;31"
"30","Nidorina","Nidoran-f","FALSE","24","128",,,"1/15/14","15/15/15",,,"15","50",,,"499","1480",,,"Poison Sting, Poison Fang, Dig","Poison Sting, Poison Fang, Thunderbolt",,,"29;30;31","30;31"
"30","Nidorina (Shadow)","Nidoran-f","TRUE","25","158",,,"1/15/14","15/15/15",,,"15","50",,,"499","1480",,,"Poison Sting, Poison Fang, Dig","Poison Sting, Poison Fang, Dig",,,"29;30;31","30;31"
"31","Nidoqueen","Nidoran-f","FALSE","232","183","37","327","0/12/4","0/15/12","0/14/15","15/15/15","8","23","47","50","500","1499","2500","2812","Poison Jab, Stone Edge, Earth Power","Poison Jab, Earth Power, Poison Fang","Poison Jab, Poison Fang, Earth Power","Poison Jab, Earth Power, Poison Fang","29;30;31","31"
"31","Nidoqueen (Shadow)","Nidoran-f","TRUE",,"191","48","314",,"0/15/12","0/14/15","15/15/15",,"23","47","50",,"1499","2500","2812",,"Poison Jab, Earth Power, Poison Fang","Poison Jab, Poison Fang, Earth Power","Poison Jab, Earth Power, Poison Fang","29;30;31","31"
"32","Nidoran Male","Nidoran-m","FALSE","127",,,,"0/14/13",,,,"23.5",,,,"495",,,,"Poison Sting, Body Slam, Sludge Bomb",,,,"32;33;34","32;33;34"
"32","Nidoran Male (Shadow)","Nidoran-m","TRUE","92",,,,"0/14/13",,,,"23.5",,,,"495",,,,"Poison Sting, Body Slam, Sludge Bomb",,,,"32;33;34","32;33;34"
"33","Nidorino","Nidoran-m","FALSE","185","496",,,"0/14/15","8/15/15",,,"14","49.5",,,"495","1500",,,"Poison Sting, Sludge Bomb, Ice Beam","Poison Sting, Sludge Bomb, Dig",,,"32;33;34","33;34"
"33","Nidorino (Shadow)","Nidoran-m","TRUE","230","484",,,"0/14/15","8/15/15",,,"14","49.5",,,"495","1500",,,"Poison Sting, Sludge Bomb, Ice Beam","Poison Sting, Sludge Bomb, Dig",,,"32;33;34","33;34"
"34","Nidoking","Nidoran-m","FALSE","275","743","510","497","0/14/14","0/14/15","0/14/14","15/15/15","7.5","22","44","50","500","1498","2486","2902","Poison Jab, Earth Power, Megahorn","Double Kick, Sand Tomb, Earth Power","Double Kick, Sand Tomb, Earth Power","Poison Jab, Earth Power, Megahorn","32;33;34","34"
"34","Nidoking (Shadow)","Nidoran-m","TRUE",,"675","430","514",,"0/14/15","0/14/14","15/15/15",,"22","44","50",,"1498","2486","2902",,"Double Kick, Sand Tomb, Earth Power","Double Kick, Sand Tomb, Earth Power","Poison Jab, Earth Power, Megahorn","32;33;34","34"
"35","Clefairy","Clefairy","FALSE","370","997",,,"0/12/15","15/15/15",,,"17.5","50",,,"500","1306",,,"Zen Headbutt, Disarming Voice, Swift","Zen Headbutt, Disarming Voice, Swift",,,"35;36;173","35;36;173"
"36","Clefable","Clefairy","FALSE","29","19","5","263","0/14/11","0/13/15","0/15/13","15/15/15","8","23.5","49","50","500","1499","2497","2755","Fairy Wind, Meteor Mash, Swift","Fairy Wind, Moonblast, Swift","Fairy Wind, Swift, Moonblast","Fairy Wind, Swift, Meteor Mash","35;36;173","36;173"
"38","Ninetales","Vulpix","FALSE",,"162","67","420",,"0/15/15","9/15/15","15/15/15",,"25","50","50",,"1494","2495","2577",,"Fire Spin, Weather Ball (Fire), Overheat","Fire Spin, Weather Ball (Fire), Overheat","Fire Spin, Weather Ball (Fire), Scorching Sands","37;38","38"
"38","Ninetales (Alolan)","Vulpix","FALSE","41","121","96","264","0/8/14","0/14/12","7/15/15","15/15/15","8.5","25","50","50","499","1498","2500","2610","Powder Snow, Weather Ball (Ice), Psyshock","Powder Snow, Weather Ball (Ice), Dazzling Gleam","Powder Snow, Weather Ball (Ice), Dazzling Gleam","Powder Snow, Weather Ball (Ice), Psyshock","37;38","38"
"38","Ninetales (Alolan) (Shadow)","Vulpix","TRUE","42","152","85","209","0/8/14","0/14/12","7/15/15","15/15/15","8.5","25","50","50","499","1498","2500","2610","Powder Snow, Weather Ball (Ice), Psyshock","Powder Snow, Weather Ball (Ice), Dazzling Gleam","Powder Snow, Weather Ball (Ice), Dazzling Gleam","Powder Snow, Weather Ball (Ice), Psyshock","37;38","38"
"38","Ninetales (Shadow)","Vulpix","TRUE",,"180","93","397",,"0/15/15","9/15/15","15/15/15",,"25","50","50",,"1494","2495","2577",,"Fire Spin, Weather Ball (Fire), Overheat","Fire Spin, Weather Ball (Fire), Overheat","Fire Spin, Weather Ball (Fire), Scorching Sands","37;38","38"
"39","Jigglypuff","Jigglypuff","FALSE","91",,,,"0/14/15",,,,"29",,,,"499",,,,"Feint Attack, Swift, Disarming Voice",,,,"39;40;174","39;40;174"
"40","Wigglytuff","Jigglypuff","FALSE","67","46","315",,"0/15/13","0/15/12","15/15/15",,"10","30","50",,"496","1495","2178",,"Charm, Swift, Disarming Voice","Charm, Icy Wind, Swift","Charm, Disarming Voice, Icy Wind",,"39;40;174","40;174"
"41","Zubat","Zubat","FALSE","108",,,,"0/15/15",,,,"32",,,,"498",,,,"Quick Attack, Swift, Poison Fang",,,,"41;42;169","41;42;169"
"41","Zubat (Shadow)","Zubat","TRUE","56",,,,"0/15/15",,,,"32",,,,"498",,,,"Quick Attack, Swift, Poison Fang",,,,"41;42;169","41;42;169"
"42","Golbat","Zubat","FALSE","106","373","522",,"4/15/14","0/15/15","15/15/15",,"9.5","29","50",,"499","1498","2234",,"Wing Attack, Poison Fang, Shadow Ball","Wing Attack, Poison Fang, Shadow Ball","Wing Attack, Poison Fang, Shadow Ball",,"41;42;169","42;169"
"42","Golbat (Shadow)","Zubat","TRUE","130","358","515",,"4/15/14","0/15/15","15/15/15",,"9.5","29","50",,"499","1498","2234",,"Wing Attack, Poison Fang, Shadow Ball","Wing Attack, Poison Fang, Shadow Ball","Wing Attack, Poison Fang, Shadow Ball",,"41;42;169","42;169"
"43","Oddish","Oddish","FALSE","271","779",,,"0/15/13","15/15/15",,,"16","50",,,"500","1389",,,"Razor Leaf, Sludge Bomb, Seed Bomb","Razor Leaf, Seed Bomb, Sludge Bomb",,,"43;44;45","43;44;45"
"43","Oddish (Shadow)","Oddish","TRUE","258","709",,,"0/15/13","15/15/15",,,"16","50",,,"500","1389",,,"Razor Leaf, Sludge Bomb, Seed Bomb","Razor Leaf, Seed Bomb, Sludge Bomb",,,"43;44;45","43;44;45"
"44","Gloom","Oddish","FALSE","266","585",,,"0/15/13","0/12/14",,,"11.5","39.5",,,"498","1500",,,"Razor Leaf, Sludge Bomb, Moonblast","Razor Leaf, Sludge Bomb, Moonblast",,,"43;44;45","44;45"
"44","Gloom (Shadow)","Oddish","TRUE","254","467",,,"0/15/13","0/12/14",,,"11.5","39.5",,,"498","1500",,,"Razor Leaf, Sludge Bomb, Moonblast","Razor Leaf, Sludge Bomb, Moonblast",,,"43;44;45","44;45"
"45","Vileplume","Oddish","FALSE","284","650","580","544","0/14/15","0/15/14","0/15/14","15/15/15","7.5","22","44","50","499","1498","2494","2893","Razor Leaf, Sludge Bomb, Moonblast","Razor Leaf, Sludge Bomb, Petal Blizzard","Razor Leaf, Sludge Bomb, Moonblast","Razor Leaf, Sludge Bomb, Moonblast","43;44;45","45"
"45","Vileplume (Shadow)","Oddish","TRUE",,"505","572","501",,"0/15/14","0/15/14","15/15/15",,"22","44","50",,"1498","2494","2893",,"Razor Leaf, Sludge Bomb, Moonblast","Razor Leaf, Sludge Bomb, Moonblast","Razor Leaf, Sludge Bomb, Moonblast","43;44;45","45"
"46","Paras","Paras","FALSE","302",,,,"0/15/13",,,,"19.5",,,,"497",,,,"Bug Bite, X-Scissor, Cross Poison",,,,"46;47","46;47"
"47","Parasect","Paras","FALSE","219","581","684",,"0/9/14","0/13/15","15/15/14",,"10.5","32","50",,"500","1495","2102",,"Fury Cutter, X-Scissor, Cross Poison","Fury Cutter, X-Scissor, Cross Poison","Fury Cutter, X-Scissor, Cross Poison",,"46;47","47"
"48","Venonat","Venonat","FALSE","239",,,,"0/15/15",,,,"20",,,,"497",,,,"Confusion, Poison Fang, Signal Beam",,,,"48;49","48;49"
"48","Venonat (Shadow)","Venonat","TRUE","217",,,,"0/15/15",,,,"20",,,,"497",,,,"Confusion, Poison Fang, Signal Beam",,,,"48;49","48;49"
"49","Venomoth","Venonat","FALSE","273","732","643",,"4/15/14","0/13/15","15/15/15",,"9","27.5","50",,"499","1499","2354",,"Confusion, Poison Fang, Silver Wind","Infestation, Poison Fang, Bug Buzz","Confusion, Poison Fang, Silver Wind",,"48;49","49"
"49","Venomoth (Shadow)","Venonat","TRUE","277","753","663",,"4/15/14","0/13/15","15/15/15",,"9","27.5","50",,"499","1499","2354",,"Confusion, Poison Fang, Silver Wind","Infestation, Poison Fang, Bug Buzz","Confusion, Poison Fang, Silver Wind",,"48;49","49"
"51","Dugtrio","Diglett","FALSE",,"296",,,,"0/14/15",,,,"44",,,,"1495",,,,"Mud Slap, Mud Bomb, Stone Edge",,,"50;51","51"
"51","Dugtrio (Alolan)","Diglett","FALSE",,"236",,,,"0/14/15",,,,"29.5",,,,"1497",,,,"Mud Slap, Mud Bomb, Iron Head",,,"50;51","51"
"51","Dugtrio (Alolan) (Shadow)","Diglett","TRUE",,"178",,,,"0/14/15",,,,"29.5",,,,"1497",,,,"Mud Slap, Mud Bomb, Iron Head",,,"50;51","51"
"51","Dugtrio (Shadow)","Diglett","TRUE",,"287",,,,"0/14/15",,,,"44",,,,"1495",,,,"Mud Slap, Mud Bomb, Stone Edge",,,"50;51","51"
"52","Meowth (Alolan)","Meowth","FALSE","115",,,,"1/15/15",,,,"25",,,,"497",,,,"Bite, Night Slash, Trailblaze",,,,"52;53;863","52;53;863"
"53","Persian","Meowth","FALSE",,"858",,,,"0/14/13",,,,"39",,,,"1496",,,,"Feint Attack, Night Slash, Power Gem",,,"52;53;863","53"
"53","Persian (Alolan)","Meowth","FALSE","247","843",,,"0/15/9","1/15/15",,,"11","34.5",,,"494","1498",,,"Feint Attack, Foul Play, Trailblaze","Feint Attack, Foul Play, Play Rough",,,"52;53;863","53"
"53","Persian (Shadow)","Meowth","TRUE",,"834",,,,"0/14/13",,,,"39",,,,"1496",,,,"Feint Attack, Night Slash, Power Gem",,,"52;53;863","53"
"55","Golduck","Psyduck","FALSE",,"423","312","414",,"0/10/14","0/13/13","15/15/15",,"23.5","48.5","50",,"1499","2496","2770",,"Water Gun, Cross Chop, Liquidation","Water Gun, Cross Chop, Liquidation","Water Gun, Cross Chop, Liquidation","54;55","55"
"55","Golduck (Shadow)","Psyduck","TRUE",,"361","299","405",,"0/10/14","0/13/13","15/15/15",,"23.5","48.5","50",,"1499","2496","2770",,"Water Gun, Cross Chop, Liquidation","Water Gun, Cross Chop, Liquidation","Water Gun, Cross Chop, Liquidation","54;55","55"
"56","Mankey","Mankey","FALSE",,"656",,,,"15/15/15",,,,"50",,,,"1317",,,,"Karate Chop, Cross Chop, Return",,,"56;57;979","56;57;979"
"56","Mankey (Shadow)","Mankey","TRUE",,"599",,,,"15/15/15",,,,"50",,,,"1317",,,,"Karate Chop, Cross Chop, Brick Break",,,"56;57;979","56;57;979"
"57","Primeape","Mankey","FALSE",,"4","3","220",,"1/15/14","7/15/15","15/15/15",,"24.5","50","50",,"1497","2490","2586",,"Karate Chop, Rage Fist, Close Combat","Karate Chop, Rage Fist, Close Combat","Karate Chop, Close Combat, Rage Fist","56;57;979","57;979"
"57","Primeape (Shadow)","Mankey","TRUE",,"22","21","207",,"1/15/14","7/15/15","15/15/15",,"24.5","50","50",,"1497","2490","2586",,"Karate Chop, Rage Fist, Close Combat","Karate Chop, Rage Fist, Close Combat","Karate Chop, Close Combat, Rage Fist","56;57;979","57;979"
"58","Growlithe","Growlithe","FALSE",,"795",,,,"15/15/15",,,,"50",,,,"1405",,,,"Ember, Body Slam, Flamethrower",,,"58;59","58;59"
"58","Growlithe (Hisuian)","Growlithe","FALSE",,"872",,,,"15/15/14",,,,"50",,,,"1495",,,,"Ember, Rock Slide, Crunch",,,"58;59","58;59"
"58","Growlithe (Shadow)","Growlithe","TRUE",,"752",,,,"15/15/15",,,,"50",,,,"1405",,,,"Ember, Body Slam, Flamethrower",,,"58;59","58;59"
"59","Arcanine","Growlithe","FALSE",,"243","579","157",,"0/14/15","0/15/15","15/15/15",,"18.5","31.5","50",,"1497","2497","3425",,"Fire Fang, Wild Charge, Psychic Fangs","Snarl, Crunch, Flamethrower","Fire Fang, Wild Charge, Psychic Fangs","58;59","59"
"59","Arcanine (Hisuian)","Growlithe","FALSE",,"727","497","260",,"0/14/10","0/10/15","15/15/15",,"18","30","50",,"1498","2485","3556",,"Fire Fang, Wild Charge, Rock Slide","Fire Fang, Rock Slide, Crunch","Fire Fang, Wild Charge, Rock Slide","58;59","59"
"59","Arcanine (Shadow)","Growlithe","TRUE",,"213","146","133",,"0/14/15","0/15/15","15/15/15",,"18.5","31.5","50",,"1497","2497","3425",,"Fire Fang, Wild Charge, Psychic Fangs","Fire Fang, Wild Charge, Psychic Fangs","Fire Fang, Wild Charge, Psychic Fangs","58;59","59"
"61","Poliwhirl","Poliwag","FALSE",,"412",,,,"6/15/15",,,,"49.5",,,,"1500",,,,"Bubble, Scald, Mud Bomb",,,"60;61;62","61;62"
"61","Poliwhirl (Shadow)","Poliwag","TRUE",,"393",,,,"6/15/15",,,,"49.5",,,,"1500",,,,"Bubble, Scald, Mud Bomb",,,"60;61;62","61;62"
"62","Poliwrath","Poliwag","FALSE",,"184","72","237",,"0/14/15","0/14/14","15/15/15",,"22","44","50",,"1500","2494","2923",,"Counter, Scald, Icy Wind","Counter, Icy Wind, Scald","Counter, Scald, Icy Wind","60;61;62","62"
"62","Poliwrath (Shadow)","Poliwag","TRUE",,"230","152","261",,"0/14/15","0/14/14","15/15/15",,"22","44","50",,"1500","2494","2923",,"Counter, Scald, Icy Wind","Counter, Icy Wind, Scald","Counter, Scald, Icy Wind","60;61;62","62"
"64","Kadabra","Abra","FALSE",,"999",,,,"2/15/14",,,,"27",,,,"1496",,,,"Psycho Cut, Shadow Ball, Return",,,"63;64;65","64;65"
"65","Alakazam","Abra","FALSE",,"886","646","387",,"1/15/15","0/14/15","15/15/15",,"18","30.5","50",,"1499","2500","3456",,"Psycho Cut, Fire Punch, Shadow Ball","Psycho Cut, Fire Punch, Shadow Ball","Psycho Cut, Fire Punch, Shadow Ball","63;64;65","65"
"65","Alakazam (Shadow)","Abra","TRUE",,"868","620","338",,"1/15/15","0/14/15","15/15/15",,"18","30.5","50",,"1499","2500","3456",,"Psycho Cut, Fire Punch, Shadow Ball","Psycho Cut, Fire Punch, Shadow Ball","Psycho Cut, Fire Punch, Shadow Ball","63;64;65","65"
"66","Machop","Machop","FALSE",,"209",,,,"15/15/15",,,,"50",,,,"1445",,,,"Karate Chop, Cross Chop, Return",,,"66;67;68","66;67;68"
"66","Machop (Shadow)","Machop","TRUE",,"214",,,,"15/15/15",,,,"50",,,,"1445",,,,"Karate Chop, Cross Chop, Brick Break",,,"66;67;68","66;67;68"
"67","Machoke","Machop","FALSE",,"138","300",,,"0/15/14","15/15/15",,,"28","50",,,"1498","2296",,,"Karate Chop, Cross Chop, Return","Karate Chop, Cross Chop, Dynamic Punch",,"66;67;68","67;68"
"67","Machoke (Shadow)","Machop","TRUE",,"37","226",,,"0/15/14","15/15/15",,,"28","50",,,"1498","2296",,,"Karate Chop, Cross Chop, Dynamic Punch","Karate Chop, Cross Chop, Dynamic Punch",,"66;67;68","67;68"
"68","Machamp","Machop","FALSE",,"51","71","144",,"0/14/11","0/15/14","15/15/15",,"18.5","31","50",,"1497","2491","3455",,"Karate Chop, Cross Chop, Stone Edge","Karate Chop, Cross Chop, Stone Edge","Karate Chop, Cross Chop, Rock Slide","66;67;68","68"
"68","Machamp (Shadow)","Machop","TRUE",,"35","47","102",,"0/14/11","0/15/14","15/15/15",,"18.5","31","50",,"1497","2491","3455",,"Karate Chop, Cross Chop, Stone Edge","Karate Chop, Cross Chop, Stone Edge","Karate Chop, Cross Chop, Stone Edge","66;67;68","68"
"69","Bellsprout","Bellsprout","FALSE","328",,,,"0/15/11",,,,"19",,,,"500",,,,"Vine Whip, Power Whip, Sludge Bomb",,,,"69;70;71","69;70;71"
"69","Bellsprout (Shadow)","Bellsprout","TRUE","331",,,,"0/15/11",,,,"19",,,,"498",,,,"Vine Whip, Power Whip, Sludge Bomb",,,,"69;70;71","69;70;71"
"70","Weepinbell","Bellsprout","FALSE","323","647",,,"0/13/13","1/15/15",,,"12","40.5",,,"499","1493",,,"Bullet Seed, Sludge Bomb, Power Whip","Bullet Seed, Power Whip, Sludge Bomb",,,"69;70;71","70;71"
"70","Weepinbell (Shadow)","Bellsprout","TRUE","325","637",,,"0/13/13","1/15/15",,,"12","40.5",,,"499","1497",,,"Bullet Seed, Sludge Bomb, Power Whip","Bullet Seed, Power Whip, Sludge Bomb",,,"69;70;71","70;71"
"71","Victreebel","Bellsprout","FALSE","181","270","202","408","0/14/8","1/15/15","0/15/12","15/15/15","8","23","48.5","50","498","1500","2498","2748","Magical Leaf, Leaf Blade, Sludge Bomb","Magical Leaf, Leaf Blade, Sludge Bomb","Magical Leaf, Leaf Blade, Sludge Bomb","Magical Leaf, Leaf Blade, Sludge Bomb","69;70;71","71"
"71","Victreebel (Shadow)","Bellsprout","TRUE",,"379","163","379",,"1/15/15","0/15/12","15/15/15",,"23","48.5","50",,"1500","2498","2748",,"Magical Leaf, Leaf Blade, Acid Spray","Magical Leaf, Leaf Blade, Sludge Bomb","Magical Leaf, Leaf Blade, Sludge Bomb","69;70;71","71"
"72","Tentacool","Tentacool","FALSE","133","925",,,"0/15/14","15/15/15",,,"19.5","50",,,"498","1176",,,"Bubble, Water Pulse, Bubble Beam","Poison Sting, Water Pulse, Wrap",,,"72;73","72;73"
"72","Tentacool (Shadow)","Tentacool","TRUE","114","918",,,"0/15/14","15/15/15",,,"19.5","50",,,"497","1176",,,"Bubble, Water Pulse, Bubble Beam","Poison Sting, Water Pulse, Wrap",,,"72;73","72;73"
"73","Tentacruel","Tentacool","FALSE","71","185","30","389","1/14/13","1/15/14","0/13/15","15/15/15","8","23.5","50","50","498","1496","2493","2738","Poison Jab, Scald, Acid Spray","Poison Jab, Acid Spray, Scald","Poison Jab, Scald, Blizzard","Poison Jab, Scald, Sludge Wave","72;73","73"
