"ID","Pokemon","Family","Shadow","Little_Rank","Great_Rank","Ultra_Rank","Master_Rank","Little_IVs","Great_IVs","Ultra_IVs","Master_IVs","Little_Level","Great_Level","Ultra_Level","Master_Level","Little_CP","Great_CP","Ultra_CP","Master_CP","Little_MoveSet","Great_MoveSet","Ultra_MoveSet","Master_MoveSet","Evo_Fam","Evo_Next"
"1","Bulbasaur","Bulbasaur","FALSE",,"867",,,,"15/15/15",,,,"50",,,,"1260",,,,"Vine Whip, Power Whip, Sludge Bomb",,,"1;2;3","1;2;3"
"1","Bulbasaur (Shadow)","Bulbasaur","TRUE",,"903",,,,"15/15/15",,,,"50",,,,"1260",,,,"Vine Whip, Power Whip, Sludge Bomb",,,"1;2;3","1;2;3"
"2","Ivysaur","Bulbasaur","FALSE",,"331",,,,"0/13/14",,,,"38.5",,,,"1493",,,,"Vine Whip, Power Whip, Sludge Bomb",,,"1;2;3","2;3"
"2","Ivysaur (Shadow)","Bulbasaur","TRUE",,"439",,,,"0/13/14",,,,"38.5",,,,"1497",,,,"Vine Whip, Power Whip, Sludge Bomb",,,"1;2;3","2;3"
"3","Venusaur","Bulbasaur","FALSE",,"127",,,,"0/14/11",,,,"21",,,,"1496",,,,"Vine Whip, Frenzy Plant, Sludge Bomb",,,"1;2;3","3"
"3","Venusaur (Shadow)","Bulbasaur","TRUE",,"161",,,,"0/14/11",,,,"21",,,,"1496",,,,"Vine Whip, Frenzy Plant, Sludge Bomb",,,"1;2;3","3"
"5","Charmeleon","Charmander","FALSE",,"574",,,,"0/13/15",,,,"40",,,,"1496",,,,"Fire Fang, Fire Punch, Return",,,"4;5;6","5;6"
"5","Charmeleon (Shadow)","Charmander","TRUE",,"520",,,,"0/13/15",,,,"40",,,,"1496",,,,"Fire Fang, Fire Punch, Flamethrower",,,"4;5;6","5;6"
"6","Charizard","Charmander","FALSE",,"262",,,,"0/15/13",,,,"19.5",,,,"1488",,,,"Fire Spin, Blast Burn, Dragon Claw",,,"4;5;6","6"
"6","Charizard (Shadow)","Charmander","TRUE",,"232",,,,"0/15/13",,,,"19.5",,,,"1488",,,,"Fire Spin, Blast Burn, Dragon Claw",,,"4;5;6","6"
"8","Wartortle","Squirtle","FALSE",,"142",,,,"0/14/15",,,,"50",,,,"1496",,,,"Water Gun, Aqua Jet, Ice Beam",,,"7;8;9","8;9"
"8","Wartortle (Shadow)","Squirtle","TRUE",,"250",,,,"0/14/15",,,,"50",,,,"1496",,,,"Water Gun, Aqua Jet, Ice Beam",,,"7;8;9","8;9"
"12","Butterfree","Caterpie","FALSE",,"973",,,,"0/13/15",,,,"33",,,,"1494",,,,"Confusion, Bug Buzz, Signal Beam",,,"10;11;12","12"
"12","Butterfree (Shadow)","Caterpie","TRUE",,"971",,,,"0/13/15",,,,"33",,,,"1494",,,,"Confusion, Bug Buzz, Signal Beam",,,"10;11;12","12"
"15","Beedrill","Weedle","FALSE",,"308",,,,"0/13/14",,,,"32.5",,,,"1494",,,,"Poison Jab, X-Scissor, Drill Run",,,"13;14;15","15"
"15","Beedrill (Shadow)","Weedle","TRUE",,"310",,,,"0/13/14",,,,"32.5",,,,"1494",,,,"Poison Jab, X-Scissor, Drill Run",,,"13;14;15","15"
"17","Pidgeotto","Pidgey","FALSE",,"707",,,,"15/15/15",,,,"50",,,,"1350",,,,"Wing Attack, Air Cutter, Aerial Ace",,,"16;17;18","17;18"
"17","Pidgeotto (Shadow)","Pidgey","TRUE",,"621",,,,"15/15/15",,,,"50",,,,"1350",,,,"Wing Attack, Air Cutter, Aerial Ace",,,"16;17;18","17;18"
"18","Pidgeot","Pidgey","FALSE",,"368",,,,"0/14/14",,,,"27",,,,"1494",,,,"Gust, Feather Dance, Brave Bird",,,"16;17;18","18"
"18","Pidgeot (Shadow)","Pidgey","TRUE",,"362",,,,"0/14/14",,,,"27",,,,"1494",,,,"Gust, Brave Bird, Aerial Ace",,,"16;17;18","18"
"20","Raticate","Rattata","FALSE",,"806",,,,"0/14/15",,,,"36.5",,,,"1494",,,,"Quick Attack, Hyper Fang, Dig",,,"19;20","20"
"20","Raticate (Alolan)","Rattata","FALSE",,"191",,,,"0/13/14",,,,"39",,,,"1496",,,,"Quick Attack, Crunch, Return",,,"19;20","20"
"20","Raticate (Alolan) (Shadow)","Rattata","TRUE",,"314",,,,"0/13/14",,,,"39",,,,"1496",,,,"Quick Attack, Crunch, Hyper Beam",,,"19;20","20"
"20","Raticate (Shadow)","Rattata","TRUE",,"807",,,,"0/14/15",,,,"36.5",,,,"1494",,,,"Quick Attack, Hyper Fang, Dig",,,"19;20","20"
"22","Fearow","Spearow","FALSE",,"850",,,,"0/15/14",,,,"28.5",,,,"1497",,,,"Steel Wing, Fly, Drill Run",,,"21;22","22"
"24","Arbok","Ekans","FALSE",,"879",,,,"0/11/14",,,,"30.5",,,,"1495",,,,"Dragon Tail, Dark Pulse, Sludge Wave",,,"23;24","24"
"24","Arbok (Shadow)","Ekans","TRUE",,"911",,,,"0/11/14",,,,"30.5",,,,"1495",,,,"Dragon Tail, Dark Pulse, Sludge Wave",,,"23;24","24"
"26","Raichu","Pikachu","FALSE",,"313",,,,"0/15/14",,,,"26",,,,"1495",,,,"Thunder Shock, Wild Charge, Brick Break",,,"25;26;172","26;172"
"26","Raichu (Alolan)","Pikachu","FALSE",,"135",,,,"1/15/15",,,,"24.5",,,,"1499",,,,"Thunder Shock, Wild Charge, Trailblaze",,,"25;26;172","26;172"
"27","Sandshrew","Sandshrew","FALSE",,"434",,,,"15/15/15",,,,"50",,,,"1426",,,,"Sand Attack, Rock Tomb, Dig",,,"27;28","27;28"
"27","Sandshrew (Alolan)","Sandshrew","FALSE",,"417",,,,"15/15/15",,,,"50",,,,"1462",,,,"Powder Snow, Night Slash, Blizzard",,,"27;28","27;28"
"27","Sandshrew (Alolan) (Shadow)","Sandshrew","TRUE",,"502",,,,"15/15/15",,,,"50",,,,"1462",,,,"Powder Snow, Night Slash, Blizzard",,,"27;28","27;28"
"27","Sandshrew (Shadow)","Sandshrew","TRUE",,"498",,,,"15/15/15",,,,"50",,,,"1426",,,,"Sand Attack, Rock Tomb, Dig",,,"27;28","27;28"
"28","Sandslash","Sandshrew","FALSE",,"194",,,,"0/14/15",,,,"24",,,,"1493",,,,"Sand Attack, Rock Tomb, Night Slash",,,"27;28","28"
"28","Sandslash (Alolan)","Sandshrew","FALSE",,"36",,,,"0/14/14",,,,"23.5",,,,"1500",,,,"Powder Snow, Ice Punch, Drill Run",,,"27;28","28"
"28","Sandslash (Alolan) (Shadow)","Sandshrew","TRUE",,"35",,,,"0/14/14",,,,"23.5",,,,"1500",,,,"Powder Snow, Ice Punch, Drill Run",,,"27;28","28"
"28","Sandslash (Shadow)","Sandshrew","TRUE",,"187",,,,"0/14/15",,,,"24",,,,"1493",,,,"Sand Attack, Rock Tomb, Night Slash",,,"27;28","28"
"30","Nidorina","Nidoran-f","FALSE",,"228",,,,"15/15/15",,,,"50",,,,"1480",,,,"Poison Sting, Poison Fang, Thunderbolt",,,"29;30;31","30;31"
"30","Nidorina (Shadow)","Nidoran-f","TRUE",,"207",,,,"15/15/15",,,,"50",,,,"1480",,,,"Poison Sting, Poison Fang, Dig",,,"29;30;31","30;31"
"31","Nidoqueen","Nidoran-f","FALSE",,"180",,,,"0/15/12",,,,"23",,,,"1499",,,,"Poison Jab, Earth Power, Poison Fang",,,"29;30;31","31"
"31","Nidoqueen (Shadow)","Nidoran-f","TRUE",,"267",,,,"0/15/12",,,,"23",,,,"1499",,,,"Poison Jab, Earth Power, Poison Fang",,,"29;30;31","31"
"33","Nidorino","Nidoran-m","FALSE",,"527",,,,"8/15/15",,,,"49.5",,,,"1500",,,,"Poison Sting, Sludge Bomb, Dig",,,"32;33;34","33;34"
"33","Nidorino (Shadow)","Nidoran-m","TRUE",,"529",,,,"8/15/15",,,,"49.5",,,,"1500",,,,"Poison Sting, Sludge Bomb, Dig",,,"32;33;34","33;34"
"34","Nidoking","Nidoran-m","FALSE",,"701",,,,"0/14/15",,,,"22",,,,"1498",,,,"Double Kick, Sand Tomb, Earth Power",,,"32;33;34","34"
"34","Nidoking (Shadow)","Nidoran-m","TRUE",,"719",,,,"0/14/15",,,,"22",,,,"1498",,,,"Double Kick, Sand Tomb, Earth Power",,,"32;33;34","34"
"35","Clefairy","Clefairy","FALSE",,"996",,,,"15/15/15",,,,"50",,,,"1306",,,,"Zen Headbutt, Disarming Voice, Swift",,,"35;36;173","35;36;173"
"36","Clefable","Clefairy","FALSE",,"46",,,,"0/13/15",,,,"23.5",,,,"1499",,,,"Fairy Wind, Moonblast, Swift",,,"35;36;173","36;173"
"38","Ninetales","Vulpix","FALSE",,"79",,,,"0/15/15",,,,"25",,,,"1494",,,,"Fire Spin, Weather Ball (Fire), Overheat",,,"37;38","38"
"38","Ninetales (Alolan)","Vulpix","FALSE",,"73",,,,"0/14/12",,,,"25",,,,"1498",,,,"Powder Snow, Weather Ball (Ice), Dazzling Gleam",,,"37;38","38"
"38","Ninetales (Alolan) (Shadow)","Vulpix","TRUE",,"66",,,,"0/14/12",,,,"25",,,,"1498",,,,"Powder Snow, Weather Ball (Ice), Dazzling Gleam",,,"37;38","38"
"38","Ninetales (Shadow)","Vulpix","TRUE",,"140",,,,"0/15/15",,,,"25",,,,"1494",,,,"Fire Spin, Weather Ball (Fire), Overheat",,,"37;38","38"
"42","Golbat","Zubat","FALSE",,"391",,,,"0/15/15",,,,"29",,,,"1498",,,,"Wing Attack, Poison Fang, Shadow Ball",,,"41;42;169","42;169"
"42","Golbat (Shadow)","Zubat","TRUE",,"380",,,,"0/15/15",,,,"29",,,,"1498",,,,"Wing Attack, Poison Fang, Shadow Ball",,,"41;42;169","42;169"
"43","Oddish","Oddish","FALSE",,"797",,,,"15/15/15",,,,"50",,,,"1389",,,,"Razor Leaf, Seed Bomb, Sludge Bomb",,,"43;44;45","43;44;45"
"43","Oddish (Shadow)","Oddish","TRUE",,"690",,,,"15/15/15",,,,"50",,,,"1389",,,,"Razor Leaf, Seed Bomb, Sludge Bomb",,,"43;44;45","43;44;45"
"44","Gloom","Oddish","FALSE",,"572",,,,"0/12/14",,,,"39.5",,,,"1500",,,,"Razor Leaf, Sludge Bomb, Moonblast",,,"43;44;45","44;45"
"44","Gloom (Shadow)","Oddish","TRUE",,"468",,,,"0/12/14",,,,"39.5",,,,"1500",,,,"Razor Leaf, Sludge Bomb, Moonblast",,,"43;44;45","44;45"
"45","Vileplume","Oddish","FALSE",,"622",,,,"0/15/14",,,,"22",,,,"1498",,,,"Razor Leaf, Sludge Bomb, Petal Blizzard",,,"43;44;45","45"
"45","Vileplume (Shadow)","Oddish","TRUE",,"513",,,,"0/15/14",,,,"22",,,,"1498",,,,"Razor Leaf, Sludge Bomb, Moonblast",,,"43;44;45","45"
"47","Parasect","Paras","FALSE",,"579",,,,"0/13/15",,,,"32",,,,"1495",,,,"Fury Cutter, X-Scissor, Cross Poison",,,"46;47","47"
"49","Venomoth","Venonat","FALSE",,"249",,,,"0/13/15",,,,"27.5",,,,"1499",,,,"Psywave, Poison Fang, Bug Buzz",,,"48;49","49"
"49","Venomoth (Shadow)","Venonat","TRUE",,"216",,,,"0/13/15",,,,"27.5",,,,"1499",,,,"Psywave, Poison Fang, Bug Buzz",,,"48;49","49"
"51","Dugtrio","Diglett","FALSE",,"386",,,,"0/14/15",,,,"44",,,,"1495",,,,"Mud Slap, Mud Bomb, Stone Edge",,,"50;51","51"
"51","Dugtrio (Alolan)","Diglett","FALSE",,"196",,,,"0/14/15",,,,"29.5",,,,"1497",,,,"Mud Slap, Mud Bomb, Iron Head",,,"50;51","51"
"51","Dugtrio (Alolan) (Shadow)","Diglett","TRUE",,"158",,,,"0/14/15",,,,"29.5",,,,"1497",,,,"Mud Slap, Mud Bomb, Iron Head",,,"50;51","51"
"51","Dugtrio (Shadow)","Diglett","TRUE",,"311",,,,"0/14/15",,,,"44",,,,"1495",,,,"Mud Slap, Mud Bomb, Stone Edge",,,"50;51","51"
"53","Persian","Meowth","FALSE",,"805",,,,"0/14/13",,,,"39",,,,"1496",,,,"Feint Attack, Night Slash, Power Gem",,,"52;53;863","53"
"53","Persian (Alolan)","Meowth","FALSE",,"721",,,,"1/15/15",,,,"34.5",,,,"1498",,,,"Feint Attack, Foul Play, Play Rough",,,"52;53;863","53"
"53","Persian (Shadow)","Meowth","TRUE",,"801",,,,"0/14/13",,,,"39",,,,"1496",,,,"Feint Attack, Night Slash, Power Gem",,,"52;53;863","53"
"55","Golduck","Psyduck","FALSE",,"464",,,,"0/10/14",,,,"23.5",,,,"1499",,,,"Water Gun, Cross Chop, Liquidation",,,"54;55","55"
"55","Golduck (Shadow)","Psyduck","TRUE",,"427",,,,"0/10/14",,,,"23.5",,,,"1499",,,,"Water Gun, Cross Chop, Liquidation",,,"54;55","55"
"56","Mankey","Mankey","FALSE",,"682",,,,"15/15/15",,,,"50",,,,"1317",,,,"Karate Chop, Cross Chop, Return",,,"56;57;979","56;57;979"
"56","Mankey (Shadow)","Mankey","TRUE",,"603",,,,"15/15/15",,,,"50",,,,"1317",,,,"Karate Chop, Cross Chop, Brick Break",,,"56;57;979","56;57;979"
"57","Primeape","Mankey","FALSE",,"6",,,,"1/15/14",,,,"24.5",,,,"1497",,,,"Karate Chop, Rage Fist, Close Combat",,,"56;57;979","57;979"
"57","Primeape (Shadow)","Mankey","TRUE",,"24",,,,"1/15/14",,,,"24.5",,,,"1497",,,,"Karate Chop, Rage Fist, Close Combat",,,"56;57;979","57;979"
"58","Growlithe","Growlithe","FALSE",,"785",,,,"15/15/15",,,,"50",,,,"1405",,,,"Ember, Body Slam, Flamethrower",,,"58;59","58;59"
"58","Growlithe (Hisuian)","Growlithe","FALSE",,"872",,,,"15/15/14",,,,"50",,,,"1495",,,,"Ember, Rock Slide, Crunch",,,"58;59","58;59"
"58","Growlithe (Shadow)","Growlithe","TRUE",,"728",,,,"15/15/15",,,,"50",,,,"1405",,,,"Ember, Body Slam, Flamethrower",,,"58;59","58;59"
"59","Arcanine","Growlithe","FALSE",,"269",,,,"0/14/15",,,,"18.5",,,,"1497",,,,"Fire Fang, Wild Charge, Psychic Fangs",,,"58;59","59"
"59","Arcanine (Hisuian)","Growlithe","FALSE",,"736",,,,"0/14/10",,,,"18",,,,"1498",,,,"Fire Fang, Wild Charge, Rock Slide",,,"58;59","59"
"59","Arcanine (Shadow)","Growlithe","TRUE",,"257",,,,"0/14/15",,,,"18.5",,,,"1497",,,,"Fire Fang, Wild Charge, Psychic Fangs",,,"58;59","59"
"61","Poliwhirl","Poliwag","FALSE",,"413",,,,"6/15/15",,,,"49.5",,,,"1500",,,,"Bubble, Scald, Mud Bomb",,,"60;61;62","61;62"
"61","Poliwhirl (Shadow)","Poliwag","TRUE",,"454",,,,"6/15/15",,,,"49.5",,,,"1500",,,,"Bubble, Scald, Mud Bomb",,,"60;61;62","61;62"
"62","Poliwrath","Poliwag","FALSE",,"273",,,,"0/14/15",,,,"22",,,,"1500",,,,"Counter, Scald, Icy Wind",,,"60;61;62","62"
"62","Poliwrath (Shadow)","Poliwag","TRUE",,"355",,,,"0/14/15",,,,"22",,,,"1500",,,,"Counter, Scald, Icy Wind",,,"60;61;62","62"
"64","Kadabra","Abra","FALSE",,"994",,,,"2/15/14",,,,"27",,,,"1496",,,,"Psycho Cut, Shadow Ball, Dazzling Gleam",,,"63;64;65","64;65"
"65","Alakazam","Abra","FALSE",,"827",,,,"1/15/15",,,,"18",,,,"1499",,,,"Psycho Cut, Fire Punch, Shadow Ball",,,"63;64;65","65"
"65","Alakazam (Shadow)","Abra","TRUE",,"802",,,,"1/15/15",,,,"18",,,,"1499",,,,"Psycho Cut, Fire Punch, Shadow Ball",,,"63;64;65","65"
"66","Machop","Machop","FALSE",,"282",,,,"15/15/15",,,,"50",,,,"1445",,,,"Karate Chop, Cross Chop, Return",,,"66;67;68","66;67;68"
"66","Machop (Shadow)","Machop","TRUE",,"283",,,,"15/15/15",,,,"50",,,,"1445",,,,"Karate Chop, Cross Chop, Brick Break",,,"66;67;68","66;67;68"
"67","Machoke","Machop","FALSE",,"170",,,,"0/15/14",,,,"28",,,,"1498",,,,"Karate Chop, Cross Chop, Return",,,"66;67;68","67;68"
"67","Machoke (Shadow)","Machop","TRUE",,"22",,,,"0/15/14",,,,"28",,,,"1498",,,,"Karate Chop, Cross Chop, Dynamic Punch",,,"66;67;68","67;68"
"68","Machamp","Machop","FALSE",,"76",,,,"0/14/11",,,,"18.5",,,,"1497",,,,"Karate Chop, Cross Chop, Stone Edge",,,"66;67;68","68"
"68","Machamp (Shadow)","Machop","TRUE",,"57",,,,"0/14/11",,,,"18.5",,,,"1497",,,,"Karate Chop, Cross Chop, Stone Edge",,,"66;67;68","68"
"70","Weepinbell","Bellsprout","FALSE",,"593",,,,"1/15/15",,,,"40.5",,,,"1493",,,,"Bullet Seed, Power Whip, Sludge Bomb",,,"69;70;71","70;71"
"70","Weepinbell (Shadow)","Bellsprout","TRUE",,"608",,,,"1/15/15",,,,"40.5",,,,"1497",,,,"Bullet Seed, Power Whip, Sludge Bomb",,,"69;70;71","70;71"
"71","Victreebel","Bellsprout","FALSE",,"307",,,,"1/15/15",,,,"23",,,,"1500",,,,"Magical Leaf, Leaf Blade, Sludge Bomb",,,"69;70;71","71"
"71","Victreebel (Shadow)","Bellsprout","TRUE",,"357",,,,"1/15/15",,,,"23",,,,"1500",,,,"Magical Leaf, Leaf Blade, Acid Spray",,,"69;70;71","71"
"72","Tentacool","Tentacool","FALSE",,"930",,,,"15/15/15",,,,"50",,,,"1176",,,,"Poison Sting, Water Pulse, Wrap",,,"72;73","72;73"
"72","Tentacool (Shadow)","Tentacool","TRUE",,"935",,,,"15/15/15",,,,"50",,,,"1176",,,,"Poison Sting, Water Pulse, Wrap",,,"72;73","72;73"
"73","Tentacruel","Tentacool","FALSE",,"261",,,,"1/15/14",,,,"23.5",,,,"1496",,,,"Poison Jab, Acid Spray, Scald",,,"72;73","73"
"73","Tentacruel (Shadow)","Tentacool","TRUE",,"327",,,,"1/15/14",,,,"23.5",,,,"1496",,,,"Poison Jab, Acid Spray, Scald",,,"72;73","73"
"74","Geodude","Geodude","FALSE",,"779",,,,"15/15/15",,,,"50",,,,"1462",,,,"Rock Throw, Rock Tomb, Rock Slide",,,"74;75;76","74;75;76"
"74","Geodude (Alolan)","Geodude","FALSE",,"692",,,,"15/15/15",,,,"50",,,,"1462",,,,"Volt Switch, Rock Tomb, Rock Slide",,,"74;75;76","74;75;76"
"74","Geodude (Alolan) (Shadow)","Geodude","TRUE",,"766",,,,"15/15/15",,,,"50",,,,"1462",,,,"Volt Switch, Rock Tomb, Rock Slide",,,"74;75;76","74;75;76"
"74","Geodude (Shadow)","Geodude","TRUE",,"747",,,,"15/15/15",,,,"50",,,,"1462",,,,"Rock Throw, Rock Tomb, Rock Slide",,,"74;75;76","74;75;76"
"75","Graveler","Geodude","FALSE",,"663",,,,"0/14/15",,,,"30.5",,,,"1500",,,,"Mud Slap, Stone Edge, Dig",,,"74;75;76","75;76"
"75","Graveler (Alolan)","Geodude","FALSE",,"537",,,,"0/14/15",,,,"30.5",,,,"1500",,,,"Volt Switch, Stone Edge, Rock Blast",,,"74;75;76","75;76"
"75","Graveler (Alolan) (Shadow)","Geodude","TRUE",,"538",,,,"0/14/15",,,,"30.5",,,,"1500",,,,"Volt Switch, Stone Edge, Rock Blast",,,"74;75;76","75;76"
"75","Graveler (Shadow)","Geodude","TRUE",,"659",,,,"0/14/15",,,,"30.5",,,,"1500",,,,"Mud Slap, Stone Edge, Dig",,,"74;75;76","75;76"
"76","Golem","Geodude","FALSE",,"422",,,,"1/14/15",,,,"19",,,,"1497",,,,"Mud Slap, Stone Edge, Rock Blast",,,"74;75;76","76"
"76","Golem (Alolan)","Geodude","FALSE",,"433",,,,"1/14/15",,,,"19",,,,"1497",,,,"Rollout, Wild Charge, Rock Blast",,,"74;75;76","76"
"76","Golem (Alolan) (Shadow)","Geodude","TRUE",,"392",,,,"1/14/15",,,,"19",,,,"1497",,,,"Rollout, Wild Charge, Rock Blast",,,"74;75;76","76"
"76","Golem (Shadow)","Geodude","TRUE",,"387",,,,"1/14/15",,,,"19",,,,"1497",,,,"Mud Slap, Stone Edge, Rock Blast",,,"74;75;76","76"
"77","Ponyta","Ponyta","FALSE",,"739",,,,"0/15/14",,,,"37.5",,,,"1500",,,,"Ember, Flame Charge, Stomp",,,"77;78","77;78"
"77","Ponyta (Galarian)","Ponyta","FALSE",,"870",,,,"0/15/14",,,,"37.5",,,,"1500",,,,"Psycho Cut, Swift, Play Rough",,,"77;78","77;78"
"78","Rapidash","Ponyta","FALSE",,"321",,,,"0/13/15",,,,"23",,,,"1498",,,,"Incinerate, Flame Charge, Wild Charge",,,"77;78","78"
"78","Rapidash (Galarian)","Ponyta","FALSE",,"297",,,,"0/13/15",,,,"23",,,,"1498",,,,"Fairy Wind, Body Slam, Wild Charge",,,"77;78","78"
"79","Slowpoke","Slowpoke","FALSE",,"686",,,,"15/15/15",,,,"50",,,,"1386",,,,"Confusion, Psyshock, Water Pulse",,,"79;80;199","79;80;199"
"79","Slowpoke (Galarian)","Slowpoke","FALSE",,"691",,,,"15/15/15",,,,"50",,,,"1386",,,,"Confusion, Psyshock, Surf",,,"79;80;199","79;80;199"
"79","Slowpoke (Shadow)","Slowpoke","TRUE",,"749",,,,"15/15/15",,,,"50",,,,"1386",,,,"Confusion, Psyshock, Water Pulse",,,"79;80;199","79;80;199"
"80","Slowbro","Slowpoke","FALSE",,"560",,,,"0/13/15",,,,"22.5",,,,"1493",,,,"Water Gun, Surf, Ice Beam",,,"79;80","80"
"80","Slowbro (Galarian)","Slowpoke","FALSE",,"335",,,,"0/14/11",,,,"23.5",,,,"1493",,,,"Poison Jab, Scald, Brutal Swing",,,"79;80","80"
"80","Slowbro (Shadow)","Slowpoke","TRUE",,"631",,,,"0/13/15",,,,"22.5",,,,"1493",,,,"Water Gun, Surf, Ice Beam",,,"79;80","80"
"81","Magnemite","Magnemite","FALSE",,"445",,,,"12/15/13",,,,"50",,,,"1495",,,,"Volt Switch, Magnet Bomb, Discharge",,,"81;82;462","81;82;462"
"81","Magnemite (Shadow)","Magnemite","TRUE",,"342",,,,"12/15/13",,,,"50",,,,"1495",,,,"Volt Switch, Magnet Bomb, Discharge",,,"81;82;462","81;82;462"
"82","Magneton","Magnemite","FALSE",,"338",,,,"0/15/15",,,,"22.5",,,,"1500",,,,"Thunder Shock, Discharge, Magnet Bomb",,,"81;82;462","82;462"
"82","Magneton (Shadow)","Magnemite","TRUE",,"212",,,,"0/15/15",,,,"22.5",,,,"1500",,,,"Thunder Shock, Discharge, Magnet Bomb",,,"81;82;462","82;462"
"83","Farfetch'd","Farfetchd","FALSE",,"323",,,,"15/15/15",,,,"50",,,,"1397",,,,"Fury Cutter, Leaf Blade, Aerial Ace",,,"83;865","83;865"
"83","Farfetch'd (Galarian)","Farfetchd","FALSE",,"372",,,,"0/15/15",,,,"38",,,,"1494",,,,"Fury Cutter, Leaf Blade, Brave Bird",,,"83;865","83;865"
"85","Dodrio","Doduo","FALSE",,"882",,,,"0/12/15",,,,"24",,,,"1494",,,,"Steel Wing, Brave Bird, Drill Peck",,,"84;85","85"
"86","Seel","Seel","FALSE",,"777",,,,"15/15/15",,,,"50",,,,"1098",,,,"Water Gun, Aqua Tail, Icy Wind",,,"86;87","86;87"
"87","Dewgong","Seel","FALSE",,"133",,,,"0/12/15",,,,"29.5",,,,"1500",,,,"Ice Shard, Icy Wind, Drill Run",,,"86;87","87"
"88","Grimer","Grimer","FALSE",,"107",,,,"10/15/14",,,,"50",,,,"1493",,,,"Mud Slap, Sludge, Mud Bomb",,,"88;89","88;89"
"88","Grimer (Alolan)","Grimer","FALSE",,"303",,,,"10/15/14",,,,"50",,,,"1500",,,,"Poison Jab, Crunch, Sludge Bomb",,,"88;89","88;89"
"88","Grimer (Alolan) (Shadow)","Grimer","TRUE",,"381",,,,"10/15/14",,,,"50",,,,"1500",,,,"Poison Jab, Crunch, Sludge Bomb",,,"88;89","88;89"
"88","Grimer (Shadow)","Grimer","TRUE",,"206",,,,"10/15/14",,,,"50",,,,"1500",,,,"Poison Jab, Sludge, Mud Bomb",,,"88;89","88;89"
"89","Muk","Grimer","FALSE",,"339",,,,"0/15/14",,,,"20.5",,,,"1497",,,,"Poison Jab, Thunder Punch, Dark Pulse",,,"88;89","89"
"89","Muk (Alolan)","Grimer","FALSE",,"367",,,,"0/15/14",,,,"20.5",,,,"1497",,,,"Poison Jab, Dark Pulse, Acid Spray",,,"88;89","89"
"89","Muk (Alolan) (Shadow)","Grimer","TRUE",,"407",,,,"0/15/14",,,,"20.5",,,,"1497",,,,"Poison Jab, Dark Pulse, Acid Spray",,,"88;89","89"
"89","Muk (Shadow)","Grimer","TRUE",,"343",,,,"0/15/14",,,,"20.5",,,,"1497",,,,"Poison Jab, Thunder Punch, Dark Pulse",,,"88;89","89"
"91","Cloyster","Shellder","FALSE",,"638",,,,"0/13/13",,,,"22.5",,,,"1499",,,,"Ice Shard, Icy Wind, Liquidation",,,"90;91","91"
"91","Cloyster (Shadow)","Shellder","TRUE",,"644",,,,"0/13/13",,,,"22.5",,,,"1499",,,,"Ice Shard, Icy Wind, Liquidation",,,"90;91","91"
"93","Haunter","Gastly","FALSE",,"223",,,,"1/15/14",,,,"28.5",,,,"1493",,,,"Shadow Claw, Shadow Punch, Ice Punch",,,"92;93;94","93;94"
"93","Haunter (Shadow)","Gastly","TRUE",,"379",,,,"1/15/14",,,,"28.5",,,,"1493",,,,"Shadow Claw, Ice Punch, Shadow Ball",,,"92;93;94","93;94"
"94","Gengar","Gastly","FALSE",,"197",,,,"0/13/13",,,,"19.5",,,,"1500",,,,"Shadow Claw, Shadow Punch, Sludge Bomb",,,"92;93;94","94"
"94","Gengar (Shadow)","Gastly","TRUE",,"162",,,,"0/13/13",,,,"19.5",,,,"1500",,,,"Shadow Claw, Shadow Punch, Sludge Bomb",,,"92;93;94","94"
"95","Onix","Onix","FALSE",,"812",,,,"15/15/14",,,,"50",,,,"1245",,,,"Rock Throw, Breaking Swipe, Stone Edge",,,"95;208","95;208"
"95","Onix (Shadow)","Onix","TRUE",,"830",,,,"15/15/14",,,,"50",,,,"1245",,,,"Rock Throw, Breaking Swipe, Stone Edge",,,"95;208","95;208"
"96","Drowzee","Drowzee","FALSE",,"925",,,,"15/15/14",,,,"50",,,,"1176",,,,"Confusion, Psyshock, Return",,,"96;97","96;97"
"96","Drowzee (Shadow)","Drowzee","TRUE",,"941",,,,"15/15/14",,,,"50",,,,"1176",,,,"Confusion, Psyshock, Psychic",,,"96;97","96;97"
"97","Hypno","Drowzee","FALSE",,"336",,,,"0/13/13",,,,"28",,,,"1499",,,,"Confusion, Shadow Ball, Thunder Punch",,,"96;97","97"
"97","Hypno (Shadow)","Drowzee","TRUE",,"473",,,,"0/13/13",,,,"28",,,,"1499",,,,"Confusion, Thunder Punch, Fire Punch",,,"96;97","97"
"98","Krabby","Krabby","FALSE",,"901",,,,"0/15/15",,,,"43",,,,"1499",,,,"Bubble, Razor Shell, Water Pulse",,,"98;99","98;99"
"99","Kingler","Krabby","FALSE",,"776",,,,"0/9/15",,,,"20",,,,"1495",,,,"Bubble, Crabhammer, X-Scissor",,,"98;99","99"
"101","Electrode","Voltorb","FALSE",,"615",,,,"1/15/15",,,,"27",,,,"1496",,,,"Volt Switch, Discharge, Hyper Beam",,,"100;101","101"
"101","Electrode (Hisuian)","Voltorb","FALSE",,"100",,,,"1/14/14",,,,"26.5",,,,"1495",,,,"Thunder Shock, Wild Charge, Swift",,,"100;101","101"
"101","Electrode (Shadow)","Voltorb","TRUE",,"699",,,,"1/15/15",,,,"27",,,,"1496",,,,"Volt Switch, Discharge, Hyper Beam",,,"100;101","101"
"102","Exeggcute","Exeggcute","FALSE",,"899",,,,"15/15/14",,,,"50",,,,"1328",,,,"Confusion, Seed Bomb, Ancient Power",,,"102;103","102;103"
"102","Exeggcute (Shadow)","Exeggcute","TRUE",,"904",,,,"15/15/14",,,,"50",,,,"1328",,,,"Confusion, Seed Bomb, Ancient Power",,,"102;103","102;103"
"103","Exeggutor","Exeggcute","FALSE",,"909",,,,"1/15/14",,,,"18.5",,,,"1497",,,,"Bullet Seed, Seed Bomb, Psychic",,,"102;103","103"
"103","Exeggutor (Alolan)","Exeggcute","FALSE",,"703",,,,"1/15/14",,,,"18.5",,,,"1493",,,,"Dragon Tail, Seed Bomb, Draco Meteor",,,"102;103","103"
"103","Exeggutor (Alolan) (Shadow)","Exeggcute","TRUE",,"597",,,,"1/15/14",,,,"18.5",,,,"1493",,,,"Dragon Tail, Seed Bomb, Draco Meteor",,,"102;103","103"
"103","Exeggutor (Shadow)","Exeggcute","TRUE",,"900",,,,"1/15/14",,,,"18.5",,,,"1497",,,,"Bullet Seed, Seed Bomb, Psychic",,,"102;103","103"
"104","Cubone","Cubone","FALSE",,"587",,,,"15/15/15",,,,"50",,,,"1152",,,,"Mud Slap, Bone Club, Return",,,"104;105","104;105"
"104","Cubone (Shadow)","Cubone","TRUE",,"523",,,,"15/15/15",,,,"50",,,,"1152",,,,"Mud Slap, Bone Club, Dig",,,"104;105","104;105"
"105","Marowak (Alolan)","Cubone","FALSE",,"20",,,,"0/14/14",,,,"33.5",,,,"1500",,,,"Fire Spin, Bone Club, Shadow Bone",,,"104;105","105"
"105","Marowak (Alolan) (Shadow)","Cubone","TRUE",,"14",,,,"0/14/14",,,,"33.5",,,,"1500",,,,"Fire Spin, Shadow Bone, Bone Club",,,"104;105","105"
"106","Hitmonlee","Hitmonlee","FALSE",,"509",,,,"2/15/15",,,,"21.5",,,,"1497",,,,"Double Kick, Close Combat, Blaze Kick",,,"106;236","106;236"
"106","Hitmonlee (Shadow)","Hitmonlee","TRUE",,"495",,,,"2/15/15",,,,"21.5",,,,"1497",,,,"Double Kick, Close Combat, Blaze Kick",,,"106;236","106;236"
"107","Hitmonchan","Hitmonchan","FALSE",,"557",,,,"0/11/15",,,,"24.5",,,,"1490",,,,"Counter, Ice Punch, Thunder Punch",,,"107;236","107;236"
"107","Hitmonchan (Shadow)","Hitmonchan","TRUE",,"539",,,,"0/11/15",,,,"24.5",,,,"1490",,,,"Counter, Ice Punch, Thunder Punch",,,"107;236","107;236"
"108","Lickitung","Lickitung","FALSE",,"43",,,,"8/14/15",,,,"50",,,,"1498",,,,"Lick, Body Slam, Power Whip",,,"108;463","108;463"
"109","Koffing","Koffing","FALSE",,"898",,,,"15/15/15",,,,"50",,,,"1373",,,,"Infestation, Sludge, Dark Pulse",,,"109;110","109;110"
"109","Koffing (Shadow)","Koffing","TRUE",,"908",,,,"15/15/15",,,,"50",,,,"1373",,,,"Infestation, Sludge, Dark Pulse",,,"109;110","109;110"
"110","Weezing","Koffing","FALSE",,"459",,,,"0/14/14",,,,"25",,,,"1491",,,,"Rollout, Sludge Bomb, Shadow Ball",,,"109;110","110"
"110","Weezing (Shadow)","Koffing","TRUE",,"484",,,,"0/14/14",,,,"25",,,,"1495",,,,"Rollout, Sludge Bomb, Shadow Ball",,,"109;110","110"
"111","Rhyhorn","Rhyhorn","FALSE",,"493",,,,"0/13/15",,,,"41",,,,"1499",,,,"Mud Slap, Bulldoze, Stomp",,,"111;112;464","111;112;464"
"111","Rhyhorn (Shadow)","Rhyhorn","TRUE",,"384",,,,"0/13/15",,,,"41",,,,"1499",,,,"Mud Slap, Bulldoze, Stomp",,,"111;112;464","111;112;464"
"112","Rhydon","Rhyhorn","FALSE",,"345",,,,"2/15/14",,,,"17.5",,,,"1498",,,,"Mud Slap, Breaking Swipe, Stone Edge",,,"111;112;464","112;464"
"112","Rhydon (Shadow)","Rhyhorn","TRUE",,"288",,,,"2/15/14",,,,"17.5",,,,"1498",,,,"Mud Slap, Breaking Swipe, Stone Edge",,,"111;112;464","112;464"
"113","Chansey","Chansey","FALSE",,"377",,,,"15/15/15",,,,"50",,,,"1418",,,,"Zen Headbutt, Dazzling Gleam, Psychic",,,"113;242;440","113;242;440"
"114","Tangela","Tangela","FALSE",,"669",,,,"0/13/15",,,,"25.5",,,,"1491",,,,"Vine Whip, Grass Knot, Sludge Bomb",,,"114;465","114;465"
"114","Tangela (Shadow)","Tangela","TRUE",,"726",,,,"0/13/15",,,,"25.5",,,,"1491",,,,"Vine Whip, Grass Knot, Sludge Bomb",,,"114;465","114;465"
"115","Kangaskhan","Kangaskhan","FALSE",,"271",,,,"0/14/15",,,,"22",,,,"1500",,,,"Mud Slap, Crunch, Stomp",,,"115","115"
"117","Seadra","Horsea","FALSE",,"957",,,,"1/15/14",,,,"27",,,,"1499",,,,"Dragon Breath, Hydro Pump, Blizzard",,,"116;117;230","117;230"
"117","Seadra (Shadow)","Horsea","TRUE",,"927",,,,"1/15/14",,,,"27",,,,"1499",,,,"Dragon Breath, Hydro Pump, Blizzard",,,"116;117;230","117;230"
