"ID","Pokemon","Family","Shadow","Little_Rank","Great_Rank","Ultra_Rank","Master_Rank","Little_IVs","Great_IVs","Ultra_IVs","Master_IVs","Little_Level","Great_Level","Ultra_Level","Master_Level","Little_CP","Great_CP","Ultra_CP","Master_CP","Little_MoveSet","Great_MoveSet","Ultra_MoveSet","Master_MoveSet","Evo_Fam","Evo_Next"
"521","Unfezant","Pidove","FALSE",,"795",,,,"0/15/14",,,,"20.5",,,,"1495",,,,"Air Slash, Sky Attack, Hyper Beam",,,"519;520;521","521"
"521","Unfezant (Shadow)","Pidove","TRUE",,"784",,,,"0/15/14",,,,"20.5",,,,"1495",,,,"Air Slash, Sky Attack, Hyper Beam",,,"519;520;521","521"
"523","Zebstrika","Blitzle","FALSE",,"653",,,,"0/15/9",,,,"23.5",,,,"1496",,,,"Spark, Wild Charge, Flame Charge",,,"522;523","523"
"523","Zebstrika (Shadow)","Blitzle","TRUE",,"716",,,,"0/15/9",,,,"23.5",,,,"1496",,,,"Spark, Wild Charge, Flame Charge",,,"522;523","523"
"524","Roggenrola","Roggenrola","FALSE",,"760",,,,"15/15/15",,,,"50",,,,"1362",,,,"Smack Down, Stone Edge, Rock Blast",,,"524;525;526","524;525;526"
"524","Roggenrola (Shadow)","Roggenrola","TRUE",,"729",,,,"15/15/15",,,,"50",,,,"1362",,,,"Smack Down, Stone Edge, Rock Blast",,,"524;525;526","524;525;526"
"525","Boldore","Roggenrola","FALSE",,"605",,,,"0/15/15",,,,"28",,,,"1484",,,,"Mud Slap, Rock Slide, Bulldoze",,,"524;525;526","525;526"
"525","Boldore (Shadow)","Roggenrola","TRUE",,"571",,,,"0/15/15",,,,"28",,,,"1500",,,,"Mud Slap, Stone Edge, Rock Slide",,,"524;525;526","525;526"
"526","Gigalith","Roggenrola","FALSE",,"523",,,,"0/11/15",,,,"17.5",,,,"1492",,,,"Mud Slap, Superpower, Meteor Beam",,,"524;525;526","526"
"526","Gigalith (Shadow)","Roggenrola","TRUE",,"535",,,,"0/11/15",,,,"17.5",,,,"1492",,,,"Mud Slap, Meteor Beam, Superpower",,,"524;525;526","526"
"528","Swoobat","Woobat","FALSE",,"67",,,,"0/15/9",,,,"38",,,,"1499",,,,"Confusion, Psychic Fangs, Fly",,,"527;528","528"
"529","Drilbur","Drilbur","FALSE",,"363",,,,"10/15/15",,,,"49.5",,,,"1499",,,,"Mud Slap, Drill Run, Rock Tomb",,,"529;530","529;530"
"529","Drilbur (Shadow)","Drilbur","TRUE",,"402",,,,"10/15/15",,,,"49.5",,,,"1499",,,,"Mud Slap, Drill Run, Rock Tomb",,,"529;530","529;530"
"531","Audino","Audino","FALSE",,"788",,,,"0/15/13",,,,"41",,,,"1499",,,,"Zen Headbutt, Disarming Voice, Hyper Beam",,,"531","531"
"532","Timburr","Timburr","FALSE",,"812",,,,"15/15/15",,,,"50",,,,"1487",,,,"Low Kick, Brick Break, Rock Tomb",,,"532;533;534","532;533;534"
"532","Timburr (Shadow)","Timburr","TRUE",,"814",,,,"15/15/15",,,,"50",,,,"1487",,,,"Low Kick, Brick Break, Rock Tomb",,,"532;533;534","532;533;534"
"533","Gurdurr","Timburr","FALSE",,"433",,,,"1/15/15",,,,"26",,,,"1491",,,,"Poison Jab, Stone Edge, Brick Break",,,"532;533;534","533;534"
"533","Gurdurr (Shadow)","Timburr","TRUE",,"502",,,,"1/15/15",,,,"26",,,,"1491",,,,"Poison Jab, Stone Edge, Brick Break",,,"532;533;534","533;534"
"534","Conkeldurr","Timburr","FALSE",,"376",,,,"3/15/14",,,,"16.5",,,,"1495",,,,"Poison Jab, Brutal Swing, Dynamic Punch",,,"532;533;534","534"
"534","Conkeldurr (Shadow)","Timburr","TRUE",,"362",,,,"3/15/14",,,,"16.5",,,,"1495",,,,"Poison Jab, Brutal Swing, Dynamic Punch",,,"532;533;534","534"
"536","Palpitoad","Tympole","FALSE",,"466",,,,"9/15/15",,,,"49.5",,,,"1497",,,,"Bubble, Earth Power, Water Pulse",,,"535;536;537","536;537"
"537","Seismitoad","Tympole","FALSE",,"525",,,,"1/15/15",,,,"22",,,,"1498",,,,"Mud Shot, Earth Power, Sludge Bomb",,,"535;536;537","537"
"538","Throh","Throh","FALSE",,"794",,,,"2/15/15",,,,"22",,,,"1493",,,,"Low Kick, Body Slam, Brick Break",,,"538","538"
"538","Throh (Shadow)","Throh","TRUE",,"796",,,,"2/15/15",,,,"22",,,,"1493",,,,"Low Kick, Body Slam, Brick Break",,,"538","538"
"539","Sawk","Sawk","FALSE",,"609",,,,"0/15/15",,,,"20",,,,"1500",,,,"Poison Jab, Body Slam, Brick Break",,,"539","539"
"539","Sawk (Shadow)","Sawk","TRUE",,"544",,,,"0/15/15",,,,"20",,,,"1500",,,,"Poison Jab, Body Slam, Brick Break",,,"539","539"
"541","Swadloon","Sewaddle","FALSE",,"536",,,,"12/15/14",,,,"49.5",,,,"1500",,,,"Bug Bite, Energy Ball, Silver Wind",,,"540;541;542","541;542"
"542","Leavanny","Sewaddle","FALSE",,"105",,,,"0/13/14",,,,"22",,,,"1499",,,,"Shadow Claw, Leaf Blade, X-Scissor",,,"540;541;542","542"
"544","Whirlipede","Venipede","FALSE",,"700",,,,"15/15/15",,,,"50",,,,"1293",,,,"Poison Sting, Sludge Bomb, Signal Beam",,,"543;544;545","544;545"
"544","Whirlipede (Shadow)","Venipede","TRUE",,"672",,,,"15/15/15",,,,"50",,,,"1293",,,,"Poison Sting, Sludge Bomb, Signal Beam",,,"543;544;545","544;545"
"545","Scolipede","Venipede","FALSE",,"399",,,,"1/15/14",,,,"23",,,,"1495",,,,"Poison Jab, X-Scissor, Sludge Bomb",,,"543;544;545","545"
"545","Scolipede (Shadow)","Venipede","TRUE",,"397",,,,"1/15/14",,,,"23",,,,"1495",,,,"Poison Jab, X-Scissor, Sludge Bomb",,,"543;544;545","545"
"549","Lilligant","Petilil","FALSE",,"705",,,,"0/15/15",,,,"22",,,,"1491",,,,"Charm, Petal Blizzard, Hyper Beam",,,"548;549","549"
"550","Basculin","Basculin","FALSE",,"413",,,,"0/11/15",,,,"27.5",,,,"1495",,,,"Water Gun, Aqua Tail, Muddy Water",,,"550;902","550;902"
"554","Darumaka","Darumaka","FALSE",,"707",,,,"2/15/14",,,,"50",,,,"1499",,,,"Fire Fang, Fire Punch, Return",,,"554;555","554;555"
"554","Darumaka (Galarian)","Darumaka","FALSE",,"485",,,,"2/15/14",,,,"50",,,,"1499",,,,"Ice Fang, Ice Punch, Ice Beam",,,"554;555","554;555"
"554","Darumaka (Shadow)","Darumaka","TRUE",,"595",,,,"2/15/14",,,,"50",,,,"1499",,,,"Fire Fang, Fire Punch, Flame Charge",,,"554;555","554;555"
"555","Darmanitan (Galarian)","Darumaka","FALSE",,"619",,,,"0/15/11",,,,"18",,,,"1497",,,,"Ice Fang, Avalanche, Superpower",,,"554;555","555"
"555","Darmanitan (Standard)","Darumaka","FALSE",,"480",,,,"0/15/11",,,,"18",,,,"1497",,,,"Incinerate, Rock Slide, Overheat",,,"554;555","555"
"555","Darmanitan (Standard) (Shadow)","Darumaka","TRUE",,"533",,,,"0/15/11",,,,"18",,,,"1497",,,,"Incinerate, Rock Slide, Overheat",,,"554;555","555"
"556","Maractus","Maractus","FALSE",,"698",,,,"0/13/14",,,,"25",,,,"1498",,,,"Bullet Seed, Aerial Ace, Petal Blizzard",,,"556","556"
"557","Dwebble","Dwebble","FALSE",,"620",,,,"15/15/15",,,,"50",,,,"1384",,,,"Smack Down, X-Scissor, Rock Blast",,,"557;558","557;558"
"557","Dwebble (Shadow)","Dwebble","TRUE",,"630",,,,"15/15/15",,,,"50",,,,"1384",,,,"Smack Down, X-Scissor, Rock Blast",,,"557;558","557;558"
"558","Crustle","Dwebble","FALSE",,"305",,,,"0/13/13",,,,"22.5",,,,"1499",,,,"Fury Cutter, X-Scissor, Rock Slide",,,"557;558","558"
"558","Crustle (Shadow)","Dwebble","TRUE",,"226",,,,"0/13/13",,,,"22.5",,,,"1499",,,,"Fury Cutter, X-Scissor, Rock Slide",,,"557;558","558"
"561","Sigilyph","Sigilyph","FALSE",,"737",,,,"1/15/14",,,,"22",,,,"1500",,,,"Air Slash, Ancient Power, Signal Beam",,,"561","561"
"563","Cofagrigus","Yamask","FALSE",,"58",,,,"0/11/14",,,,"25.5",,,,"1500",,,,"Shadow Claw, Shadow Ball, Dark Pulse",,,"562;563","563"
"564","Tirtouga","Tirtouga","FALSE",,"545",,,,"0/14/15",,,,"49.5",,,,"1494",,,,"Water Gun, Surf, Ancient Power",,,"564;565","564;565"
"564","Tirtouga (Shadow)","Tirtouga","TRUE",,"573",,,,"0/14/15",,,,"49.5",,,,"1494",,,,"Water Gun, Surf, Ancient Power",,,"564;565","564;565"
"565","Carracosta","Tirtouga","FALSE",,"498",,,,"1/14/15",,,,"21.5",,,,"1497",,,,"Rock Throw, Ancient Power, Liquidation",,,"564;565","565"
"565","Carracosta (Shadow)","Tirtouga","TRUE",,"392",,,,"1/14/15",,,,"21.5",,,,"1497",,,,"Rock Throw, Ancient Power, Liquidation",,,"564;565","565"
"566","Archen","Archen","FALSE",,"537",,,,"0/15/14",,,,"31",,,,"1497",,,,"Wing Attack, Dragon Claw, Ancient Power",,,"566;567","566;567"
"566","Archen (Shadow)","Archen","TRUE",,"478",,,,"0/15/14",,,,"31",,,,"1497",,,,"Quick Attack, Dragon Claw, Ancient Power",,,"566;567","566;567"
"567","Archeops","Archen","FALSE",,"548",,,,"1/15/15",,,,"16.5",,,,"1494",,,,"Wing Attack, Dragon Claw, Ancient Power",,,"566;567","567"
"567","Archeops (Shadow)","Archen","TRUE",,"443",,,,"1/15/15",,,,"16.5",,,,"1494",,,,"Wing Attack, Dragon Claw, Ancient Power",,,"566;567","567"
"569","Garbodor","Trubbish","FALSE",,"746",,,,"0/13/13",,,,"24.5",,,,"1498",,,,"Infestation, Body Slam, Seed Bomb",,,"568;569","569"
"573","Cinccino","Minccino","FALSE",,"639",,,,"2/15/14",,,,"25",,,,"1499",,,,"Charm, Aqua Tail, Thunderbolt",,,"572;573","573"
"575","Gothorita","Gothita","FALSE",,"456",,,,"0/15/14",,,,"43",,,,"1498",,,,"Confusion, Future Sight, Psychic",,,"574;575;576","575;576"
"575","Gothorita (Shadow)","Gothita","TRUE",,"461",,,,"0/15/14",,,,"43",,,,"1498",,,,"Confusion, Future Sight, Psychic",,,"574;575;576","575;576"
"576","Gothitelle","Gothita","FALSE",,"422",,,,"0/15/15",,,,"23.5",,,,"1498",,,,"Confusion, Rock Slide, Future Sight",,,"574;575;576","576"
"576","Gothitelle (Shadow)","Gothita","TRUE",,"455",,,,"0/15/15",,,,"23.5",,,,"1498",,,,"Confusion, Rock Slide, Future Sight",,,"574;575;576","576"
"577","Solosis","Solosis","FALSE",,"806",,,,"9/15/15",,,,"50",,,,"1497",,,,"Hidden Power (Psychic), Psyshock, Night Shade",,,"577;578;579","577;578;579"
"577","Solosis (Shadow)","Solosis","TRUE",,"798",,,,"9/15/15",,,,"50",,,,"1497",,,,"Hidden Power (Psychic), Psyshock, Night Shade",,,"577;578;579","577;578;579"
"578","Duosion","Solosis","FALSE",,"804",,,,"0/15/13",,,,"28",,,,"1493",,,,"Hidden Power (Psychic), Psyshock, Night Shade",,,"577;578;579","578;579"
"578","Duosion (Shadow)","Solosis","TRUE",,"797",,,,"0/15/13",,,,"28",,,,"1493",,,,"Hidden Power (Psychic), Psyshock, Night Shade",,,"577;578;579","578;579"
"579","Reuniclus","Solosis","FALSE",,"817",,,,"2/15/14",,,,"19",,,,"1500",,,,"Hidden Power (Fighting), Shadow Ball, Future Sight",,,"577;578;579","579"
"579","Reuniclus (Shadow)","Solosis","TRUE",,"793",,,,"2/15/14",,,,"19",,,,"1500",,,,"Hidden Power (Psychic), Shadow Ball, Future Sight",,,"577;578;579","579"
"581","Swanna","Ducklett","FALSE",,"457",,,,"1/15/15",,,,"27",,,,"1498",,,,"Air Slash, Fly, Ice Beam",,,"580;581","581"
"581","Swanna (Shadow)","Ducklett","TRUE",,"522",,,,"1/15/15",,,,"27",,,,"1498",,,,"Air Slash, Fly, Ice Beam",,,"580;581","581"
"583","Vanillish","Vanillite","FALSE",,"333",,,,"0/14/15",,,,"43",,,,"1499",,,,"Astonish, Icy Wind, Signal Beam",,,"582;583;584","583;584"
"584","Vanilluxe","Vanillite","FALSE",,"800",,,,"0/15/12",,,,"20",,,,"1497",,,,"Astonish, Blizzard, Signal Beam",,,"582;583;584","584"
"585","Deerling","Deerling","FALSE",,"740",,,,"15/15/14",,,,"50",,,,"1283",,,,"Tackle, Wild Charge, Trailblaze",,,"585;586","585;586"
"586","Sawsbuck","Deerling","FALSE",,"709",,,,"0/14/14",,,,"23.5",,,,"1495",,,,"Feint Attack, Wild Charge, Trailblaze",,,"585;586","586"
"587","Emolga","Emolga","FALSE",,"127",,,,"0/13/15",,,,"41",,,,"1498",,,,"Thunder Shock, Acrobatics, Discharge",,,"587","587"
"588","Karrablast","Karrablast","FALSE",,"622",,,,"15/15/15",,,,"50",,,,"1336",,,,"Fury Cutter, X-Scissor, Drill Run",,,"588;589","588;589"
"588","Karrablast (Shadow)","Karrablast","TRUE",,"610",,,,"15/15/15",,,,"50",,,,"1336",,,,"Fury Cutter, X-Scissor, Drill Run",,,"588;589","588;589"
"591","Amoonguss","Foongus","FALSE",,"147",,,,"0/14/15",,,,"27",,,,"1500",,,,"Astonish, Grass Knot, Foul Play",,,"590;591","591"
"591","Amoonguss (Shadow)","Foongus","TRUE",,"240",,,,"0/14/15",,,,"27",,,,"1500",,,,"Astonish, Grass Knot, Foul Play",,,"590;591","591"
"592","Frillish","Frillish","FALSE",,"352",,,,"15/15/15",,,,"50",,,,"1421",,,,"Bubble, Night Shade, Ice Beam",,,"592;593","592;593"
"593","Jellicent","Frillish","FALSE",,"82",,,,"1/14/14",,,,"24.5",,,,"1490",,,,"Hex, Surf, Shadow Ball",,,"592;593","593"
"594","Alomomola","Alomomola","FALSE",,"301",,,,"0/15/11",,,,"27",,,,"1490",,,,"Waterfall, Hydro Pump, Blizzard",,,"594","594"
"596","Galvantula","Joltik","FALSE",,"334",,,,"0/15/15",,,,"25.5",,,,"1499",,,,"Volt Switch, Discharge, Lunge",,,"595;596","596"
"596","Galvantula (Shadow)","Joltik","TRUE",,"327",,,,"0/15/15",,,,"25.5",,,,"1499",,,,"Volt Switch, Discharge, Lunge",,,"595;596","596"
"603","Eelektrik","Tynamo","FALSE",,"621",,,,"0/13/15",,,,"37.5",,,,"1498",,,,"Spark, Crunch, Discharge",,,"602;603;604","603;604"
"604","Eelektross","Tynamo","FALSE",,"452",,,,"1/15/14",,,,"20.5",,,,"1500",,,,"Volt Switch, Dragon Claw, Thunderbolt",,,"602;603;604","604"
"605","Elgyem","Elgyem","FALSE",,"666",,,,"8/15/15",,,,"50",,,,"1500",,,,"Confusion, Dark Pulse, Psychic",,,"605;606","605;606"
"606","Beheeyem","Elgyem","FALSE",,"651",,,,"0/14/13",,,,"20.5",,,,"1491",,,,"Confusion, Rock Slide, Dark Pulse",,,"605;606","606"
"608","Lampent","Litwick","FALSE",,"606",,,,"0/15/14",,,,"37",,,,"1497",,,,"Astonish, Energy Ball, Flame Burst",,,"607;608;609","608;609"
"608","Lampent (Shadow)","Litwick","TRUE",,"538",,,,"0/15/14",,,,"37",,,,"1497",,,,"Astonish, Energy Ball, Flame Burst",,,"607;608;609","608;609"
"609","Chandelure","Litwick","FALSE",,"551",,,,"0/15/14",,,,"17",,,,"1498",,,,"Incinerate, Shadow Ball, Flame Charge",,,"607;608;609","609"
"609","Chandelure (Shadow)","Litwick","TRUE",,"479",,,,"0/15/14",,,,"17",,,,"1498",,,,"Incinerate, Shadow Ball, Flame Charge",,,"607;608;609","609"
"610","Axew","Axew","FALSE",,"785",,,,"10/15/14",,,,"50",,,,"1498",,,,"Scratch, Dragon Claw, Aqua Tail",,,"610;611;612","610;611;612"
"611","Fraxure","Axew","FALSE",,"132",,,,"1/15/15",,,,"25",,,,"1499",,,,"Dragon Tail, Dragon Claw, Aqua Tail",,,"610;611;612","611;612"
"612","Haxorus","Axew","FALSE",,"169",,,,"0/14/13",,,,"15.5",,,,"1496",,,,"Dragon Tail, Breaking Swipe, Surf",,,"610;611;612","612"
"614","Beartic","Cubchoo","FALSE",,"401",,,,"0/15/12",,,,"18.5",,,,"1491",,,,"Powder Snow, Ice Punch, Liquidation",,,"613;614","614"
"615","Cryogonal","Cryogonal","FALSE",,"255",,,,"0/14/11",,,,"20.5",,,,"1497",,,,"Ice Shard, Triple Axel, Night Slash",,,"615","615"
"617","Accelgor","Shelmet","FALSE",,"764",,,,"0/14/15",,,,"23",,,,"1498",,,,"Water Shuriken, Bug Buzz, Acid Spray",,,"616;617","617"
"617","Accelgor (Shadow)","Shelmet","TRUE",,"748",,,,"0/14/15",,,,"23",,,,"1498",,,,"Water Shuriken, Bug Buzz, Signal Beam",,,"616;617","617"
"618","Stunfisk","Stunfisk","FALSE",,"146",,,,"0/12/15",,,,"27",,,,"1497",,,,"Thunder Shock, Mud Bomb, Discharge",,,"618","618"
"619","Mienfoo","Mienfoo","FALSE",,"818",,,,"7/15/15",,,,"50",,,,"1500",,,,"Low Kick, High Jump Kick, Brick Break",,,"619;620","619;620"
"620","Mienshao","Mienfoo","FALSE",,"300",,,,"0/15/14",,,,"20.5",,,,"1486",,,,"Force Palm, Brick Break, Brutal Swing",,,"619;620","620"
"621","Druddigon","Druddigon","FALSE",,"81",,,,"0/15/15",,,,"20.5",,,,"1498",,,,"Dragon Tail, Dragon Claw, Night Slash",,,"621","621"
"622","Golett","Golett","FALSE",,"204",,,,"15/15/15",,,,"50",,,,"1344",,,,"Mud Slap, Shadow Punch, Brick Break",,,"622;623","622;623"
"622","Golett (Shadow)","Golett","TRUE",,"148",,,,"15/15/15",,,,"50",,,,"1344",,,,"Astonish, Shadow Punch, Brick Break",,,"622;623","622;623"
"623","Golurk","Golett","FALSE",,"48",,,,"2/15/14",,,,"19.5",,,,"1500",,,,"Mud Slap, Shadow Punch, Dynamic Punch",,,"622;623","623"
"623","Golurk (Shadow)","Golett","TRUE",,"29",,,,"2/15/14",,,,"19.5",,,,"1500",,,,"Mud Slap, Shadow Punch, Dynamic Punch",,,"622;623","623"
"626","Bouffalant","Bouffalant","FALSE",,"405",,,,"0/13/11",,,,"20.5",,,,"1496",,,,"Mud Shot, Stomp, Megahorn",,,"626","626"
"627","Rufflet","Rufflet","FALSE",,"262",,,,"0/15/15",,,,"48",,,,"1492",,,,"Wing Attack, Brave Bird, Fly",,,"627;628","627;628"
"628","Braviary","Rufflet","FALSE",,"517",,,,"1/15/15",,,,"18",,,,"1497",,,,"Air Slash, Fly, Close Combat",,,"627;628","628"
"628","Braviary (Hisuian)","Rufflet","FALSE",,"593",,,,"0/15/13",,,,"20",,,,"1491",,,,"Air Slash, Brave Bird, Fly",,,"627;628","628"
"631","Heatmor","Heatmor","FALSE",,"550",,,,"0/15/14",,,,"23.5",,,,"1489",,,,"Fire Spin, Flamethrower, Thunder Punch",,,"631","631"
"636","Larvesta","Larvesta","FALSE",,"726",,,,"0/15/15",,,,"47.5",,,,"1499",,,,"Ember, Flame Charge, Bug Buzz",,,"636;637","636;637"
"650","Chespin","Chespin","FALSE",,"661",,,,"15/15/14",,,,"50",,,,"1239",,,,"Vine Whip, Body Slam, Seed Bomb",,,"650;651;652","650;651;652"
"651","Quilladin","Chespin","FALSE",,"252",,,,"0/14/15",,,,"37.5",,,,"1495",,,,"Vine Whip, Body Slam, Energy Ball",,,"650;651;652","651;652"
"652","Chesnaught","Chespin","FALSE",,"80",,,,"1/15/15",,,,"19",,,,"1498",,,,"Vine Whip, Frenzy Plant, Superpower",,,"650;651;652","652"
"654","Braixen","Fennekin","FALSE",,"722",,,,"0/15/14",,,,"33",,,,"1497",,,,"Ember, Psyshock, Flame Charge",,,"653;654;655","654;655"
"655","Delphox","Fennekin","FALSE",,"510",,,,"0/11/14",,,,"18.5",,,,"1491",,,,"Fire Spin, Blast Burn, Mystical Fire",,,"653;654;655","655"
"657","Frogadier","Froakie","FALSE",,"506",,,,"1/15/15",,,,"39.5",,,,"1500",,,,"Bubble, Surf, Aerial Ace",,,"656;657;658","657;658"
"660","Diggersby","Bunnelby","FALSE",,"16",,,,"0/15/13",,,,"50",,,,"1496",,,,"Quick Attack, Fire Punch, Scorching Sands",,,"659;660","660"
"662","Fletchinder","Fletchling","FALSE",,"495",,,,"0/14/15",,,,"50",,,,"1492",,,,"Ember, Fly, Aerial Ace",,,"661;662;663","662;663"
"663","Talonflame","Fletchling","FALSE",,"116",,,,"0/13/14",,,,"26",,,,"1499",,,,"Incinerate, Fly, Brave Bird",,,"661;662;663","663"
"666","Vivillon","Scatterbug","FALSE",,"546",,,,"0/15/14",,,,"31.5",,,,"1500",,,,"Gust, Aerial Ace, Bug Buzz",,,"664;665;666","666"
"667","Litleo","Litleo","FALSE",,"245",,,,"4/15/15",,,,"50",,,,"1495",,,,"Incinerate, Flame Charge, Crunch",,,"667;668","667;668"
"668","Pyroar","Litleo","FALSE",,"354",,,,"0/15/10",,,,"20.5",,,,"1496",,,,"Incinerate, Flame Charge, Dark Pulse",,,"667;668","668"
"672","Skiddo","Skiddo","FALSE",,"815",,,,"15/15/15",,,,"50",,,,"1414",,,,"Rock Smash, Rock Slide, Seed Bomb",,,"672;673","672;673"
"673","Gogoat","Skiddo","FALSE",,"94",,,,"2/15/15",,,,"20",,,,"1492",,,,"Vine Whip, Leaf Blade, Brick Break",,,"672;673","673"
"674","Pancham","Pancham","FALSE",,"702",,,,"1/15/15",,,,"48",,,,"1498",,,,"Tackle, Crunch, Body Slam",,,"674;675","674;675"
"676","Furfrou","Furfrou","FALSE",,"151",,,,"1/14/15",,,,"27",,,,"1500",,,,"Sucker Punch, Surf, Dark Pulse",,,"676","676"
"677","Espurr","Espurr","FALSE",,"519",,,,"15/15/15",,,,"50",,,,"1424",,,,"Confusion, Psyshock, Energy Ball",,,"677;678","677;678"
"678","Meowstic (Female)","Espurr","FALSE",,"560",,,,"0/14/15",,,,"27",,,,"1499",,,,"Confusion, Shadow Ball, Psychic",,,"677;678","678"
"678","Meowstic (Male)","Espurr","FALSE",,"454",,,,"0/14/15",,,,"27",,,,"1499",,,,"Sucker Punch, Psychic, Energy Ball",,,"677;678","678"
"689","Barbaracle","Binacle","FALSE",,"247",,,,"0/10/13",,,,"21.5",,,,"1492",,,,"Mud Slap, Stone Edge, Cross Chop",,,"688;689","689"
"690","Skrelp","Skrelp","FALSE",,"643",,,,"15/15/15",,,,"50",,,,"1202",,,,"Water Gun, Aqua Tail, Sludge Bomb",,,"690;691","690;691"
"691","Dragalge","Skrelp","FALSE",,"69",,,,"0/15/13",,,,"24",,,,"1496",,,,"Dragon Tail, Aqua Tail, Outrage",,,"690;691","691"
"692","Clauncher","Clauncher","FALSE",,"780",,,,"15/15/15",,,,"50",,,,"1230",,,,"Water Gun, Crabhammer, Aqua Jet",,,"692;693","692;693"
"693","Clawitzer","Clauncher","FALSE",,"765",,,,"0/13/13",,,,"20.5",,,,"1493",,,,"Water Gun, Crabhammer, Ice Beam",,,"692;693","693"
"695","Heliolisk","Helioptile","FALSE",,"529",,,,"0/15/15",,,,"21.5",,,,"1493",,,,"Volt Switch, Breaking Swipe, Parabolic Charge",,,"694;695","695"
"696","Tyrunt","Tyrunt","FALSE",,"135",,,,"0/15/15",,,,"40",,,,"1499",,,,"Dragon Tail, Dragon Claw, Ancient Power",,,"696;697","696;697"
"697","Tyrantrum","Tyrunt","FALSE",,"449",,,,"0/15/12",,,,"18",,,,"1495",,,,"Dragon Tail, Meteor Beam, Crunch",,,"696;697","697"
"698","Amaura","Amaura","FALSE",,"89",,,,"11/15/15",,,,"50",,,,"1497",,,,"Powder Snow, Weather Ball (Ice), Thunderbolt",,,"698;699","698;699"
"699","Aurorus","Amaura","FALSE",,"13",,,,"0/12/13",,,,"20.5",,,,"1498",,,,"Powder Snow, Weather Ball (Ice), Meteor Beam",,,"698;699","699"
"701","Hawlucha","Hawlucha","FALSE",,"138",,,,"0/14/15",,,,"23.5",,,,"1498",,,,"Poison Jab, Flying Press, Aerial Ace",,,"701","701"
"705","Sliggoo","Goomy","FALSE",,"575",,,,"1/15/15",,,,"28",,,,"1499",,,,"Water Gun, Dragon Pulse, Muddy Water",,,"704;705;706","705;706"
"706","Goodra","Goomy","FALSE",,"17",,,,"1/14/14",,,,"16",,,,"1497",,,,"Dragon Breath, Aqua Tail, Thunder Punch",,,"704;705;706","706"
"709","Trevenant","Phantump","FALSE",,"53",,,,"0/15/15",,,,"22",,,,"1499",,,,"Shadow Claw, Seed Bomb, Shadow Ball",,,"708;709","709"
"710","Pumpkaboo (Average)","Pumpkaboo","FALSE",,"337",,,,"15/15/15",,,,"50",,,,"1381",,,,"Astonish, Grass Knot, Foul Play",,,"710;711","710;711"
"710","Pumpkaboo (Large)","Pumpkaboo","FALSE",,"289",,,,"15/15/15",,,,"50",,,,"1406",,,,"Astonish, Grass Knot, Foul Play",,,"710;711","710;711"
"710","Pumpkaboo (Small)","Pumpkaboo","FALSE",,"388",,,,"15/15/15",,,,"50",,,,"1359",,,,"Astonish, Grass Knot, Foul Play",,,"710;711","710;711"
"710","Pumpkaboo (Super)","Pumpkaboo","FALSE",,"239",,,,"15/15/15",,,,"50",,,,"1414",,,,"Astonish, Grass Knot, Foul Play",,,"710;711","710;711"
"711","Gourgeist (Average)","Pumpkaboo","FALSE",,"328",,,,"1/15/14",,,,"21.5",,,,"1500",,,,"Hex, Shadow Ball, Seed Bomb",,,"710;711","711"
"711","Gourgeist (Large)","Pumpkaboo","FALSE",,"293",,,,"1/15/14",,,,"21.5",,,,"1500",,,,"Hex, Shadow Ball, Seed Bomb",,,"710;711","711"
"711","Gourgeist (Small)","Pumpkaboo","FALSE",,"332",,,,"1/15/14",,,,"21.5",,,,"1495",,,,"Hex, Shadow Ball, Seed Bomb",,,"710;711","711"
"711","Gourgeist (Super)","Pumpkaboo","FALSE",,"285",,,,"1/15/14",,,,"21.5",,,,"1499",,,,"Hex, Shadow Ball, Seed Bomb",,,"710;711","711"
"712","Bergmite","Bergmite","FALSE",,"710",,,,"15/15/15",,,,"50",,,,"1374",,,,"Tackle, Icy Wind, Crunch",,,"712;713","712;713"
"713","Avalugg","Bergmite","FALSE",,"280",,,,"2/15/15",,,,"17.5",,,,"1500",,,,"Ice Fang, Avalanche, Crunch",,,"712;713","713"
"713","Avalugg (Hisuian)","Bergmite","FALSE",,"154",,,,"0/14/9",,,,"16.5",,,,"1498",,,,"Powder Snow, Rock Slide, Icy Wind",,,"712;713","713"
"715","Noivern","Noibat","FALSE",,"770",,,,"0/15/12",,,,"20.5",,,,"1498",,,,"Air Slash, Hurricane, Draco Meteor",,,"714;715","715"
"718","Zygarde (10% Forme)","Zygarde","FALSE",,"428",,,,"0/14/12",,,,"24",,,,"1494",,,,"Dragon Tail, Crunch, Earthquake",,,"718;718&0-4attack;718&1-4attack","718;718&0-4attack;718&1-4attack"
"718","Zygarde (50% Forme)","Zygarde","FALSE",,"160",,,,"1/14/14",,,,"16.5",,,,"1494",,,,"Dragon Tail, Crunch, Earthquake",,,"718;718&0-4attack;718&1-4attack","718;718&0-4attack;718&1-4attack"
"720","Hoopa","Hoopa","FALSE",,"708",,,,"0/15/15",,,,"16.5",,,,"1488",,,,"Astonish, Shadow Ball, Psychic",,,"720","720"
"722","Rowlet","Rowlet","FALSE",,"778",,,,"15/15/15",,,,"50",,,,"1196",,,,"Leafage, Seed Bomb, Energy Ball",,,"722;723;724","722;723;724"
"723","Dartrix","Rowlet","FALSE",,"203",,,,"0/15/14",,,,"37.5",,,,"1498",,,,"Leafage, Brave Bird, Seed Bomb",,,"722;723;724","723;724"
"724","Decidueye","Rowlet","FALSE",,"79",,,,"0/14/11",,,,"20.5",,,,"1492",,,,"Astonish, Frenzy Plant, Spirit Shackle",,,"722;723;724","724"
"724","Decidueye (Hisuian)","Rowlet","FALSE",,"481",,,,"0/15/13",,,,"19.5",,,,"1494",,,,"Magical Leaf, Aerial Ace, Aura Sphere",,,"722;723;724","724"
"726","Torracat","Litten","FALSE",,"733",,,,"0/15/13",,,,"37",,,,"1497",,,,"Ember, Crunch, Flame Charge",,,"725;726;727","726;727"
"728","Popplio","Popplio","FALSE",,"658",,,,"15/15/15",,,,"50",,,,"1276",,,,"Water Gun, Aqua Tail, Water Pulse",,,"728;729;730","728;729;730"
"729","Brionne","Popplio","FALSE",,"655",,,,"1/15/14",,,,"30.5",,,,"1488",,,,"Charm, Disarming Voice, Water Pulse",,,"728;729;730","729;730"
"732","Trumbeak","Pikipek","FALSE",,"751",,,,"0/15/15",,,,"48.5",,,,"1500",,,,"Peck, Drill Peck, Rock Blast",,,"731;732;733","732;733"
"733","Toucannon","Pikipek","FALSE",,"617",,,,"0/14/13",,,,"21",,,,"1492",,,,"Bullet Seed, Drill Peck, Rock Blast",,,"731;732;733","733"
"735","Gumshoos","Yungoos","FALSE",,"715",,,,"0/15/12",,,,"26",,,,"1500",,,,"Bite, Crunch, Hyper Fang",,,"734;735","735"
"737","Charjabug","Grubbin","FALSE",,"126",,,,"0/13/15",,,,"38.5",,,,"1500",,,,"Volt Switch, X-Scissor, Discharge",,,"736;737;738","737;738"
"738","Vikavolt","Grubbin","FALSE",,"340",,,,"0/14/12",,,,"18",,,,"1500",,,,"Volt Switch, X-Scissor, Fly",,,"736;737;738","738"
"739","Crabrawler","Crabrawler","FALSE",,"734",,,,"11/15/15",,,,"49.5",,,,"1495",,,,"Bubble, Crabhammer, Power-Up Punch",,,"739;740","739;740"
"740","Crabominable","Crabrawler","FALSE",,"773",,,,"0/11/15",,,,"19.5",,,,"1494",,,,"Bubble, Ice Punch, Crabhammer",,,"739;740","740"
"741","Oricorio (Baile)","Oricorio","FALSE",,"657",,,,"0/13/13",,,,"24.5",,,,"1492",,,,"Air Slash, Aerial Ace, Hurricane",,,"741","741"
"741","Oricorio (Pa'u)","Oricorio","FALSE",,"671",,,,"0/13/13",,,,"24.5",,,,"1492",,,,"Air Slash, Aerial Ace, Hurricane",,,"741","741"
"741","Oricorio (Pom-Pom)","Oricorio","FALSE",,"608",,,,"0/13/13",,,,"24.5",,,,"1492",,,,"Air Slash, Aerial Ace, Hurricane",,,"741","741"
"741","Oricorio (Sensu)","Oricorio","FALSE",,"577",,,,"0/13/13",,,,"24.5",,,,"1492",,,,"Air Slash, Aerial Ace, Hurricane",,,"741","741"
"745","Lycanroc (Dusk)","Rockruff","FALSE",,"589",,,,"2/15/15",,,,"20.5",,,,"1500",,,,"Sucker Punch, Stone Edge, Trailblaze",,,"744;745","745"
"745","Lycanroc (Midday)","Rockruff","FALSE",,"586",,,,"0/14/14",,,,"21",,,,"1500",,,,"Sucker Punch, Stone Edge, Drill Run",,,"744;745","745"
"745","Lycanroc (Midnight)","Rockruff","FALSE",,"487",,,,"0/15/14",,,,"20.5",,,,"1498",,,,"Rock Throw, Stone Edge, Psychic Fangs",,,"744;745","745"
"748","Toxapex","Mareanie","FALSE",,"20",,,,"0/15/15",,,,"40.5",,,,"1493",,,,"Poison Jab, Brine, Sludge Wave",,,"747;748","748"
"752","Araquanid","Dewpider","FALSE",,"91",,,,"0/10/15",,,,"35",,,,"1499",,,,"Bug Bite, Bug Buzz, Bubble Beam",,,"751;752","752"
"754","Lurantis","Fomantis","FALSE",,"156",,,,"0/15/15",,,,"23.5",,,,"1495",,,,"Fury Cutter, Leaf Blade, Superpower",,,"753;754","754"
"758","Salazzle","Salandit","FALSE",,"193",,,,"2/15/13",,,,"22.5",,,,"1492",,,,"Incinerate, Poison Fang, Dragon Pulse",,,"757;758","758"
