"ID","Pokemon","Family","Shadow","Little_Rank","Great_Rank","Ultra_Rank","Master_Rank","Little_IVs","Great_IVs","Ultra_IVs","Master_IVs","Little_Level","Great_Level","Ultra_Level","Master_Level","Little_CP","Great_CP","Ultra_CP","Master_CP","Little_MoveSet","Great_MoveSet","Ultra_MoveSet","Master_MoveSet","Evo_Fam","Evo_Next"
"587","Emolga","Emolga","FALSE",,"48",,,,"0/13/15",,,,"41",,,,"1498",,,,"Thunder Shock, Acrobatics, Discharge",,,"587","587"
"588","Karrablast","Karrablast","FALSE",,"767",,,,"15/15/15",,,,"50",,,,"1336",,,,"Fury Cutter, X-Scissor, Drill Run",,,"588;589","588;589"
"588","Karrablast (Shadow)","Karrablast","TRUE",,"697",,,,"15/15/15",,,,"50",,,,"1336",,,,"Fury Cutter, X-Scissor, Drill Run",,,"588;589","588;589"
"589","Escavalier","Karrablast","FALSE",,"653",,,,"0/15/13",,,,"19.5",,,,"1499",,,,"Counter, Drill Run, Megahorn",,,"588;589","589"
"589","Escavalier (Shadow)","Karrablast","TRUE",,"746",,,,"0/15/13",,,,"19.5",,,,"1499",,,,"Counter, Drill Run, Megahorn",,,"588;589","589"
"591","Amoonguss","Foongus","FALSE",,"41",,,,"0/14/15",,,,"27",,,,"1500",,,,"Astonish, Grass Knot, Foul Play",,,"590;591","591"
"591","Amoonguss (Shadow)","Foongus","TRUE",,"61",,,,"0/14/15",,,,"27",,,,"1500",,,,"Astonish, Grass Knot, Foul Play",,,"590;591","591"
"592","Frillish","Frillish","FALSE",,"278",,,,"15/15/15",,,,"50",,,,"1421",,,,"Hex, Night Shade, Ice Beam",,,"592;593","592;593"
"593","Jellicent","Frillish","FALSE",,"11",,,,"1/14/14",,,,"24.5",,,,"1490",,,,"Hex, Surf, Shadow Ball",,,"592;593","593"
"594","Alomomola","Alomomola","FALSE",,"404",,,,"0/15/11",,,,"27",,,,"1490",,,,"Waterfall, Hydro Pump, Blizzard",,,"594","594"
"596","Galvantula","Joltik","FALSE",,"471",,,,"0/15/15",,,,"25.5",,,,"1499",,,,"Volt Switch, Discharge, Lunge",,,"595;596","596"
"596","Galvantula (Shadow)","Joltik","TRUE",,"455",,,,"0/15/15",,,,"25.5",,,,"1499",,,,"Volt Switch, Discharge, Lunge",,,"595;596","596"
"597","Ferroseed","Ferroseed","FALSE",,"969",,,,"15/15/15",,,,"50",,,,"1064",,,,"Metal Claw, Iron Head, Return",,,"597;598","597;598"
"597","Ferroseed (Shadow)","Ferroseed","TRUE",,"976",,,,"15/15/15",,,,"50",,,,"1064",,,,"Metal Claw, Iron Head, Flash Cannon",,,"597;598","597;598"
"598","Ferrothorn","Ferroseed","FALSE",,"185",,,,"0/13/13",,,,"25",,,,"1498",,,,"Bullet Seed, Power Whip, Thunder",,,"597;598","598"
"598","Ferrothorn (Shadow)","Ferroseed","TRUE",,"227",,,,"0/13/13",,,,"25",,,,"1498",,,,"Bullet Seed, Power Whip, Thunder",,,"597;598","598"
"600","Klang","Klink","FALSE",,"625",,,,"0/15/14",,,,"32.5",,,,"1494",,,,"Thunder Shock, Thunderbolt, Vise Grip",,,"599;600;601","600;601"
"601","Klinklang","Klink","FALSE",,"646",,,,"0/13/15",,,,"21.5",,,,"1494",,,,"Thunder Shock, Mirror Shot, Zap Cannon",,,"599;600;601","601"
"603","Eelektrik","Tynamo","FALSE",,"745",,,,"0/13/15",,,,"37.5",,,,"1498",,,,"Spark, Discharge, Crunch",,,"602;603;604","603;604"
"604","Eelektross","Tynamo","FALSE",,"662",,,,"1/15/14",,,,"20.5",,,,"1500",,,,"Volt Switch, Dragon Claw, Thunderbolt",,,"602;603;604","604"
"605","Elgyem","Elgyem","FALSE",,"946",,,,"8/15/15",,,,"50",,,,"1500",,,,"Confusion, Dark Pulse, Psychic",,,"605;606","605;606"
"606","Beheeyem","Elgyem","FALSE",,"940",,,,"0/14/13",,,,"20.5",,,,"1491",,,,"Confusion, Rock Slide, Dark Pulse",,,"605;606","606"
"608","Lampent","Litwick","FALSE",,"764",,,,"0/15/14",,,,"37",,,,"1497",,,,"Astonish, Energy Ball, Flame Burst",,,"607;608;609","608;609"
"608","Lampent (Shadow)","Litwick","TRUE",,"660",,,,"0/15/14",,,,"37",,,,"1497",,,,"Astonish, Energy Ball, Flame Burst",,,"607;608;609","608;609"
"609","Chandelure","Litwick","FALSE",,"670",,,,"0/15/14",,,,"17",,,,"1498",,,,"Incinerate, Flame Charge, Shadow Ball",,,"607;608;609","609"
"609","Chandelure (Shadow)","Litwick","TRUE",,"648",,,,"0/15/14",,,,"17",,,,"1498",,,,"Incinerate, Flame Charge, Shadow Ball",,,"607;608;609","609"
"610","Axew","Axew","FALSE",,"972",,,,"10/15/14",,,,"50",,,,"1498",,,,"Scratch, Dragon Claw, Aqua Tail",,,"610;611;612","610;611;612"
"611","Fraxure","Axew","FALSE",,"346",,,,"1/15/15",,,,"25",,,,"1499",,,,"Dragon Tail, Dragon Claw, Aqua Tail",,,"610;611;612","611;612"
"612","Haxorus","Axew","FALSE",,"396",,,,"0/14/13",,,,"15.5",,,,"1496",,,,"Dragon Tail, Breaking Swipe, Surf",,,"610;611;612","612"
"614","Beartic","Cubchoo","FALSE",,"542",,,,"0/15/12",,,,"18.5",,,,"1491",,,,"Powder Snow, Ice Punch, Liquidation",,,"613;614","614"
"615","Cryogonal","Cryogonal","FALSE",,"426",,,,"0/14/11",,,,"20.5",,,,"1497",,,,"Ice Shard, Triple Axel, Night Slash",,,"615","615"
"617","Accelgor","Shelmet","FALSE",,"942",,,,"0/14/15",,,,"23",,,,"1498",,,,"Water Shuriken, Bug Buzz, Acid Spray",,,"616;617","617"
"617","Accelgor (Shadow)","Shelmet","TRUE",,"860",,,,"0/14/15",,,,"23",,,,"1498",,,,"Water Shuriken, Bug Buzz, Energy Ball",,,"616;617","617"
"618","Stunfisk","Stunfisk","FALSE",,"21",,,,"0/12/15",,,,"27",,,,"1497",,,,"Thunder Shock, Mud Bomb, Discharge",,,"618","618"
"618","Stunfisk (Galarian)","Stunfisk","FALSE",,"82",,,,"0/12/15",,,,"27",,,,"1497",,,,"Mud Shot, Rock Slide, Earthquake",,,"618","618"
"619","Mienfoo","Mienfoo","FALSE",,"998",,,,"7/15/15",,,,"50",,,,"1500",,,,"Low Kick, High Jump Kick, Brick Break",,,"619;620","619;620"
"620","Mienshao","Mienfoo","FALSE",,"334",,,,"0/15/14",,,,"20.5",,,,"1486",,,,"Force Palm, Brick Break, Brutal Swing",,,"619;620","620"
"621","Druddigon","Druddigon","FALSE",,"309",,,,"0/15/15",,,,"20.5",,,,"1498",,,,"Dragon Tail, Dragon Claw, Night Slash",,,"621","621"
"622","Golett","Golett","FALSE",,"222",,,,"15/15/15",,,,"50",,,,"1344",,,,"Mud Slap, Shadow Punch, Brick Break",,,"622;623","622;623"
"622","Golett (Shadow)","Golett","TRUE",,"139",,,,"15/15/15",,,,"50",,,,"1344",,,,"Mud Slap, Shadow Punch, Brick Break",,,"622;623","622;623"
"623","Golurk","Golett","FALSE",,"40",,,,"2/15/14",,,,"19.5",,,,"1500",,,,"Mud Slap, Shadow Punch, Dynamic Punch",,,"622;623","623"
"623","Golurk (Shadow)","Golett","TRUE",,"23",,,,"2/15/14",,,,"19.5",,,,"1500",,,,"Mud Slap, Shadow Punch, Dynamic Punch",,,"622;623","623"
"624","Pawniard","Pawniard","FALSE",,"436",,,,"2/15/15",,,,"50",,,,"1492",,,,"Fury Cutter, Night Slash, X-Scissor",,,"624;625;983","624;625;983"
"625","Bisharp","Pawniard","FALSE",,"466",,,,"1/15/15",,,,"19.5",,,,"1497",,,,"Snarl, Dark Pulse, X-Scissor",,,"624;625;983","625;983"
"626","Bouffalant","Bouffalant","FALSE",,"566",,,,"0/13/11",,,,"20.5",,,,"1496",,,,"Mud Shot, Stomp, Megahorn",,,"626","626"
"627","Rufflet","Rufflet","FALSE",,"449",,,,"0/15/15",,,,"48",,,,"1492",,,,"Wing Attack, Brave Bird, Fly",,,"627;628","627;628"
"628","Braviary","Rufflet","FALSE",,"696",,,,"1/15/15",,,,"18",,,,"1497",,,,"Air Slash, Fly, Close Combat",,,"627;628","628"
"628","Braviary (Hisuian)","Rufflet","FALSE",,"863",,,,"0/15/13",,,,"20",,,,"1491",,,,"Air Slash, Brave Bird, Fly",,,"627;628","628"
"629","Vullaby","Vullaby","FALSE",,"291",,,,"15/15/15",,,,"50",,,,"1437",,,,"Air Slash, Brave Bird, Foul Play",,,"629;630","629;630"
"631","Heatmor","Heatmor","FALSE",,"543",,,,"0/15/14",,,,"23.5",,,,"1489",,,,"Fire Spin, Thunder Punch, Flamethrower",,,"631","631"
"632","Durant","Durant","FALSE",,"585",,,,"1/15/14",,,,"21",,,,"1499",,,,"Metal Claw, X-Scissor, Stone Edge",,,"632","632"
"634","Zweilous","Deino","FALSE",,"62",,,,"0/15/15",,,,"32.5",,,,"1496",,,,"Dragon Breath, Dark Pulse, Body Slam",,,"633;634;635","634;635"
"635","Hydreigon","Deino","FALSE",,"110",,,,"0/15/10",,,,"15.5",,,,"1499",,,,"Dragon Breath, Brutal Swing, Flash Cannon",,,"633;634;635","635"
"636","Larvesta","Larvesta","FALSE",,"799",,,,"0/15/15",,,,"47.5",,,,"1499",,,,"Ember, Flame Charge, Bug Buzz",,,"636;637","636;637"
"641","Tornadus (Incarnate)","Tornadus","FALSE",,"979",,,,"1/15/15",,,,"16.5",,,,"1500",,,,"Air Slash, Grass Knot, Hurricane",,,"641","641"
"642","Thundurus (Incarnate)","Thundurus","FALSE",,"441",,,,"1/15/15",,,,"16.5",,,,"1500",,,,"Thunder Shock, Thunder Punch, Crunch",,,"642","642"
"645","Landorus (Incarnate)","Landorus","FALSE",,"606",,,,"0/15/14",,,,"15.5",,,,"1497",,,,"Mud Shot, Earth Power, Rock Slide",,,"645","645"
"649","Genesect","Genesect","FALSE",,"399",,,,"2/15/14",,,,"16.5",,,,"1498",,,,"Fury Cutter, X-Scissor, Techno Blast (Normal)",,,"649","649"
"650","Chespin","Chespin","FALSE",,"907",,,,"15/15/14",,,,"50",,,,"1239",,,,"Vine Whip, Body Slam, Seed Bomb",,,"650;651;652","650;651;652"
"651","Quilladin","Chespin","FALSE",,"383",,,,"0/14/15",,,,"37.5",,,,"1495",,,,"Vine Whip, Body Slam, Energy Ball",,,"650;651;652","651;652"
"652","Chesnaught","Chespin","FALSE",,"99",,,,"1/15/15",,,,"19",,,,"1498",,,,"Vine Whip, Frenzy Plant, Superpower",,,"650;651;652","652"
"654","Braixen","Fennekin","FALSE",,"642",,,,"0/15/14",,,,"33",,,,"1497",,,,"Ember, Psyshock, Flame Charge",,,"653;654;655","654;655"
"655","Delphox","Fennekin","FALSE",,"549",,,,"0/11/14",,,,"18.5",,,,"1491",,,,"Fire Spin, Blast Burn, Mystical Fire",,,"653;654;655","655"
"657","Frogadier","Froakie","FALSE",,"665",,,,"1/15/15",,,,"39.5",,,,"1500",,,,"Bubble, Surf, Aerial Ace",,,"656;657;658","657;658"
"658","Greninja","Froakie","FALSE",,"42",,,,"3/15/12",,,,"21",,,,"1497",,,,"Water Shuriken, Hydro Cannon, Night Slash",,,"656;657;658","658"
"660","Diggersby","Bunnelby","FALSE",,"7",,,,"0/15/13",,,,"50",,,,"1496",,,,"Quick Attack, Fire Punch, Scorching Sands",,,"659;660","660"
"660","Diggersby (Shadow)","Bunnelby","TRUE",,"28",,,,"0/15/13",,,,"50",,,,"1496",,,,"Quick Attack, Scorching Sands, Fire Punch",,,"659;660","660"
"662","Fletchinder","Fletchling","FALSE",,"410",,,,"0/14/15",,,,"50",,,,"1492",,,,"Ember, Fly, Aerial Ace",,,"661;662;663","662;663"
"666","Vivillon","Scatterbug","FALSE",,"775",,,,"0/15/14",,,,"31.5",,,,"1500",,,,"Gust, Aerial Ace, Bug Buzz",,,"664;665;666","666"
"667","Litleo","Litleo","FALSE",,"163",,,,"4/15/15",,,,"50",,,,"1495",,,,"Incinerate, Flame Charge, Crunch",,,"667;668","667;668"
"668","Pyroar","Litleo","FALSE",,"370",,,,"0/15/10",,,,"20.5",,,,"1496",,,,"Incinerate, Flame Charge, Dark Pulse",,,"667;668","668"
"669","Flabebe","Flabebe","FALSE",,"952",,,,"15/15/15",,,,"50",,,,"1202",,,,"Vine Whip, Dazzling Gleam, Psychic",,,"669;670;671","669;670;671"
"670","Floette","Flabebe","FALSE",,"490",,,,"0/14/15",,,,"47",,,,"1499",,,,"Vine Whip, Dazzling Gleam, Psychic",,,"669;670;671","670;671"
"671","Florges","Flabebe","FALSE",,"85",,,,"0/14/13",,,,"17.5",,,,"1494",,,,"Fairy Wind, Moonblast, Trailblaze",,,"669;670;671","671"
"672","Skiddo","Skiddo","FALSE",,"992",,,,"15/15/15",,,,"50",,,,"1414",,,,"Rock Smash, Rock Slide, Seed Bomb",,,"672;673","672;673"
"673","Gogoat","Skiddo","FALSE",,"101",,,,"2/15/15",,,,"20",,,,"1492",,,,"Vine Whip, Leaf Blade, Brick Break",,,"672;673","673"
"674","Pancham","Pancham","FALSE",,"915",,,,"1/15/15",,,,"48",,,,"1498",,,,"Tackle, Crunch, Body Slam",,,"674;675","674;675"
"675","Pangoro","Pancham","FALSE",,"5",,,,"0/13/13",,,,"19.5",,,,"1496",,,,"Karate Chop, Close Combat, Night Slash",,,"674;675","675"
"676","Furfrou","Furfrou","FALSE",,"215",,,,"1/14/15",,,,"27",,,,"1500",,,,"Sucker Punch, Surf, Grass Knot",,,"676","676"
"677","Espurr","Espurr","FALSE",,"768",,,,"15/15/15",,,,"50",,,,"1424",,,,"Confusion, Psyshock, Energy Ball",,,"677;678","677;678"
"678","Meowstic (Female)","Espurr","FALSE",,"890",,,,"0/14/15",,,,"27",,,,"1499",,,,"Confusion, Shadow Ball, Psychic",,,"677;678","678"
"678","Meowstic (Male)","Espurr","FALSE",,"729",,,,"0/14/15",,,,"27",,,,"1499",,,,"Sucker Punch, Psychic, Thunderbolt",,,"677;678","678"
"682","Spritzee","Spritzee","FALSE",,"274",,,,"15/15/14",,,,"50",,,,"1415",,,,"Charm, Thunderbolt, Draining Kiss",,,"682;683","682;683"
"683","Aromatisse","Spritzee","FALSE",,"217",,,,"0/13/15",,,,"24.5",,,,"1497",,,,"Charm, Moonblast, Thunderbolt",,,"682;683","683"
"684","Swirlix","Swirlix","FALSE",,"974",,,,"15/15/15",,,,"50",,,,"1333",,,,"Tackle, Energy Ball, Draining Kiss",,,"684;685","684;685"
"685","Slurpuff","Swirlix","FALSE",,"394",,,,"1/14/14",,,,"26",,,,"1499",,,,"Fairy Wind, Play Rough, Energy Ball",,,"684;685","685"
"689","Barbaracle","Binacle","FALSE",,"258",,,,"0/10/13",,,,"21.5",,,,"1492",,,,"Mud Slap, Cross Chop, Stone Edge",,,"688;689","689"
"690","Skrelp","Skrelp","FALSE",,"773",,,,"15/15/15",,,,"50",,,,"1202",,,,"Water Gun, Aqua Tail, Sludge Bomb",,,"690;691","690;691"
"691","Dragalge","Skrelp","FALSE",,"105",,,,"0/15/13",,,,"24",,,,"1496",,,,"Dragon Tail, Aqua Tail, Sludge Bomb",,,"690;691","691"
"692","Clauncher","Clauncher","FALSE",,"861",,,,"15/15/15",,,,"50",,,,"1230",,,,"Water Gun, Aqua Jet, Crabhammer",,,"692;693","692;693"
"693","Clawitzer","Clauncher","FALSE",,"934",,,,"0/13/13",,,,"20.5",,,,"1493",,,,"Water Gun, Crabhammer, Ice Beam",,,"692;693","693"
"695","Heliolisk","Helioptile","FALSE",,"706",,,,"0/15/15",,,,"21.5",,,,"1493",,,,"Volt Switch, Breaking Swipe, Parabolic Charge",,,"694;695","695"
"696","Tyrunt","Tyrunt","FALSE",,"401",,,,"0/15/15",,,,"40",,,,"1499",,,,"Dragon Tail, Dragon Claw, Ancient Power",,,"696;697","696;697"
"697","Tyrantrum","Tyrunt","FALSE",,"717",,,,"0/15/12",,,,"18",,,,"1495",,,,"Dragon Tail, Meteor Beam, Crunch",,,"696;697","697"
"698","Amaura","Amaura","FALSE",,"301",,,,"11/15/15",,,,"50",,,,"1497",,,,"Powder Snow, Weather Ball (Ice), Thunderbolt",,,"698;699","698;699"
"699","Aurorus","Amaura","FALSE",,"64",,,,"0/12/13",,,,"20.5",,,,"1498",,,,"Powder Snow, Weather Ball (Ice), Meteor Beam",,,"698;699","699"
"700","Sylveon","Eevee","FALSE",,"231",,,,"0/15/12",,,,"18.5",,,,"1498",,,,"Charm, Psyshock, Moonblast",,,"133;700","700"
"701","Hawlucha","Hawlucha","FALSE",,"210",,,,"0/14/15",,,,"23.5",,,,"1498",,,,"Poison Jab, Flying Press, Aerial Ace",,,"701","701"
"702","Dedenne","Dedenne","FALSE",,"157",,,,"0/14/12",,,,"33",,,,"1497",,,,"Thunder Shock, Parabolic Charge, Play Rough",,,"702","702"
"703","Carbink","Carbink","FALSE",,"16",,,,"5/15/15",,,,"49.5",,,,"1500",,,,"Rock Throw, Power Gem, Moonblast",,,"703","703"
"705","Sliggoo","Goomy","FALSE",,"723",,,,"1/15/15",,,,"28",,,,"1499",,,,"Water Gun, Muddy Water, Dragon Pulse",,,"704;705;706","705;706"
"706","Goodra","Goomy","FALSE",,"59",,,,"1/14/14",,,,"16",,,,"1497",,,,"Dragon Breath, Aqua Tail, Thunder Punch",,,"704;705;706","706"
"707","Klefki","Klefki","FALSE",,"68",,,,"0/15/14",,,,"29.5",,,,"1499",,,,"Astonish, Foul Play, Play Rough",,,"707","707"
"709","Trevenant","Phantump","FALSE",,"114",,,,"0/15/15",,,,"22",,,,"1499",,,,"Shadow Claw, Seed Bomb, Shadow Ball",,,"708;709","709"
"710","Pumpkaboo (Average)","Pumpkaboo","FALSE",,"263",,,,"15/15/15",,,,"50",,,,"1381",,,,"Astonish, Grass Knot, Foul Play",,,"710;711","710;711"
"710","Pumpkaboo (Large)","Pumpkaboo","FALSE",,"175",,,,"15/15/15",,,,"50",,,,"1406",,,,"Astonish, Grass Knot, Foul Play",,,"710;711","710;711"
"710","Pumpkaboo (Small)","Pumpkaboo","FALSE",,"349",,,,"15/15/15",,,,"50",,,,"1359",,,,"Astonish, Grass Knot, Foul Play",,,"710;711","710;711"
"710","Pumpkaboo (Super)","Pumpkaboo","FALSE",,"124",,,,"15/15/15",,,,"50",,,,"1414",,,,"Astonish, Grass Knot, Foul Play",,,"710;711","710;711"
"711","Gourgeist (Average)","Pumpkaboo","FALSE",,"128",,,,"1/15/14",,,,"21.5",,,,"1500",,,,"Hex, Shadow Ball, Seed Bomb",,,"710;711","711"
"711","Gourgeist (Large)","Pumpkaboo","FALSE",,"104",,,,"1/15/14",,,,"21.5",,,,"1500",,,,"Hex, Shadow Ball, Seed Bomb",,,"710;711","711"
"711","Gourgeist (Small)","Pumpkaboo","FALSE",,"136",,,,"1/15/14",,,,"21.5",,,,"1495",,,,"Hex, Shadow Ball, Seed Bomb",,,"710;711","711"
"711","Gourgeist (Super)","Pumpkaboo","FALSE",,"91",,,,"1/15/14",,,,"21.5",,,,"1499",,,,"Hex, Shadow Ball, Seed Bomb",,,"710;711","711"
"712","Bergmite","Bergmite","FALSE",,"945",,,,"15/15/15",,,,"50",,,,"1374",,,,"Tackle, Icy Wind, Crunch",,,"712;713","712;713"
"713","Avalugg","Bergmite","FALSE",,"235",,,,"2/15/15",,,,"17.5",,,,"1500",,,,"Ice Fang, Avalanche, Body Slam",,,"712;713","713"
"713","Avalugg (Hisuian)","Bergmite","FALSE",,"425",,,,"0/14/9",,,,"16.5",,,,"1498",,,,"Powder Snow, Rock Slide, Icy Wind",,,"712;713","713"
"715","Noivern","Noibat","FALSE",,"964",,,,"0/15/12",,,,"20.5",,,,"1498",,,,"Air Slash, Hurricane, Draco Meteor",,,"714;715","715"
"718","Zygarde (10% Forme)","Zygarde","FALSE",,"735",,,,"0/14/12",,,,"24",,,,"1494",,,,"Dragon Tail, Crunch, Earthquake",,,"718;718&0-4attack;718&1-4attack","718;718&0-4attack;718&1-4attack"
"718","Zygarde (50% Forme)","Zygarde","FALSE",,"340",,,,"1/14/14",,,,"16.5",,,,"1494",,,,"Dragon Tail, Crunch, Earthquake",,,"718;718&0-4attack;718&1-4attack","718;718&0-4attack;718&1-4attack"
"719","Diancie","Diancie","FALSE",,"732",,,,"0/7/15",,,,"21",,,,"1488",,,,"Rock Throw, Power Gem, Rock Slide",,,"719","719"
"720","Hoopa","Hoopa","FALSE",,"913",,,,"0/15/15",,,,"16.5",,,,"1488",,,,"Astonish, Shadow Ball, Psychic",,,"720","720"
"722","Rowlet","Rowlet","FALSE",,"937",,,,"15/15/15",,,,"50",,,,"1196",,,,"Leafage, Seed Bomb, Energy Ball",,,"722;723;724","722;723;724"
"723","Dartrix","Rowlet","FALSE",,"218",,,,"0/15/14",,,,"37.5",,,,"1498",,,,"Leafage, Brave Bird, Seed Bomb",,,"722;723;724","723;724"
"724","Decidueye","Rowlet","FALSE",,"126",,,,"0/14/11",,,,"20.5",,,,"1492",,,,"Astonish, Frenzy Plant, Spirit Shackle",,,"722;723;724","724"
"724","Decidueye (Hisuian)","Rowlet","FALSE",,"688",,,,"0/15/13",,,,"19.5",,,,"1494",,,,"Magical Leaf, Aerial Ace, Aura Sphere",,,"722;723;724","724"
"726","Torracat","Litten","FALSE",,"834",,,,"0/15/13",,,,"37",,,,"1497",,,,"Ember, Flame Charge, Crunch",,,"725;726;727","726;727"
"727","Incineroar","Litten","FALSE",,"186",,,,"0/15/9",,,,"19",,,,"1498",,,,"Snarl, Darkest Lariat, Blast Burn",,,"725;726;727","727"
"728","Popplio","Popplio","FALSE",,"788",,,,"15/15/15",,,,"50",,,,"1276",,,,"Water Gun, Aqua Tail, Aqua Jet",,,"728;729;730","728;729;730"
"729","Brionne","Popplio","FALSE",,"765",,,,"1/15/14",,,,"30.5",,,,"1488",,,,"Charm, Aqua Jet, Disarming Voice",,,"728;729;730","729;730"
"730","Primarina","Popplio","FALSE",,"317",,,,"0/15/14",,,,"17.5",,,,"1499",,,,"Charm, Disarming Voice, Hydro Cannon",,,"728;729;730","730"
"732","Trumbeak","Pikipek","FALSE",,"928",,,,"0/15/15",,,,"48.5",,,,"1500",,,,"Peck, Drill Peck, Rock Blast",,,"731;732;733","732;733"
"733","Toucannon","Pikipek","FALSE",,"840",,,,"0/14/13",,,,"21",,,,"1492",,,,"Bullet Seed, Drill Peck, Rock Blast",,,"731;732;733","733"
"735","Gumshoos","Yungoos","FALSE",,"873",,,,"0/15/12",,,,"26",,,,"1500",,,,"Bite, Rock Tomb, Crunch",,,"734;735","735"
"737","Charjabug","Grubbin","FALSE",,"131",,,,"0/13/15",,,,"38.5",,,,"1500",,,,"Volt Switch, X-Scissor, Discharge",,,"736;737;738","737;738"
"738","Vikavolt","Grubbin","FALSE",,"458",,,,"0/14/12",,,,"18",,,,"1500",,,,"Volt Switch, X-Scissor, Fly",,,"736;737;738","738"
"739","Crabrawler","Crabrawler","FALSE",,"910",,,,"11/15/15",,,,"49.5",,,,"1495",,,,"Bubble, Crabhammer, Power-Up Punch",,,"739;740","739;740"
"740","Crabominable","Crabrawler","FALSE",,"842",,,,"0/11/15",,,,"19.5",,,,"1494",,,,"Bubble, Ice Punch, Brick Break",,,"739;740","740"
"741","Oricorio (Baile)","Oricorio","FALSE",,"720",,,,"0/13/13",,,,"24.5",,,,"1492",,,,"Air Slash, Air Cutter, Aerial Ace",,,"741","741"
"741","Oricorio (Pa'u)","Oricorio","FALSE",,"833",,,,"0/13/13",,,,"24.5",,,,"1492",,,,"Air Slash, Air Cutter, Aerial Ace",,,"741","741"
"741","Oricorio (Pom-Pom)","Oricorio","FALSE",,"712",,,,"0/13/13",,,,"24.5",,,,"1492",,,,"Air Slash, Air Cutter, Aerial Ace",,,"741","741"
"741","Oricorio (Sensu)","Oricorio","FALSE",,"748",,,,"0/13/13",,,,"24.5",,,,"1492",,,,"Air Slash, Air Cutter, Aerial Ace",,,"741","741"
"743","Ribombee","Cutiefly","FALSE",,"716",,,,"1/15/14",,,,"25.5",,,,"1500",,,,"Fairy Wind, Dazzling Gleam, Bug Buzz",,,"742;743","743"
"745","Lycanroc (Dusk)","Rockruff","FALSE",,"792",,,,"2/15/15",,,,"20.5",,,,"1500",,,,"Sucker Punch, Stone Edge, Trailblaze",,,"744;745","745"
"745","Lycanroc (Midday)","Rockruff","FALSE",,"787",,,,"0/14/14",,,,"21",,,,"1500",,,,"Sucker Punch, Stone Edge, Drill Run",,,"744;745","745"
"745","Lycanroc (Midnight)","Rockruff","FALSE",,"808",,,,"0/15/14",,,,"20.5",,,,"1498",,,,"Counter, Stone Edge, Psychic Fangs",,,"744;745","745"
"748","Toxapex","Mareanie","FALSE",,"27",,,,"0/15/15",,,,"40.5",,,,"1493",,,,"Poison Jab, Brine, Sludge Wave",,,"747;748","748"
"752","Araquanid","Dewpider","FALSE",,"182",,,,"0/10/15",,,,"35",,,,"1499",,,,"Bug Bite, Bug Buzz, Bubble Beam",,,"751;752","752"
"754","Lurantis","Fomantis","FALSE",,"173",,,,"0/15/15",,,,"23.5",,,,"1495",,,,"Fury Cutter, Leaf Blade, Superpower",,,"753;754","754"
"756","Shiinotic","Morelull","FALSE",,"290",,,,"0/14/15",,,,"32",,,,"1497",,,,"Astonish, Moonblast, Seed Bomb",,,"755;756","756"
"758","Salazzle","Salandit","FALSE",,"192",,,,"2/15/13",,,,"22.5",,,,"1492",,,,"Incinerate, Poison Fang, Dragon Pulse",,,"757;758","758"
"759","Stufful","Stufful","FALSE",,"774",,,,"12/15/15",,,,"50",,,,"1495",,,,"Tackle, Superpower, Stomp",,,"759;760","759;760"
"760","Bewear","Stufful","FALSE",,"226",,,,"0/15/14",,,,"18",,,,"1497",,,,"Shadow Claw, Superpower, Stomp",,,"759;760","760"
"763","Tsareena","Bounsweet","FALSE",,"708",,,,"0/15/13",,,,"19",,,,"1499",,,,"Magical Leaf, Triple Axel, High Jump Kick",,,"761;762;763","763"
"764","Comfey","Comfey","FALSE",,"649",,,,"1/15/14",,,,"27",,,,"1494",,,,"Vine Whip, Grass Knot, Draining Kiss",,,"764","764"
"765","Oranguru","Oranguru","FALSE",,"132",,,,"0/13/14",,,,"23.5",,,,"1499",,,,"Confusion, Brutal Swing, Trailblaze",,,"765","765"
"766","Passimian","Passimian","FALSE",,"344",,,,"0/15/14",,,,"18.5",,,,"1496",,,,"Counter, Brutal Swing, Brick Break",,,"766","766"
"769","Sandygast","Sandygast","FALSE",,"518",,,,"15/15/15",,,,"50",,,,"1394",,,,"Astonish, Scorching Sands, Shadow Ball",,,"769;770","769;770"
"770","Palossand","Sandygast","FALSE",,"318",,,,"0/15/11",,,,"23.5",,,,"1494",,,,"Astonish, Scorching Sands, Shadow Ball",,,"769;770","770"
"775","Komala","Komala","FALSE",,"895",,,,"0/15/11",,,,"22",,,,"1498",,,,"Rollout, Payback, Bulldoze",,,"775","775"
"776","Turtonator","Turtonator","FALSE",,"202",,,,"0/12/14",,,,"26",,,,"1496",,,,"Incinerate, Dragon Pulse, Overheat",,,"776","776"
"777","Togedemaru","Togedemaru","FALSE",,"58",,,,"0/13/13",,,,"26.5",,,,"1495",,,,"Thunder Shock, Fell Stinger, Wild Charge",,,"777","777"
"779","Bruxish","Bruxish","FALSE",,"442",,,,"0/15/15",,,,"23.5",,,,"1497",,,,"Confusion, Aqua Tail, Psychic Fangs",,,"779","779"
"780","Drampa","Drampa","FALSE",,"172",,,,"2/15/15",,,,"19",,,,"1492",,,,"Dragon Breath, Swift, Fly",,,"780","780"
"781","Dhelmise","Dhelmise","FALSE",,"420",,,,"0/15/14",,,,"19",,,,"1498",,,,"Shadow Claw, Power Whip, Shadow Ball",,,"781","781"
"783","Hakamo-o","Jangmo-o","FALSE",,"60",,,,"0/13/15",,,,"39",,,,"1493",,,,"Dragon Tail, Dragon Claw, Brick Break",,,"782;783;784","783;784"
"784","Kommo-o","Jangmo-o","FALSE",,"147",,,,"0/14/14",,,,"17",,,,"1497",,,,"Dragon Tail, Close Combat, Dragon Claw",,,"782;783;784","784"
"788","Tapu Fini","Tapu-fini","FALSE",,"201",,,,"0/12/14",,,,"20",,,,"1498",,,,"Water Gun, Surf, Nature's Madness",,,"788","788"
"794","Buzzwole","Buzzwole","FALSE",,"460",,,,"2/15/15",,,,"16",,,,"1498",,,,"Counter, Superpower, Lunge",,,"794","794"
"797","Celesteela","Celesteela","FALSE",,"409",,,,"2/15/14",,,,"18",,,,"1495",,,,"Air Slash, Body Slam, Iron Head",,,"797","797"
"798","Kartana","Kartana","FALSE",,"640",,,,"0/14/14",,,,"15",,,,"1500",,,,"Razor Leaf, Leaf Blade, Night Slash",,,"798","798"
"799","Guzzlord","Guzzlord","FALSE",,"8",,,,"1/15/15",,,,"19.5",,,,"1494",,,,"Dragon Tail, Brutal Swing, Sludge Bomb",,,"799","799"
"803","Poipole","Poipole","FALSE",,"627",,,,"3/15/14",,,,"39",,,,"1495",,,,"Poison Jab, Sludge Bomb, Fell Stinger",,,"803;804","803;804"
"804","Naganadel","Poipole","FALSE",,"563",,,,"1/15/13",,,,"17.5",,,,"1500",,,,"Poison Jab, Dragon Claw, Sludge Bomb",,,"803;804","804"
"805","Stakataka","Stakataka","FALSE",,"702",,,,"1/14/15",,,,"17",,,,"1498",,,,"Rock Throw, Stone Edge, Bulldoze",,,"805","805"
"808","Meltan","Meltan","FALSE",,"975",,,,"15/15/14",,,,"50",,,,"1207",,,,"Thunder Shock, Thunderbolt, Flash Cannon",,,"808;809","808;809"
"809","Melmetal","Meltan","FALSE",,"111",,,,"1/15/14",,,,"15.5",,,,"1500",,,,"Thunder Shock, Double Iron Bash, Superpower",,,"808;809","809"
"811","Thwackey","Grookey","FALSE",,"634",,,,"0/14/13",,,,"31.5",,,,"1500",,,,"Razor Leaf, Grass Knot, Energy Ball",,,"810;811;812","811;812"
"812","Rillaboom","Grookey","FALSE",,"672",,,,"0/12/13",,,,"17",,,,"1499",,,,"Razor Leaf, Grass Knot, Earth Power",,,"810;811;812","812"
"814","Raboot","Scorbunny","FALSE",,"630",,,,"0/12/14",,,,"33.5",,,,"1498",,,,"Fire Spin, Flame Charge, Flamethrower",,,"813;814;815","814;815"
"815","Cinderace","Scorbunny","FALSE",,"737",,,,"0/15/14",,,,"18.5",,,,"1499",,,,"Fire Spin, Flamethrower, Flame Charge",,,"813;814;815","815"
"817","Drizzile","Sobble","FALSE",,"883",,,,"0/13/14",,,,"30.5",,,,"1493",,,,"Water Gun, Surf, Water Pulse",,,"816;817;818","817;818"
"818","Inteleon","Sobble","FALSE",,"943",,,,"0/13/12",,,,"19",,,,"1498",,,,"Water Gun, Surf, Shadow Ball",,,"816;817;818","818"
"820","Greedent","Skwovet","FALSE",,"166",,,,"0/12/14",,,,"24.5",,,,"1498",,,,"Mud Shot, Body Slam, Trailblaze",,,"819;820","820"
"822","Corvisquire","Rookidee","FALSE",,"470",,,,"12/15/15",,,,"49.5",,,,"1500",,,,"Sand Attack, Sky Attack, Payback",,,"821;822;823","822;823"
"823","Corviknight","Rookidee","FALSE",,"15",,,,"0/13/14",,,,"23.5",,,,"1498",,,,"Sand Attack, Sky Attack, Iron Head",,,"821;822;823","823"
"828","Thievul","Nickit","FALSE",,"19",,,,"0/15/11",,,,"27",,,,"1498",,,,"Sucker Punch, Night Slash, Play Rough",,,"827;828","828"
"830","Eldegoss","Gossifleur","FALSE",,"602",,,,"0/14/15",,,,"29",,,,"1500",,,,"Bullet Seed, Grass Knot, Energy Ball",,,"829;830","830"
"832","Dubwool","Wooloo","FALSE",,"151",,,,"1/15/15",,,,"26",,,,"1499",,,,"Double Kick, Body Slam, Payback",,,"831;832","832"
"841","Flapple","Flapple","FALSE",,"589",,,,"1/14/15",,,,"25.5",,,,"1499",,,,"Dragon Breath, Fly, Seed Bomb",,,"840;841","841"
