"ID","Pokemon","Family","Shadow","Little_Rank","Great_Rank","Ultra_Rank","Master_Rank","Little_IVs","Great_IVs","Ultra_IVs","Master_IVs","Little_Level","Great_Level","Ultra_Level","Master_Level","Little_CP","Great_CP","Ultra_CP","Master_CP","Little_MoveSet","Great_MoveSet","Ultra_MoveSet","Master_MoveSet","Evo_Fam","Evo_Next"
"310","Manectric","Electrike","FALSE",,"447","452","559",,"0/15/15","3/15/15","15/15/15",,"24","49.5","50",,"1494","2488","2646",,"Thunder Fang, Psychic Fangs, Wild Charge","Snarl, Wild Charge, Psychic Fangs","Snarl, Wild Charge, Psychic Fangs","309;310","310"
"310","Manectric (Shadow)","Electrike","TRUE",,"696","506","517",,"0/15/15","3/15/15","15/15/15",,"24","49.5","50",,"1494","2488","2646",,"Snarl, Wild Charge, Psychic Fangs","Snarl, Wild Charge, Psychic Fangs","Snarl, Wild Charge, Psychic Fangs","309;310","310"
"311","Plusle","Plusle","FALSE",,"802",,,,"0/15/14",,,,"34.5",,,,"1499",,,,"Quick Attack, Thunderbolt, Grass Knot",,,"311","311"
"312","Minun","Minun","FALSE",,"567",,,,"0/15/14",,,,"38.5",,,,"1493",,,,"Quick Attack, Thunderbolt, Grass Knot",,,"312","312"
"313","Volbeat","Volbeat","FALSE","363","907","729",,"0/13/14","0/15/15","15/15/15",,"11","35.5","50",,"497","1494","2002",,"Tackle, Thunderbolt, Bug Buzz","Tackle, Bug Buzz, Thunderbolt","Tackle, Bug Buzz, Thunderbolt",,"313","313"
"314","Illumise","Illumise","FALSE","352","864","728",,"0/13/14","0/15/15","15/15/15",,"11","35.5","50",,"497","1494","2002",,"Tackle, Silver Wind, Bug Buzz","Tackle, Silver Wind, Dazzling Gleam","Tackle, Silver Wind, Dazzling Gleam",,"314","314"
"315","Roselia","Roselia","FALSE","326","890",,,"2/15/15","0/13/15",,,"10","31",,,"499","1497",,,"Poison Jab, Sludge Bomb, Petal Blizzard","Poison Jab, Sludge Bomb, Petal Blizzard",,,"315;406;407","315;406;407"
"316","Gulpin","Gulpin","FALSE","354",,,,"0/15/15",,,,"24",,,,"499",,,,"Rock Smash, Ice Beam, Sludge",,,,"316;317","316;317"
"317","Swalot","Gulpin","FALSE","121","234","398","581","0/14/7","0/15/13","15/15/15","15/15/15","10","29.5","50","50","500","1500","2236","2236","Mud Shot, Ice Beam, Sludge Bomb","Mud Shot, Sludge Bomb, Ice Beam","Mud Shot, Sludge Bomb, Ice Beam","Mud Shot, Sludge Bomb, Ice Beam","316;317","317"
"318","Carvanha","Carvanha","FALSE","335",,,,"1/15/15",,,,"18.5",,,,"499",,,,"Snarl, Crunch, Poison Fang",,,,"318;319","318;319"
"318","Carvanha (Shadow)","Carvanha","TRUE","351",,,,"1/15/15",,,,"18.5",,,,"499",,,,"Snarl, Crunch, Poison Fang",,,,"318;319","318;319"
"319","Sharpedo","Carvanha","FALSE","206","745","625",,"4/15/14","0/15/15","15/15/15",,"8.5","25.5","50",,"499","1493","2466",,"Waterfall, Crunch, Poison Fang","Waterfall, Crunch, Poison Fang","Waterfall, Crunch, Poison Fang",,"318;319","319"
"319","Sharpedo (Shadow)","Carvanha","TRUE","189",,"605",,"4/15/14",,"15/15/15",,"8.5",,"50",,"499",,"2466",,"Waterfall, Crunch, Poison Fang",,"Waterfall, Crunch, Poison Fang",,"318;319","319"
"320","Wailmer","Wailmer","FALSE",,"305",,,,"0/15/15",,,,"50",,,,"1500",,,,"Water Gun, Scald, Body Slam",,,"320;321","320;321"
"320","Wailmer (Shadow)","Wailmer","TRUE",,"276",,,,"0/15/15",,,,"50",,,,"1500",,,,"Water Gun, Scald, Body Slam",,,"320;321","320;321"
"321","Wailord","Wailmer","FALSE",,"546","462","503",,"0/15/14","9/15/15","15/15/15",,"25","50","50",,"1500","2499","2577",,"Water Gun, Surf, Scald","Water Gun, Scald, Blizzard","Water Gun, Surf, Scald","320;321","321"
"321","Wailord (Shadow)","Wailmer","TRUE",,"561","558","526",,"0/15/14","9/15/15","15/15/15",,"25","50","50",,"1500","2499","2577",,"Water Gun, Surf, Scald","Water Gun, Scald, Blizzard","Water Gun, Surf, Scald","320;321","321"
"323","Camerupt","Numel","FALSE",,"651","275",,,"0/14/13","15/15/15",,,"26","50",,,"1499","2479",,,"Incinerate, Earth Power, Overheat","Incinerate, Earth Power, Overheat",,"322;323","323"
"323","Camerupt (Shadow)","Numel","TRUE",,"625","367",,,"0/14/13","15/15/15",,,"26","50",,,"1499","2479",,,"Incinerate, Earth Power, Overheat","Incinerate, Earth Power, Overheat",,"322;323","323"
"324","Torkoal","Torkoal","FALSE",,"481","392","567",,"0/15/15","15/15/15","15/15/15",,"27.5","50","50",,"1491","2366","2366",,"Fire Spin, Overheat, Earthquake","Fire Spin, Overheat, Earthquake","Fire Spin, Overheat, Earthquake","324","324"
"325","Spoink","Spoink","FALSE",,"998",,,,"15/15/15",,,,"49.5",,,,"1495",,,,"Zen Headbutt, Shadow Ball, Return",,,"325;326","325;326"
"325","Spoink (Shadow)","Spoink","TRUE",,"995",,,,"15/15/15",,,,"49.5",,,,"1495",,,,"Zen Headbutt, Shadow Ball, Mirror Coat",,,"325;326","325;326"
"326","Grumpig","Spoink","FALSE",,"945","611","612",,"1/14/15","3/14/15","15/15/15",,"24","50","50",,"1498","2493","2679",,"Extrasensory, Shadow Ball, Psychic","Extrasensory, Shadow Ball, Psychic","Extrasensory, Shadow Ball, Psychic","325;326","326"
"326","Grumpig (Shadow)","Spoink","TRUE",,"966","654","618",,"1/14/15","3/14/15","15/15/15",,"24","50","50",,"1498","2493","2679",,"Extrasensory, Shadow Ball, Psychic","Extrasensory, Shadow Ball, Psychic","Extrasensory, Shadow Ball, Psychic","325;326","326"
"327","Spinda","Spinda","FALSE",,"269",,,,"15/15/14",,,,"50",,,,"1380",,,,"Sucker Punch, Icy Wind, Dig",,,"327","327"
"328","Trapinch","Trapinch","FALSE",,"846",,,,"15/15/15",,,,"50",,,,"1441",,,,"Sand Attack, Scorching Sands, Crunch",,,"328;329;330","328;329;330"
"328","Trapinch (Shadow)","Trapinch","TRUE",,"854",,,,"15/15/15",,,,"50",,,,"1441",,,,"Sand Attack, Scorching Sands, Crunch",,,"328;329;330","328;329;330"
"329","Vibrava","Trapinch","FALSE",,"591",,,,"15/15/15",,,,"50",,,,"1384",,,,"Dragon Breath, Sand Tomb, Bug Buzz",,,"328;329;330","329;330"
"329","Vibrava (Shadow)","Trapinch","TRUE",,"535",,,,"15/15/15",,,,"50",,,,"1384",,,,"Dragon Breath, Sand Tomb, Bug Buzz",,,"328;329;330","329;330"
"330","Flygon","Trapinch","FALSE",,"172","141","310",,"0/15/9","0/13/15","15/15/15",,"21.5","41","50",,"1499","2497","3008",,"Dragon Tail, Scorching Sands, Dragon Claw","Dragon Tail, Dragon Claw, Scorching Sands","Sand Attack, Dragon Claw, Scorching Sands","328;329;330","330"
"330","Flygon (Shadow)","Trapinch","TRUE",,"181","128","291",,"0/15/9","0/13/15","15/15/15",,"21.5","41","50",,"1499","2497","3008",,"Dragon Tail, Dragon Claw, Scorching Sands","Dragon Tail, Dragon Claw, Scorching Sands","Sand Attack, Dragon Claw, Scorching Sands","328;329;330","330"
"332","Cacturne","Cacnea","FALSE","184","477","336",,"7/15/15","0/14/15","6/15/15",,"8","24.5","50",,"496","1498","2495",,"Sucker Punch, Dark Pulse, Trailblaze","Sucker Punch, Trailblaze, Dark Pulse","Sucker Punch, Trailblaze, Dark Pulse",,"331;332","332"
"332","Cacturne (Shadow)","Cacnea","TRUE","169","417","387",,"7/15/15","0/14/15","6/15/15",,"8","24.5","50",,"496","1498","2495",,"Sucker Punch, Dark Pulse, Trailblaze","Sucker Punch, Trailblaze, Dark Pulse","Sucker Punch, Trailblaze, Dark Pulse",,"331;332","332"
"334","Altaria","Swablu","FALSE",,"140","268","555",,"0/14/15","15/15/15","15/15/15",,"29","50","50",,"1498","2266","2266",,"Dragon Breath, Sky Attack, Moonblast","Dragon Breath, Sky Attack, Moonblast","Dragon Breath, Sky Attack, Moonblast","333;334","334"
"335","Zangoose","Zangoose","FALSE",,"285","310","367",,"0/15/10","0/15/15","15/15/15",,"23.5","48","50",,"1494","2498","2733",,"Shadow Claw, Close Combat, Night Slash","Shadow Claw, Close Combat, Night Slash","Shadow Claw, Close Combat, Night Slash","335","335"
"336","Seviper","Seviper","FALSE","200","497","484",,"0/15/14","0/15/12","15/15/15",,"9","27","50",,"500","1500","2380",,"Poison Jab, Crunch, Poison Fang","Poison Jab, Crunch, Poison Fang","Poison Jab, Crunch, Poison Fang",,"336","336"
"337","Lunatone","Lunatone","FALSE",,"377","176","451",,"0/15/14","6/15/14","15/15/15",,"24.5","49.5","50",,"1494","2497","2631",,"Psywave, Rock Slide, Moonblast","Psywave, Rock Slide, Moonblast","Psywave, Rock Slide, Moonblast","337","337"
"338","Solrock","Solrock","FALSE",,"396","240","487",,"0/15/14","6/15/14","15/15/15",,"24.5","49.5","50",,"1494","2497","2631",,"Psywave, Rock Slide, Psychic","Psywave, Rock Slide, Psychic","Psywave, Rock Slide, Psychic","338","338"
"340","Whiscash","Barboach","FALSE",,"60","131","444",,"0/14/13","15/15/14","15/15/15",,"28","50","50",,"1490","2346","2346",,"Mud Shot, Mud Bomb, Scald","Mud Shot, Mud Bomb, Scald","Mud Shot, Mud Bomb, Scald","339;340","340"
"340","Whiscash (Shadow)","Barboach","TRUE",,"63","149","458",,"0/14/13","15/15/14","15/15/15",,"28","50","50",,"1490","2346","2346",,"Mud Shot, Mud Bomb, Scald","Mud Shot, Mud Bomb, Scald","Mud Shot, Mud Bomb, Scald","339;340","340"
"341","Corphish","Corphish","FALSE",,"871",,,,"15/15/15",,,,"50",,,,"1391",,,,"Bubble, Scald, Razor Shell",,,"341;342","341;342"
"341","Corphish (Shadow)","Corphish","TRUE",,"828",,,,"15/15/15",,,,"50",,,,"1391",,,,"Bubble, Scald, Razor Shell",,,"341;342","341;342"
"342","Crawdaunt","Corphish","FALSE","152","532","424","341","6/15/14","2/15/14","0/15/15","15/15/15","7.5","22.5","46","50","497","1497","2496","2797","Snarl, Night Slash, Scald","Snarl, Night Slash, Scald","Snarl, Night Slash, Crabhammer","Snarl, Night Slash, Scald","341;342","342"
"342","Crawdaunt (Shadow)","Corphish","TRUE",,"486","375","305",,"2/15/14","0/15/15","15/15/15",,"22.5","46","50",,"1497","2496","2797",,"Snarl, Night Slash, Scald","Snarl, Night Slash, Scald","Snarl, Night Slash, Scald","341;342","342"
"344","Claydol","Baltoy","FALSE",,"307","323","518",,"0/14/15","15/15/14","15/15/15",,"29.5","50","50",,"1488","2229","2229",,"Mud Slap, Ice Beam, Shadow Ball","Mud Slap, Scorching Sands, Ice Beam","Mud Slap, Scorching Sands, Ice Beam","343;344","344"
"345","Lileep","Lileep","FALSE",,"274",,,,"15/15/15",,,,"50",,,,"1460",,,,"Bullet Seed, Ancient Power, Grass Knot",,,"345;346","345;346"
"345","Lileep (Shadow)","Lileep","TRUE",,"315",,,,"15/15/15",,,,"50",,,,"1460",,,,"Bullet Seed, Ancient Power, Grass Knot",,,"345;346","345;346"
"346","Cradily","Lileep","FALSE",,"205","186","532",,"0/15/15","15/15/15","15/15/15",,"26","50","50",,"1498","2499","2499",,"Bullet Seed, Rock Slide, Grass Knot","Bullet Seed, Stone Edge, Grass Knot","Bullet Seed, Grass Knot, Stone Edge","345;346","346"
"346","Cradily (Shadow)","Lileep","TRUE",,"221","237","536",,"0/15/15","15/15/15","15/15/15",,"26","50","50",,"1498","2499","2499",,"Bullet Seed, Rock Slide, Grass Knot","Bullet Seed, Grass Knot, Stone Edge","Bullet Seed, Grass Knot, Stone Edge","345;346","346"
"347","Anorith","Anorith","FALSE","366","982",,,"0/14/14","0/15/15",,,"12.5","45",,,"499","1500",,,"Struggle Bug, Ancient Power, Cross Poison","Struggle Bug, Ancient Power, Cross Poison",,,"347;348","347;348"
"347","Anorith (Shadow)","Anorith","TRUE","364","983",,,"0/14/14","0/15/15",,,"12.5","45",,,"499","1500",,,"Struggle Bug, Ancient Power, Cross Poison","Struggle Bug, Ancient Power, Cross Poison",,,"347;348","347;348"
"348","Armaldo","Anorith","FALSE","186","629","598","415","0/7/8","0/9/15","2/15/15","15/15/15","7","20","35","50","498","1497","2495","3220","Fury Cutter, Rock Blast, Cross Poison","Fury Cutter, Rock Blast, Liquidation","Fury Cutter, Rock Blast, Liquidation","Fury Cutter, Rock Blast, Cross Poison","347;348","348"
"348","Armaldo (Shadow)","Anorith","TRUE",,"539","569","407",,"0/9/15","2/15/15","15/15/15",,"20","35","50",,"1497","2495","3220",,"Fury Cutter, Rock Blast, Liquidation","Fury Cutter, Rock Blast, Liquidation","Fury Cutter, Cross Poison, Rock Blast","347;348","348"
"350","Milotic","Feebas","FALSE",,"452","227","173",,"0/15/11","0/13/15","15/15/15",,"19","33","50",,"1495","2493","3398",,"Dragon Tail, Surf, Blizzard","Dragon Tail, Surf, Blizzard","Dragon Tail, Surf, Blizzard","349;350","350"
"352","Kecleon","Kecleon","FALSE",,"367","525","541",,"0/15/15","15/15/14","15/15/15",,"28","50","50",,"1495","2314","2314",,"Sucker Punch, Aerial Ace, Ice Beam","Sucker Punch, Aerial Ace, Foul Play","Sucker Punch, Aerial Ace, Foul Play","352","352"
"353","Shuppet","Shuppet","FALSE","214",,,,"1/15/14",,,,"19",,,,"499",,,,"Astonish, Night Shade, Shadow Sneak",,,,"353;354","353;354"
"353","Shuppet (Shadow)","Shuppet","TRUE","198",,,,"1/15/14",,,,"19",,,,"499",,,,"Astonish, Night Shade, Shadow Sneak",,,,"353;354","353;354"
"354","Banette","Shuppet","FALSE","299","773","399",,"0/9/11","0/14/15","6/15/15",,"8.5","24.5","50",,"494","1500","2499",,"Shadow Claw, Shadow Ball, Thunder","Shadow Claw, Shadow Ball, Thunder","Shadow Claw, Shadow Ball, Thunder",,"353;354","354"
"354","Banette (Shadow)","Shuppet","TRUE","300","874","485",,"0/9/11","0/14/15","6/15/15",,"8.5","24.5","50",,"499","1500","2498",,"Shadow Claw, Shadow Ball, Thunder","Shadow Claw, Shadow Ball, Thunder","Shadow Claw, Shadow Ball, Thunder",,"353;354","354"
"355","Duskull","Duskull","FALSE","22",,,,"0/15/15",,,,"30",,,,"500",,,,"Astonish, Night Shade, Return",,,,"355;356;477","355;356;477"
"355","Duskull (Shadow)","Duskull","TRUE","31",,,,"0/15/15",,,,"30",,,,"500",,,,"Astonish, Night Shade, Shadow Sneak",,,,"355;356;477","355;356;477"
"356","Dusclops","Duskull","FALSE","60","271",,,"0/14/12","0/11/15",,,"12.5","45",,,"498","1498",,,"Hex, Shadow Punch, Fire Punch","Hex, Ice Punch, Poltergeist",,,"355;356;477","356;477"
"356","Dusclops (Shadow)","Duskull","TRUE","63","441",,,"0/14/12","0/11/15",,,"12.5","45",,,"498","1498",,,"Hex, Shadow Punch, Fire Punch","Hex, Ice Punch, Poltergeist",,,"355;356;477","356;477"
"357","Tropius","Tropius","FALSE",,"123","401","561",,"0/15/15","15/15/14","15/15/15",,"30","50","50",,"1494","2194","2194",,"Air Slash, Leaf Blade, Aerial Ace","Air Slash, Leaf Blade, Brutal Swing","Air Slash, Leaf Blade, Brutal Swing","357","357"
"358","Chimecho","Chimecho","FALSE",,"679","411","545",,"0/14/12","11/15/15","15/15/15",,"25.5","50","50",,"1500","2495","2554",,"Astonish, Psyshock, Shadow Ball","Astonish, Psyshock, Shadow Ball","Astonish, Psyshock, Shadow Ball","358;433","358;433"
"359","Absol","Absol","FALSE","347","927","685","523","0/15/14","0/15/15","0/15/14","15/15/15","7.5","22","44","50","498","1499","2491","2856","Snarl, Dark Pulse, Megahorn","Snarl, Dark Pulse, Megahorn","Snarl, Dark Pulse, Megahorn","Snarl, Dark Pulse, Megahorn","359","359"
"359","Absol (Shadow)","Absol","TRUE",,"915","634","494",,"0/15/15","0/15/14","15/15/15",,"22","44","50",,"1499","2491","2856",,"Snarl, Dark Pulse, Megahorn","Snarl, Dark Pulse, Megahorn","Snarl, Dark Pulse, Megahorn","359","359"
"362","Glalie","Snorunt","FALSE",,"473","416","537",,"0/13/13","15/15/15","15/15/15",,"27.5","50","50",,"1498","2380","2380",,"Ice Shard, Avalanche, Shadow Ball","Ice Shard, Avalanche, Shadow Ball","Ice Shard, Avalanche, Shadow Ball","361;362","362"
"362","Glalie (Shadow)","Snorunt","TRUE",,"515","499","534",,"0/13/13","15/15/15","15/15/15",,"27.5","50","50",,"1498","2380","2380",,"Ice Shard, Avalanche, Shadow Ball","Ice Shard, Avalanche, Shadow Ball","Ice Shard, Avalanche, Shadow Ball","361;362","362"
"364","Sealeo","Spheal","FALSE",,"202","706",,,"0/15/14","15/15/15",,,"38","50",,,"1497","1938",,,"Powder Snow, Water Pulse, Body Slam","Powder Snow, Body Slam, Water Pulse",,"363;364;365","364;365"
"364","Sealeo (Shadow)","Spheal","TRUE",,"133","691",,,"0/15/14","15/15/15",,,"38","50",,,"1497","1938",,,"Powder Snow, Water Pulse, Body Slam","Powder Snow, Body Slam, Water Pulse",,"363;364;365","364;365"
"365","Walrein","Spheal","FALSE",,"41","58","123",,"0/12/15","0/15/15","15/15/15",,"21","39.5","50",,"1495","2500","3081",,"Powder Snow, Icicle Spear, Earthquake","Powder Snow, Icicle Spear, Earthquake","Powder Snow, Icicle Spear, Earthquake","363;364;365","365"
"365","Walrein (Shadow)","Spheal","TRUE",,"66","49","124",,"0/12/15","0/15/15","15/15/15",,"21","39.5","50",,"1495","2500","3081",,"Powder Snow, Icicle Spear, Earthquake","Powder Snow, Icicle Spear, Earthquake","Powder Snow, Icicle Spear, Earthquake","363;364;365","365"
"366","Clamperl","Clamperl","FALSE",,"738",,,,"15/15/14",,,,"50",,,,"1436",,,,"Water Gun, Body Slam, Water Pulse",,,"366;367","366;367"
"367","Huntail","Clamperl","FALSE",,"522","455","469",,"1/15/15","5/15/14","15/15/15",,"24","49.5","50",,"1498","2500","2645",,"Water Gun, Aqua Tail, Crunch","Water Gun, Aqua Tail, Crunch","Water Gun, Aqua Tail, Crunch","366;367","367"
"368","Gorebyss","Gorebyss","FALSE",,"947","694","598",,"0/15/15","0/15/12","15/15/15",,"22.5","46.5","50",,"1500","2494","2820",,"Water Gun, Water Pulse, Psychic","Water Gun, Water Pulse, Psychic","Water Gun, Water Pulse, Psychic","366;368","368"
"369","Relicanth","Relicanth","FALSE",,"197","140","303",,"1/15/15","0/11/15","15/15/15",,"22.5","47","50",,"1498","2497","2858",,"Water Gun, Aqua Tail, Ancient Power","Water Gun, Aqua Tail, Ancient Power","Water Gun, Aqua Tail, Ancient Power","369","369"
"372","Shelgon","Bagon","FALSE",,"498","587",,,"1/15/14","15/15/15",,,"28","50",,,"1493","2296",,,"Dragon Breath, Flamethrower, Twister","Dragon Breath, Flamethrower, Dragon Pulse",,"371;372;373","372;373"
"372","Shelgon (Shadow)","Bagon","TRUE",,"571","619",,,"1/15/14","15/15/15",,,"28","50",,,"1493","2296",,,"Dragon Breath, Flamethrower, Dragon Pulse","Dragon Breath, Flamethrower, Dragon Pulse",,"371;372;373","372;373"
"373","Salamence","Bagon","FALSE",,"492","264","98",,"0/10/14","1/15/14","15/15/15",,"15","24.5","50",,"1490","2500","4239",,"Dragon Tail, Fly, Outrage","Dragon Tail, Fly, Outrage","Dragon Tail, Fly, Outrage","371;372;373","373"
"373","Salamence (Shadow)","Bagon","TRUE",,"465","288","92",,"0/10/14","1/15/14","15/15/15",,"15","24.5","50",,"1490","2500","4239",,"Dragon Tail, Fly, Outrage","Dragon Tail, Fly, Outrage","Dragon Tail, Fly, Outrage","371;372;373","373"
"375","Metang","Beldum","FALSE",,"418","701",,,"0/13/15","15/15/14",,,"38","50",,,"1494","1946",,,"Metal Claw, Psyshock, Gyro Ball","Metal Claw, Psyshock, Gyro Ball",,"374;375;376","375;376"
"375","Metang (Shadow)","Beldum","TRUE",,"409","709",,,"0/13/15","15/15/14",,,"38","50",,,"1494","1946",,,"Metal Claw, Psyshock, Gyro Ball","Metal Claw, Psyshock, Gyro Ball",,"374;375;376","375;376"
"376","Metagross","Beldum","FALSE",,"865","495","60",,"2/15/15","0/15/13","15/15/15",,"14.5","24.5","50",,"1496","2493","4286",,"Bullet Punch, Meteor Mash, Psychic","Bullet Punch, Meteor Mash, Earthquake","Bullet Punch, Meteor Mash, Earthquake","374;375;376","376"
"376","Metagross (Shadow)","Beldum","TRUE",,"895","578","100",,"2/15/15","0/15/13","15/15/15",,"14.5","24.5","50",,"1496","2493","4286",,"Bullet Punch, Meteor Mash, Psychic","Bullet Punch, Meteor Mash, Psychic","Bullet Punch, Meteor Mash, Earthquake","374;375;376","376"
"377","Regirock","Regirock","FALSE",,"89","14","96",,"0/10/12","0/12/15","15/15/15",,"18.5","31","50",,"1497","2494","3530",,"Lock On, Stone Edge, Focus Blast","Lock On, Stone Edge, Focus Blast","Lock On, Stone Edge, Focus Blast","377","377"
"377","Regirock (Shadow)","Regirock","TRUE",,"129","29","97",,"0/10/12","0/12/15","15/15/15",,"18.5","31","50",,"1497","2494","3530",,"Lock On, Stone Edge, Focus Blast","Lock On, Stone Edge, Focus Blast","Lock On, Stone Edge, Focus Blast","377","377"
"378","Regice","Regice","FALSE",,"132","79","212",,"0/10/12","0/12/15","15/15/15",,"18.5","31","50",,"1497","2494","3530",,"Lock On, Blizzard, Thunder","Lock On, Thunder, Blizzard","Lock On, Thunder, Earthquake","378","378"
"378","Regice (Shadow)","Regice","TRUE",,"242","122","240",,"0/10/12","0/12/15","15/15/15",,"18.5","31","50",,"1497","2494","3530",,"Lock On, Blizzard, Thunder","Lock On, Thunder, Blizzard","Lock On, Thunder, Earthquake","378","378"
"379","Registeel","Registeel","FALSE",,"57","9","241",,"0/8/15","0/14/15","15/15/15",,"24","50","50",,"1499","2500","2766",,"Lock On, Focus Blast, Zap Cannon","Lock On, Focus Blast, Zap Cannon","Lock On, Focus Blast, Flash Cannon","379","379"
"379","Registeel (Shadow)","Registeel","TRUE",,"177","66","306",,"0/8/15","0/14/15","15/15/15",,"24","50","50",,"1499","2500","2766",,"Lock On, Focus Blast, Zap Cannon","Lock On, Focus Blast, Zap Cannon","Lock On, Focus Blast, Flash Cannon","379","379"
"380","Latias","Latias","FALSE",,"702","483","183",,"0/14/14","1/15/14","15/15/15",,"16","26.5","50",,"1499","2497","3968",,"Dragon Breath, Mist Ball, Thunder","Dragon Breath, Mist Ball, Thunder","Dragon Breath, Mist Ball, Outrage","380","380"
"380","Latias (Shadow)","Latias","TRUE",,"615","536","232",,"0/14/14","1/15/14","15/15/15",,"16","26.5","50",,"1499","2497","3968",,"Dragon Breath, Mist Ball, Thunder","Dragon Breath, Mist Ball, Thunder","Dragon Breath, Mist Ball, Outrage","380","380"
"381","Latios","Latios","FALSE",,"445","417","87",,"0/15/15","2/15/15","15/15/15",,"14.5","24","50",,"1497","2492","4310",,"Dragon Breath, Dragon Claw, Luster Purge","Dragon Breath, Dragon Claw, Luster Purge","Dragon Breath, Dragon Claw, Luster Purge","381","381"
"381","Latios (Shadow)","Latios","TRUE",,"390","341","65",,"0/15/15","2/15/15","15/15/15",,"14.5","24","50",,"1497","2492","4310",,"Dragon Breath, Dragon Claw, Luster Purge","Dragon Breath, Dragon Claw, Luster Purge","Dragon Breath, Dragon Claw, Luster Purge","381","381"
"382","Kyogre","Kyogre","FALSE",,,"609","54",,,"0/15/13","15/15/15",,,"22.5","50",,,"2500","4652",,,"Waterfall, Surf, Origin Pulse","Waterfall, Surf, Origin Pulse","382","382"
"382","Kyogre (Shadow)","Kyogre","TRUE",,"742","627","69",,"0/15/13","0/15/13","15/15/15",,"13.5","22.5","50",,"1500","2500","4652",,"Waterfall, Surf, Origin Pulse","Waterfall, Surf, Origin Pulse","Waterfall, Surf, Origin Pulse","382","382"
"383","Groudon","Groudon","FALSE",,,"407","15",,,"0/15/13","15/15/15",,,"22.5","50",,,"2500","4652",,,"Mud Shot, Precipice Blades, Fire Punch","Mud Shot, Fire Punch, Precipice Blades","383","383"
"383","Groudon (Shadow)","Groudon","TRUE",,"621","459","26",,"0/15/13","0/15/13","15/15/15",,"13.5","22.5","50",,"1500","2500","4652",,"Mud Shot, Precipice Blades, Fire Punch","Mud Shot, Precipice Blades, Fire Punch","Mud Shot, Precipice Blades, Fire Punch","383","383"
"384","Rayquaza","Rayquaza","FALSE",,"427","423","91",,"0/15/12","0/15/15","15/15/15",,"14.5","24","50",,"1496","2497","4336",,"Dragon Tail, Breaking Swipe, Dragon Ascent","Dragon Tail, Breaking Swipe, Dragon Ascent","Dragon Tail, Breaking Swipe, Dragon Ascent","384","384"
"385","Jirachi","Jirachi","FALSE",,"376","208","143",,"0/10/13","0/15/10","15/15/15",,"17.5","29","50",,"1498","2493","3691",,"Confusion, Doom Desire, Psychic","Confusion, Doom Desire, Dazzling Gleam","Confusion, Doom Desire, Psychic","385","385"
"386","Deoxys","Deoxys","FALSE",,,,"611",,,,"15/15/15",,,,"50",,,,"3573",,,,"Charge Beam, Psycho Boost, Thunderbolt","386","386"
"386","Deoxys (Defense)","Deoxys","FALSE",,"284","230","531",,"0/15/15","12/13/15","15/15/15",,"25.5","49.5","50",,"1491","2490","2570",,"Counter, Psycho Boost, Thunderbolt","Counter, Psycho Boost, Rock Slide","Counter, Psycho Boost, Rock Slide","386","386"
"386","Deoxys (Speed)","Deoxys","FALSE",,"980","725","602",,"0/14/14","1/14/15","15/15/15",,"19.5","34.5","50",,"1499","2492","3255",,"Charge Beam, Psycho Boost, Swift","Charge Beam, Psycho Boost, Swift","Charge Beam, Psycho Boost, Swift","386","386"
"387","Turtwig","Turtwig","FALSE",,"940",,,,"15/15/15",,,,"50",,,,"1342",,,,"Tackle, Body Slam, Seed Bomb",,,"387;388;389","387;388;389"
"387","Turtwig (Shadow)","Turtwig","TRUE",,"941",,,,"15/15/15",,,,"50",,,,"1342",,,,"Tackle, Body Slam, Seed Bomb",,,"387;388;389","387;388;389"
"388","Grotle","Turtwig","FALSE",,"590","707",,,"0/15/11","15/15/15",,,"31.5","50",,,"1497","2137",,,"Razor Leaf, Body Slam, Energy Ball","Razor Leaf, Body Slam, Energy Ball",,"387;388;389","388;389"
"388","Grotle (Shadow)","Turtwig","TRUE",,"501","697",,,"0/15/11","15/15/15",,,"31.5","50",,,"1497","2137",,,"Razor Leaf, Body Slam, Energy Ball","Razor Leaf, Body Slam, Energy Ball",,"387;388;389","388;389"
"389","Torterra","Turtwig","FALSE",,"658","617","390",,"0/11/13","0/15/15","15/15/15",,"19.5","34","50",,"1496","2493","3318",,"Razor Leaf, Frenzy Plant, Stone Edge","Razor Leaf, Frenzy Plant, Stone Edge","Razor Leaf, Frenzy Plant, Stone Edge","387;388;389","389"
"389","Torterra (Shadow)","Turtwig","TRUE",,"534","589","358",,"0/11/13","0/15/15","15/15/15",,"19.5","34","50",,"1496","2493","3318",,"Razor Leaf, Frenzy Plant, Stone Edge","Razor Leaf, Frenzy Plant, Stone Edge","Razor Leaf, Frenzy Plant, Stone Edge","387;388;389","389"
"391","Monferno","Chimchar","FALSE",,"870",,,,"0/15/14",,,,"43.5",,,,"1498",,,,"Ember, Flamethrower, Low Sweep",,,"390;391;392","391;392"
"391","Monferno (Shadow)","Chimchar","TRUE",,"866",,,,"0/15/14",,,,"43.5",,,,"1498",,,,"Ember, Flamethrower, Low Sweep",,,"390;391;392","391;392"
"392","Infernape","Chimchar","FALSE",,"655","307","360",,"0/13/15","1/15/14","15/15/15",,"21","39.5","50",,"1491","2500","3033",,"Fire Spin, Close Combat, Blast Burn","Fire Spin, Close Combat, Blast Burn","Fire Spin, Close Combat, Blast Burn","390;391;392","392"
"392","Infernape (Shadow)","Chimchar","TRUE",,"716","427","388",,"0/13/15","1/15/14","15/15/15",,"21","39.5","50",,"1491","2500","3033",,"Fire Spin, Close Combat, Blast Burn","Fire Spin, Close Combat, Blast Burn","Fire Spin, Close Combat, Blast Burn","390;391;392","392"
"393","Piplup","Piplup","FALSE",,"909",,,,"15/15/14",,,,"50",,,,"1215",,,,"Bubble, Drill Peck, Icy Wind",,,"393;394;395","393;394;395"
"393","Piplup (Shadow)","Piplup","TRUE",,"913",,,,"15/15/14",,,,"50",,,,"1215",,,,"Bubble, Drill Peck, Icy Wind",,,"393;394;395","393;394;395"
"394","Prinplup","Piplup","FALSE",,"479",,,,"0/15/14",,,,"38",,,,"1500",,,,"Bubble, Icy Wind, Hydro Pump",,,"393;394;395","394;395"
"394","Prinplup (Shadow)","Piplup","TRUE",,"604",,,,"0/15/14",,,,"38",,,,"1500",,,,"Bubble, Icy Wind, Hydro Pump",,,"393;394;395","394;395"
"395","Empoleon","Piplup","FALSE",,"222","180","224",,"0/13/15","1/15/14","15/15/15",,"19.5","34.5","50",,"1500","2488","3279",,"Metal Claw, Hydro Cannon, Drill Peck","Metal Claw, Hydro Cannon, Drill Peck","Metal Claw, Hydro Cannon, Drill Peck","393;394;395","395"
