"ID","Pokemon","Family","Shadow","Little_Rank","Great_Rank","Ultra_Rank","Master_Rank","Little_IVs","Great_IVs","Ultra_IVs","Master_IVs","Little_Level","Great_Level","Ultra_Level","Master_Level","Little_CP","Great_CP","Ultra_CP","Master_CP","Little_MoveSet","Great_MoveSet","Ultra_MoveSet","Master_MoveSet","Evo_Fam","Evo_Next"
"327","Spinda","Spinda","FALSE",,"113",,,,"15/15/14",,,,"50",,,,"1380",,,,"Sucker Punch, Icy Wind, Dig",,,"327","327"
"328","Trapinch","Trapinch","FALSE",,"676",,,,"15/15/15",,,,"50",,,,"1441",,,,"Sand Attack, Scorching Sands, Crunch",,,"328;329;330","328;329;330"
"328","Trapinch (Shadow)","Trapinch","TRUE",,"678",,,,"15/15/15",,,,"50",,,,"1441",,,,"Sand Attack, Crunch, Scorching Sands",,,"328;329;330","328;329;330"
"329","Vibrava","Trapinch","FALSE",,"418",,,,"15/15/15",,,,"50",,,,"1384",,,,"Dragon Breath, Sand Tomb, Bug Buzz",,,"328;329;330","329;330"
"329","Vibrava (Shadow)","Trapinch","TRUE",,"355",,,,"15/15/15",,,,"50",,,,"1384",,,,"Dragon Breath, Sand Tomb, Bug Buzz",,,"328;329;330","329;330"
"330","Flygon","Trapinch","FALSE",,"70",,,,"0/15/9",,,,"21.5",,,,"1499",,,,"Dragon Tail, Scorching Sands, Dragon Claw",,,"328;329;330","330"
"330","Flygon (Shadow)","Trapinch","TRUE",,"78",,,,"0/15/9",,,,"21.5",,,,"1499",,,,"Dragon Tail, Dragon Claw, Scorching Sands",,,"328;329;330","330"
"334","Altaria","Swablu","FALSE",,"45",,,,"0/14/15",,,,"29",,,,"1498",,,,"Dragon Breath, Sky Attack, Moonblast",,,"333;334","334"
"335","Zangoose","Zangoose","FALSE",,"158",,,,"0/15/10",,,,"23.5",,,,"1494",,,,"Shadow Claw, Night Slash, Close Combat",,,"335","335"
"336","Seviper","Seviper","FALSE",,"377",,,,"0/15/12",,,,"27",,,,"1500",,,,"Poison Jab, Crunch, Poison Fang",,,"336","336"
"337","Lunatone","Lunatone","FALSE",,"109",,,,"0/15/14",,,,"24.5",,,,"1494",,,,"Psywave, Rock Slide, Psychic",,,"337","337"
"338","Solrock","Solrock","FALSE",,"110",,,,"0/15/14",,,,"24.5",,,,"1494",,,,"Psywave, Rock Slide, Psychic",,,"338","338"
"340","Whiscash","Barboach","FALSE",,"100",,,,"0/14/13",,,,"28",,,,"1490",,,,"Mud Shot, Mud Bomb, Scald",,,"339;340","340"
"340","Whiscash (Shadow)","Barboach","TRUE",,"92",,,,"0/14/13",,,,"28",,,,"1490",,,,"Mud Shot, Mud Bomb, Scald",,,"339;340","340"
"341","Corphish","Corphish","FALSE",,"744",,,,"15/15/15",,,,"50",,,,"1391",,,,"Bubble, Scald, Razor Shell",,,"341;342","341;342"
"341","Corphish (Shadow)","Corphish","TRUE",,"686",,,,"15/15/15",,,,"50",,,,"1391",,,,"Bubble, Scald, Razor Shell",,,"341;342","341;342"
"344","Claydol","Baltoy","FALSE",,"264",,,,"0/14/15",,,,"29.5",,,,"1488",,,,"Mud Slap, Ice Beam, Shadow Ball",,,"343;344","344"
"345","Lileep","Lileep","FALSE",,"170",,,,"15/15/15",,,,"50",,,,"1460",,,,"Bullet Seed, Ancient Power, Grass Knot",,,"345;346","345;346"
"345","Lileep (Shadow)","Lileep","TRUE",,"179",,,,"15/15/15",,,,"50",,,,"1460",,,,"Bullet Seed, Ancient Power, Grass Knot",,,"345;346","345;346"
"346","Cradily","Lileep","FALSE",,"122",,,,"0/15/15",,,,"26",,,,"1498",,,,"Bullet Seed, Rock Slide, Grass Knot",,,"345;346","346"
"346","Cradily (Shadow)","Lileep","TRUE",,"104",,,,"0/15/15",,,,"26",,,,"1498",,,,"Bullet Seed, Rock Slide, Grass Knot",,,"345;346","346"
"347","Anorith","Anorith","FALSE",,"803",,,,"0/15/15",,,,"45",,,,"1500",,,,"Struggle Bug, Ancient Power, Cross Poison",,,"347;348","347;348"
"347","Anorith (Shadow)","Anorith","TRUE",,"805",,,,"0/15/15",,,,"45",,,,"1500",,,,"Struggle Bug, Ancient Power, Cross Poison",,,"347;348","347;348"
"348","Armaldo","Anorith","FALSE",,"516",,,,"0/9/15",,,,"20",,,,"1497",,,,"Fury Cutter, Rock Blast, Liquidation",,,"347;348","348"
"348","Armaldo (Shadow)","Anorith","TRUE",,"391",,,,"0/9/15",,,,"20",,,,"1497",,,,"Fury Cutter, Rock Blast, Liquidation",,,"347;348","348"
"350","Milotic","Feebas","FALSE",,"237",,,,"0/15/11",,,,"19",,,,"1495",,,,"Dragon Tail, Surf, Blizzard",,,"349;350","350"
"352","Kecleon","Kecleon","FALSE",,"139",,,,"0/15/15",,,,"28",,,,"1495",,,,"Sucker Punch, Aerial Ace, Ice Beam",,,"352","352"
"354","Banette","Shuppet","FALSE",,"539",,,,"0/14/15",,,,"24.5",,,,"1500",,,,"Shadow Claw, Shadow Ball, Thunder",,,"353;354","354"
"354","Banette (Shadow)","Shuppet","TRUE",,"665",,,,"0/14/15",,,,"24.5",,,,"1500",,,,"Shadow Claw, Shadow Ball, Thunder",,,"353;354","354"
"356","Dusclops","Duskull","FALSE",,"128",,,,"0/11/15",,,,"45",,,,"1498",,,,"Hex, Ice Punch, Poltergeist",,,"355;356;477","356;477"
"356","Dusclops (Shadow)","Duskull","TRUE",,"320",,,,"0/11/15",,,,"45",,,,"1498",,,,"Hex, Ice Punch, Poltergeist",,,"355;356;477","356;477"
"357","Tropius","Tropius","FALSE",,"49",,,,"0/15/15",,,,"30",,,,"1494",,,,"Air Slash, Leaf Blade, Aerial Ace",,,"357","357"
"358","Chimecho","Chimecho","FALSE",,"426",,,,"0/14/12",,,,"25.5",,,,"1500",,,,"Astonish, Psyshock, Shadow Ball",,,"358;433","358;433"
"362","Glalie","Snorunt","FALSE",,"296",,,,"0/13/13",,,,"27.5",,,,"1498",,,,"Ice Shard, Avalanche, Shadow Ball",,,"361;362","362"
"362","Glalie (Shadow)","Snorunt","TRUE",,"371",,,,"0/13/13",,,,"27.5",,,,"1498",,,,"Ice Shard, Avalanche, Shadow Ball",,,"361;362","362"
"364","Sealeo","Spheal","FALSE",,"143",,,,"0/15/14",,,,"38",,,,"1497",,,,"Powder Snow, Water Pulse, Body Slam",,,"363;364;365","364;365"
"364","Sealeo (Shadow)","Spheal","TRUE",,"95",,,,"0/15/14",,,,"38",,,,"1497",,,,"Powder Snow, Water Pulse, Body Slam",,,"363;364;365","364;365"
"365","Walrein","Spheal","FALSE",,"47",,,,"0/12/15",,,,"21",,,,"1495",,,,"Powder Snow, Icicle Spear, Earthquake",,,"363;364;365","365"
"365","Walrein (Shadow)","Spheal","TRUE",,"51",,,,"0/12/15",,,,"21",,,,"1495",,,,"Powder Snow, Icicle Spear, Earthquake",,,"363;364;365","365"
"366","Clamperl","Clamperl","FALSE",,"581",,,,"15/15/14",,,,"50",,,,"1436",,,,"Water Gun, Body Slam, Ice Beam",,,"366;367","366;367"
"367","Huntail","Clamperl","FALSE",,"385",,,,"1/15/15",,,,"24",,,,"1498",,,,"Water Gun, Aqua Tail, Crunch",,,"366;367","367"
"368","Gorebyss","Gorebyss","FALSE",,"790",,,,"0/15/15",,,,"22.5",,,,"1500",,,,"Confusion, Water Pulse, Psychic",,,"366;368","368"
"369","Relicanth","Relicanth","FALSE",,"174",,,,"1/15/15",,,,"22.5",,,,"1498",,,,"Water Gun, Aqua Tail, Ancient Power",,,"369","369"
"372","Shelgon","Bagon","FALSE",,"282",,,,"1/15/14",,,,"28",,,,"1493",,,,"Dragon Breath, Flamethrower, Twister",,,"371;372;373","372;373"
"372","Shelgon (Shadow)","Bagon","TRUE",,"284",,,,"1/15/14",,,,"28",,,,"1493",,,,"Dragon Breath, Dragon Pulse, Flamethrower",,,"371;372;373","372;373"
"373","Salamence","Bagon","FALSE",,"291",,,,"0/10/14",,,,"15",,,,"1490",,,,"Dragon Tail, Fly, Outrage",,,"371;372;373","373"
"373","Salamence (Shadow)","Bagon","TRUE",,"260",,,,"0/10/14",,,,"15",,,,"1490",,,,"Dragon Tail, Fly, Outrage",,,"371;372;373","373"
"377","Regirock","Regirock","FALSE",,"76",,,,"0/10/12",,,,"18.5",,,,"1497",,,,"Lock On, Stone Edge, Focus Blast",,,"377","377"
"377","Regirock (Shadow)","Regirock","TRUE",,"87",,,,"0/10/12",,,,"18.5",,,,"1497",,,,"Lock On, Stone Edge, Focus Blast",,,"377","377"
"378","Regice","Regice","FALSE",,"106",,,,"0/10/12",,,,"18.5",,,,"1497",,,,"Lock On, Blizzard, Thunder",,,"378","378"
"378","Regice (Shadow)","Regice","TRUE",,"189",,,,"0/10/12",,,,"18.5",,,,"1497",,,,"Lock On, Blizzard, Thunder",,,"378","378"
"380","Latias","Latias","FALSE",,"373",,,,"0/14/14",,,,"16",,,,"1499",,,,"Dragon Breath, Mist Ball, Thunder",,,"380","380"
"380","Latias (Shadow)","Latias","TRUE",,"283",,,,"0/14/14",,,,"16",,,,"1499",,,,"Dragon Breath, Mist Ball, Thunder",,,"380","380"
"381","Latios","Latios","FALSE",,"166",,,,"0/15/15",,,,"14.5",,,,"1497",,,,"Dragon Breath, Dragon Claw, Luster Purge",,,"381","381"
"381","Latios (Shadow)","Latios","TRUE",,"120",,,,"0/15/15",,,,"14.5",,,,"1497",,,,"Dragon Breath, Dragon Claw, Luster Purge",,,"381","381"
"382","Kyogre (Shadow)","Kyogre","TRUE",,"615",,,,"0/15/13",,,,"13.5",,,,"1500",,,,"Waterfall, Surf, Origin Pulse",,,"382","382"
"383","Groudon (Shadow)","Groudon","TRUE",,"604",,,,"0/15/13",,,,"13.5",,,,"1500",,,,"Mud Shot, Precipice Blades, Fire Punch",,,"383","383"
"384","Rayquaza","Rayquaza","FALSE",,"246",,,,"0/15/12",,,,"14.5",,,,"1496",,,,"Dragon Tail, Breaking Swipe, Dragon Ascent",,,"384","384"
"386","Deoxys (Defense)","Deoxys","FALSE",,"185",,,,"0/15/15",,,,"25.5",,,,"1491",,,,"Counter, Psycho Boost, Thunderbolt",,,"386","386"
"386","Deoxys (Speed)","Deoxys","FALSE",,"792",,,,"0/14/14",,,,"19.5",,,,"1499",,,,"Charge Beam, Psycho Boost, Swift",,,"386","386"
"387","Turtwig","Turtwig","FALSE",,"775",,,,"15/15/15",,,,"50",,,,"1342",,,,"Tackle, Body Slam, Seed Bomb",,,"387;388;389","387;388;389"
"387","Turtwig (Shadow)","Turtwig","TRUE",,"763",,,,"15/15/15",,,,"50",,,,"1342",,,,"Tackle, Body Slam, Seed Bomb",,,"387;388;389","387;388;389"
"388","Grotle","Turtwig","FALSE",,"408",,,,"0/15/11",,,,"31.5",,,,"1497",,,,"Razor Leaf, Body Slam, Energy Ball",,,"387;388;389","388;389"
"388","Grotle (Shadow)","Turtwig","TRUE",,"321",,,,"0/15/11",,,,"31.5",,,,"1497",,,,"Razor Leaf, Body Slam, Energy Ball",,,"387;388;389","388;389"
"389","Torterra","Turtwig","FALSE",,"427",,,,"0/11/13",,,,"19.5",,,,"1496",,,,"Razor Leaf, Frenzy Plant, Stone Edge",,,"387;388;389","389"
"389","Torterra (Shadow)","Turtwig","TRUE",,"345",,,,"0/11/13",,,,"19.5",,,,"1496",,,,"Razor Leaf, Frenzy Plant, Stone Edge",,,"387;388;389","389"
"391","Monferno","Chimchar","FALSE",,"755",,,,"0/15/14",,,,"43.5",,,,"1498",,,,"Ember, Flamethrower, Low Sweep",,,"390;391;392","391;392"
"391","Monferno (Shadow)","Chimchar","TRUE",,"750",,,,"0/15/14",,,,"43.5",,,,"1498",,,,"Ember, Flamethrower, Low Sweep",,,"390;391;392","391;392"
"392","Infernape","Chimchar","FALSE",,"559",,,,"0/13/15",,,,"21",,,,"1491",,,,"Fire Spin, Close Combat, Blast Burn",,,"390;391;392","392"
"392","Infernape (Shadow)","Chimchar","TRUE",,"625",,,,"0/13/15",,,,"21",,,,"1491",,,,"Fire Spin, Close Combat, Blast Burn",,,"390;391;392","392"
"393","Piplup","Piplup","FALSE",,"747",,,,"15/15/14",,,,"50",,,,"1215",,,,"Bubble, Drill Peck, Icy Wind",,,"393;394;395","393;394;395"
"393","Piplup (Shadow)","Piplup","TRUE",,"736",,,,"15/15/14",,,,"50",,,,"1215",,,,"Bubble, Drill Peck, Icy Wind",,,"393;394;395","393;394;395"
"394","Prinplup","Piplup","FALSE",,"396",,,,"0/15/14",,,,"38",,,,"1500",,,,"Bubble, Icy Wind, Hydro Pump",,,"393;394;395","394;395"
"394","Prinplup (Shadow)","Piplup","TRUE",,"520",,,,"0/15/14",,,,"38",,,,"1500",,,,"Bubble, Icy Wind, Hydro Pump",,,"393;394;395","394;395"
"397","Staravia","Starly","FALSE",,"115",,,,"15/15/15",,,,"50",,,,"1468",,,,"Quick Attack, Brave Bird, Fly",,,"396;397;398","397;398"
"397","Staravia (Shadow)","Starly","TRUE",,"150",,,,"15/15/15",,,,"50",,,,"1468",,,,"Quick Attack, Brave Bird, Fly",,,"396;397;398","397;398"
"398","Staraptor","Starly","FALSE",,"162",,,,"0/13/13",,,,"20",,,,"1492",,,,"Quick Attack, Fly, Close Combat",,,"396;397;398","398"
"398","Staraptor (Shadow)","Starly","TRUE",,"172",,,,"0/13/13",,,,"20",,,,"1492",,,,"Quick Attack, Fly, Close Combat",,,"396;397;398","398"
"400","Bibarel","Bidoof","FALSE",,"444",,,,"0/14/13",,,,"33.5",,,,"1499",,,,"Water Gun, Surf, Hyper Fang",,,"399;400","400"
"400","Bibarel (Shadow)","Bidoof","TRUE",,"450",,,,"0/14/13",,,,"33.5",,,,"1499",,,,"Water Gun, Surf, Hyper Fang",,,"399;400","400"
"402","Kricketune","Kricketot","FALSE",,"357",,,,"0/15/15",,,,"39.5",,,,"1492",,,,"Fury Cutter, X-Scissor, Aerial Ace",,,"401;402","402"
"404","Luxio","Shinx","FALSE",,"631",,,,"0/15/15",,,,"48",,,,"1500",,,,"Spark, Wild Charge, Crunch",,,"403;404;405","404;405"
"404","Luxio (Shadow)","Shinx","TRUE",,"680",,,,"0/15/15",,,,"48",,,,"1493",,,,"Spark, Wild Charge, Crunch",,,"403;404;405","404;405"
"405","Luxray","Shinx","FALSE",,"445",,,,"0/15/12",,,,"19.5",,,,"1496",,,,"Spark, Wild Charge, Psychic Fangs",,,"403;404;405","405"
"405","Luxray (Shadow)","Shinx","TRUE",,"492",,,,"0/15/12",,,,"19.5",,,,"1496",,,,"Snarl, Wild Charge, Psychic Fangs",,,"403;404;405","405"
"407","Roserade","Roselia","FALSE",,"513",,,,"0/11/14",,,,"19",,,,"1497",,,,"Bullet Seed, Weather Ball (Fire), Leaf Storm",,,"315;406;407","406;407"
"409","Rampardos","Cranidos","FALSE",,"749",,,,"1/14/8",,,,"17",,,,"1498",,,,"Smack Down, Rock Slide, Outrage",,,"408;409","409"
"409","Rampardos (Shadow)","Cranidos","TRUE",,"618",,,,"1/14/8",,,,"17",,,,"1498",,,,"Smack Down, Rock Slide, Outrage",,,"408;409","409"
"413","Wormadam (Plant)","Burmy","FALSE",,"641",,,,"0/15/14",,,,"35.5",,,,"1497",,,,"Confusion, Energy Ball, Bug Buzz",,,"412;413","413"
"413","Wormadam (Sandy)","Burmy","FALSE",,"558",,,,"0/15/14",,,,"35.5",,,,"1497",,,,"Confusion, Bug Buzz, Bulldoze",,,"412;413","413"
"414","Mothim","Mothim","FALSE",,"724",,,,"0/15/15",,,,"32.5",,,,"1496",,,,"Air Slash, Aerial Ace, Bug Buzz",,,"412;414","414"
"416","Vespiquen","Combee","FALSE",,"238",,,,"0/14/13",,,,"29",,,,"1500",,,,"Poison Sting, X-Scissor, Power Gem",,,"415;416","416"
"417","Pachirisu","Pachirisu","FALSE",,"157",,,,"15/15/14",,,,"50",,,,"1372",,,,"Volt Switch, Thunder Punch, Thunderbolt",,,"417","417"
"419","Floatzel","Buizel","FALSE",,"543",,,,"0/15/13",,,,"23",,,,"1494",,,,"Waterfall, Liquidation, Swift",,,"418;419","419"
"421","Cherrim (Overcast)","Cherubi","FALSE",,"809",,,,"0/13/15",,,,"28",,,,"1498",,,,"Bullet Seed, Solar Beam, Dazzling Gleam",,,"420;421","421"
"421","Cherrim (Sunshine)","Cherubi","FALSE",,"542",,,,"0/13/15",,,,"28",,,,"1498",,,,"Bullet Seed, Weather Ball (Fire), Solar Beam",,,"420;421","421"
"422","Shellos","Shellos","FALSE",,"526",,,,"15/15/15",,,,"50",,,,"1284",,,,"Mud Slap, Body Slam, Mud Bomb",,,"422;423","422;423"
"423","Gastrodon","Shellos","FALSE",,"14",,,,"1/15/14",,,,"24.5",,,,"1497",,,,"Mud Slap, Body Slam, Earth Power",,,"422;423","423"
"424","Ambipom","Aipom","FALSE",,"515",,,,"0/13/14",,,,"23.5",,,,"1496",,,,"Astonish, Aerial Ace, Return",,,"190;424","424"
"424","Ambipom (Shadow)","Aipom","TRUE",,"570",,,,"0/13/14",,,,"23.5",,,,"1496",,,,"Astonish, Aerial Ace, Hyper Beam",,,"190;424","424"
"425","Drifloon","Drifloon","FALSE",,"123",,,,"15/15/15",,,,"50",,,,"1353",,,,"Astonish, Icy Wind, Shadow Ball",,,"425;426","425;426"
"425","Drifloon (Shadow)","Drifloon","TRUE",,"141",,,,"15/15/15",,,,"50",,,,"1353",,,,"Astonish, Icy Wind, Shadow Ball",,,"425;426","425;426"
"426","Drifblim","Drifloon","FALSE",,"9",,,,"0/15/12",,,,"24",,,,"1498",,,,"Astonish, Icy Wind, Shadow Ball",,,"425;426","426"
"426","Drifblim (Shadow)","Drifloon","TRUE",,"27",,,,"0/15/12",,,,"24",,,,"1498",,,,"Astonish, Icy Wind, Shadow Ball",,,"425;426","426"
"427","Buneary","Buneary","FALSE",,"415",,,,"15/15/15",,,,"50",,,,"1423",,,,"Quick Attack, Swift, Fire Punch",,,"427;428","427;428"
"428","Lopunny","Buneary","FALSE",,"310",,,,"0/15/14",,,,"28",,,,"1493",,,,"Double Kick, Triple Axel, Focus Blast",,,"427;428","428"
"429","Mismagius","Misdreavus","FALSE",,"177",,,,"0/15/15",,,,"21.5",,,,"1499",,,,"Psywave, Shadow Ball, Dark Pulse",,,"200;429","429"
"429","Mismagius (Shadow)","Misdreavus","TRUE",,"261",,,,"0/15/15",,,,"21.5",,,,"1499",,,,"Psywave, Shadow Ball, Dark Pulse",,,"200;429","429"
"432","Purugly","Glameow","FALSE",,"270",,,,"0/12/15",,,,"29.5",,,,"1489",,,,"Shadow Claw, Aerial Ace, Return",,,"431;432","432"
"432","Purugly (Shadow)","Glameow","TRUE",,"287",,,,"0/12/15",,,,"29.5",,,,"1489",,,,"Shadow Claw, Aerial Ace, Thunder",,,"431;432","432"
"438","Bonsly","Sudowoodo","FALSE",,"549",,,,"15/15/15",,,,"50",,,,"1472",,,,"Rock Throw, Rock Slide, Earthquake",,,"185;438","438"
"441","Chatot","Chatot","FALSE",,"771",,,,"0/15/14",,,,"33.5",,,,"1500",,,,"Steel Wing, Night Shade, Sky Attack",,,"441","441"
"444","Gabite","Gible","FALSE",,"636",,,,"0/15/14",,,,"31",,,,"1497",,,,"Mud Shot, Dig, Flamethrower",,,"443;444;445","444;445"
"444","Gabite (Shadow)","Gible","TRUE",,"697",,,,"0/15/14",,,,"31",,,,"1497",,,,"Mud Shot, Dig, Flamethrower",,,"443;444;445","444;445"
"445","Garchomp","Gible","FALSE",,"398",,,,"0/15/14",,,,"14",,,,"1495",,,,"Dragon Tail, Sand Tomb, Outrage",,,"443;444;445","445"
"445","Garchomp (Shadow)","Gible","TRUE",,"365",,,,"0/15/14",,,,"14",,,,"1495",,,,"Dragon Tail, Sand Tomb, Outrage",,,"443;444;445","445"
"446","Munchlax","Snorlax","FALSE",,"129",,,,"0/14/13",,,,"32",,,,"1499",,,,"Tackle, Body Slam, Bulldoze",,,"143;446","446"
"449","Hippopotas","Hippopotas","FALSE",,"315",,,,"13/15/14",,,,"49.5",,,,"1498",,,,"Sand Attack, Body Slam, Dig",,,"449;450","449;450"
"449","Hippopotas (Shadow)","Hippopotas","TRUE",,"227",,,,"13/15/14",,,,"49.5",,,,"1498",,,,"Sand Attack, Body Slam, Dig",,,"449;450","449;450"
"450","Hippowdon","Hippopotas","FALSE",,"144",,,,"0/14/10",,,,"18.5",,,,"1494",,,,"Sand Attack, Weather Ball (Rock), Scorching Sands",,,"449;450","450"
"450","Hippowdon (Shadow)","Hippopotas","TRUE",,"61",,,,"0/14/10",,,,"18.5",,,,"1494",,,,"Sand Attack, Weather Ball (Rock), Scorching Sands",,,"449;450","450"
"451","Skorupi","Skorupi","FALSE",,"699",,,,"15/15/15",,,,"50",,,,"1141",,,,"Poison Sting, Cross Poison, Aqua Tail",,,"451;452","451;452"
"451","Skorupi (Shadow)","Skorupi","TRUE",,"640",,,,"15/15/15",,,,"50",,,,"1141",,,,"Poison Sting, Cross Poison, Aqua Tail",,,"451;452","451;452"
"454","Toxicroak","Croagunk","FALSE",,"563",,,,"1/15/15",,,,"22.5",,,,"1498",,,,"Counter, Mud Bomb, Shadow Ball",,,"453;454","454"
"454","Toxicroak (Shadow)","Croagunk","TRUE",,"583",,,,"1/15/15",,,,"22.5",,,,"1498",,,,"Counter, Mud Bomb, Shadow Ball",,,"453;454","454"
"455","Carnivine","Carnivine","FALSE",,"383",,,,"0/14/13",,,,"26.5",,,,"1498",,,,"Vine Whip, Crunch, Power Whip",,,"455","455"
"457","Lumineon","Finneon","FALSE",,"395",,,,"0/15/12",,,,"34.5",,,,"1497",,,,"Water Gun, Water Pulse, Silver Wind",,,"456;457","457"
"458","Mantyke","Mantine","FALSE",,"225",,,,"15/15/15",,,,"50",,,,"1411",,,,"Bubble, Aerial Ace, Water Pulse",,,"226;458","458"
"459","Snover","Snover","FALSE",,"579",,,,"15/15/14",,,,"50",,,,"1311",,,,"Powder Snow, Ice Beam, Energy Ball",,,"459;460","459;460"
"459","Snover (Shadow)","Snover","TRUE",,"682",,,,"15/15/14",,,,"50",,,,"1311",,,,"Powder Snow, Ice Beam, Energy Ball",,,"459;460","459;460"
"460","Abomasnow","Snover","FALSE",,"50",,,,"0/15/15",,,,"24",,,,"1491",,,,"Powder Snow, Icy Wind, Energy Ball",,,"459;460","460"
"460","Abomasnow (Shadow)","Snover","TRUE",,"44",,,,"0/15/15",,,,"24",,,,"1491",,,,"Powder Snow, Weather Ball (Ice), Energy Ball",,,"459;460","460"
"463","Lickilicky","Lickitung","FALSE",,"2",,,,"0/15/10",,,,"23.5",,,,"1498",,,,"Rollout, Body Slam, Shadow Ball",,,"108;463","463"
"464","Rhyperior","Rhyhorn","FALSE",,"257",,,,"0/14/14",,,,"15",,,,"1498",,,,"Mud Slap, Breaking Swipe, Rock Wrecker",,,"111;112;464","464"
"464","Rhyperior (Shadow)","Rhyhorn","TRUE",,"187",,,,"0/14/14",,,,"15",,,,"1498",,,,"Mud Slap, Breaking Swipe, Rock Wrecker",,,"111;112;464","464"
"465","Tangrowth","Tangela","FALSE",,"308",,,,"1/15/14",,,,"18.5",,,,"1498",,,,"Vine Whip, Power Whip, Rock Slide",,,"114;465","465"
"465","Tangrowth (Shadow)","Tangela","TRUE",,"317",,,,"1/15/14",,,,"18.5",,,,"1498",,,,"Vine Whip, Power Whip, Rock Slide",,,"114;465","465"
"466","Electivire","Electabuzz","FALSE",,"394",,,,"1/15/15",,,,"18",,,,"1498",,,,"Thunder Shock, Ice Punch, Wild Charge",,,"125;239;466","239;466"
"466","Electivire (Shadow)","Electabuzz","TRUE",,"364",,,,"1/15/15",,,,"18",,,,"1498",,,,"Thunder Shock, Ice Punch, Wild Charge",,,"125;239;466","239;466"
"467","Magmortar","Magmar","FALSE",,"378",,,,"0/10/15",,,,"18",,,,"1500",,,,"Karate Chop, Fire Punch, Thunderbolt",,,"126;240;467","240;467"
"467","Magmortar (Shadow)","Magmar","TRUE",,"314",,,,"0/10/15",,,,"18",,,,"1500",,,,"Karate Chop, Fire Punch, Thunderbolt",,,"126;240;467","240;467"
"469","Yanmega","Yanma","FALSE",,"592",,,,"0/14/15",,,,"19",,,,"1498",,,,"Wing Attack, Aerial Ace, Ancient Power",,,"193;469","469"
"470","Leafeon","Leafeon","FALSE",,"215",,,,"1/15/14",,,,"19",,,,"1496",,,,"Quick Attack, Leaf Blade, Last Resort",,,"133;470","470"
"471","Glaceon","Glaceon","FALSE",,"576",,,,"0/15/12",,,,"18",,,,"1499",,,,"Ice Shard, Avalanche, Icy Wind",,,"133;471","471"
"472","Gliscor","Gligar","FALSE",,"192",,,,"1/15/14",,,,"21",,,,"1496",,,,"Fury Cutter, Earthquake, Aerial Ace",,,"207;472","472"
"472","Gliscor (Shadow)","Gligar","TRUE",,"212",,,,"1/15/14",,,,"21",,,,"1496",,,,"Fury Cutter, Earthquake, Aerial Ace",,,"207;472","472"
"473","Mamoswine","Swinub","FALSE",,"311",,,,"0/15/7",,,,"17",,,,"1491",,,,"Powder Snow, Avalanche, High Horsepower",,,"220;221;473","473"
"473","Mamoswine (Shadow)","Swinub","TRUE",,"325",,,,"0/15/7",,,,"17",,,,"1491",,,,"Powder Snow, Avalanche, High Horsepower",,,"220;221;473","473"
"474","Porygon-Z","Porygon","FALSE",,"774",,,,"1/15/13",,,,"17",,,,"1499",,,,"Lock On, Tri Attack, Zap Cannon",,,"137;233;474","474"
"474","Porygon-Z (Shadow)","Porygon","TRUE",,"776",,,,"1/15/13",,,,"17",,,,"1499",,,,"Lock On, Tri Attack, Zap Cannon",,,"137;233;474","474"
"475","Gallade","Gallade","FALSE",,"62",,,,"0/15/15",,,,"18",,,,"1498",,,,"Psycho Cut, Leaf Blade, Close Combat",,,"280;281;475","475"
"475","Gallade (Shadow)","Gallade","TRUE",,"31",,,,"0/15/15",,,,"18",,,,"1498",,,,"Psycho Cut, Leaf Blade, Close Combat",,,"280;281;475","475"
"477","Dusknoir","Duskull","FALSE",,"36",,,,"0/14/13",,,,"24",,,,"1499",,,,"Astonish, Shadow Ball, Shadow Punch",,,"355;356;477","477"
"477","Dusknoir (Shadow)","Duskull","TRUE",,"28",,,,"0/14/13",,,,"24",,,,"1499",,,,"Astonish, Shadow Ball, Shadow Punch",,,"355;356;477","477"
"478","Froslass","Froslass","FALSE",,"41",,,,"0/15/15",,,,"28",,,,"1496",,,,"Powder Snow, Avalanche, Shadow Ball",,,"361;478","478"
"478","Froslass (Shadow)","Froslass","TRUE",,"59",,,,"0/15/15",,,,"28",,,,"1496",,,,"Powder Snow, Avalanche, Shadow Ball",,,"361;478","478"
"479","Rotom","Rotom","FALSE",,"416",,,,,,,,,,,,"1500",,,,"Astonish, Thunderbolt, Ominous Wind",,,"479","479"
"479","Rotom (Frost)","Rotom","FALSE",,"777",,,,"0/12/15",,,,"22",,,,"1491",,,,"Thunder Shock, Blizzard, Thunderbolt",,,"479","479"
"479","Rotom (Heat)","Rotom","FALSE",,"649",,,,"0/12/15",,,,"22",,,,"1491",,,,"Thunder Shock, Overheat, Thunderbolt",,,"479","479"
"479","Rotom (Mow)","Rotom","FALSE",,"714",,,,"0/12/15",,,,"22",,,,"1491",,,,"Astonish, Thunderbolt, Ominous Wind",,,"479","479"
"479","Rotom (Wash)","Rotom","FALSE",,"769",,,,"0/12/15",,,,"22",,,,"1491",,,,"Astonish, Thunderbolt, Hydro Pump",,,"479","479"
"480","Uxie","Uxie","FALSE",,"77",,,,"0/13/13",,,,"23",,,,"1500",,,,"Confusion, Swift, Future Sight",,,"480","480"
"481","Mesprit","Mesprit","FALSE",,"441",,,,"0/15/12",,,,"18.5",,,,"1500",,,,"Confusion, Swift, Future Sight",,,"481","481"
"482","Azelf","Azelf","FALSE",,"624",,,,"0/14/11",,,,"17.5",,,,"1500",,,,"Confusion, Swift, Future Sight",,,"482","482"
"486","Regigigas (Shadow)","Regigigas","TRUE",,"811",,,,"0/8/12",,,,"13",,,,"1496",,,,"Hidden Power (Rock), Thunder, Giga Impact",,,"486","486"
"487","Giratina (Origin)","Giratina","FALSE",,"74",,,,"0/10/11",,,,"15.5",,,,"1499",,,,"Shadow Claw, Ominous Wind, Shadow Ball",,,"487","487"
"488","Cresselia","Cresselia","FALSE",,"11",,,,"2/15/13",,,,"20",,,,"1497",,,,"Psycho Cut, Grass Knot, Moonblast",,,"488","488"
"488","Cresselia (Shadow)","Cresselia","TRUE",,"32",,,,"2/15/13",,,,"20",,,,"1497",,,,"Psycho Cut, Grass Knot, Moonblast",,,"488","488"
"492","Shaymin (Land)","Shaymin","FALSE",,"578",,,,"0/10/13",,,,"17.5",,,,"1492",,,,"Magical Leaf, Grass Knot, Seed Flare",,,"492","492"
"492","Shaymin (Sky)","Shaymin","FALSE",,"742",,,,"0/14/15",,,,"15.5",,,,"1489",,,,"Magical Leaf, Grass Knot, Energy Ball",,,"492","492"
"494","Victini","Victini","FALSE",,"277",,,,"0/10/13",,,,"17.5",,,,"1498",,,,"Quick Attack, V-Create, Psychic",,,"494","494"
"496","Servine","Snivy","FALSE",,"265",,,,"4/15/14",,,,"50",,,,"1500",,,,"Vine Whip, Grass Knot, Wrap",,,"495;496;497","496;497"
"497","Serperior","Snivy","FALSE",,"43",,,,"0/10/15",,,,"25.5",,,,"1499",,,,"Vine Whip, Frenzy Plant, Aerial Ace",,,"495;496;497","497"
"499","Pignite","Tepig","FALSE",,"728",,,,"0/15/15",,,,"29.5",,,,"1495",,,,"Ember, Flame Charge, Rock Tomb",,,"498;499;500","499;500"
"500","Emboar","Tepig","FALSE",,"759",,,,"0/14/9",,,,"19",,,,"1494",,,,"Ember, Blast Burn, Rock Slide",,,"498;499;500","500"
"502","Dewott","Oshawott","FALSE",,"201",,,,"0/15/15",,,,"36",,,,"1498",,,,"Fury Cutter, Aqua Tail, X-Scissor",,,"501;502;503","502;503"
"503","Samurott","Oshawott","FALSE",,"71",,,,"0/14/14",,,,"20",,,,"1498",,,,"Fury Cutter, Hydro Cannon, Megahorn",,,"501;502;503","503"
"505","Watchog","Patrat","FALSE",,"684",,,,"0/15/15",,,,"33",,,,"1497",,,,"Bite, Crunch, Hyper Fang",,,"504;505","505"
"505","Watchog (Shadow)","Patrat","TRUE",,"629",,,,"0/15/15",,,,"33",,,,"1497",,,,"Bite, Crunch, Hyper Fang",,,"504;505","505"
"507","Herdier","Lillipup","FALSE",,"491",,,,"1/15/15",,,,"43",,,,"1497",,,,"Sand Attack, Dig, Thunderbolt",,,"506;507;508","507;508"
"508","Stoutland","Lillipup","FALSE",,"351",,,,"0/15/13",,,,"20",,,,"1500",,,,"Sand Attack, Wild Charge, Crunch",,,"506;507;508","508"
"512","Simisage","Pansage","FALSE",,"462",,,,"0/14/15",,,,"24",,,,"1496",,,,"Vine Whip, Crunch, Grass Knot",,,"511;512","512"
"514","Simisear","Pansear","FALSE",,"656",,,,"0/14/15",,,,"24",,,,"1496",,,,"Fire Spin, Crunch, Flamethrower",,,"513;514","514"
"516","Simipour","Panpour","FALSE",,"626",,,,"0/14/15",,,,"24",,,,"1496",,,,"Water Gun, Surf, Crunch",,,"515;516","516"
"517","Munna","Munna","FALSE",,"816",,,,"15/15/15",,,,"50",,,,"1294",,,,"Charge Beam, Psyshock, Dazzling Gleam",,,"517;518","517;518"
"518","Musharna","Munna","FALSE",,"786",,,,"0/12/15",,,,"21",,,,"1499",,,,"Charge Beam, Psyshock, Dazzling Gleam",,,"517;518","518"
"520","Tranquill","Pidove","FALSE",,"553",,,,"2/15/15",,,,"50",,,,"1494",,,,"Air Slash, Aerial Ace, Return",,,"519;520;521","520;521"
"520","Tranquill (Shadow)","Pidove","TRUE",,"474",,,,"2/15/15",,,,"50",,,,"1494",,,,"Air Slash, Aerial Ace, Sky Attack",,,"519;520;521","520;521"
