"ID","Pokemon","Family","Shadow","Little_Rank","Great_Rank","Ultra_Rank","Master_Rank","Little_IVs","Great_IVs","Ultra_IVs","Master_IVs","Little_Level","Great_Level","Ultra_Level","Master_Level","Little_CP","Great_CP","Ultra_CP","Master_CP","Little_MoveSet","Great_MoveSet","Ultra_MoveSet","Master_MoveSet","Evo_Fam","Evo_Next"
"1","Bulbasaur","Bulbasaur","FALSE",,"742",,,,"15/15/15",,,,"50",,,,"1260",,,,"Vine Whip, Power Whip, Sludge Bomb",,,"1;2;3","1;2;3"
"1","Bulbasaur (Shadow)","Bulbasaur","TRUE",,"782",,,,"15/15/15",,,,"50",,,,"1260",,,,"Vine Whip, Power Whip, Sludge Bomb",,,"1;2;3","1;2;3"
"2","Ivysaur","Bulbasaur","FALSE",,"311",,,,"0/13/14",,,,"38.5",,,,"1493",,,,"Vine Whip, Power Whip, Sludge Bomb",,,"1;2;3","2;3"
"2","Ivysaur (Shadow)","Bulbasaur","TRUE",,"381",,,,"0/13/14",,,,"38.5",,,,"1497",,,,"Vine Whip, Power Whip, Sludge Bomb",,,"1;2;3","2;3"
"3","Venusaur","Bulbasaur","FALSE",,"110",,,,"0/14/11",,,,"21",,,,"1496",,,,"Vine Whip, Frenzy Plant, Sludge Bomb",,,"1;2;3","3"
"3","Venusaur (Shadow)","Bulbasaur","TRUE",,"154",,,,"0/14/11",,,,"21",,,,"1496",,,,"Vine Whip, Frenzy Plant, Sludge Bomb",,,"1;2;3","3"
"5","Charmeleon","Charmander","FALSE",,"630",,,,"0/13/15",,,,"40",,,,"1496",,,,"Fire Fang, Fire Punch, Return",,,"4;5;6","5;6"
"5","Charmeleon (Shadow)","Charmander","TRUE",,"569",,,,"0/13/15",,,,"40",,,,"1496",,,,"Fire Fang, Fire Punch, Flamethrower",,,"4;5;6","5;6"
"6","Charizard","Charmander","FALSE",,"331",,,,"0/15/13",,,,"19.5",,,,"1488",,,,"Fire Spin, Blast Burn, Dragon Claw",,,"4;5;6","6"
"6","Charizard (Shadow)","Charmander","TRUE",,"290",,,,"0/15/13",,,,"19.5",,,,"1488",,,,"Fire Spin, Blast Burn, Dragon Claw",,,"4;5;6","6"
"8","Wartortle","Squirtle","FALSE",,"209",,,,"0/14/15",,,,"50",,,,"1496",,,,"Water Gun, Aqua Jet, Ice Beam",,,"7;8;9","8;9"
"8","Wartortle (Shadow)","Squirtle","TRUE",,"292",,,,"0/14/15",,,,"50",,,,"1496",,,,"Water Gun, Aqua Jet, Ice Beam",,,"7;8;9","8;9"
"9","Blastoise","Squirtle","FALSE",,"56",,,,"1/15/15",,,,"23",,,,"1492",,,,"Rollout, Hydro Cannon, Skull Bash",,,"7;8;9","9"
"9","Blastoise (Shadow)","Squirtle","TRUE",,"82",,,,"1/15/15",,,,"23",,,,"1492",,,,"Rollout, Hydro Cannon, Skull Bash",,,"7;8;9","9"
"12","Butterfree","Caterpie","FALSE",,"825",,,,"0/13/15",,,,"33",,,,"1494",,,,"Confusion, Bug Buzz, Signal Beam",,,"10;11;12","12"
"12","Butterfree (Shadow)","Caterpie","TRUE",,"816",,,,"0/13/15",,,,"33",,,,"1494",,,,"Confusion, Bug Buzz, Signal Beam",,,"10;11;12","12"
"15","Beedrill","Weedle","FALSE",,"298",,,,"0/13/14",,,,"32.5",,,,"1494",,,,"Poison Jab, X-Scissor, Drill Run",,,"13;14;15","15"
"15","Beedrill (Shadow)","Weedle","TRUE",,"289",,,,"0/13/14",,,,"32.5",,,,"1494",,,,"Poison Jab, X-Scissor, Drill Run",,,"13;14;15","15"
"17","Pidgeotto","Pidgey","FALSE",,"484",,,,"15/15/15",,,,"50",,,,"1350",,,,"Wing Attack, Air Cutter, Aerial Ace",,,"16;17;18","17;18"
"17","Pidgeotto (Shadow)","Pidgey","TRUE",,"408",,,,"15/15/15",,,,"50",,,,"1350",,,,"Wing Attack, Air Cutter, Aerial Ace",,,"16;17;18","17;18"
"18","Pidgeot","Pidgey","FALSE",,"218",,,,"0/14/14",,,,"27",,,,"1494",,,,"Gust, Feather Dance, Brave Bird",,,"16;17;18","18"
"18","Pidgeot (Shadow)","Pidgey","TRUE",,"269",,,,"0/14/14",,,,"27",,,,"1494",,,,"Gust, Brave Bird, Aerial Ace",,,"16;17;18","18"
"20","Raticate","Rattata","FALSE",,"624",,,,"0/14/15",,,,"36.5",,,,"1494",,,,"Quick Attack, Hyper Fang, Dig",,,"19;20","20"
"20","Raticate (Shadow)","Rattata","TRUE",,"618",,,,"0/14/15",,,,"36.5",,,,"1494",,,,"Quick Attack, Hyper Fang, Dig",,,"19;20","20"
"22","Fearow","Spearow","FALSE",,"677",,,,"0/15/14",,,,"28.5",,,,"1497",,,,"Steel Wing, Fly, Drill Run",,,"21;22","22"
"24","Arbok","Ekans","FALSE",,"690",,,,"0/11/14",,,,"30.5",,,,"1495",,,,"Dragon Tail, Dark Pulse, Sludge Wave",,,"23;24","24"
"24","Arbok (Shadow)","Ekans","TRUE",,"704",,,,"0/11/14",,,,"30.5",,,,"1495",,,,"Dragon Tail, Dark Pulse, Sludge Wave",,,"23;24","24"
"26","Raichu","Pikachu","FALSE",,"243",,,,"0/15/14",,,,"26",,,,"1495",,,,"Thunder Shock, Wild Charge, Brick Break",,,"25;26;172","26;172"
"26","Raichu (Alolan)","Pikachu","FALSE",,"129",,,,"1/15/15",,,,"24.5",,,,"1499",,,,"Thunder Shock, Wild Charge, Trailblaze",,,"25;26;172","26;172"
"27","Sandshrew","Sandshrew","FALSE",,"429",,,,"15/15/15",,,,"50",,,,"1426",,,,"Sand Attack, Rock Tomb, Dig",,,"27;28","27;28"
"27","Sandshrew (Shadow)","Sandshrew","TRUE",,"460",,,,"15/15/15",,,,"50",,,,"1426",,,,"Sand Attack, Rock Tomb, Dig",,,"27;28","27;28"
"28","Sandslash","Sandshrew","FALSE",,"251",,,,"0/14/15",,,,"24",,,,"1493",,,,"Sand Attack, Rock Tomb, Night Slash",,,"27;28","28"
"28","Sandslash (Shadow)","Sandshrew","TRUE",,"213",,,,"0/14/15",,,,"24",,,,"1493",,,,"Sand Attack, Rock Tomb, Night Slash",,,"27;28","28"
"30","Nidorina","Nidoran-f","FALSE",,"156",,,,"15/15/15",,,,"50",,,,"1480",,,,"Poison Sting, Poison Fang, Thunderbolt",,,"29;30;31","30;31"
"30","Nidorina (Shadow)","Nidoran-f","TRUE",,"236",,,,"15/15/15",,,,"50",,,,"1480",,,,"Poison Sting, Poison Fang, Dig",,,"29;30;31","30;31"
"31","Nidoqueen","Nidoran-f","FALSE",,"212",,,,"0/15/12",,,,"23",,,,"1499",,,,"Poison Jab, Earth Power, Poison Fang",,,"29;30;31","31"
"31","Nidoqueen (Shadow)","Nidoran-f","TRUE",,"242",,,,"0/15/12",,,,"23",,,,"1499",,,,"Poison Jab, Earth Power, Poison Fang",,,"29;30;31","31"
"33","Nidorino","Nidoran-m","FALSE",,"496",,,,"8/15/15",,,,"49.5",,,,"1500",,,,"Poison Sting, Sludge Bomb, Dig",,,"32;33;34","33;34"
"33","Nidorino (Shadow)","Nidoran-m","TRUE",,"451",,,,"8/15/15",,,,"49.5",,,,"1500",,,,"Poison Sting, Sludge Bomb, Dig",,,"32;33;34","33;34"
"34","Nidoking","Nidoran-m","FALSE",,"726",,,,"0/14/15",,,,"22",,,,"1498",,,,"Double Kick, Sand Tomb, Earth Power",,,"32;33;34","34"
"34","Nidoking (Shadow)","Nidoran-m","TRUE",,"699",,,,"0/14/15",,,,"22",,,,"1498",,,,"Double Kick, Sand Tomb, Earth Power",,,"32;33;34","34"
"38","Ninetales","Vulpix","FALSE",,"246",,,,"0/15/15",,,,"25",,,,"1494",,,,"Fire Spin, Weather Ball (Fire), Overheat",,,"37;38","38"
"38","Ninetales (Shadow)","Vulpix","TRUE",,"221",,,,"0/15/15",,,,"25",,,,"1494",,,,"Fire Spin, Weather Ball (Fire), Overheat",,,"37;38","38"
"42","Golbat","Zubat","FALSE",,"284",,,,"0/15/15",,,,"29",,,,"1498",,,,"Wing Attack, Poison Fang, Shadow Ball",,,"41;42;169","42;169"
"42","Golbat (Shadow)","Zubat","TRUE",,"259",,,,"0/15/15",,,,"29",,,,"1498",,,,"Wing Attack, Poison Fang, Shadow Ball",,,"41;42;169","42;169"
"43","Oddish","Oddish","FALSE",,"670",,,,"15/15/15",,,,"50",,,,"1389",,,,"Razor Leaf, Seed Bomb, Sludge Bomb",,,"43;44;45","43;44;45"
"43","Oddish (Shadow)","Oddish","TRUE",,"582",,,,"15/15/15",,,,"50",,,,"1389",,,,"Razor Leaf, Seed Bomb, Sludge Bomb",,,"43;44;45","43;44;45"
"44","Gloom","Oddish","FALSE",,"510",,,,"0/12/14",,,,"39.5",,,,"1500",,,,"Razor Leaf, Sludge Bomb, Moonblast",,,"43;44;45","44;45"
"44","Gloom (Shadow)","Oddish","TRUE",,"393",,,,"0/12/14",,,,"39.5",,,,"1500",,,,"Razor Leaf, Sludge Bomb, Moonblast",,,"43;44;45","44;45"
"45","Vileplume","Oddish","FALSE",,"545",,,,"0/15/14",,,,"22",,,,"1498",,,,"Razor Leaf, Sludge Bomb, Petal Blizzard",,,"43;44;45","45"
"45","Vileplume (Shadow)","Oddish","TRUE",,"425",,,,"0/15/14",,,,"22",,,,"1498",,,,"Razor Leaf, Sludge Bomb, Moonblast",,,"43;44;45","45"
"47","Parasect","Paras","FALSE",,"500",,,,"0/13/15",,,,"32",,,,"1495",,,,"Fury Cutter, X-Scissor, Cross Poison",,,"46;47","47"
"49","Venomoth","Venonat","FALSE",,"153",,,,"0/13/15",,,,"27.5",,,,"1499",,,,"Psywave, Poison Fang, Bug Buzz",,,"48;49","49"
"49","Venomoth (Shadow)","Venonat","TRUE",,"151",,,,"0/13/15",,,,"27.5",,,,"1499",,,,"Psywave, Poison Fang, Bug Buzz",,,"48;49","49"
"51","Dugtrio","Diglett","FALSE",,"412",,,,"0/14/15",,,,"44",,,,"1495",,,,"Mud Slap, Mud Bomb, Stone Edge",,,"50;51","51"
"51","Dugtrio (Shadow)","Diglett","TRUE",,"359",,,,"0/14/15",,,,"44",,,,"1495",,,,"Mud Slap, Mud Bomb, Stone Edge",,,"50;51","51"
"53","Persian","Meowth","FALSE",,"548",,,,"0/14/13",,,,"39",,,,"1496",,,,"Feint Attack, Night Slash, Power Gem",,,"52;53;863","53"
"53","Persian (Shadow)","Meowth","TRUE",,"540",,,,"0/14/13",,,,"39",,,,"1496",,,,"Feint Attack, Night Slash, Power Gem",,,"52;53;863","53"
"55","Golduck","Psyduck","FALSE",,"416",,,,"0/10/14",,,,"23.5",,,,"1499",,,,"Water Gun, Cross Chop, Liquidation",,,"54;55","55"
"55","Golduck (Shadow)","Psyduck","TRUE",,"397",,,,"0/10/14",,,,"23.5",,,,"1499",,,,"Water Gun, Cross Chop, Liquidation",,,"54;55","55"
"56","Mankey","Mankey","FALSE",,"667",,,,"15/15/15",,,,"50",,,,"1317",,,,"Karate Chop, Cross Chop, Return",,,"56;57;979","56;57;979"
"56","Mankey (Shadow)","Mankey","TRUE",,"599",,,,"15/15/15",,,,"50",,,,"1317",,,,"Karate Chop, Cross Chop, Brick Break",,,"56;57;979","56;57;979"
"57","Primeape","Mankey","FALSE",,"33",,,,"1/15/14",,,,"24.5",,,,"1497",,,,"Karate Chop, Rage Fist, Close Combat",,,"56;57;979","57;979"
"57","Primeape (Shadow)","Mankey","TRUE",,"42",,,,"1/15/14",,,,"24.5",,,,"1497",,,,"Karate Chop, Rage Fist, Close Combat",,,"56;57;979","57;979"
"58","Growlithe","Growlithe","FALSE",,"759",,,,"15/15/15",,,,"50",,,,"1405",,,,"Ember, Body Slam, Flamethrower",,,"58;59","58;59"
"58","Growlithe (Hisuian)","Growlithe","FALSE",,"787",,,,"15/15/14",,,,"50",,,,"1495",,,,"Ember, Rock Slide, Crunch",,,"58;59","58;59"
"58","Growlithe (Shadow)","Growlithe","TRUE",,"723",,,,"15/15/15",,,,"50",,,,"1405",,,,"Ember, Body Slam, Flamethrower",,,"58;59","58;59"
"59","Arcanine","Growlithe","FALSE",,"312",,,,"0/14/15",,,,"18.5",,,,"1497",,,,"Fire Fang, Wild Charge, Psychic Fangs",,,"58;59","59"
"59","Arcanine (Hisuian)","Growlithe","FALSE",,"679",,,,"0/14/10",,,,"18",,,,"1498",,,,"Fire Fang, Wild Charge, Rock Slide",,,"58;59","59"
"59","Arcanine (Shadow)","Growlithe","TRUE",,"272",,,,"0/14/15",,,,"18.5",,,,"1497",,,,"Fire Fang, Wild Charge, Psychic Fangs",,,"58;59","59"
"61","Poliwhirl","Poliwag","FALSE",,"445",,,,"6/15/15",,,,"49.5",,,,"1500",,,,"Bubble, Scald, Mud Bomb",,,"60;61;62","61;62"
"61","Poliwhirl (Shadow)","Poliwag","TRUE",,"446",,,,"6/15/15",,,,"49.5",,,,"1500",,,,"Bubble, Scald, Mud Bomb",,,"60;61;62","61;62"
"62","Poliwrath","Poliwag","FALSE",,"320",,,,"0/14/15",,,,"22",,,,"1500",,,,"Counter, Scald, Icy Wind",,,"60;61;62","62"
"62","Poliwrath (Shadow)","Poliwag","TRUE",,"375",,,,"0/14/15",,,,"22",,,,"1500",,,,"Counter, Scald, Icy Wind",,,"60;61;62","62"
"64","Kadabra","Abra","FALSE",,"845",,,,"2/15/14",,,,"27",,,,"1496",,,,"Psycho Cut, Shadow Ball, Dazzling Gleam",,,"63;64;65","64;65"
"65","Alakazam","Abra","FALSE",,"715",,,,"1/15/15",,,,"18",,,,"1499",,,,"Psycho Cut, Fire Punch, Shadow Ball",,,"63;64;65","65"
"65","Alakazam (Shadow)","Abra","TRUE",,"703",,,,"1/15/15",,,,"18",,,,"1499",,,,"Psycho Cut, Fire Punch, Shadow Ball",,,"63;64;65","65"
"66","Machop","Machop","FALSE",,"310",,,,"15/15/15",,,,"50",,,,"1445",,,,"Karate Chop, Cross Chop, Return",,,"66;67;68","66;67;68"
"66","Machop (Shadow)","Machop","TRUE",,"335",,,,"15/15/15",,,,"50",,,,"1445",,,,"Karate Chop, Cross Chop, Brick Break",,,"66;67;68","66;67;68"
"67","Machoke","Machop","FALSE",,"241",,,,"0/15/14",,,,"28",,,,"1498",,,,"Karate Chop, Cross Chop, Return",,,"66;67;68","67;68"
"67","Machoke (Shadow)","Machop","TRUE",,"52",,,,"0/15/14",,,,"28",,,,"1498",,,,"Karate Chop, Cross Chop, Dynamic Punch",,,"66;67;68","67;68"
"68","Machamp","Machop","FALSE",,"97",,,,"0/14/11",,,,"18.5",,,,"1497",,,,"Karate Chop, Cross Chop, Stone Edge",,,"66;67;68","68"
"68","Machamp (Shadow)","Machop","TRUE",,"72",,,,"0/14/11",,,,"18.5",,,,"1497",,,,"Karate Chop, Cross Chop, Stone Edge",,,"66;67;68","68"
"70","Weepinbell","Bellsprout","FALSE",,"482",,,,"1/15/15",,,,"40.5",,,,"1493",,,,"Bullet Seed, Power Whip, Sludge Bomb",,,"69;70;71","70;71"
"70","Weepinbell (Shadow)","Bellsprout","TRUE",,"471",,,,"1/15/15",,,,"40.5",,,,"1497",,,,"Bullet Seed, Power Whip, Sludge Bomb",,,"69;70;71","70;71"
"71","Victreebel","Bellsprout","FALSE",,"252",,,,"1/15/15",,,,"23",,,,"1500",,,,"Magical Leaf, Leaf Blade, Sludge Bomb",,,"69;70;71","71"
"71","Victreebel (Shadow)","Bellsprout","TRUE",,"307",,,,"1/15/15",,,,"23",,,,"1500",,,,"Magical Leaf, Leaf Blade, Acid Spray",,,"69;70;71","71"
"72","Tentacool","Tentacool","FALSE",,"817",,,,"15/15/15",,,,"50",,,,"1176",,,,"Poison Sting, Water Pulse, Wrap",,,"72;73","72;73"
"72","Tentacool (Shadow)","Tentacool","TRUE",,"805",,,,"15/15/15",,,,"50",,,,"1176",,,,"Poison Sting, Water Pulse, Wrap",,,"72;73","72;73"
"73","Tentacruel","Tentacool","FALSE",,"206",,,,"1/15/14",,,,"23.5",,,,"1496",,,,"Poison Jab, Acid Spray, Scald",,,"72;73","73"
"73","Tentacruel (Shadow)","Tentacool","TRUE",,"256",,,,"1/15/14",,,,"23.5",,,,"1496",,,,"Poison Jab, Acid Spray, Scald",,,"72;73","73"
"74","Geodude","Geodude","FALSE",,"597",,,,"15/15/15",,,,"50",,,,"1462",,,,"Rock Throw, Rock Tomb, Rock Slide",,,"74;75;76","74;75;76"
"74","Geodude (Alolan)","Geodude","FALSE",,"520",,,,"15/15/15",,,,"50",,,,"1462",,,,"Volt Switch, Rock Tomb, Rock Slide",,,"74;75;76","74;75;76"
"74","Geodude (Alolan) (Shadow)","Geodude","TRUE",,"539",,,,"15/15/15",,,,"50",,,,"1462",,,,"Volt Switch, Rock Tomb, Rock Slide",,,"74;75;76","74;75;76"
"74","Geodude (Shadow)","Geodude","TRUE",,"499",,,,"15/15/15",,,,"50",,,,"1462",,,,"Rock Throw, Rock Tomb, Rock Slide",,,"74;75;76","74;75;76"
"75","Graveler","Geodude","FALSE",,"687",,,,"0/14/15",,,,"30.5",,,,"1500",,,,"Mud Slap, Stone Edge, Dig",,,"74;75;76","75;76"
"75","Graveler (Alolan)","Geodude","FALSE",,"356",,,,"0/14/15",,,,"30.5",,,,"1500",,,,"Volt Switch, Stone Edge, Rock Blast",,,"74;75;76","75;76"
"75","Graveler (Alolan) (Shadow)","Geodude","TRUE",,"317",,,,"0/14/15",,,,"30.5",,,,"1500",,,,"Volt Switch, Stone Edge, Rock Blast",,,"74;75;76","75;76"
"75","Graveler (Shadow)","Geodude","TRUE",,"652",,,,"0/14/15",,,,"30.5",,,,"1500",,,,"Mud Slap, Stone Edge, Dig",,,"74;75;76","75;76"
"76","Golem","Geodude","FALSE",,"405",,,,"1/14/15",,,,"19",,,,"1497",,,,"Mud Slap, Stone Edge, Rock Blast",,,"74;75;76","76"
"76","Golem (Alolan)","Geodude","FALSE",,"299",,,,"1/14/15",,,,"19",,,,"1497",,,,"Rollout, Wild Charge, Rock Blast",,,"74;75;76","76"
"76","Golem (Alolan) (Shadow)","Geodude","TRUE",,"262",,,,"1/14/15",,,,"19",,,,"1497",,,,"Rollout, Wild Charge, Rock Blast",,,"74;75;76","76"
"76","Golem (Shadow)","Geodude","TRUE",,"341",,,,"1/14/15",,,,"19",,,,"1497",,,,"Mud Slap, Stone Edge, Rock Blast",,,"74;75;76","76"
"77","Ponyta","Ponyta","FALSE",,"741",,,,"0/15/14",,,,"37.5",,,,"1500",,,,"Ember, Flame Charge, Stomp",,,"77;78","77;78"
"77","Ponyta (Galarian)","Ponyta","FALSE",,"659",,,,"0/15/14",,,,"37.5",,,,"1500",,,,"Psycho Cut, Swift, Play Rough",,,"77;78","77;78"
"78","Rapidash","Ponyta","FALSE",,"321",,,,"0/13/15",,,,"23",,,,"1498",,,,"Incinerate, Flame Charge, Wild Charge",,,"77;78","78"
"79","Slowpoke","Slowpoke","FALSE",,"441",,,,"15/15/15",,,,"50",,,,"1386",,,,"Confusion, Psyshock, Water Pulse",,,"79;80;199","79;80;199"
"79","Slowpoke (Galarian)","Slowpoke","FALSE",,"464",,,,"15/15/15",,,,"50",,,,"1386",,,,"Confusion, Psyshock, Surf",,,"79;80;199","79;80;199"
"79","Slowpoke (Shadow)","Slowpoke","TRUE",,"474",,,,"15/15/15",,,,"50",,,,"1386",,,,"Confusion, Psyshock, Water Pulse",,,"79;80;199","79;80;199"
"80","Slowbro","Slowpoke","FALSE",,"526",,,,"0/13/15",,,,"22.5",,,,"1493",,,,"Water Gun, Surf, Ice Beam",,,"79;80","80"
"80","Slowbro (Galarian)","Slowpoke","FALSE",,"220",,,,"0/14/11",,,,"23.5",,,,"1493",,,,"Poison Jab, Scald, Brutal Swing",,,"79;80","80"
"80","Slowbro (Shadow)","Slowpoke","TRUE",,"619",,,,"0/13/15",,,,"22.5",,,,"1493",,,,"Water Gun, Surf, Ice Beam",,,"79;80","80"
"83","Farfetch'd","Farfetchd","FALSE",,"161",,,,"15/15/15",,,,"50",,,,"1397",,,,"Fury Cutter, Leaf Blade, Aerial Ace",,,"83;865","83;865"
"83","Farfetch'd (Galarian)","Farfetchd","FALSE",,"254",,,,"0/15/15",,,,"38",,,,"1494",,,,"Fury Cutter, Leaf Blade, Brave Bird",,,"83;865","83;865"
"85","Dodrio","Doduo","FALSE",,"710",,,,"0/12/15",,,,"24",,,,"1494",,,,"Steel Wing, Brave Bird, Drill Peck",,,"84;85","85"
"86","Seel","Seel","FALSE",,"694",,,,"15/15/15",,,,"50",,,,"1098",,,,"Water Gun, Aqua Tail, Icy Wind",,,"86;87","86;87"
"87","Dewgong","Seel","FALSE",,"101",,,,"0/12/15",,,,"29.5",,,,"1500",,,,"Ice Shard, Icy Wind, Drill Run",,,"86;87","87"
"88","Grimer","Grimer","FALSE",,"249",,,,"10/15/14",,,,"50",,,,"1493",,,,"Mud Slap, Sludge, Mud Bomb",,,"88;89","88;89"
"88","Grimer (Shadow)","Grimer","TRUE",,"164",,,,"10/15/14",,,,"50",,,,"1500",,,,"Poison Jab, Sludge, Mud Bomb",,,"88;89","88;89"
"89","Muk","Grimer","FALSE",,"225",,,,"0/15/14",,,,"20.5",,,,"1497",,,,"Poison Jab, Thunder Punch, Dark Pulse",,,"88;89","89"
"89","Muk (Shadow)","Grimer","TRUE",,"192",,,,"0/15/14",,,,"20.5",,,,"1497",,,,"Poison Jab, Thunder Punch, Dark Pulse",,,"88;89","89"
"91","Cloyster","Shellder","FALSE",,"421",,,,"0/13/13",,,,"22.5",,,,"1499",,,,"Ice Shard, Icy Wind, Liquidation",,,"90;91","91"
"91","Cloyster (Shadow)","Shellder","TRUE",,"456",,,,"0/13/13",,,,"22.5",,,,"1499",,,,"Ice Shard, Icy Wind, Liquidation",,,"90;91","91"
"93","Haunter","Gastly","FALSE",,"139",,,,"1/15/14",,,,"28.5",,,,"1493",,,,"Shadow Claw, Shadow Punch, Ice Punch",,,"92;93;94","93;94"
"93","Haunter (Shadow)","Gastly","TRUE",,"264",,,,"1/15/14",,,,"28.5",,,,"1493",,,,"Shadow Claw, Ice Punch, Shadow Ball",,,"92;93;94","93;94"
"94","Gengar","Gastly","FALSE",,"146",,,,"0/13/13",,,,"19.5",,,,"1500",,,,"Shadow Claw, Shadow Punch, Sludge Bomb",,,"92;93;94","94"
"94","Gengar (Shadow)","Gastly","TRUE",,"98",,,,"0/13/13",,,,"19.5",,,,"1500",,,,"Shadow Claw, Shadow Punch, Sludge Bomb",,,"92;93;94","94"
"95","Onix","Onix","FALSE",,"623",,,,"15/15/14",,,,"50",,,,"1245",,,,"Rock Throw, Breaking Swipe, Stone Edge",,,"95;208","95;208"
"95","Onix (Shadow)","Onix","TRUE",,"631",,,,"15/15/14",,,,"50",,,,"1245",,,,"Rock Throw, Breaking Swipe, Stone Edge",,,"95;208","95;208"
"96","Drowzee","Drowzee","FALSE",,"743",,,,"15/15/14",,,,"50",,,,"1176",,,,"Confusion, Psyshock, Return",,,"96;97","96;97"
"96","Drowzee (Shadow)","Drowzee","TRUE",,"751",,,,"15/15/14",,,,"50",,,,"1176",,,,"Confusion, Psyshock, Psychic",,,"96;97","96;97"
"97","Hypno","Drowzee","FALSE",,"178",,,,"0/13/13",,,,"28",,,,"1499",,,,"Confusion, Shadow Ball, Thunder Punch",,,"96;97","97"
"97","Hypno (Shadow)","Drowzee","TRUE",,"309",,,,"0/13/13",,,,"28",,,,"1499",,,,"Confusion, Thunder Punch, Fire Punch",,,"96;97","97"
"98","Krabby","Krabby","FALSE",,"788",,,,"0/15/15",,,,"43",,,,"1499",,,,"Bubble, Razor Shell, Water Pulse",,,"98;99","98;99"
"99","Kingler","Krabby","FALSE",,"664",,,,"0/9/15",,,,"20",,,,"1495",,,,"Bubble, Crabhammer, X-Scissor",,,"98;99","99"
"101","Electrode","Voltorb","FALSE",,"483",,,,"1/15/15",,,,"27",,,,"1496",,,,"Volt Switch, Discharge, Hyper Beam",,,"100;101","101"
"101","Electrode (Hisuian)","Voltorb","FALSE",,"87",,,,"1/14/14",,,,"26.5",,,,"1495",,,,"Thunder Shock, Wild Charge, Swift",,,"100;101","101"
"101","Electrode (Shadow)","Voltorb","TRUE",,"517",,,,"1/15/15",,,,"27",,,,"1496",,,,"Volt Switch, Discharge, Hyper Beam",,,"100;101","101"
"102","Exeggcute","Exeggcute","FALSE",,"725",,,,"15/15/14",,,,"50",,,,"1328",,,,"Confusion, Seed Bomb, Ancient Power",,,"102;103","102;103"
"102","Exeggcute (Shadow)","Exeggcute","TRUE",,"716",,,,"15/15/14",,,,"50",,,,"1328",,,,"Confusion, Seed Bomb, Ancient Power",,,"102;103","102;103"
"103","Exeggutor","Exeggcute","FALSE",,"731",,,,"1/15/14",,,,"18.5",,,,"1497",,,,"Bullet Seed, Seed Bomb, Psychic",,,"102;103","103"
"103","Exeggutor (Alolan)","Exeggcute","FALSE",,"462",,,,"1/15/14",,,,"18.5",,,,"1493",,,,"Dragon Tail, Seed Bomb, Draco Meteor",,,"102;103","103"
"103","Exeggutor (Alolan) (Shadow)","Exeggcute","TRUE",,"385",,,,"1/15/14",,,,"18.5",,,,"1493",,,,"Dragon Tail, Seed Bomb, Draco Meteor",,,"102;103","103"
"103","Exeggutor (Shadow)","Exeggcute","TRUE",,"714",,,,"1/15/14",,,,"18.5",,,,"1497",,,,"Bullet Seed, Seed Bomb, Psychic",,,"102;103","103"
"104","Cubone","Cubone","FALSE",,"668",,,,"15/15/15",,,,"50",,,,"1152",,,,"Mud Slap, Bone Club, Return",,,"104;105","104;105"
"104","Cubone (Shadow)","Cubone","TRUE",,"611",,,,"15/15/15",,,,"50",,,,"1152",,,,"Mud Slap, Bone Club, Dig",,,"104;105","104;105"
"105","Marowak","Cubone","FALSE",,"136",,,,"0/14/14",,,,"33.5",,,,"1500",,,,"Mud Slap, Bone Club, Rock Slide",,,"104;105","105"
"105","Marowak (Alolan)","Cubone","FALSE",,"121",,,,"0/14/14",,,,"33.5",,,,"1500",,,,"Fire Spin, Bone Club, Shadow Bone",,,"104;105","105"
"105","Marowak (Alolan) (Shadow)","Cubone","TRUE",,"75",,,,"0/14/14",,,,"33.5",,,,"1500",,,,"Fire Spin, Shadow Bone, Bone Club",,,"104;105","105"
"105","Marowak (Shadow)","Cubone","TRUE",,"79",,,,"0/14/14",,,,"33.5",,,,"1500",,,,"Mud Slap, Bone Club, Rock Slide",,,"104;105","105"
"106","Hitmonlee","Hitmonlee","FALSE",,"511",,,,"2/15/15",,,,"21.5",,,,"1497",,,,"Double Kick, Close Combat, Blaze Kick",,,"106;236","106;236"
"106","Hitmonlee (Shadow)","Hitmonlee","TRUE",,"533",,,,"2/15/15",,,,"21.5",,,,"1497",,,,"Double Kick, Close Combat, Blaze Kick",,,"106;236","106;236"
"107","Hitmonchan","Hitmonchan","FALSE",,"515",,,,"0/11/15",,,,"24.5",,,,"1490",,,,"Counter, Ice Punch, Thunder Punch",,,"107;236","107;236"
"107","Hitmonchan (Shadow)","Hitmonchan","TRUE",,"551",,,,"0/11/15",,,,"24.5",,,,"1490",,,,"Counter, Ice Punch, Thunder Punch",,,"107;236","107;236"
"108","Lickitung","Lickitung","FALSE",,"26",,,,"8/14/15",,,,"50",,,,"1498",,,,"Lick, Body Slam, Power Whip",,,"108;463","108;463"
"109","Koffing","Koffing","FALSE",,"753",,,,"15/15/15",,,,"50",,,,"1373",,,,"Infestation, Sludge, Dark Pulse",,,"109;110","109;110"
"109","Koffing (Shadow)","Koffing","TRUE",,"768",,,,"15/15/15",,,,"50",,,,"1373",,,,"Infestation, Sludge, Dark Pulse",,,"109;110","109;110"
"110","Weezing","Koffing","FALSE",,"389",,,,"0/14/14",,,,"25",,,,"1491",,,,"Rollout, Sludge Bomb, Shadow Ball",,,"109;110","110"
"110","Weezing (Shadow)","Koffing","TRUE",,"365",,,,"0/14/14",,,,"25",,,,"1495",,,,"Rollout, Sludge Bomb, Shadow Ball",,,"109;110","110"
"111","Rhyhorn","Rhyhorn","FALSE",,"591",,,,"0/13/15",,,,"41",,,,"1499",,,,"Mud Slap, Bulldoze, Stomp",,,"111;112;464","111;112;464"
"111","Rhyhorn (Shadow)","Rhyhorn","TRUE",,"478",,,,"0/13/15",,,,"41",,,,"1499",,,,"Mud Slap, Bulldoze, Stomp",,,"111;112;464","111;112;464"
"112","Rhydon","Rhyhorn","FALSE",,"342",,,,"2/15/14",,,,"17.5",,,,"1498",,,,"Mud Slap, Breaking Swipe, Stone Edge",,,"111;112;464","112;464"
"112","Rhydon (Shadow)","Rhyhorn","TRUE",,"300",,,,"2/15/14",,,,"17.5",,,,"1498",,,,"Mud Slap, Breaking Swipe, Stone Edge",,,"111;112;464","112;464"
"113","Chansey","Chansey","FALSE",,"224",,,,"15/15/15",,,,"50",,,,"1418",,,,"Zen Headbutt, Dazzling Gleam, Psychic",,,"113;242;440","113;242;440"
"114","Tangela","Tangela","FALSE",,"519",,,,"0/13/15",,,,"25.5",,,,"1491",,,,"Vine Whip, Grass Knot, Sludge Bomb",,,"114;465","114;465"
"114","Tangela (Shadow)","Tangela","TRUE",,"592",,,,"0/13/15",,,,"25.5",,,,"1491",,,,"Vine Whip, Grass Knot, Sludge Bomb",,,"114;465","114;465"
"115","Kangaskhan","Kangaskhan","FALSE",,"324",,,,"0/14/15",,,,"22",,,,"1500",,,,"Mud Slap, Crunch, Stomp",,,"115","115"
"117","Seadra","Horsea","FALSE",,"792",,,,"1/15/14",,,,"27",,,,"1499",,,,"Dragon Breath, Hydro Pump, Blizzard",,,"116;117;230","117;230"
"117","Seadra (Shadow)","Horsea","TRUE",,"739",,,,"1/15/14",,,,"27",,,,"1499",,,,"Dragon Breath, Hydro Pump, Blizzard",,,"116;117;230","117;230"
"118","Goldeen","Goldeen","FALSE",,"809",,,,"15/15/15",,,,"50",,,,"1302",,,,"Mud Shot, Aqua Tail, Horn Attack",,,"118;119","118;119"
"119","Seaking","Goldeen","FALSE",,"294",,,,"0/14/14",,,,"26.5",,,,"1500",,,,"Poison Jab, Drill Run, Icy Wind",,,"118;119","119"
"121","Starmie","Staryu","FALSE",,"109",,,,"0/15/11",,,,"22",,,,"1488",,,,"Psywave, Surf, Power Gem",,,"120;121","121"
"122","Mr. Mime (Galarian)","Mr-mime","FALSE",,"669",,,,"1/15/13",,,,"27.5",,,,"1497",,,,"Confusion, Ice Punch, Triple Axel",,,"122;439;866","122;439;866"
"123","Scyther","Scyther","FALSE",,"419",,,,"0/14/11",,,,"21",,,,"1496",,,,"Fury Cutter, Aerial Ace, Night Slash",,,"123;212","123;212"
"123","Scyther (Shadow)","Scyther","TRUE",,"316",,,,"0/14/11",,,,"21",,,,"1496",,,,"Fury Cutter, Aerial Ace, Night Slash",,,"123;212","123;212"
"124","Jynx","Jynx","FALSE",,"777",,,,"0/14/15",,,,"22",,,,"1496",,,,"Confusion, Avalanche, Psyshock",,,"124;238","124;238"
"125","Electabuzz","Electabuzz","FALSE",,"353",,,,"0/14/11",,,,"24.5",,,,"1490",,,,"Thunder Shock, Thunder Punch, Return",,,"125;239;466","125;239;466"
"125","Electabuzz (Shadow)","Electabuzz","TRUE",,"314",,,,"0/14/11",,,,"24.5",,,,"1500",,,,"Thunder Shock, Thunder Punch, Thunderbolt",,,"125;239;466","125;239;466"
"126","Magmar","Magmar","FALSE",,"332",,,,"0/15/15",,,,"23.5",,,,"1499",,,,"Karate Chop, Fire Punch, Scorching Sands",,,"126;240;467","126;240;467"
"126","Magmar (Shadow)","Magmar","TRUE",,"238",,,,"0/15/15",,,,"23.5",,,,"1499",,,,"Karate Chop, Fire Punch, Scorching Sands",,,"126;240;467","126;240;467"
"127","Pinsir","Pinsir","FALSE",,"477",,,,"0/13/14",,,,"19",,,,"1500",,,,"Fury Cutter, Close Combat, X-Scissor",,,"127","127"
"127","Pinsir (Shadow)","Pinsir","TRUE",,"379",,,,"0/13/14",,,,"19",,,,"1500",,,,"Fury Cutter, Close Combat, X-Scissor",,,"127","127"
"128","Tauros","Tauros","FALSE",,"485",,,,"0/15/15",,,,"21.5",,,,"1495",,,,"Tackle, Trailblaze, Horn Attack",,,"128","128"
"128","Tauros (Aqua)","Tauros","FALSE",,"283",,,,"0/11/15",,,,"20",,,,"1494",,,,"Double Kick, Aqua Jet, Trailblaze",,,"128","128"
"128","Tauros (Blaze)","Tauros","FALSE",,"470",,,,"0/11/15",,,,"20",,,,"1494",,,,"Double Kick, Flame Charge, Trailblaze",,,"128","128"
"128","Tauros (Combat)","Tauros","FALSE",,"362",,,,"0/11/15",,,,"20",,,,"1494",,,,"Double Kick, Close Combat, Trailblaze",,,"128","128"
"130","Gyarados","Magikarp","FALSE",,"117",,,,"0/14/15",,,,"16.5",,,,"1498",,,,"Dragon Breath, Aqua Tail, Crunch",,,"129;130","130"
"130","Gyarados (Shadow)","Magikarp","TRUE",,"382",,,,"0/14/15",,,,"16.5",,,,"1498",,,,"Waterfall, Aqua Tail, Crunch",,,"129;130","130"
