"ID","Pokemon","Family","Shadow","Little_Rank","Great_Rank","Ultra_Rank","Master_Rank","Little_IVs","Great_IVs","Ultra_IVs","Master_IVs","Little_Level","Great_Level","Ultra_Level","Master_Level","Little_CP","Great_CP","Ultra_CP","Master_CP","Little_MoveSet","Great_MoveSet","Ultra_MoveSet","Master_MoveSet","Evo_Fam","Evo_Next"
"503","Samurott","Oshawott","FALSE",,"158",,,,"0/14/14",,,,"20",,,,"1498",,,,"Fury Cutter, Hydro Cannon, Megahorn",,,"501;502;503","503"
"503","Samurott (Shadow)","Oshawott","TRUE",,"150",,,,"0/14/14",,,,"20",,,,"1498",,,,"Fury Cutter, Hydro Cannon, Megahorn",,,"501;502;503","503"
"505","Watchog","Patrat","FALSE",,"701",,,,"0/15/15",,,,"33",,,,"1497",,,,"Bite, Crunch, Hyper Fang",,,"504;505","505"
"505","Watchog (Shadow)","Patrat","TRUE",,"636",,,,"0/15/15",,,,"33",,,,"1497",,,,"Bite, Crunch, Hyper Fang",,,"504;505","505"
"507","Herdier","Lillipup","FALSE",,"577",,,,"1/15/15",,,,"43",,,,"1497",,,,"Sand Attack, Dig, Thunderbolt",,,"506;507;508","507;508"
"508","Stoutland","Lillipup","FALSE",,"372",,,,"0/15/13",,,,"20",,,,"1500",,,,"Sand Attack, Wild Charge, Crunch",,,"506;507;508","508"
"512","Simisage","Pansage","FALSE",,"507",,,,"0/14/15",,,,"24",,,,"1496",,,,"Vine Whip, Grass Knot, Crunch",,,"511;512","512"
"514","Simisear","Pansear","FALSE",,"685",,,,"0/14/15",,,,"24",,,,"1496",,,,"Fire Spin, Crunch, Flamethrower",,,"513;514","514"
"516","Simipour","Panpour","FALSE",,"728",,,,"0/14/15",,,,"24",,,,"1496",,,,"Water Gun, Surf, Crunch",,,"515;516","516"
"517","Munna","Munna","FALSE",,"840",,,,"15/15/15",,,,"50",,,,"1294",,,,"Charge Beam, Psyshock, Dazzling Gleam",,,"517;518","517;518"
"518","Musharna","Munna","FALSE",,"719",,,,"0/12/15",,,,"21",,,,"1499",,,,"Charge Beam, Psyshock, Dazzling Gleam",,,"517;518","518"
"520","Tranquill","Pidove","FALSE",,"538",,,,"2/15/15",,,,"50",,,,"1494",,,,"Air Slash, Aerial Ace, Return",,,"519;520;521","520;521"
"520","Tranquill (Shadow)","Pidove","TRUE",,"493",,,,"2/15/15",,,,"50",,,,"1494",,,,"Air Slash, Aerial Ace, Sky Attack",,,"519;520;521","520;521"
"521","Unfezant","Pidove","FALSE",,"831",,,,"0/15/14",,,,"20.5",,,,"1495",,,,"Air Slash, Sky Attack, Hyper Beam",,,"519;520;521","521"
"521","Unfezant (Shadow)","Pidove","TRUE",,"815",,,,"0/15/14",,,,"20.5",,,,"1495",,,,"Air Slash, Sky Attack, Hyper Beam",,,"519;520;521","521"
"523","Zebstrika","Blitzle","FALSE",,"702",,,,"0/15/9",,,,"23.5",,,,"1496",,,,"Spark, Wild Charge, Flame Charge",,,"522;523","523"
"523","Zebstrika (Shadow)","Blitzle","TRUE",,"629",,,,"0/15/9",,,,"23.5",,,,"1496",,,,"Spark, Wild Charge, Discharge",,,"522;523","523"
"524","Roggenrola","Roggenrola","FALSE",,"804",,,,"15/15/15",,,,"50",,,,"1362",,,,"Smack Down, Stone Edge, Rock Blast",,,"524;525;526","524;525;526"
"524","Roggenrola (Shadow)","Roggenrola","TRUE",,"765",,,,"15/15/15",,,,"50",,,,"1362",,,,"Smack Down, Stone Edge, Rock Blast",,,"524;525;526","524;525;526"
"525","Boldore","Roggenrola","FALSE",,"660",,,,"0/15/15",,,,"28",,,,"1484",,,,"Mud Slap, Rock Slide, Bulldoze",,,"524;525;526","525;526"
"525","Boldore (Shadow)","Roggenrola","TRUE",,"622",,,,"0/15/15",,,,"28",,,,"1500",,,,"Mud Slap, Stone Edge, Rock Slide",,,"524;525;526","525;526"
"526","Gigalith","Roggenrola","FALSE",,"573",,,,"0/11/15",,,,"17.5",,,,"1492",,,,"Mud Slap, Superpower, Meteor Beam",,,"524;525;526","526"
"526","Gigalith (Shadow)","Roggenrola","TRUE",,"589",,,,"0/11/15",,,,"17.5",,,,"1492",,,,"Mud Slap, Meteor Beam, Superpower",,,"524;525;526","526"
"528","Swoobat","Woobat","FALSE",,"216",,,,"0/15/9",,,,"38",,,,"1499",,,,"Confusion, Fly, Psychic Fangs",,,"527;528","528"
"529","Drilbur","Drilbur","FALSE",,"480",,,,"10/15/15",,,,"49.5",,,,"1499",,,,"Mud Slap, Drill Run, Rock Tomb",,,"529;530","529;530"
"529","Drilbur (Shadow)","Drilbur","TRUE",,"475",,,,"10/15/15",,,,"49.5",,,,"1499",,,,"Mud Slap, Drill Run, Rock Tomb",,,"529;530","529;530"
"531","Audino","Audino","FALSE",,"786",,,,"0/15/13",,,,"41",,,,"1499",,,,"Zen Headbutt, Body Slam, Disarming Voice",,,"531","531"
"532","Timburr","Timburr","FALSE",,"842",,,,"15/15/15",,,,"50",,,,"1487",,,,"Low Kick, Rock Tomb, Brick Break",,,"532;533;534","532;533;534"
"532","Timburr (Shadow)","Timburr","TRUE",,"846",,,,"15/15/15",,,,"50",,,,"1487",,,,"Low Kick, Rock Tomb, Brick Break",,,"532;533;534","532;533;534"
"533","Gurdurr","Timburr","FALSE",,"504",,,,"1/15/15",,,,"26",,,,"1491",,,,"Poison Jab, Brick Break, Stone Edge",,,"532;533;534","533;534"
"533","Gurdurr (Shadow)","Timburr","TRUE",,"558",,,,"1/15/15",,,,"26",,,,"1491",,,,"Poison Jab, Brick Break, Stone Edge",,,"532;533;534","533;534"
"534","Conkeldurr","Timburr","FALSE",,"400",,,,"3/15/14",,,,"16.5",,,,"1495",,,,"Counter, Dynamic Punch, Brutal Swing",,,"532;533;534","534"
"534","Conkeldurr (Shadow)","Timburr","TRUE",,"378",,,,"3/15/14",,,,"16.5",,,,"1495",,,,"Counter, Dynamic Punch, Brutal Swing",,,"532;533;534","534"
"536","Palpitoad","Tympole","FALSE",,"547",,,,"9/15/15",,,,"49.5",,,,"1497",,,,"Mud Shot, Earth Power, Water Pulse",,,"535;536;537","536;537"
"537","Seismitoad","Tympole","FALSE",,"614",,,,"1/15/15",,,,"22",,,,"1498",,,,"Mud Shot, Earth Power, Sludge Bomb",,,"535;536;537","537"
"538","Throh","Throh","FALSE",,"838",,,,"2/15/15",,,,"22",,,,"1493",,,,"Low Kick, Body Slam, Brick Break",,,"538","538"
"538","Throh (Shadow)","Throh","TRUE",,"839",,,,"2/15/15",,,,"22",,,,"1493",,,,"Low Kick, Body Slam, Brick Break",,,"538","538"
"539","Sawk","Sawk","FALSE",,"648",,,,"0/15/15",,,,"20",,,,"1500",,,,"Poison Jab, Body Slam, Brick Break",,,"539","539"
"539","Sawk (Shadow)","Sawk","TRUE",,"557",,,,"0/15/15",,,,"20",,,,"1500",,,,"Poison Jab, Body Slam, Brick Break",,,"539","539"
"541","Swadloon","Sewaddle","FALSE",,"531",,,,"12/15/14",,,,"49.5",,,,"1500",,,,"Bug Bite, Energy Ball, Silver Wind",,,"540;541;542","541;542"
"542","Leavanny","Sewaddle","FALSE",,"94",,,,"0/13/14",,,,"22",,,,"1499",,,,"Shadow Claw, Leaf Blade, X-Scissor",,,"540;541;542","542"
"544","Whirlipede","Venipede","FALSE",,"750",,,,"15/15/15",,,,"50",,,,"1293",,,,"Poison Sting, Sludge Bomb, Signal Beam",,,"543;544;545","544;545"
"544","Whirlipede (Shadow)","Venipede","TRUE",,"748",,,,"15/15/15",,,,"50",,,,"1293",,,,"Poison Sting, Sludge Bomb, Signal Beam",,,"543;544;545","544;545"
"545","Scolipede","Venipede","FALSE",,"413",,,,"1/15/14",,,,"23",,,,"1495",,,,"Poison Jab, X-Scissor, Sludge Bomb",,,"543;544;545","545"
"545","Scolipede (Shadow)","Venipede","TRUE",,"388",,,,"1/15/14",,,,"23",,,,"1495",,,,"Poison Jab, X-Scissor, Sludge Bomb",,,"543;544;545","545"
"549","Lilligant","Petilil","FALSE",,"735",,,,"0/15/15",,,,"22",,,,"1491",,,,"Charm, Petal Blizzard, Hyper Beam",,,"548;549","549"
"550","Basculin","Basculin","FALSE",,"437",,,,"0/11/15",,,,"27.5",,,,"1495",,,,"Water Gun, Aqua Tail, Aqua Jet",,,"550;902","550;902"
"554","Darumaka","Darumaka","FALSE",,"534",,,,"2/15/14",,,,"50",,,,"1499",,,,"Fire Fang, Fire Punch, Flame Charge",,,"554;555","554;555"
"554","Darumaka (Galarian)","Darumaka","FALSE",,"396",,,,"2/15/14",,,,"50",,,,"1499",,,,"Ice Fang, Ice Punch, Ice Beam",,,"554;555","554;555"
"554","Darumaka (Shadow)","Darumaka","TRUE",,"503",,,,"2/15/14",,,,"50",,,,"1499",,,,"Fire Fang, Fire Punch, Flame Charge",,,"554;555","554;555"
"555","Darmanitan (Galarian)","Darumaka","FALSE",,"574",,,,"0/15/11",,,,"18",,,,"1497",,,,"Ice Fang, Avalanche, Superpower",,,"554;555","555"
"555","Darmanitan (Standard)","Darumaka","FALSE",,"562",,,,"0/15/11",,,,"18",,,,"1497",,,,"Incinerate, Rock Slide, Overheat",,,"554;555","555"
"555","Darmanitan (Standard) (Shadow)","Darumaka","TRUE",,"595",,,,"0/15/11",,,,"18",,,,"1497",,,,"Incinerate, Overheat, Rock Slide",,,"554;555","555"
"556","Maractus","Maractus","FALSE",,"738",,,,"0/13/14",,,,"25",,,,"1498",,,,"Bullet Seed, Aerial Ace, Petal Blizzard",,,"556","556"
"557","Dwebble","Dwebble","FALSE",,"658",,,,"15/15/15",,,,"50",,,,"1384",,,,"Smack Down, Rock Tomb, X-Scissor",,,"557;558","557;558"
"557","Dwebble (Shadow)","Dwebble","TRUE",,"696",,,,"15/15/15",,,,"50",,,,"1384",,,,"Smack Down, Rock Tomb, X-Scissor",,,"557;558","557;558"
"558","Crustle","Dwebble","FALSE",,"340",,,,"0/13/13",,,,"22.5",,,,"1499",,,,"Fury Cutter, X-Scissor, Rock Slide",,,"557;558","558"
"558","Crustle (Shadow)","Dwebble","TRUE",,"308",,,,"0/13/13",,,,"22.5",,,,"1499",,,,"Fury Cutter, X-Scissor, Rock Slide",,,"557;558","558"
"561","Sigilyph","Sigilyph","FALSE",,"572",,,,"1/15/14",,,,"22",,,,"1500",,,,"Air Slash, Air Cutter, Ancient Power",,,"561","561"
"563","Cofagrigus","Yamask","FALSE",,"106",,,,"0/11/14",,,,"25.5",,,,"1500",,,,"Shadow Claw, Shadow Ball, Dark Pulse",,,"562;563","563"
"564","Tirtouga","Tirtouga","FALSE",,"615",,,,"0/14/15",,,,"49.5",,,,"1494",,,,"Water Gun, Surf, Ancient Power",,,"564;565","564;565"
"564","Tirtouga (Shadow)","Tirtouga","TRUE",,"640",,,,"0/14/15",,,,"49.5",,,,"1494",,,,"Water Gun, Surf, Ancient Power",,,"564;565","564;565"
"565","Carracosta","Tirtouga","FALSE",,"697",,,,"1/14/15",,,,"21.5",,,,"1497",,,,"Water Gun, Liquidation, Ancient Power",,,"564;565","565"
"565","Carracosta (Shadow)","Tirtouga","TRUE",,"709",,,,"1/14/15",,,,"21.5",,,,"1497",,,,"Water Gun, Liquidation, Ancient Power",,,"564;565","565"
"566","Archen","Archen","FALSE",,"616",,,,"0/15/14",,,,"31",,,,"1497",,,,"Quick Attack, Ancient Power, Dragon Claw",,,"566;567","566;567"
"566","Archen (Shadow)","Archen","TRUE",,"494",,,,"0/15/14",,,,"31",,,,"1497",,,,"Quick Attack, Ancient Power, Dragon Claw",,,"566;567","566;567"
"567","Archeops","Archen","FALSE",,"516",,,,"1/15/15",,,,"16.5",,,,"1494",,,,"Wing Attack, Ancient Power, Dragon Claw",,,"566;567","567"
"567","Archeops (Shadow)","Archen","TRUE",,"399",,,,"1/15/15",,,,"16.5",,,,"1494",,,,"Wing Attack, Ancient Power, Dragon Claw",,,"566;567","567"
"569","Garbodor","Trubbish","FALSE",,"780",,,,"0/13/13",,,,"24.5",,,,"1498",,,,"Infestation, Body Slam, Seed Bomb",,,"568;569","569"
"569","Garbodor (Shadow)","Trubbish","TRUE",,"733",,,,"0/13/13",,,,"24.5",,,,"1498",,,,"Infestation, Body Slam, Seed Bomb",,,"568;569","569"
"573","Cinccino","Minccino","FALSE",,"643",,,,"2/15/14",,,,"25",,,,"1499",,,,"Charm, Aqua Tail, Thunderbolt",,,"572;573","573"
"575","Gothorita","Gothita","FALSE",,"600",,,,"0/15/14",,,,"43",,,,"1498",,,,"Confusion, Future Sight, Psychic",,,"574;575;576","575;576"
"575","Gothorita (Shadow)","Gothita","TRUE",,"585",,,,"0/15/14",,,,"43",,,,"1498",,,,"Confusion, Future Sight, Psychic",,,"574;575;576","575;576"
"576","Gothitelle","Gothita","FALSE",,"565",,,,"0/15/15",,,,"23.5",,,,"1498",,,,"Confusion, Rock Slide, Future Sight",,,"574;575;576","576"
"576","Gothitelle (Shadow)","Gothita","TRUE",,"607",,,,"0/15/15",,,,"23.5",,,,"1498",,,,"Confusion, Rock Slide, Future Sight",,,"574;575;576","576"
"577","Solosis","Solosis","FALSE",,"835",,,,"9/15/15",,,,"50",,,,"1497",,,,"Hidden Power (Psychic), Psyshock, Night Shade",,,"577;578;579","577;578;579"
"577","Solosis (Shadow)","Solosis","TRUE",,"834",,,,"9/15/15",,,,"50",,,,"1497",,,,"Hidden Power (Psychic), Psyshock, Night Shade",,,"577;578;579","577;578;579"
"578","Duosion","Solosis","FALSE",,"833",,,,"0/15/13",,,,"28",,,,"1493",,,,"Hidden Power (Psychic), Psyshock, Night Shade",,,"577;578;579","578;579"
"578","Duosion (Shadow)","Solosis","TRUE",,"829",,,,"0/15/13",,,,"28",,,,"1493",,,,"Hidden Power (Psychic), Psyshock, Night Shade",,,"577;578;579","578;579"
"579","Reuniclus","Solosis","FALSE",,"830",,,,"2/15/14",,,,"19",,,,"1500",,,,"Hidden Power (Fighting), Psyshock, Shadow Ball",,,"577;578;579","579"
"579","Reuniclus (Shadow)","Solosis","TRUE",,"785",,,,"2/15/14",,,,"19",,,,"1500",,,,"Hidden Power (Psychic), Psyshock, Shadow Ball",,,"577;578;579","579"
"581","Swanna","Ducklett","FALSE",,"508",,,,"1/15/15",,,,"27",,,,"1498",,,,"Air Slash, Fly, Ice Beam",,,"580;581","581"
"581","Swanna (Shadow)","Ducklett","TRUE",,"527",,,,"1/15/15",,,,"27",,,,"1498",,,,"Water Gun, Fly, Ice Beam",,,"580;581","581"
"583","Vanillish","Vanillite","FALSE",,"377",,,,"0/14/15",,,,"43",,,,"1499",,,,"Astonish, Icy Wind, Signal Beam",,,"582;583;584","583;584"
"584","Vanilluxe","Vanillite","FALSE",,"576",,,,"0/15/12",,,,"20",,,,"1497",,,,"Astonish, Avalanche, Flash Cannon",,,"582;583;584","584"
"585","Deerling","Deerling","FALSE",,"799",,,,"15/15/14",,,,"50",,,,"1283",,,,"Tackle, Wild Charge, Trailblaze",,,"585;586","585;586"
"586","Sawsbuck","Deerling","FALSE",,"712",,,,"0/14/14",,,,"23.5",,,,"1495",,,,"Feint Attack, Wild Charge, Trailblaze",,,"585;586","586"
"587","Emolga","Emolga","FALSE",,"16",,,,"0/13/15",,,,"41",,,,"1498",,,,"Thunder Shock, Acrobatics, Discharge",,,"587","587"
"588","Karrablast","Karrablast","FALSE",,"653",,,,"15/15/15",,,,"50",,,,"1336",,,,"Fury Cutter, X-Scissor, Drill Run",,,"588;589","588;589"
"588","Karrablast (Shadow)","Karrablast","TRUE",,"604",,,,"15/15/15",,,,"50",,,,"1336",,,,"Fury Cutter, X-Scissor, Drill Run",,,"588;589","588;589"
"591","Amoonguss","Foongus","FALSE",,"69",,,,"0/14/15",,,,"27",,,,"1500",,,,"Astonish, Grass Knot, Foul Play",,,"590;591","591"
"591","Amoonguss (Shadow)","Foongus","TRUE",,"81",,,,"0/14/15",,,,"27",,,,"1500",,,,"Astonish, Grass Knot, Foul Play",,,"590;591","591"
"592","Frillish","Frillish","FALSE",,"185",,,,"15/15/15",,,,"50",,,,"1421",,,,"Hex, Night Shade, Ice Beam",,,"592;593","592;593"
"593","Jellicent","Frillish","FALSE",,"14",,,,"1/14/14",,,,"24.5",,,,"1490",,,,"Hex, Surf, Shadow Ball",,,"592;593","593"
"594","Alomomola","Alomomola","FALSE",,"432",,,,"0/15/11",,,,"27",,,,"1490",,,,"Waterfall, Hydro Pump, Blizzard",,,"594","594"
"596","Galvantula","Joltik","FALSE",,"350",,,,"0/15/15",,,,"25.5",,,,"1499",,,,"Volt Switch, Discharge, Lunge",,,"595;596","596"
"596","Galvantula (Shadow)","Joltik","TRUE",,"386",,,,"0/15/15",,,,"25.5",,,,"1499",,,,"Volt Switch, Discharge, Lunge",,,"595;596","596"
"603","Eelektrik","Tynamo","FALSE",,"570",,,,"0/13/15",,,,"37.5",,,,"1498",,,,"Spark, Discharge, Crunch",,,"602;603;604","603;604"
"604","Eelektross","Tynamo","FALSE",,"461",,,,"1/15/14",,,,"20.5",,,,"1500",,,,"Volt Switch, Dragon Claw, Thunderbolt",,,"602;603;604","604"
"605","Elgyem","Elgyem","FALSE",,"761",,,,"8/15/15",,,,"50",,,,"1500",,,,"Confusion, Dark Pulse, Psychic",,,"605;606","605;606"
"606","Beheeyem","Elgyem","FALSE",,"755",,,,"0/14/13",,,,"20.5",,,,"1491",,,,"Confusion, Rock Slide, Dark Pulse",,,"605;606","606"
"608","Lampent","Litwick","FALSE",,"655",,,,"0/15/14",,,,"37",,,,"1497",,,,"Astonish, Energy Ball, Flame Burst",,,"607;608;609","608;609"
"608","Lampent (Shadow)","Litwick","TRUE",,"578",,,,"0/15/14",,,,"37",,,,"1497",,,,"Astonish, Energy Ball, Flame Burst",,,"607;608;609","608;609"
"609","Chandelure","Litwick","FALSE",,"625",,,,"0/15/14",,,,"17",,,,"1498",,,,"Incinerate, Flame Charge, Shadow Ball",,,"607;608;609","609"
"609","Chandelure (Shadow)","Litwick","TRUE",,"603",,,,"0/15/14",,,,"17",,,,"1498",,,,"Incinerate, Flame Charge, Shadow Ball",,,"607;608;609","609"
"610","Axew","Axew","FALSE",,"828",,,,"10/15/14",,,,"50",,,,"1498",,,,"Scratch, Dragon Claw, Aqua Tail",,,"610;611;612","610;611;612"
"611","Fraxure","Axew","FALSE",,"155",,,,"1/15/15",,,,"25",,,,"1499",,,,"Dragon Tail, Dragon Claw, Aqua Tail",,,"610;611;612","611;612"
"612","Haxorus","Axew","FALSE",,"199",,,,"0/14/13",,,,"15.5",,,,"1496",,,,"Dragon Tail, Breaking Swipe, Surf",,,"610;611;612","612"
"614","Beartic","Cubchoo","FALSE",,"355",,,,"0/15/12",,,,"18.5",,,,"1491",,,,"Powder Snow, Ice Punch, Liquidation",,,"613;614","614"
"615","Cryogonal","Cryogonal","FALSE",,"258",,,,"0/14/11",,,,"20.5",,,,"1497",,,,"Ice Shard, Triple Axel, Night Slash",,,"615","615"
"617","Accelgor","Shelmet","FALSE",,"807",,,,"0/14/15",,,,"23",,,,"1498",,,,"Water Shuriken, Bug Buzz, Acid Spray",,,"616;617","617"
"617","Accelgor (Shadow)","Shelmet","TRUE",,"794",,,,"0/14/15",,,,"23",,,,"1498",,,,"Water Shuriken, Bug Buzz, Signal Beam",,,"616;617","617"
"618","Stunfisk","Stunfisk","FALSE",,"64",,,,"0/12/15",,,,"27",,,,"1497",,,,"Thunder Shock, Mud Bomb, Discharge",,,"618","618"
"619","Mienfoo","Mienfoo","FALSE",,"850",,,,"7/15/15",,,,"50",,,,"1500",,,,"Low Kick, High Jump Kick, Brick Break",,,"619;620","619;620"
"620","Mienshao","Mienfoo","FALSE",,"345",,,,"0/15/14",,,,"20.5",,,,"1486",,,,"Force Palm, Brick Break, Brutal Swing",,,"619;620","620"
"621","Druddigon","Druddigon","FALSE",,"116",,,,"0/15/15",,,,"20.5",,,,"1498",,,,"Dragon Tail, Dragon Claw, Night Slash",,,"621","621"
"622","Golett","Golett","FALSE",,"360",,,,"15/15/15",,,,"50",,,,"1344",,,,"Mud Slap, Shadow Punch, Brick Break",,,"622;623","622;623"
"622","Golett (Shadow)","Golett","TRUE",,"265",,,,"15/15/15",,,,"50",,,,"1344",,,,"Mud Slap, Shadow Punch, Brick Break",,,"622;623","622;623"
"623","Golurk","Golett","FALSE",,"100",,,,"2/15/14",,,,"19.5",,,,"1500",,,,"Mud Slap, Shadow Punch, Dynamic Punch",,,"622;623","623"
"623","Golurk (Shadow)","Golett","TRUE",,"51",,,,"2/15/14",,,,"19.5",,,,"1500",,,,"Mud Slap, Shadow Punch, Dynamic Punch",,,"622;623","623"
"626","Bouffalant","Bouffalant","FALSE",,"455",,,,"0/13/11",,,,"20.5",,,,"1496",,,,"Mud Shot, Stomp, Megahorn",,,"626","626"
"627","Rufflet","Rufflet","FALSE",,"271",,,,"0/15/15",,,,"48",,,,"1492",,,,"Wing Attack, Brave Bird, Fly",,,"627;628","627;628"
"628","Braviary","Rufflet","FALSE",,"535",,,,"1/15/15",,,,"18",,,,"1497",,,,"Air Slash, Fly, Close Combat",,,"627;628","628"
"628","Braviary (Hisuian)","Rufflet","FALSE",,"645",,,,"0/15/13",,,,"20",,,,"1491",,,,"Air Slash, Brave Bird, Fly",,,"627;628","628"
"631","Heatmor","Heatmor","FALSE",,"542",,,,"0/15/14",,,,"23.5",,,,"1489",,,,"Fire Spin, Thunder Punch, Flamethrower",,,"631","631"
"636","Larvesta","Larvesta","FALSE",,"802",,,,"0/15/15",,,,"47.5",,,,"1499",,,,"Ember, Flame Charge, Bug Buzz",,,"636;637","636;637"
"641","Tornadus (Incarnate)","Tornadus","FALSE",,"836",,,,"1/15/15",,,,"16.5",,,,"1500",,,,"Air Slash, Grass Knot, Hurricane",,,"641","641"
"642","Thundurus (Incarnate)","Thundurus","FALSE",,"301",,,,"1/15/15",,,,"16.5",,,,"1500",,,,"Thunder Shock, Thunder Punch, Crunch",,,"642","642"
"645","Landorus (Incarnate)","Landorus","FALSE",,"586",,,,"0/15/14",,,,"15.5",,,,"1497",,,,"Mud Shot, Earth Power, Rock Slide",,,"645","645"
"650","Chespin","Chespin","FALSE",,"736",,,,"15/15/14",,,,"50",,,,"1239",,,,"Vine Whip, Body Slam, Seed Bomb",,,"650;651;652","650;651;652"
"651","Quilladin","Chespin","FALSE",,"304",,,,"0/14/15",,,,"37.5",,,,"1495",,,,"Vine Whip, Body Slam, Energy Ball",,,"650;651;652","651;652"
"652","Chesnaught","Chespin","FALSE",,"125",,,,"1/15/15",,,,"19",,,,"1498",,,,"Vine Whip, Frenzy Plant, Superpower",,,"650;651;652","652"
"654","Braixen","Fennekin","FALSE",,"639",,,,"0/15/14",,,,"33",,,,"1497",,,,"Ember, Psyshock, Flame Charge",,,"653;654;655","654;655"
"655","Delphox","Fennekin","FALSE",,"575",,,,"0/11/14",,,,"18.5",,,,"1491",,,,"Fire Spin, Blast Burn, Mystical Fire",,,"653;654;655","655"
"657","Frogadier","Froakie","FALSE",,"563",,,,"1/15/15",,,,"39.5",,,,"1500",,,,"Bubble, Surf, Aerial Ace",,,"656;657;658","657;658"
"660","Diggersby","Bunnelby","FALSE",,"68",,,,"0/15/13",,,,"50",,,,"1496",,,,"Quick Attack, Fire Punch, Scorching Sands",,,"659;660","660"
"660","Diggersby (Shadow)","Bunnelby","TRUE",,"93",,,,"0/15/13",,,,"50",,,,"1496",,,,"Quick Attack, Scorching Sands, Fire Punch",,,"659;660","660"
"662","Fletchinder","Fletchling","FALSE",,"472",,,,"0/14/15",,,,"50",,,,"1492",,,,"Ember, Fly, Aerial Ace",,,"661;662;663","662;663"
"663","Talonflame","Fletchling","FALSE",,"145",,,,"0/13/14",,,,"26",,,,"1499",,,,"Incinerate, Fly, Brave Bird",,,"661;662;663","663"
"666","Vivillon","Scatterbug","FALSE",,"612",,,,"0/15/14",,,,"31.5",,,,"1500",,,,"Gust, Aerial Ace, Bug Buzz",,,"664;665;666","666"
"667","Litleo","Litleo","FALSE",,"266",,,,"4/15/15",,,,"50",,,,"1495",,,,"Incinerate, Flame Charge, Crunch",,,"667;668","667;668"
"668","Pyroar","Litleo","FALSE",,"367",,,,"0/15/10",,,,"20.5",,,,"1496",,,,"Incinerate, Flame Charge, Dark Pulse",,,"667;668","668"
"672","Skiddo","Skiddo","FALSE",,"849",,,,"15/15/15",,,,"50",,,,"1414",,,,"Rock Smash, Rock Slide, Seed Bomb",,,"672;673","672;673"
"673","Gogoat","Skiddo","FALSE",,"143",,,,"2/15/15",,,,"20",,,,"1492",,,,"Vine Whip, Leaf Blade, Brick Break",,,"672;673","673"
"674","Pancham","Pancham","FALSE",,"758",,,,"1/15/15",,,,"48",,,,"1498",,,,"Tackle, Crunch, Body Slam",,,"674;675","674;675"
"676","Furfrou","Furfrou","FALSE",,"142",,,,"1/14/15",,,,"27",,,,"1500",,,,"Sucker Punch, Surf, Grass Knot",,,"676","676"
"677","Espurr","Espurr","FALSE",,"524",,,,"15/15/15",,,,"50",,,,"1424",,,,"Confusion, Psyshock, Energy Ball",,,"677;678","677;678"
"678","Meowstic (Female)","Espurr","FALSE",,"665",,,,"0/14/15",,,,"27",,,,"1499",,,,"Confusion, Shadow Ball, Psychic",,,"677;678","678"
"678","Meowstic (Male)","Espurr","FALSE",,"559",,,,"0/14/15",,,,"27",,,,"1499",,,,"Sucker Punch, Psychic, Thunderbolt",,,"677;678","678"
"689","Barbaracle","Binacle","FALSE",,"297",,,,"0/10/13",,,,"21.5",,,,"1492",,,,"Mud Slap, Cross Chop, Stone Edge",,,"688;689","689"
"690","Skrelp","Skrelp","FALSE",,"666",,,,"15/15/15",,,,"50",,,,"1202",,,,"Water Gun, Aqua Tail, Sludge Bomb",,,"690;691","690;691"
"691","Dragalge","Skrelp","FALSE",,"57",,,,"0/15/13",,,,"24",,,,"1496",,,,"Dragon Tail, Aqua Tail, Sludge Bomb",,,"690;691","691"
"692","Clauncher","Clauncher","FALSE",,"746",,,,"15/15/15",,,,"50",,,,"1230",,,,"Water Gun, Aqua Jet, Crabhammer",,,"692;693","692;693"
"693","Clawitzer","Clauncher","FALSE",,"824",,,,"0/13/13",,,,"20.5",,,,"1493",,,,"Water Gun, Crabhammer, Ice Beam",,,"692;693","693"
"695","Heliolisk","Helioptile","FALSE",,"473",,,,"0/15/15",,,,"21.5",,,,"1493",,,,"Volt Switch, Breaking Swipe, Parabolic Charge",,,"694;695","695"
"696","Tyrunt","Tyrunt","FALSE",,"122",,,,"0/15/15",,,,"40",,,,"1499",,,,"Dragon Tail, Dragon Claw, Ancient Power",,,"696;697","696;697"
"696","Tyrunt (Shadow)","Tyrunt","TRUE",,"91",,,,"0/15/15",,,,"40",,,,"1499",,,,"Dragon Tail, Dragon Claw, Ancient Power",,,"696;697","696;697"
"697","Tyrantrum","Tyrunt","FALSE",,"431",,,,"0/15/12",,,,"18",,,,"1495",,,,"Dragon Tail, Meteor Beam, Crunch",,,"696;697","697"
"697","Tyrantrum (Shadow)","Tyrunt","TRUE",,"465",,,,"0/15/12",,,,"18",,,,"1495",,,,"Dragon Tail, Meteor Beam, Stone Edge",,,"696;697","697"
"698","Amaura","Amaura","FALSE",,"92",,,,"11/15/15",,,,"50",,,,"1497",,,,"Powder Snow, Weather Ball (Ice), Thunderbolt",,,"698;699","698;699"
"698","Amaura (Shadow)","Amaura","TRUE",,"70",,,,"11/15/15",,,,"50",,,,"1497",,,,"Powder Snow, Weather Ball (Ice), Thunderbolt",,,"698;699","698;699"
"699","Aurorus","Amaura","FALSE",,"8",,,,"0/12/13",,,,"20.5",,,,"1498",,,,"Powder Snow, Weather Ball (Ice), Meteor Beam",,,"698;699","699"
"699","Aurorus (Shadow)","Amaura","TRUE",,"25",,,,"0/12/13",,,,"20.5",,,,"1498",,,,"Powder Snow, Weather Ball (Ice), Meteor Beam",,,"698;699","699"
"701","Hawlucha","Hawlucha","FALSE",,"186",,,,"0/14/15",,,,"23.5",,,,"1498",,,,"Poison Jab, Flying Press, Aerial Ace",,,"701","701"
"705","Sliggoo","Goomy","FALSE",,"605",,,,"1/15/15",,,,"28",,,,"1499",,,,"Water Gun, Muddy Water, Dragon Pulse",,,"704;705;706","705;706"
"706","Goodra","Goomy","FALSE",,"13",,,,"1/14/14",,,,"16",,,,"1497",,,,"Dragon Breath, Aqua Tail, Thunder Punch",,,"704;705;706","706"
"709","Trevenant","Phantump","FALSE",,"95",,,,"0/15/15",,,,"22",,,,"1499",,,,"Shadow Claw, Seed Bomb, Shadow Ball",,,"708;709","709"
"710","Pumpkaboo (Average)","Pumpkaboo","FALSE",,"229",,,,"15/15/15",,,,"50",,,,"1381",,,,"Astonish, Grass Knot, Foul Play",,,"710;711","710;711"
"710","Pumpkaboo (Large)","Pumpkaboo","FALSE",,"168",,,,"15/15/15",,,,"50",,,,"1406",,,,"Astonish, Grass Knot, Foul Play",,,"710;711","710;711"
"710","Pumpkaboo (Small)","Pumpkaboo","FALSE",,"277",,,,"15/15/15",,,,"50",,,,"1359",,,,"Astonish, Grass Knot, Foul Play",,,"710;711","710;711"
"710","Pumpkaboo (Super)","Pumpkaboo","FALSE",,"131",,,,"15/15/15",,,,"50",,,,"1414",,,,"Astonish, Grass Knot, Foul Play",,,"710;711","710;711"
"711","Gourgeist (Average)","Pumpkaboo","FALSE",,"107",,,,"1/15/14",,,,"21.5",,,,"1500",,,,"Hex, Shadow Ball, Seed Bomb",,,"710;711","711"
"711","Gourgeist (Large)","Pumpkaboo","FALSE",,"88",,,,"1/15/14",,,,"21.5",,,,"1500",,,,"Hex, Shadow Ball, Seed Bomb",,,"710;711","711"
"711","Gourgeist (Small)","Pumpkaboo","FALSE",,"132",,,,"1/15/14",,,,"21.5",,,,"1495",,,,"Hex, Shadow Ball, Seed Bomb",,,"710;711","711"
"711","Gourgeist (Super)","Pumpkaboo","FALSE",,"90",,,,"1/15/14",,,,"21.5",,,,"1499",,,,"Hex, Shadow Ball, Seed Bomb",,,"710;711","711"
"712","Bergmite","Bergmite","FALSE",,"795",,,,"15/15/15",,,,"50",,,,"1374",,,,"Tackle, Icy Wind, Crunch",,,"712;713","712;713"
"713","Avalugg","Bergmite","FALSE",,"130",,,,"2/15/15",,,,"17.5",,,,"1500",,,,"Ice Fang, Avalanche, Body Slam",,,"712;713","713"
"713","Avalugg (Hisuian)","Bergmite","FALSE",,"228",,,,"0/14/9",,,,"16.5",,,,"1498",,,,"Powder Snow, Rock Slide, Icy Wind",,,"712;713","713"
"715","Noivern","Noibat","FALSE",,"812",,,,"0/15/12",,,,"20.5",,,,"1498",,,,"Air Slash, Hurricane, Draco Meteor",,,"714;715","715"
"718","Zygarde (10% Forme)","Zygarde","FALSE",,"532",,,,"0/14/12",,,,"24",,,,"1494",,,,"Dragon Tail, Crunch, Earthquake",,,"718;718&0-4attack;718&1-4attack","718;718&0-4attack;718&1-4attack"
"718","Zygarde (50% Forme)","Zygarde","FALSE",,"226",,,,"1/14/14",,,,"16.5",,,,"1494",,,,"Dragon Tail, Crunch, Earthquake",,,"718;718&0-4attack;718&1-4attack","718;718&0-4attack;718&1-4attack"
"720","Hoopa","Hoopa","FALSE",,"769",,,,"0/15/15",,,,"16.5",,,,"1488",,,,"Astonish, Shadow Ball, Psychic",,,"720","720"
"722","Rowlet","Rowlet","FALSE",,"806",,,,"15/15/15",,,,"50",,,,"1196",,,,"Leafage, Seed Bomb, Energy Ball",,,"722;723;724","722;723;724"
"723","Dartrix","Rowlet","FALSE",,"237",,,,"0/15/14",,,,"37.5",,,,"1498",,,,"Leafage, Brave Bird, Seed Bomb",,,"722;723;724","723;724"
"724","Decidueye","Rowlet","FALSE",,"115",,,,"0/14/11",,,,"20.5",,,,"1492",,,,"Astonish, Frenzy Plant, Spirit Shackle",,,"722;723;724","724"
