"ID","Pokemon","Family","Shadow","Little_Rank","Great_Rank","Ultra_Rank","Master_Rank","Little_IVs","Great_IVs","Ultra_IVs","Master_IVs","Little_Level","Great_Level","Ultra_Level","Master_Level","Little_CP","Great_CP","Ultra_CP","Master_CP","Little_MoveSet","Great_MoveSet","Ultra_MoveSet","Master_MoveSet","Evo_Fam","Evo_Next"
"131","Lapras","Lapras","FALSE",,"12",,,,"0/10/14",,,,"22",,,,"1497",,,,"Psywave, Sparkling Aria, Skull Bash",,,"131","131"
"131","Lapras (Shadow)","Lapras","TRUE",,"10",,,,"0/10/14",,,,"22",,,,"1497",,,,"Psywave, Sparkling Aria, Ice Beam",,,"131","131"
"133","Eevee","Eevee","FALSE",,"722",,,,"15/15/15",,,,"50",,,,"1210",,,,"Quick Attack, Swift, Dig",,,"133;134;135;136;196;197;470;471;700","133;134;135;136;196;197;470;471;700"
"134","Vaporeon","Eevee","FALSE",,"313",,,,"1/15/15",,,,"18",,,,"1499",,,,"Water Gun, Aqua Tail, Last Resort",,,"133;134","134"
"135","Jolteon","Eevee","FALSE",,"463",,,,"0/12/15",,,,"19.5",,,,"1495",,,,"Thunder Shock, Discharge, Last Resort",,,"133;135","135"
"136","Flareon","Eevee","FALSE",,"580",,,,"0/15/13",,,,"18.5",,,,"1488",,,,"Fire Spin, Superpower, Flamethrower",,,"133;136","136"
"137","Porygon","Porygon","FALSE",,"501",,,,"0/13/15",,,,"37.5",,,,"1500",,,,"Quick Attack, Discharge, Hyper Beam",,,"137;233;474","137;233;474"
"137","Porygon (Shadow)","Porygon","TRUE",,"656",,,,"0/13/15",,,,"37.5",,,,"1500",,,,"Tackle, Discharge, Signal Beam",,,"137;233;474","137;233;474"
"138","Omanyte","Omanyte","FALSE",,"487",,,,"0/13/15",,,,"45.5",,,,"1500",,,,"Mud Shot, Rock Tomb, Rock Blast",,,"138;139","138;139"
"138","Omanyte (Shadow)","Omanyte","TRUE",,"481",,,,"0/13/15",,,,"45.5",,,,"1500",,,,"Mud Shot, Rock Tomb, Rock Blast",,,"138;139","138;139"
"139","Omastar","Omanyte","FALSE",,"706",,,,"0/9/15",,,,"20.5",,,,"1493",,,,"Mud Shot, Rock Slide, Hydro Pump",,,"138;139","139"
"139","Omastar (Shadow)","Omanyte","TRUE",,"700",,,,"0/9/15",,,,"20.5",,,,"1493",,,,"Mud Shot, Rock Slide, Hydro Pump",,,"138;139","139"
"140","Kabuto","Kabuto","FALSE",,"390",,,,"10/15/15",,,,"49.5",,,,"1498",,,,"Mud Shot, Aqua Jet, Rock Tomb",,,"140;141","140;141"
"141","Kabutops","Kabuto","FALSE",,"608",,,,"0/14/10",,,,"21",,,,"1493",,,,"Fury Cutter, Stone Edge, Ancient Power",,,"140;141","141"
"142","Aerodactyl","Aerodactyl","FALSE",,"554",,,,"1/15/15",,,,"20",,,,"1500",,,,"Rock Throw, Rock Slide, Earth Power",,,"142","142"
"142","Aerodactyl (Shadow)","Aerodactyl","TRUE",,"404",,,,"1/15/15",,,,"20",,,,"1500",,,,"Rock Throw, Rock Slide, Earth Power",,,"142","142"
"143","Snorlax","Snorlax","FALSE",,"280",,,,"1/15/14",,,,"17.5",,,,"1498",,,,"Lick, Body Slam, Superpower",,,"143;446","143;446"
"143","Snorlax (Shadow)","Snorlax","TRUE",,"214",,,,"1/15/14",,,,"17.5",,,,"1498",,,,"Lick, Body Slam, Superpower",,,"143;446","143;446"
"144","Articuno","Articuno","FALSE",,"334",,,,"0/15/15",,,,"18.5",,,,"1500",,,,"Ice Shard, Triple Axel, Ancient Power",,,"144","144"
"144","Articuno (Galarian)","Articuno","FALSE",,"426",,,,"0/15/14",,,,"15.5",,,,"1498",,,,"Psycho Cut, Ancient Power, Brave Bird",,,"144","144"
"144","Articuno (Shadow)","Articuno","TRUE",,"354",,,,"0/15/15",,,,"18.5",,,,"1500",,,,"Ice Shard, Triple Axel, Ancient Power",,,"144","144"
"145","Zapdos","Zapdos","FALSE",,"76",,,,"0/12/12",,,,"16",,,,"1495",,,,"Thunder Shock, Drill Peck, Thunderbolt",,,"145","145"
"145","Zapdos (Galarian)","Zapdos","FALSE",,"671",,,,"3/15/14",,,,"15.5",,,,"1495",,,,"Counter, Ancient Power, Brave Bird",,,"145","145"
"145","Zapdos (Shadow)","Zapdos","TRUE",,"44",,,,"0/12/12",,,,"16",,,,"1498",,,,"Thunder Shock, Drill Peck, Thunderbolt",,,"145","145"
"146","Moltres","Moltres","FALSE",,"560",,,,"1/15/14",,,,"16",,,,"1493",,,,"Fire Spin, Sky Attack, Ancient Power",,,"146","146"
"146","Moltres (Shadow)","Moltres","TRUE",,"552",,,,"1/15/14",,,,"16",,,,"1499",,,,"Fire Spin, Sky Attack, Ancient Power",,,"146","146"
"148","Dragonair","Dratini","FALSE",,"54",,,,"1/15/15",,,,"34",,,,"1497",,,,"Dragon Breath, Aqua Tail, Body Slam",,,"147;148;149","148;149"
"148","Dragonair (Shadow)","Dratini","TRUE",,"38",,,,"1/15/15",,,,"34",,,,"1497",,,,"Dragon Breath, Body Slam, Aqua Tail",,,"147;148;149","148;149"
"149","Dragonite","Dratini","FALSE",,"37",,,,"3/15/14",,,,"14.5",,,,"1495",,,,"Dragon Breath, Dragon Claw, Superpower",,,"147;148;149","149"
"149","Dragonite (Shadow)","Dratini","TRUE",,"34",,,,"3/15/14",,,,"14.5",,,,"1495",,,,"Dragon Breath, Dragon Claw, Superpower",,,"147;148;149","149"
"150","Mewtwo (Shadow)","Mewtwo","TRUE",,"255",,,,"4/15/15",,,,"13",,,,"1499",,,,"Psycho Cut, Psystrike, Thunderbolt",,,"150","150"
"151","Mew","Mew","FALSE",,"29",,,,"0/10/13",,,,"17.5",,,,"1498",,,,"Shadow Claw, Wild Charge, Psyshock",,,"151","151"
"153","Bayleef","Chikorita","FALSE",,"349",,,,"3/15/14",,,,"50",,,,"1494",,,,"Magical Leaf, Ancient Power, Energy Ball",,,"152;153;154","153;154"
"153","Bayleef (Shadow)","Chikorita","TRUE",,"410",,,,"3/15/14",,,,"50",,,,"1494",,,,"Magical Leaf, Ancient Power, Energy Ball",,,"152;153;154","153;154"
"154","Meganium","Chikorita","FALSE",,"137",,,,"0/10/15",,,,"24",,,,"1499",,,,"Vine Whip, Frenzy Plant, Earthquake",,,"152;153;154","154"
"154","Meganium (Shadow)","Chikorita","TRUE",,"191",,,,"0/10/15",,,,"24",,,,"1499",,,,"Vine Whip, Frenzy Plant, Earthquake",,,"152;153;154","154"
"156","Quilava","Cyndaquil","FALSE",,"773",,,,"0/13/15",,,,"40",,,,"1496",,,,"Ember, Flame Charge, Dig",,,"155;156;157","156;157"
"156","Quilava (Shadow)","Cyndaquil","TRUE",,"784",,,,"0/13/15",,,,"40",,,,"1496",,,,"Ember, Flame Charge, Dig",,,"155;156;157","156;157"
"157","Typhlosion","Cyndaquil","FALSE",,"233",,,,"0/15/13",,,,"19.5",,,,"1488",,,,"Incinerate, Blast Burn, Thunder Punch",,,"155;156;157","157"
"157","Typhlosion (Hisuian)","Cyndaquil","FALSE",,"373",,,,"0/11/12",,,,"19",,,,"1500",,,,"Hex, Fire Punch, Shadow Ball",,,"155;156;157","157"
"157","Typhlosion (Shadow)","Cyndaquil","TRUE",,"163",,,,"0/15/13",,,,"19.5",,,,"1488",,,,"Incinerate, Blast Burn, Thunder Punch",,,"155;156;157","157"
"158","Totodile","Totodile","FALSE",,"754",,,,"15/15/15",,,,"50",,,,"1279",,,,"Water Gun, Aqua Jet, Crunch",,,"158;159;160","158;159;160"
"158","Totodile (Shadow)","Totodile","TRUE",,"764",,,,"15/15/15",,,,"50",,,,"1279",,,,"Water Gun, Aqua Jet, Crunch",,,"158;159;160","158;159;160"
"159","Croconaw","Totodile","FALSE",,"411",,,,"0/13/15",,,,"37.5",,,,"1499",,,,"Water Gun, Ice Punch, Crunch",,,"158;159;160","159;160"
"159","Croconaw (Shadow)","Totodile","TRUE",,"392",,,,"0/13/15",,,,"37.5",,,,"1499",,,,"Water Gun, Ice Punch, Crunch",,,"158;159;160","159;160"
"160","Feraligatr","Totodile","FALSE",,"17",,,,"0/11/13",,,,"20",,,,"1493",,,,"Shadow Claw, Hydro Cannon, Ice Beam",,,"158;159;160","160"
"160","Feraligatr (Shadow)","Totodile","TRUE",,"22",,,,"0/11/13",,,,"20",,,,"1493",,,,"Shadow Claw, Hydro Cannon, Ice Beam",,,"158;159;160","160"
"162","Furret","Sentret","FALSE",,"3",,,,"1/15/14",,,,"35.5",,,,"1500",,,,"Sucker Punch, Swift, Trailblaze",,,"161;162","162"
"164","Noctowl","Hoothoot","FALSE",,"165",,,,"1/14/15",,,,"28.5",,,,"1494",,,,"Wing Attack, Sky Attack, Night Shade",,,"163;164","164"
"166","Ledian","Ledyba","FALSE",,"368",,,,"13/15/15",,,,"50",,,,"1500",,,,"Counter, Dynamic Punch, Aerial Ace",,,"165;166","166"
"166","Ledian (Shadow)","Ledyba","TRUE",,"361",,,,"13/15/15",,,,"50",,,,"1500",,,,"Counter, Dynamic Punch, Aerial Ace",,,"165;166","166"
"168","Ariados","Spinarak","FALSE",,"196",,,,"0/14/15",,,,"35",,,,"1497",,,,"Poison Sting, Lunge, Trailblaze",,,"167;168","168"
"169","Crobat","Zubat","FALSE",,"447",,,,"0/15/12",,,,"21.5",,,,"1496",,,,"Air Slash, Poison Fang, Shadow Ball",,,"41;42;169","169"
"169","Crobat (Shadow)","Zubat","TRUE",,"467",,,,"0/15/12",,,,"21.5",,,,"1496",,,,"Air Slash, Poison Fang, Shadow Ball",,,"41;42;169","169"
"170","Chinchou","Chinchou","FALSE",,"766",,,,"15/15/15",,,,"50",,,,"1265",,,,"Bubble, Thunderbolt, Water Pulse",,,"170;171","170;171"
"171","Lanturn","Chinchou","FALSE",,"135",,,,"0/13/14",,,,"28",,,,"1496",,,,"Water Gun, Surf, Thunderbolt",,,"170;171","171"
"178","Xatu","Natu","FALSE",,"720",,,,"0/13/15",,,,"26",,,,"1499",,,,"Air Slash, Aerial Ace, Future Sight",,,"177;178","178"
"178","Xatu (Shadow)","Natu","TRUE",,"730",,,,"0/13/15",,,,"26",,,,"1499",,,,"Air Slash, Aerial Ace, Future Sight",,,"177;178","178"
"180","Flaaffy","Mareep","FALSE",,"762",,,,"0/15/14",,,,"47",,,,"1497",,,,"Charge Beam, Trailblaze, Discharge",,,"179;180;181","180;181"
"180","Flaaffy (Shadow)","Mareep","TRUE",,"757",,,,"0/15/14",,,,"47",,,,"1497",,,,"Charge Beam, Trailblaze, Discharge",,,"179;180;181","180;181"
"181","Ampharos","Mareep","FALSE",,"253",,,,"0/13/11",,,,"20",,,,"1499",,,,"Volt Switch, Brutal Swing, Trailblaze",,,"179;180;181","181"
"181","Ampharos (Shadow)","Mareep","TRUE",,"227",,,,"0/13/11",,,,"20",,,,"1499",,,,"Volt Switch, Brutal Swing, Trailblaze",,,"179;180;181","181"
"182","Bellossom","Bellossom","FALSE",,"197",,,,"1/14/14",,,,"25",,,,"1499",,,,"Bullet Seed, Leaf Blade, Dazzling Gleam",,,"43;44;182","182"
"182","Bellossom (Shadow)","Bellossom","TRUE",,"166",,,,"1/14/14",,,,"25",,,,"1499",,,,"Bullet Seed, Leaf Blade, Dazzling Gleam",,,"43;44;182","182"
"185","Sudowoodo","Sudowoodo","FALSE",,"695",,,,"0/14/11",,,,"27",,,,"1496",,,,"Counter, Meteor Beam, Trailblaze",,,"185;438","185;438"
"185","Sudowoodo (Shadow)","Sudowoodo","TRUE",,"772",,,,"0/14/11",,,,"27",,,,"1496",,,,"Counter, Meteor Beam, Trailblaze",,,"185;438","185;438"
"186","Politoed","Politoed","FALSE",,"348",,,,"0/15/11",,,,"23.5",,,,"1498",,,,"Mud Shot, Weather Ball (Water), Earthquake",,,"60;61;186","186"
"186","Politoed (Shadow)","Politoed","TRUE",,"319",,,,"0/15/11",,,,"23.5",,,,"1498",,,,"Mud Shot, Weather Ball (Water), Earthquake",,,"60;61;186","186"
"189","Jumpluff","Hoppip","FALSE",,"18",,,,"0/14/14",,,,"43",,,,"1500",,,,"Fairy Wind, Aerial Ace, Energy Ball",,,"187;188;189","189"
"189","Jumpluff (Shadow)","Hoppip","TRUE",,"1",,,,"0/14/14",,,,"43",,,,"1500",,,,"Fairy Wind, Aerial Ace, Acrobatics",,,"187;188;189","189"
"190","Aipom","Aipom","FALSE",,"248",,,,"14/15/14",,,,"49.5",,,,"1500",,,,"Astonish, Swift, Aerial Ace",,,"190;424","190;424"
"190","Aipom (Shadow)","Aipom","TRUE",,"169",,,,"14/15/14",,,,"49.5",,,,"1500",,,,"Astonish, Swift, Aerial Ace",,,"190;424","190;424"
"192","Sunflora","Sunkern","FALSE",,"649",,,,"0/15/14",,,,"26.5",,,,"1492",,,,"Bullet Seed, Sludge Bomb, Leaf Storm",,,"191;192","192"
"193","Yanma","Yanma","FALSE",,"587",,,,"0/14/15",,,,"49.5",,,,"1498",,,,"Quick Attack, Aerial Ace, Silver Wind",,,"193;469","193;469"
"195","Quagsire","Wooper","FALSE",,"114",,,,"0/15/14",,,,"29",,,,"1494",,,,"Mud Shot, Aqua Tail, Stone Edge",,,"194;195","195"
"195","Quagsire (Shadow)","Wooper","TRUE",,"80",,,,"0/15/14",,,,"29",,,,"1494",,,,"Mud Shot, Aqua Tail, Stone Edge",,,"194;195","195"
"196","Espeon","Eevee","FALSE",,"489",,,,"0/15/15",,,,"17.5",,,,"1491",,,,"Confusion, Psychic Fangs, Shadow Ball",,,"133;196","196"
"199","Slowking","Slowpoke","FALSE",,"549",,,,"0/13/15",,,,"22.5",,,,"1493",,,,"Water Gun, Surf, Psychic",,,"79;199","199"
"199","Slowking (Galarian)","Slowpoke","FALSE",,"436",,,,"0/14/13",,,,"21",,,,"1498",,,,"Hex, Surf, Shadow Ball",,,"79;199","199"
"199","Slowking (Shadow)","Slowpoke","TRUE",,"620",,,,"0/13/15",,,,"22.5",,,,"1493",,,,"Water Gun, Surf, Psychic",,,"79;199","199"
"200","Misdreavus","Misdreavus","FALSE",,"263",,,,"1/15/15",,,,"29.5",,,,"1498",,,,"Psywave, Dark Pulse, Shadow Sneak",,,"200;429","200;429"
"200","Misdreavus (Shadow)","Misdreavus","TRUE",,"327",,,,"1/15/15",,,,"29.5",,,,"1498",,,,"Astonish, Dark Pulse, Shadow Sneak",,,"200;429","200;429"
"201","Unown","Unown","FALSE",,"847",,,,"15/15/15",,,,"50",,,,"1339",,,,"Hidden Power (Psychic), Struggle, NA",,,"201","201"
"202","Wobbuffet","Wobbuffet","FALSE",,"383",,,,"15/15/15",,,,"50",,,,"1160",,,,"Counter, Return, Mirror Coat",,,"202;360","202;360"
"202","Wobbuffet (Shadow)","Wobbuffet","TRUE",,"621",,,,"15/15/15",,,,"50",,,,"1160",,,,"Counter, Mirror Coat, Frustration",,,"202;360","202;360"
"203","Girafarig","Girafarig","FALSE",,"127",,,,"0/15/12",,,,"28",,,,"1486",,,,"Confusion, Psychic Fangs, Trailblaze",,,"203;981","203;981"
"203","Girafarig (Shadow)","Girafarig","TRUE",,"148",,,,"0/15/12",,,,"28",,,,"1486",,,,"Confusion, Psychic Fangs, Trailblaze",,,"203;981","203;981"
"204","Pineco","Pineco","FALSE",,"814",,,,"15/15/15",,,,"50",,,,"1253",,,,"Bug Bite, Rock Tomb, Return",,,"204;205","204;205"
"204","Pineco (Shadow)","Pineco","TRUE",,"818",,,,"15/15/15",,,,"50",,,,"1253",,,,"Bug Bite, Rock Tomb, Sand Tomb",,,"204;205","204;205"
"206","Dunsparce","Dunsparce","FALSE",,"71",,,,"0/14/12",,,,"40",,,,"1496",,,,"Rollout, Drill Run, Rock Slide",,,"206;982","206;982"
"207","Gligar","Gligar","FALSE",,"207",,,,"0/15/12",,,,"33",,,,"1493",,,,"Fury Cutter, Aerial Ace, Dig",,,"207;472","207;472"
"207","Gligar (Shadow)","Gligar","TRUE",,"181",,,,"0/15/12",,,,"33",,,,"1493",,,,"Fury Cutter, Aerial Ace, Dig",,,"207;472","207;472"
"211","Qwilfish","Qwilfish","FALSE",,"55",,,,"0/12/14",,,,"28",,,,"1490",,,,"Poison Sting, Aqua Tail, Ice Beam",,,"211;904","211;904"
"214","Heracross","Heracross","FALSE",,"613",,,,"0/15/15",,,,"18",,,,"1497",,,,"Counter, Upper Hand, Megahorn",,,"214","214"
"215","Sneasel (Hisuian)","Sneasel","FALSE",,"380",,,,"1/15/14",,,,"27.5",,,,"1499",,,,"Poison Jab, Close Combat, Aerial Ace",,,"215;461","215;461"
"215","Sneasel (Hisuian) (Shadow)","Sneasel","TRUE",,"402",,,,"1/15/14",,,,"27.5",,,,"1499",,,,"Poison Jab, Close Combat, Aerial Ace",,,"215;461","215;461"
"216","Teddiursa","Teddiursa","FALSE",,"550",,,,"15/15/14",,,,"50",,,,"1482",,,,"Lick, Swift, Cross Chop",,,"216;217;901","216;217;901"
"216","Teddiursa (Shadow)","Teddiursa","TRUE",,"423",,,,"15/15/14",,,,"50",,,,"1482",,,,"Lick, Swift, Cross Chop",,,"216;217;901","216;217;901"
"217","Ursaring","Teddiursa","FALSE",,"66",,,,"0/14/15",,,,"19",,,,"1499",,,,"Shadow Claw, Swift, Close Combat",,,"216;217;901","217;901"
"217","Ursaring (Shadow)","Teddiursa","TRUE",,"40",,,,"0/14/15",,,,"19",,,,"1499",,,,"Shadow Claw, Swift, Close Combat",,,"216;217;901","217;901"
"219","Magcargo","Slugma","FALSE",,"208",,,,"0/15/14",,,,"38.5",,,,"1492",,,,"Incinerate, Rock Tomb, Overheat",,,"218;219","219"
"221","Piloswine","Swinub","FALSE",,"157",,,,"0/15/10",,,,"24.5",,,,"1497",,,,"Powder Snow, Icicle Spear, High Horsepower",,,"220;221;473","221;473"
"221","Piloswine (Shadow)","Swinub","TRUE",,"140",,,,"0/15/10",,,,"24.5",,,,"1497",,,,"Powder Snow, Icicle Spear, High Horsepower",,,"220;221;473","221;473"
"222","Corsola","Corsola","FALSE",,"434",,,,"10/15/15",,,,"50",,,,"1500",,,,"Bubble, Power Gem, Rock Blast",,,"222","222"
"222","Corsola (Galarian)","Corsola","FALSE",,"5",,,,"1/14/15",,,,"49.5",,,,"1494",,,,"Astonish, Night Shade, Power Gem",,,"222","222"
"224","Octillery","Remoraid","FALSE",,"810",,,,"0/15/13",,,,"24.5",,,,"1500",,,,"Lock On, Octazooka, Gunk Shot",,,"223;224","224"
"226","Mantine","Mantine","FALSE",,"144",,,,"0/15/13",,,,"27.5",,,,"1499",,,,"Wing Attack, Aerial Ace, Ice Beam",,,"226;458","226;458"
"230","Kingdra","Horsea","FALSE",,"325",,,,"0/15/13",,,,"21.5",,,,"1498",,,,"Dragon Breath, Outrage, Octazooka",,,"116;117;230","230"
"230","Kingdra (Shadow)","Horsea","TRUE",,"318",,,,"0/15/13",,,,"21.5",,,,"1498",,,,"Dragon Breath, Outrage, Octazooka",,,"116;117;230","230"
"231","Phanpy","Phanpy","FALSE",,"745",,,,"15/15/15",,,,"50",,,,"1364",,,,"Tackle, Trailblaze, Body Slam",,,"231;232","231;232"
"231","Phanpy (Shadow)","Phanpy","TRUE",,"727",,,,"15/15/15",,,,"50",,,,"1364",,,,"Tackle, Trailblaze, Body Slam",,,"231;232","231;232"
"232","Donphan","Phanpy","FALSE",,"245",,,,"0/14/8",,,,"19",,,,"1500",,,,"Mud Slap, Trailblaze, Body Slam",,,"231;232","232"
"232","Donphan (Shadow)","Phanpy","TRUE",,"198",,,,"0/14/8",,,,"19",,,,"1500",,,,"Mud Slap, Trailblaze, Body Slam",,,"231;232","232"
"233","Porygon2","Porygon","FALSE",,"567",,,,"0/12/15",,,,"21",,,,"1500",,,,"Lock On, Tri Attack, Zap Cannon",,,"137;233;474","233;474"
"233","Porygon2 (Shadow)","Porygon","TRUE",,"617",,,,"0/12/15",,,,"21",,,,"1500",,,,"Lock On, Tri Attack, Zap Cannon",,,"137;233;474","233;474"
"234","Stantler","Stantler","FALSE",,"657",,,,"0/11/15",,,,"26.5",,,,"1496",,,,"Tackle, Wild Charge, Stomp",,,"234;899","234;899"
"234","Stantler (Shadow)","Stantler","TRUE",,"693",,,,"0/11/15",,,,"26.5",,,,"1494",,,,"Tackle, Wild Charge, Stomp",,,"234;899","234;899"
"237","Hitmontop","Hitmonlee","FALSE",,"435",,,,"0/14/15",,,,"26.5",,,,"1500",,,,"Counter, Close Combat, Triple Axel",,,"106;236","237"
"237","Hitmontop (Shadow)","Hitmonlee","TRUE",,"495",,,,"0/14/15",,,,"26.5",,,,"1500",,,,"Counter, Close Combat, Triple Axel",,,"106;236","237"
"238","Smoochum","Jynx","FALSE",,"287",,,,"15/15/15",,,,"50",,,,"1460",,,,"Powder Snow, Psyshock, Ice Punch",,,"124;238","238"
"239","Elekid","Electabuzz","FALSE",,"523",,,,"15/15/15",,,,"50",,,,"1364",,,,"Thunder Shock, Thunder Punch, Brick Break",,,"125;239;466","239"
"240","Magby","Magmar","FALSE",,"440",,,,"15/15/15",,,,"50",,,,"1496",,,,"Karate Chop, Fire Punch, Brick Break",,,"126;240;467","240"
"241","Miltank","Miltank","FALSE",,"104",,,,"0/14/14",,,,"24.5",,,,"1494",,,,"Rollout, Body Slam, Thunderbolt",,,"241","241"
"242","Blissey","Chansey","FALSE",,"466",,,,"0/15/3",,,,"21.5",,,,"1498",,,,"Zen Headbutt, Wild Charge, Dazzling Gleam",,,"113;242;440","242;440"
"243","Raikou","Raikou","FALSE",,"187",,,,"3/15/14",,,,"16",,,,"1492",,,,"Thunder Shock, Wild Charge, Shadow Ball",,,"243","243"
"243","Raikou (Shadow)","Raikou","TRUE",,"179",,,,"3/15/14",,,,"16",,,,"1500",,,,"Thunder Shock, Wild Charge, Shadow Ball",,,"243","243"
"244","Entei","Entei","FALSE",,"673",,,,"1/15/15",,,,"16",,,,"1500",,,,"Fire Fang, Flame Charge, Scorching Sands",,,"244","244"
"244","Entei (Shadow)","Entei","TRUE",,"633",,,,"1/15/15",,,,"16",,,,"1499",,,,"Fire Fang, Flame Charge, Scorching Sands",,,"244","244"
"245","Suicune","Suicune","FALSE",,"133",,,,"1/15/14",,,,"19",,,,"1499",,,,"Ice Fang, Bubble Beam, Scald",,,"245","245"
"245","Suicune (Shadow)","Suicune","TRUE",,"174",,,,"1/15/14",,,,"19",,,,"1491",,,,"Ice Fang, Bubble Beam, Scald",,,"245","245"
"247","Pupitar","Larvitar","FALSE",,"789",,,,"0/14/14",,,,"35.5",,,,"1500",,,,"Bite, Ancient Power, Dig",,,"246;247;248","247;248"
"247","Pupitar (Shadow)","Larvitar","TRUE",,"724",,,,"0/14/14",,,,"35.5",,,,"1500",,,,"Bite, Ancient Power, Dig",,,"246;247;248","247;248"
"249","Lugia","Lugia","FALSE",,"449",,,,"0/11/11",,,,"15.5",,,,"1496",,,,"Dragon Tail, Sky Attack, Aeroblast",,,"249","249"
"249","Lugia (Shadow)","Lugia","TRUE",,"590",,,,"0/11/11",,,,"15.5",,,,"1497",,,,"Dragon Tail, Aeroblast, Sky Attack",,,"249","249"
"250","Ho-Oh","Ho-oh","FALSE",,"459",,,,"0/13/15",,,,"14.5",,,,"1500",,,,"Incinerate, Brave Bird, Earthquake",,,"250","250"
"250","Ho-Oh (Shadow)","Ho-oh","TRUE",,"566",,,,"0/13/15",,,,"14.5",,,,"1499",,,,"Incinerate, Brave Bird, Earthquake",,,"250","250"
"251","Celebi","Celebi","FALSE",,"641",,,,"0/10/13",,,,"17.5",,,,"1498",,,,"Magical Leaf, Seed Bomb, Leaf Storm",,,"251","251"
"253","Grovyle","Treecko","FALSE",,"273",,,,"0/15/14",,,,"38.5",,,,"1499",,,,"Quick Attack, Leaf Blade, Aerial Ace",,,"252;253;254","253;254"
"253","Grovyle (Shadow)","Treecko","TRUE",,"315",,,,"0/15/14",,,,"38.5",,,,"1499",,,,"Bullet Seed, Leaf Blade, Aerial Ace",,,"252;253;254","253;254"
"254","Sceptile","Treecko","FALSE",,"370",,,,"0/12/15",,,,"20.5",,,,"1497",,,,"Bullet Seed, Leaf Blade, Earthquake",,,"252;253;254","254"
"254","Sceptile (Shadow)","Treecko","TRUE",,"357",,,,"0/12/15",,,,"20.5",,,,"1497",,,,"Bullet Seed, Leaf Blade, Earthquake",,,"252;253;254","254"
"256","Combusken","Torchic","FALSE",,"767",,,,"0/15/14",,,,"39.5",,,,"1497",,,,"Ember, Flame Charge, Rock Slide",,,"255;256;257","256;257"
"256","Combusken (Shadow)","Torchic","TRUE",,"760",,,,"0/15/14",,,,"39.5",,,,"1497",,,,"Ember, Flame Charge, Rock Slide",,,"255;256;257","256;257"
"257","Blaziken","Torchic","FALSE",,"454",,,,"1/15/14",,,,"19.5",,,,"1496",,,,"Fire Spin, Blaze Kick, Blast Burn",,,"255;256;257","257"
"257","Blaziken (Shadow)","Torchic","TRUE",,"417",,,,"1/15/14",,,,"19.5",,,,"1496",,,,"Fire Spin, Blaze Kick, Blast Burn",,,"255;256;257","257"
"259","Marshtomp","Mudkip","FALSE",,"336",,,,"0/14/15",,,,"35",,,,"1498",,,,"Mud Shot, Mud Bomb, Surf",,,"258;259;260","259;260"
"259","Marshtomp (Shadow)","Mudkip","TRUE",,"326",,,,"0/14/15",,,,"35",,,,"1499",,,,"Mud Shot, Mud Bomb, Surf",,,"258;259;260","259;260"
"260","Swampert","Mudkip","FALSE",,"202",,,,"0/14/14",,,,"19",,,,"1498",,,,"Mud Shot, Hydro Cannon, Sludge",,,"258;259;260","260"
"260","Swampert (Shadow)","Mudkip","TRUE",,"195",,,,"0/14/14",,,,"19",,,,"1498",,,,"Mud Shot, Hydro Cannon, Sludge",,,"258;259;260","260"
"264","Linoone","Zigzagoon","FALSE",,"35",,,,"0/15/14",,,,"40",,,,"1497",,,,"Shadow Claw, Swift, Grass Knot",,,"263;264;862","264;862"
"267","Beautifly","Wurmple","FALSE",,"686",,,,"0/15/15",,,,"34",,,,"1500",,,,"Infestation, Air Cutter, Silver Wind",,,"265;266;267","267"
"269","Dustox","Cascoon","FALSE",,"598",,,,"15/15/14",,,,"50",,,,"1384",,,,"Confusion, Sludge Bomb, Silver Wind",,,"265;268;269","269"
"271","Lombre","Lotad","FALSE",,"734",,,,"15/15/14",,,,"50",,,,"1353",,,,"Bubble, Scald, Grass Knot",,,"270;271;272","271;272"
"272","Ludicolo","Lotad","FALSE",,"439",,,,"0/15/15",,,,"24.5",,,,"1497",,,,"Bubble, Scald, Leaf Storm",,,"270;271;272","272"
"277","Swellow","Taillow","FALSE",,"430",,,,"0/15/15",,,,"29.5",,,,"1496",,,,"Wing Attack, Brave Bird, Aerial Ace",,,"276;277","277"
"277","Swellow (Shadow)","Taillow","TRUE",,"409",,,,"0/15/15",,,,"29.5",,,,"1496",,,,"Wing Attack, Brave Bird, Aerial Ace",,,"276;277","277"
"279","Pelipper","Wingull","FALSE",,"194",,,,"0/12/15",,,,"27",,,,"1496",,,,"Wing Attack, Weather Ball (Water), Hurricane",,,"278;279","279"
"284","Masquerain","Surskit","FALSE",,"571",,,,"0/15/14",,,,"25",,,,"1499",,,,"Air Slash, Air Cutter, Lunge",,,"283;284","284"
"286","Breloom","Shroomish","FALSE",,"661",,,,"2/15/15",,,,"21",,,,"1493",,,,"Force Palm, Dynamic Punch, Grass Knot",,,"285;286","286"
"288","Vigoroth","Slakoth","FALSE",,"403",,,,"1/15/15",,,,"29",,,,"1499",,,,"Counter, Body Slam, Rock Slide",,,"287;288;289","288;289"
"288","Vigoroth (Shadow)","Slakoth","TRUE",,"344",,,,"1/15/15",,,,"29",,,,"1499",,,,"Counter, Body Slam, Rock Slide",,,"287;288;289","288;289"
"289","Slaking","Slakoth","FALSE",,"851",,,,"0/14/15",,,,"12.5",,,,"1498",,,,"Yawn, Body Slam, Earthquake",,,"287;288;289","289"
"289","Slaking (Shadow)","Slakoth","TRUE",,"852",,,,"0/14/15",,,,"12.5",,,,"1498",,,,"Yawn, Body Slam, Earthquake",,,"287;288;289","289"
"291","Ninjask","Nincada","FALSE",,"513",,,,"0/12/15",,,,"29",,,,"1496",,,,"Fury Cutter, Aerial Ace, Bug Buzz",,,"290;291","291"
"294","Loudred","Whismur","FALSE",,"626",,,,"15/15/15",,,,"50",,,,"1500",,,,"Bite, Stomp, Disarming Voice",,,"293;294;295","294;295"
"294","Loudred (Shadow)","Whismur","TRUE",,"581",,,,"15/15/15",,,,"50",,,,"1500",,,,"Bite, Stomp, Disarming Voice",,,"293;294;295","294;295"
"295","Exploud","Whismur","FALSE",,"414",,,,"0/15/10",,,,"24.5",,,,"1494",,,,"Astonish, Crunch, Disarming Voice",,,"293;294;295","295"
"295","Exploud (Shadow)","Whismur","TRUE",,"428",,,,"0/15/10",,,,"24.5",,,,"1494",,,,"Astonish, Crunch, Disarming Voice",,,"293;294;295","295"
"297","Hariyama","Makuhita","FALSE",,"282",,,,"0/14/13",,,,"20",,,,"1492",,,,"Force Palm, Upper Hand, Heavy Slam",,,"296;297","297"
"297","Hariyama (Shadow)","Makuhita","TRUE",,"276",,,,"0/14/13",,,,"20",,,,"1492",,,,"Force Palm, Upper Hand, Heavy Slam",,,"296;297","297"
"299","Nosepass","Nosepass","FALSE",,"771",,,,"15/15/15",,,,"50",,,,"1123",,,,"Rock Throw, Rock Slide, Rock Blast",,,"299;476","299;476"
"299","Nosepass (Shadow)","Nosepass","TRUE",,"790",,,,"15/15/15",,,,"50",,,,"1123",,,,"Rock Throw, Rock Slide, Rock Blast",,,"299;476","299;476"
"301","Delcatty","Skitty","FALSE",,"488",,,,"0/15/15",,,,"49",,,,"1496",,,,"Charm, Wild Charge, Disarming Voice",,,"300;301","301"
"308","Medicham","Meditite","FALSE",,"58",,,,"5/15/14",,,,"50",,,,"1500",,,,"Psycho Cut, Ice Punch, Dynamic Punch",,,"307;308","308"
"310","Manectric","Electrike","FALSE",,"369",,,,"0/15/15",,,,"24",,,,"1494",,,,"Thunder Fang, Psychic Fangs, Wild Charge",,,"309;310","310"
"310","Manectric (Shadow)","Electrike","TRUE",,"525",,,,"0/15/15",,,,"24",,,,"1494",,,,"Snarl, Wild Charge, Psychic Fangs",,,"309;310","310"
"311","Plusle","Plusle","FALSE",,"683",,,,"0/15/14",,,,"34.5",,,,"1499",,,,"Quick Attack, Thunderbolt, Grass Knot",,,"311","311"
"312","Minun","Minun","FALSE",,"536",,,,"0/15/14",,,,"38.5",,,,"1493",,,,"Quick Attack, Thunderbolt, Grass Knot",,,"312","312"
"313","Volbeat","Volbeat","FALSE",,"800",,,,"0/15/15",,,,"35.5",,,,"1494",,,,"Tackle, Bug Buzz, Thunderbolt",,,"313","313"
"314","Illumise","Illumise","FALSE",,"717",,,,"0/15/15",,,,"35.5",,,,"1494",,,,"Tackle, Silver Wind, Dazzling Gleam",,,"314","314"
"315","Roselia","Roselia","FALSE",,"801",,,,"0/13/15",,,,"31",,,,"1497",,,,"Poison Jab, Sludge Bomb, Petal Blizzard",,,"315;406;407","315;406;407"
"317","Swalot","Gulpin","FALSE",,"77",,,,"0/15/13",,,,"29.5",,,,"1500",,,,"Mud Shot, Sludge, Ice Beam",,,"316;317","317"
"320","Wailmer","Wailmer","FALSE",,"177",,,,"0/15/15",,,,"50",,,,"1500",,,,"Rollout, Scald, Body Slam",,,"320;321","320;321"
"320","Wailmer (Shadow)","Wailmer","TRUE",,"160",,,,"0/15/15",,,,"50",,,,"1500",,,,"Rollout, Scald, Body Slam",,,"320;321","320;321"
"321","Wailord","Wailmer","FALSE",,"184",,,,"0/15/14",,,,"25",,,,"1500",,,,"Rollout, Surf, Return",,,"320;321","321"
"321","Wailord (Shadow)","Wailmer","TRUE",,"288",,,,"0/15/14",,,,"25",,,,"1500",,,,"Rollout, Surf, Hyper Beam",,,"320;321","321"
"323","Camerupt","Numel","FALSE",,"672",,,,"0/14/13",,,,"26",,,,"1499",,,,"Incinerate, Earth Power, Overheat",,,"322;323","323"
